[I 2025-04-11 20:58:32,512] A new study created in RDB with name: TabNet_Diamonds
[I 2025-04-11 22:23:19,723] Trial 0 finished with value: 0.6349880000000001 and parameters: {'n_d': 46, 'n_steps': 3, 'gamma': 1.6799265498143026, 'cat_emb_dim': 3, 'n_independent': 5, 'n_shared': 4, 'momentum': 0.002516499123859832, 'mask_type': 'entmax'}. Best is trial 0 with value: 0.6349880000000001.
[I 2025-04-11 23:24:48,205] Trial 1 finished with value: 0.594228 and parameters: {'n_d': 62, 'n_steps': 3, 'gamma': 1.1240342936418037, 'cat_emb_dim': 3, 'n_independent': 2, 'n_shared': 5, 'momentum': 0.034019709479691004, 'mask_type': 'entmax'}. Best is trial 0 with value: 0.6349880000000001.
[I 2025-04-12 00:59:30,953] Trial 2 finished with value: 0.6447 and parameters: {'n_d': 62, 'n_steps': 4, 'gamma': 1.516377955404658, 'cat_emb_dim': 1, 'n_independent': 5, 'n_shared': 5, 'momentum': 0.020471122461130514, 'mask_type': 'entmax'}. Best is trial 2 with value: 0.6447.
[I 2025-04-12 03:38:58,731] Trial 3 finished with value: 0.706772 and parameters: {'n_d': 34, 'n_steps': 8, 'gamma': 1.5116708369234604, 'cat_emb_dim': 2, 'n_independent': 3, 'n_shared': 4, 'momentum': 0.002012543828720413, 'mask_type': 'sparsemax'}. Best is trial 3 with value: 0.706772.
[I 2025-04-12 05:30:52,355] Trial 4 finished with value: 0.627482 and parameters: {'n_d': 40, 'n_steps': 9, 'gamma': 1.0986237231252804, 'cat_emb_dim': 2, 'n_independent': 5, 'n_shared': 1, 'momentum': 0.004128786644941466, 'mask_type': 'entmax'}. Best is trial 3 with value: 0.706772.
[I 2025-04-12 07:19:16,338] Trial 5 finished with value: 0.6556139999999999 and parameters: {'n_d': 55, 'n_steps': 5, 'gamma': 1.35230165704172, 'cat_emb_dim': 1, 'n_independent': 4, 'n_shared': 5, 'momentum': 0.00660244026040987, 'mask_type': 'entmax'}. Best is trial 3 with value: 0.706772.
[I 2025-04-12 09:20:11,530] Trial 6 finished with value: 0.79122 and parameters: {'n_d': 12, 'n_steps': 6, 'gamma': 1.9362413683946194, 'cat_emb_dim': 1, 'n_independent': 5, 'n_shared': 2, 'momentum': 0.001565927056447722, 'mask_type': 'sparsemax'}. Best is trial 6 with value: 0.79122.
[I 2025-04-12 11:53:22,046] Trial 7 finished with value: 0.624722 and parameters: {'n_d': 54, 'n_steps': 10, 'gamma': 1.9134822737181094, 'cat_emb_dim': 3, 'n_independent': 4, 'n_shared': 1, 'momentum': 0.003997547159562351, 'mask_type': 'sparsemax'}. Best is trial 6 with value: 0.79122.
[I 2025-04-12 13:34:34,262] Trial 8 finished with value: 0.61563 and parameters: {'n_d': 54, 'n_steps': 6, 'gamma': 1.194444779701091, 'cat_emb_dim': 3, 'n_independent': 4, 'n_shared': 1, 'momentum': 0.04773028710697589, 'mask_type': 'sparsemax'}. Best is trial 6 with value: 0.79122.
[I 2025-04-12 14:28:17,767] Trial 9 finished with value: 0.651452 and parameters: {'n_d': 60, 'n_steps': 5, 'gamma': 1.1929947079501824, 'cat_emb_dim': 3, 'n_independent': 3, 'n_shared': 3, 'momentum': 0.011121135935539636, 'mask_type': 'sparsemax'}. Best is trial 6 with value: 0.79122.
[I 2025-04-12 15:56:26,237] Trial 10 finished with value: 0.650212 and parameters: {'n_d': 12, 'n_steps': 7, 'gamma': 1.9823727799595416, 'cat_emb_dim': 1, 'n_independent': 1, 'n_shared': 2, 'momentum': 0.15141699777415107, 'mask_type': 'sparsemax'}. Best is trial 6 with value: 0.79122.
[I 2025-04-12 18:29:32,238] Trial 11 finished with value: 0.675504 and parameters: {'n_d': 21, 'n_steps': 8, 'gamma': 1.7329752920874772, 'cat_emb_dim': 2, 'n_independent': 3, 'n_shared': 3, 'momentum': 0.0010591422190486747, 'mask_type': 'sparsemax'}. Best is trial 6 with value: 0.79122.
[I 2025-04-12 20:06:04,871] Trial 12 finished with value: 0.731746 and parameters: {'n_d': 27, 'n_steps': 7, 'gamma': 1.753566056503768, 'cat_emb_dim': 2, 'n_independent': 2, 'n_shared': 2, 'momentum': 0.0010262374022040695, 'mask_type': 'sparsemax'}. Best is trial 6 with value: 0.79122.
[I 2025-04-12 21:31:20,076] Trial 13 finished with value: 0.7515639999999999 and parameters: {'n_d': 24, 'n_steps': 7, 'gamma': 1.813378928653155, 'cat_emb_dim': 1, 'n_independent': 1, 'n_shared': 2, 'momentum': 0.0011208234899848504, 'mask_type': 'sparsemax'}. Best is trial 6 with value: 0.79122.
[I 2025-04-12 22:56:13,339] Trial 14 finished with value: 0.6799259999999999 and parameters: {'n_d': 8, 'n_steps': 6, 'gamma': 1.8541636658707565, 'cat_emb_dim': 1, 'n_independent': 1, 'n_shared': 2, 'momentum': 0.26428042769386917, 'mask_type': 'sparsemax'}. Best is trial 6 with value: 0.79122.
[I 2025-04-13 00:18:49,896] Trial 15 finished with value: 0.73377 and parameters: {'n_d': 18, 'n_steps': 8, 'gamma': 1.6512811368015412, 'cat_emb_dim': 1, 'n_independent': 2, 'n_shared': 2, 'momentum': 0.0019053071382104593, 'mask_type': 'sparsemax'}. Best is trial 6 with value: 0.79122.
[I 2025-04-13 01:02:58,118] Trial 16 finished with value: 0.695776 and parameters: {'n_d': 27, 'n_steps': 5, 'gamma': 1.8408689007727632, 'cat_emb_dim': 1, 'n_independent': 1, 'n_shared': 3, 'momentum': 0.010803114317036809, 'mask_type': 'sparsemax'}. Best is trial 6 with value: 0.79122.
[I 2025-04-13 02:55:47,206] Trial 17 finished with value: 0.639528 and parameters: {'n_d': 17, 'n_steps': 7, 'gamma': 1.998492472407185, 'cat_emb_dim': 1, 'n_independent': 4, 'n_shared': 2, 'momentum': 0.0776258246393317, 'mask_type': 'sparsemax'}. Best is trial 6 with value: 0.79122.
[I 2025-04-13 04:38:49,270] Trial 18 finished with value: 0.61708 and parameters: {'n_d': 26, 'n_steps': 6, 'gamma': 1.620390742752858, 'cat_emb_dim': 2, 'n_independent': 2, 'n_shared': 3, 'momentum': 0.00448963300950211, 'mask_type': 'sparsemax'}. Best is trial 6 with value: 0.79122.
[I 2025-04-13 06:07:42,550] Trial 19 finished with value: 0.7934220000000001 and parameters: {'n_d': 12, 'n_steps': 10, 'gamma': 1.3943964936907358, 'cat_emb_dim': 1, 'n_independent': 3, 'n_shared': 1, 'momentum': 0.0017623393850073233, 'mask_type': 'sparsemax'}. Best is trial 19 with value: 0.7934220000000001.
[I 2025-04-13 08:02:08,823] Trial 20 finished with value: 0.661964 and parameters: {'n_d': 8, 'n_steps': 10, 'gamma': 1.321472566806313, 'cat_emb_dim': 2, 'n_independent': 3, 'n_shared': 1, 'momentum': 0.009513634461822839, 'mask_type': 'sparsemax'}. Best is trial 19 with value: 0.7934220000000001.
[I 2025-04-13 10:05:04,801] Trial 21 finished with value: 0.749864 and parameters: {'n_d': 14, 'n_steps': 9, 'gamma': 1.3919636479341027, 'cat_emb_dim': 1, 'n_independent': 5, 'n_shared': 1, 'momentum': 0.0015760481811444673, 'mask_type': 'sparsemax'}. Best is trial 19 with value: 0.7934220000000001.
[I 2025-04-13 11:32:22,033] Trial 22 finished with value: 0.6883579999999999 and parameters: {'n_d': 22, 'n_steps': 9, 'gamma': 1.8014105945746723, 'cat_emb_dim': 1, 'n_independent': 1, 'n_shared': 2, 'momentum': 0.0026061980675367684, 'mask_type': 'sparsemax'}. Best is trial 19 with value: 0.7934220000000001.
[I 2025-04-13 12:31:31,692] Trial 23 finished with value: 0.714676 and parameters: {'n_d': 35, 'n_steps': 4, 'gamma': 1.436414012154017, 'cat_emb_dim': 1, 'n_independent': 2, 'n_shared': 1, 'momentum': 0.0010190857915640347, 'mask_type': 'sparsemax'}. Best is trial 19 with value: 0.7934220000000001.
[I 2025-04-13 14:07:04,397] Trial 24 finished with value: 0.76586 and parameters: {'n_d': 14, 'n_steps': 10, 'gamma': 1.55202398308253, 'cat_emb_dim': 1, 'n_independent': 4, 'n_shared': 2, 'momentum': 0.0033210536627955663, 'mask_type': 'sparsemax'}. Best is trial 19 with value: 0.7934220000000001.
[I 2025-04-13 15:49:45,278] Trial 25 finished with value: 0.702682 and parameters: {'n_d': 14, 'n_steps': 10, 'gamma': 1.011626032531321, 'cat_emb_dim': 1, 'n_independent': 4, 'n_shared': 1, 'momentum': 0.0035913910289870087, 'mask_type': 'sparsemax'}. Best is trial 19 with value: 0.7934220000000001.
[I 2025-04-13 17:53:48,440] Trial 26 finished with value: 0.6626399999999999 and parameters: {'n_d': 12, 'n_steps': 9, 'gamma': 1.553872555107036, 'cat_emb_dim': 2, 'n_independent': 5, 'n_shared': 2, 'momentum': 0.005877567898940405, 'mask_type': 'sparsemax'}. Best is trial 19 with value: 0.7934220000000001.
[I 2025-04-13 20:02:45,098] Trial 27 finished with value: 0.71181 and parameters: {'n_d': 30, 'n_steps': 10, 'gamma': 1.321948110290802, 'cat_emb_dim': 1, 'n_independent': 4, 'n_shared': 3, 'momentum': 0.002719813881868167, 'mask_type': 'entmax'}. Best is trial 19 with value: 0.7934220000000001.
[I 2025-04-13 21:42:32,081] Trial 28 finished with value: 0.69392 and parameters: {'n_d': 17, 'n_steps': 8, 'gamma': 1.5951603764672637, 'cat_emb_dim': 1, 'n_independent': 3, 'n_shared': 2, 'momentum': 0.01904481102855936, 'mask_type': 'sparsemax'}. Best is trial 19 with value: 0.7934220000000001.
[I 2025-04-14 00:24:19,535] Trial 29 finished with value: 0.6552720000000001 and parameters: {'n_d': 20, 'n_steps': 9, 'gamma': 1.444951600779731, 'cat_emb_dim': 2, 'n_independent': 5, 'n_shared': 4, 'momentum': 0.0018384726326434273, 'mask_type': 'entmax'}. Best is trial 19 with value: 0.7934220000000001.
