[I 2025-01-08 15:31:04,795] A new study created in RDB with name: TabNet_Brazillian_Houses
[I 2025-01-08 15:45:14,667] Trial 0 finished with value: 98818911.10942322 and parameters: {'n_d': 63, 'n_steps': 9, 'gamma': 1.6722364682993278, 'cat_emb_dim': 2, 'n_independent': 2, 'n_shared': 3, 'momentum': 0.09242241311332636, 'mask_type': 'entmax'}. Best is trial 0 with value: 98818911.10942322.
[I 2025-01-08 15:56:18,260] Trial 1 finished with value: 15799481.447035799 and parameters: {'n_d': 45, 'n_steps': 4, 'gamma': 1.0272834913833628, 'cat_emb_dim': 3, 'n_independent': 2, 'n_shared': 3, 'momentum': 0.008415364229901167, 'mask_type': 'entmax'}. Best is trial 1 with value: 15799481.447035799.
[I 2025-01-08 16:04:16,479] Trial 2 finished with value: 164350606.41742557 and parameters: {'n_d': 9, 'n_steps': 3, 'gamma': 1.096096962338041, 'cat_emb_dim': 1, 'n_independent': 2, 'n_shared': 3, 'momentum': 0.008260973058022841, 'mask_type': 'entmax'}. Best is trial 1 with value: 15799481.447035799.
[I 2025-01-08 16:13:45,462] Trial 3 finished with value: 121195219.28812048 and parameters: {'n_d': 63, 'n_steps': 8, 'gamma': 1.6922876931765736, 'cat_emb_dim': 1, 'n_independent': 1, 'n_shared': 1, 'momentum': 0.0013781932870369966, 'mask_type': 'sparsemax'}. Best is trial 1 with value: 15799481.447035799.
[I 2025-01-08 16:24:44,250] Trial 4 finished with value: 116804727.09041505 and parameters: {'n_d': 17, 'n_steps': 8, 'gamma': 1.0190360913677117, 'cat_emb_dim': 2, 'n_independent': 2, 'n_shared': 1, 'momentum': 0.13160061505579326, 'mask_type': 'sparsemax'}. Best is trial 1 with value: 15799481.447035799.
[I 2025-01-08 16:34:30,106] Trial 5 finished with value: 95941437.22946522 and parameters: {'n_d': 54, 'n_steps': 4, 'gamma': 1.1829861073219416, 'cat_emb_dim': 1, 'n_independent': 3, 'n_shared': 2, 'momentum': 0.13007131674758954, 'mask_type': 'entmax'}. Best is trial 1 with value: 15799481.447035799.
[I 2025-01-08 16:48:46,229] Trial 6 finished with value: 104495199.89784956 and parameters: {'n_d': 33, 'n_steps': 10, 'gamma': 1.2793690837353928, 'cat_emb_dim': 2, 'n_independent': 3, 'n_shared': 4, 'momentum': 0.005380857583177424, 'mask_type': 'entmax'}. Best is trial 1 with value: 15799481.447035799.
[I 2025-01-08 17:03:53,476] Trial 7 finished with value: 208054398.2469626 and parameters: {'n_d': 12, 'n_steps': 3, 'gamma': 1.1146417093142986, 'cat_emb_dim': 2, 'n_independent': 2, 'n_shared': 4, 'momentum': 0.002257816219418367, 'mask_type': 'sparsemax'}. Best is trial 1 with value: 15799481.447035799.
[I 2025-01-08 17:13:15,950] Trial 8 finished with value: 153801542.18558204 and parameters: {'n_d': 40, 'n_steps': 6, 'gamma': 1.3440506402823553, 'cat_emb_dim': 1, 'n_independent': 2, 'n_shared': 3, 'momentum': 0.01064456821658416, 'mask_type': 'entmax'}. Best is trial 1 with value: 15799481.447035799.
[I 2025-01-08 17:25:02,478] Trial 9 finished with value: 176699266.3581178 and parameters: {'n_d': 29, 'n_steps': 6, 'gamma': 1.7724898639201772, 'cat_emb_dim': 1, 'n_independent': 4, 'n_shared': 3, 'momentum': 0.04679086534507053, 'mask_type': 'sparsemax'}. Best is trial 1 with value: 15799481.447035799.
[I 2025-01-08 17:36:36,963] Trial 10 finished with value: 159675014.37930018 and parameters: {'n_d': 47, 'n_steps': 5, 'gamma': 1.4619658924930203, 'cat_emb_dim': 3, 'n_independent': 5, 'n_shared': 5, 'momentum': 0.03149151083043816, 'mask_type': 'entmax'}. Best is trial 1 with value: 15799481.447035799.
[I 2025-01-08 17:45:32,957] Trial 11 finished with value: 140217124.29364124 and parameters: {'n_d': 50, 'n_steps': 4, 'gamma': 1.2378379750024018, 'cat_emb_dim': 3, 'n_independent': 4, 'n_shared': 2, 'momentum': 0.351128027386493, 'mask_type': 'entmax'}. Best is trial 1 with value: 15799481.447035799.
[I 2025-01-08 17:52:25,684] Trial 12 finished with value: 190573238.83822808 and parameters: {'n_d': 54, 'n_steps': 5, 'gamma': 1.9610855918349412, 'cat_emb_dim': 3, 'n_independent': 3, 'n_shared': 2, 'momentum': 0.01752763994741113, 'mask_type': 'entmax'}. Best is trial 1 with value: 15799481.447035799.
[I 2025-01-08 17:59:43,007] Trial 13 finished with value: 89211371.84696676 and parameters: {'n_d': 44, 'n_steps': 4, 'gamma': 1.1532191570901367, 'cat_emb_dim': 3, 'n_independent': 1, 'n_shared': 2, 'momentum': 0.2410608751975085, 'mask_type': 'entmax'}. Best is trial 1 with value: 15799481.447035799.
[I 2025-01-08 18:09:44,939] Trial 14 finished with value: 154355743.89963013 and parameters: {'n_d': 42, 'n_steps': 4, 'gamma': 1.3855378607698725, 'cat_emb_dim': 3, 'n_independent': 1, 'n_shared': 4, 'momentum': 0.39396597402012046, 'mask_type': 'entmax'}. Best is trial 1 with value: 15799481.447035799.
[I 2025-01-08 18:22:08,283] Trial 15 finished with value: 83141210.48157305 and parameters: {'n_d': 25, 'n_steps': 7, 'gamma': 1.0054282628091347, 'cat_emb_dim': 3, 'n_independent': 1, 'n_shared': 2, 'momentum': 0.004373164262699337, 'mask_type': 'entmax'}. Best is trial 1 with value: 15799481.447035799.
[I 2025-01-08 18:35:41,378] Trial 16 finished with value: 35215551.89475141 and parameters: {'n_d': 24, 'n_steps': 7, 'gamma': 1.003920831342099, 'cat_emb_dim': 3, 'n_independent': 1, 'n_shared': 1, 'momentum': 0.003926410913536784, 'mask_type': 'entmax'}. Best is trial 1 with value: 15799481.447035799.
[I 2025-01-08 18:46:44,198] Trial 17 finished with value: 140332387.51819676 and parameters: {'n_d': 21, 'n_steps': 7, 'gamma': 1.545312715528563, 'cat_emb_dim': 3, 'n_independent': 1, 'n_shared': 5, 'momentum': 0.0028083982326935564, 'mask_type': 'entmax'}. Best is trial 1 with value: 15799481.447035799.
[I 2025-01-08 19:02:24,116] Trial 18 finished with value: 24929162.14172214 and parameters: {'n_d': 36, 'n_steps': 8, 'gamma': 1.0137114380491843, 'cat_emb_dim': 2, 'n_independent': 3, 'n_shared': 1, 'momentum': 0.01565560493427606, 'mask_type': 'sparsemax'}. Best is trial 1 with value: 15799481.447035799.
[I 2025-01-08 19:13:24,557] Trial 19 finished with value: 151060180.88028887 and parameters: {'n_d': 35, 'n_steps': 10, 'gamma': 1.3246100574467568, 'cat_emb_dim': 2, 'n_independent': 4, 'n_shared': 1, 'momentum': 0.01742596856129769, 'mask_type': 'sparsemax'}. Best is trial 1 with value: 15799481.447035799.
[I 2025-01-08 19:29:46,319] Trial 20 finished with value: 103288240.11879739 and parameters: {'n_d': 37, 'n_steps': 8, 'gamma': 1.5307112642038883, 'cat_emb_dim': 2, 'n_independent': 5, 'n_shared': 4, 'momentum': 0.012006979564164471, 'mask_type': 'sparsemax'}. Best is trial 1 with value: 15799481.447035799.
[I 2025-01-08 19:37:33,503] Trial 21 finished with value: 168806499.88254896 and parameters: {'n_d': 29, 'n_steps': 7, 'gamma': 1.00007697811649, 'cat_emb_dim': 2, 'n_independent': 3, 'n_shared': 1, 'momentum': 0.005851029438817634, 'mask_type': 'sparsemax'}. Best is trial 1 with value: 15799481.447035799.
[I 2025-01-08 19:48:12,128] Trial 22 finished with value: 140740196.00600594 and parameters: {'n_d': 22, 'n_steps': 9, 'gamma': 1.084779578755593, 'cat_emb_dim': 3, 'n_independent': 2, 'n_shared': 1, 'momentum': 0.0385828446987663, 'mask_type': 'sparsemax'}. Best is trial 1 with value: 15799481.447035799.
[I 2025-01-08 20:01:38,220] Trial 23 finished with value: 125784332.35499308 and parameters: {'n_d': 30, 'n_steps': 6, 'gamma': 1.2162788119984178, 'cat_emb_dim': 2, 'n_independent': 3, 'n_shared': 1, 'momentum': 0.0012921377923856472, 'mask_type': 'sparsemax'}. Best is trial 1 with value: 15799481.447035799.
[I 2025-01-08 20:15:04,466] Trial 24 finished with value: 47590621.03399776 and parameters: {'n_d': 39, 'n_steps': 8, 'gamma': 1.08601065755408, 'cat_emb_dim': 3, 'n_independent': 2, 'n_shared': 2, 'momentum': 0.00296324241620184, 'mask_type': 'entmax'}. Best is trial 1 with value: 15799481.447035799.
[I 2025-01-08 20:22:25,047] Trial 25 finished with value: 168226755.8837646 and parameters: {'n_d': 16, 'n_steps': 9, 'gamma': 1.1699106699309285, 'cat_emb_dim': 2, 'n_independent': 1, 'n_shared': 1, 'momentum': 0.008931539891528244, 'mask_type': 'entmax'}. Best is trial 1 with value: 15799481.447035799.
[I 2025-01-08 20:28:48,244] Trial 26 finished with value: 163991446.5228999 and parameters: {'n_d': 47, 'n_steps': 5, 'gamma': 1.0565330445135057, 'cat_emb_dim': 3, 'n_independent': 4, 'n_shared': 2, 'momentum': 0.020932685700597576, 'mask_type': 'sparsemax'}. Best is trial 1 with value: 15799481.447035799.
[I 2025-01-08 20:39:08,243] Trial 27 finished with value: 166538458.0557604 and parameters: {'n_d': 24, 'n_steps': 7, 'gamma': 1.4350906127007317, 'cat_emb_dim': 3, 'n_independent': 2, 'n_shared': 1, 'momentum': 0.0042587174392978554, 'mask_type': 'entmax'}. Best is trial 1 with value: 15799481.447035799.
[I 2025-01-08 20:51:35,225] Trial 28 finished with value: 140626732.0948825 and parameters: {'n_d': 57, 'n_steps': 6, 'gamma': 1.2673929344286312, 'cat_emb_dim': 2, 'n_independent': 1, 'n_shared': 5, 'momentum': 0.05846272295741016, 'mask_type': 'sparsemax'}. Best is trial 1 with value: 15799481.447035799.
[I 2025-01-08 21:06:52,233] Trial 29 finished with value: 164783338.27411124 and parameters: {'n_d': 31, 'n_steps': 9, 'gamma': 1.9891063874226036, 'cat_emb_dim': 2, 'n_independent': 2, 'n_shared': 3, 'momentum': 0.027641975090960818, 'mask_type': 'entmax'}. Best is trial 1 with value: 15799481.447035799.
[I 2025-01-08 21:18:21,046] Trial 30 finished with value: 76851606.36113791 and parameters: {'n_d': 36, 'n_steps': 8, 'gamma': 1.146801418892852, 'cat_emb_dim': 3, 'n_independent': 3, 'n_shared': 2, 'momentum': 0.007066629474732099, 'mask_type': 'entmax'}. Best is trial 1 with value: 15799481.447035799.
[I 2025-01-08 21:30:23,374] Trial 31 finished with value: 74876252.45766078 and parameters: {'n_d': 40, 'n_steps': 8, 'gamma': 1.0621992214179523, 'cat_emb_dim': 3, 'n_independent': 2, 'n_shared': 3, 'momentum': 0.0032240211374830415, 'mask_type': 'entmax'}. Best is trial 1 with value: 15799481.447035799.
[I 2025-01-08 21:40:48,967] Trial 32 finished with value: 110446441.09576075 and parameters: {'n_d': 45, 'n_steps': 7, 'gamma': 1.099313605005028, 'cat_emb_dim': 3, 'n_independent': 2, 'n_shared': 2, 'momentum': 0.0016443678141083147, 'mask_type': 'entmax'}. Best is trial 1 with value: 15799481.447035799.
[I 2025-01-08 21:52:59,468] Trial 33 finished with value: 72971688.35138169 and parameters: {'n_d': 50, 'n_steps': 8, 'gamma': 1.053552682403719, 'cat_emb_dim': 3, 'n_independent': 3, 'n_shared': 1, 'momentum': 0.002128884723018913, 'mask_type': 'entmax'}. Best is trial 1 with value: 15799481.447035799.
[I 2025-01-08 22:07:41,796] Trial 34 finished with value: 40697089.107288495 and parameters: {'n_d': 39, 'n_steps': 9, 'gamma': 1.0037490935899624, 'cat_emb_dim': 3, 'n_independent': 2, 'n_shared': 3, 'momentum': 0.012599695618249864, 'mask_type': 'entmax'}. Best is trial 1 with value: 15799481.447035799.
[I 2025-01-08 22:24:57,887] Trial 35 finished with value: 105562142.95360786 and parameters: {'n_d': 8, 'n_steps': 10, 'gamma': 1.0098081741765956, 'cat_emb_dim': 3, 'n_independent': 1, 'n_shared': 3, 'momentum': 0.011740709850855643, 'mask_type': 'entmax'}. Best is trial 1 with value: 15799481.447035799.
[I 2025-01-08 22:38:43,540] Trial 36 finished with value: 116331289.84613189 and parameters: {'n_d': 59, 'n_steps': 9, 'gamma': 1.6094474580511309, 'cat_emb_dim': 1, 'n_independent': 3, 'n_shared': 4, 'momentum': 0.0146892971709726, 'mask_type': 'entmax'}. Best is trial 1 with value: 15799481.447035799.
[I 2025-01-08 22:48:54,237] Trial 37 finished with value: 129404874.44851024 and parameters: {'n_d': 26, 'n_steps': 9, 'gamma': 1.201337502728863, 'cat_emb_dim': 2, 'n_independent': 2, 'n_shared': 3, 'momentum': 0.007162564876252025, 'mask_type': 'sparsemax'}. Best is trial 1 with value: 15799481.447035799.
[I 2025-01-08 22:57:57,899] Trial 38 finished with value: 162613560.82955706 and parameters: {'n_d': 34, 'n_steps': 3, 'gamma': 1.1134395030450714, 'cat_emb_dim': 2, 'n_independent': 2, 'n_shared': 3, 'momentum': 0.024473576822883175, 'mask_type': 'entmax'}. Best is trial 1 with value: 15799481.447035799.
[I 2025-01-08 23:10:54,147] Trial 39 finished with value: 158162144.6641379 and parameters: {'n_d': 16, 'n_steps': 10, 'gamma': 1.718634091975975, 'cat_emb_dim': 3, 'n_independent': 1, 'n_shared': 4, 'momentum': 0.09097414843058972, 'mask_type': 'sparsemax'}. Best is trial 1 with value: 15799481.447035799.
[I 2025-01-08 23:23:55,704] Trial 40 finished with value: 122212383.66755323 and parameters: {'n_d': 51, 'n_steps': 8, 'gamma': 1.8510677075725779, 'cat_emb_dim': 1, 'n_independent': 2, 'n_shared': 2, 'momentum': 0.004893471436493528, 'mask_type': 'entmax'}. Best is trial 1 with value: 15799481.447035799.
[I 2025-01-08 23:33:55,115] Trial 41 finished with value: 96946002.3391734 and parameters: {'n_d': 41, 'n_steps': 8, 'gamma': 1.0523405408359352, 'cat_emb_dim': 3, 'n_independent': 2, 'n_shared': 1, 'momentum': 0.0033359473545559715, 'mask_type': 'entmax'}. Best is trial 1 with value: 15799481.447035799.
[I 2025-01-08 23:46:49,184] Trial 42 finished with value: 126439785.86645088 and parameters: {'n_d': 38, 'n_steps': 8, 'gamma': 1.1265850673894726, 'cat_emb_dim': 3, 'n_independent': 2, 'n_shared': 2, 'momentum': 0.009186281612369345, 'mask_type': 'entmax'}. Best is trial 1 with value: 15799481.447035799.
[I 2025-01-09 00:06:06,926] Trial 43 finished with value: 55312272.16972619 and parameters: {'n_d': 43, 'n_steps': 9, 'gamma': 1.0392567282177565, 'cat_emb_dim': 3, 'n_independent': 3, 'n_shared': 3, 'momentum': 0.0018428829317633844, 'mask_type': 'entmax'}. Best is trial 1 with value: 15799481.447035799.
[I 2025-01-09 00:12:20,668] Trial 44 finished with value: 152907435.3049012 and parameters: {'n_d': 39, 'n_steps': 7, 'gamma': 1.0879881682776487, 'cat_emb_dim': 3, 'n_independent': 2, 'n_shared': 1, 'momentum': 0.006035007748222137, 'mask_type': 'entmax'}. Best is trial 1 with value: 15799481.447035799.
[I 2025-01-09 00:21:21,709] Trial 45 finished with value: 118247382.14123389 and parameters: {'n_d': 47, 'n_steps': 6, 'gamma': 1.174189222963789, 'cat_emb_dim': 3, 'n_independent': 1, 'n_shared': 2, 'momentum': 0.0011249146874147576, 'mask_type': 'entmax'}. Best is trial 1 with value: 15799481.447035799.
[I 2025-01-09 00:38:18,881] Trial 46 finished with value: 25193007.32087676 and parameters: {'n_d': 32, 'n_steps': 5, 'gamma': 1.0042048898495488, 'cat_emb_dim': 3, 'n_independent': 4, 'n_shared': 3, 'momentum': 0.002615943725356089, 'mask_type': 'entmax'}. Best is trial 1 with value: 15799481.447035799.
[I 2025-01-09 00:49:08,752] Trial 47 finished with value: 124920749.55401674 and parameters: {'n_d': 33, 'n_steps': 5, 'gamma': 1.0065067828343515, 'cat_emb_dim': 2, 'n_independent': 4, 'n_shared': 3, 'momentum': 0.013960930011662563, 'mask_type': 'entmax'}. Best is trial 1 with value: 15799481.447035799.
[I 2025-01-09 01:00:00,958] Trial 48 finished with value: 134413793.9262299 and parameters: {'n_d': 20, 'n_steps': 3, 'gamma': 1.2542897648325417, 'cat_emb_dim': 3, 'n_independent': 5, 'n_shared': 4, 'momentum': 0.0041847993249834745, 'mask_type': 'sparsemax'}. Best is trial 1 with value: 15799481.447035799.
[I 2025-01-09 01:11:04,672] Trial 49 finished with value: 72826566.80888031 and parameters: {'n_d': 28, 'n_steps': 5, 'gamma': 1.1296936872962524, 'cat_emb_dim': 3, 'n_independent': 4, 'n_shared': 3, 'momentum': 0.007680529367730951, 'mask_type': 'entmax'}. Best is trial 1 with value: 15799481.447035799.
[I 2025-01-09 01:22:40,369] Trial 50 finished with value: 23754051.802760847 and parameters: {'n_d': 32, 'n_steps': 4, 'gamma': 1.0367765461507217, 'cat_emb_dim': 2, 'n_independent': 4, 'n_shared': 4, 'momentum': 0.011044099870675337, 'mask_type': 'entmax'}. Best is trial 1 with value: 15799481.447035799.
[I 2025-01-09 01:35:07,338] Trial 51 finished with value: 89720634.97858039 and parameters: {'n_d': 32, 'n_steps': 4, 'gamma': 1.0316925185972063, 'cat_emb_dim': 2, 'n_independent': 4, 'n_shared': 4, 'momentum': 0.009786944152371822, 'mask_type': 'entmax'}. Best is trial 1 with value: 15799481.447035799.
[I 2025-01-09 01:43:42,919] Trial 52 finished with value: 158280027.06548494 and parameters: {'n_d': 12, 'n_steps': 4, 'gamma': 1.0006963988980184, 'cat_emb_dim': 2, 'n_independent': 4, 'n_shared': 5, 'momentum': 0.014236702820554732, 'mask_type': 'entmax'}. Best is trial 1 with value: 15799481.447035799.
[I 2025-01-09 02:03:22,345] Trial 53 finished with value: 44500951.71175694 and parameters: {'n_d': 36, 'n_steps': 4, 'gamma': 1.3168246686808946, 'cat_emb_dim': 2, 'n_independent': 5, 'n_shared': 4, 'momentum': 0.01968447839978638, 'mask_type': 'entmax'}. Best is trial 1 with value: 15799481.447035799.
[I 2025-01-09 02:13:18,150] Trial 54 finished with value: 71615502.0403816 and parameters: {'n_d': 27, 'n_steps': 3, 'gamma': 1.0615369671085915, 'cat_emb_dim': 2, 'n_independent': 4, 'n_shared': 3, 'momentum': 0.0022596228403291697, 'mask_type': 'entmax'}. Best is trial 1 with value: 15799481.447035799.
[I 2025-01-09 02:25:26,449] Trial 55 finished with value: 50808110.13276866 and parameters: {'n_d': 23, 'n_steps': 5, 'gamma': 1.144068442585637, 'cat_emb_dim': 1, 'n_independent': 3, 'n_shared': 4, 'momentum': 0.033614247666163305, 'mask_type': 'entmax'}. Best is trial 1 with value: 15799481.447035799.
[I 2025-01-09 02:32:56,018] Trial 56 finished with value: 180234341.59961 and parameters: {'n_d': 32, 'n_steps': 4, 'gamma': 1.2174191169743416, 'cat_emb_dim': 2, 'n_independent': 4, 'n_shared': 3, 'momentum': 0.005662988212255883, 'mask_type': 'sparsemax'}. Best is trial 1 with value: 15799481.447035799.
[I 2025-01-09 02:40:15,794] Trial 57 finished with value: 160227809.08838826 and parameters: {'n_d': 45, 'n_steps': 3, 'gamma': 1.1015209269417587, 'cat_emb_dim': 3, 'n_independent': 3, 'n_shared': 3, 'momentum': 0.0037180774822981595, 'mask_type': 'entmax'}. Best is trial 1 with value: 15799481.447035799.
[I 2025-01-09 02:56:42,449] Trial 58 finished with value: 88763400.39864258 and parameters: {'n_d': 19, 'n_steps': 6, 'gamma': 1.035844552763148, 'cat_emb_dim': 3, 'n_independent': 5, 'n_shared': 5, 'momentum': 0.010271911585114769, 'mask_type': 'sparsemax'}. Best is trial 1 with value: 15799481.447035799.
[I 2025-01-09 03:07:46,957] Trial 59 finished with value: 77424568.45191446 and parameters: {'n_d': 34, 'n_steps': 5, 'gamma': 1.0784851865703369, 'cat_emb_dim': 2, 'n_independent': 3, 'n_shared': 1, 'momentum': 0.016737551984424098, 'mask_type': 'entmax'}. Best is trial 1 with value: 15799481.447035799.
[I 2025-01-09 03:17:33,705] Trial 60 finished with value: 78915307.3579342 and parameters: {'n_d': 30, 'n_steps': 4, 'gamma': 1.0345718496845304, 'cat_emb_dim': 3, 'n_independent': 4, 'n_shared': 3, 'momentum': 0.0027167247229077265, 'mask_type': 'entmax'}. Best is trial 1 with value: 15799481.447035799.
[I 2025-01-09 03:30:02,536] Trial 61 finished with value: 19694866.671316266 and parameters: {'n_d': 36, 'n_steps': 4, 'gamma': 1.4323711770604026, 'cat_emb_dim': 2, 'n_independent': 5, 'n_shared': 4, 'momentum': 0.02007336510421456, 'mask_type': 'entmax'}. Best is trial 1 with value: 15799481.447035799.
[I 2025-01-09 03:41:26,677] Trial 62 finished with value: 98769476.5650092 and parameters: {'n_d': 42, 'n_steps': 4, 'gamma': 1.4089359952907443, 'cat_emb_dim': 2, 'n_independent': 5, 'n_shared': 4, 'momentum': 0.02211378486485808, 'mask_type': 'entmax'}. Best is trial 1 with value: 15799481.447035799.
[I 2025-01-09 03:57:27,526] Trial 63 finished with value: 52833030.28632096 and parameters: {'n_d': 37, 'n_steps': 4, 'gamma': 1.5770899994588206, 'cat_emb_dim': 2, 'n_independent': 5, 'n_shared': 4, 'momentum': 0.011566641268840237, 'mask_type': 'entmax'}. Best is trial 1 with value: 15799481.447035799.
[I 2025-01-09 04:09:12,473] Trial 64 finished with value: 107406375.13060665 and parameters: {'n_d': 36, 'n_steps': 5, 'gamma': 1.8451676411216804, 'cat_emb_dim': 2, 'n_independent': 5, 'n_shared': 4, 'momentum': 0.05198253150511966, 'mask_type': 'entmax'}. Best is trial 1 with value: 15799481.447035799.
[I 2025-01-09 04:22:30,054] Trial 65 finished with value: 156870188.79569986 and parameters: {'n_d': 39, 'n_steps': 7, 'gamma': 1.4822420566964938, 'cat_emb_dim': 2, 'n_independent': 3, 'n_shared': 5, 'momentum': 0.02633335199392206, 'mask_type': 'entmax'}. Best is trial 1 with value: 15799481.447035799.
[I 2025-01-09 04:32:19,545] Trial 66 finished with value: 130728573.18727024 and parameters: {'n_d': 29, 'n_steps': 3, 'gamma': 1.1649185584632664, 'cat_emb_dim': 2, 'n_independent': 1, 'n_shared': 3, 'momentum': 0.006870620759662631, 'mask_type': 'sparsemax'}. Best is trial 1 with value: 15799481.447035799.
[I 2025-01-09 04:41:37,235] Trial 67 finished with value: 92679834.80521052 and parameters: {'n_d': 35, 'n_steps': 4, 'gamma': 1.0000681494069958, 'cat_emb_dim': 2, 'n_independent': 4, 'n_shared': 4, 'momentum': 0.016985152005593775, 'mask_type': 'entmax'}. Best is trial 1 with value: 15799481.447035799.
[I 2025-01-09 04:53:32,521] Trial 68 finished with value: 73480998.44612232 and parameters: {'n_d': 26, 'n_steps': 5, 'gamma': 1.2957799942727253, 'cat_emb_dim': 3, 'n_independent': 3, 'n_shared': 2, 'momentum': 0.04293141192326631, 'mask_type': 'entmax'}. Best is trial 1 with value: 15799481.447035799.
[I 2025-01-09 05:04:11,365] Trial 69 finished with value: 97213882.05258583 and parameters: {'n_d': 41, 'n_steps': 6, 'gamma': 1.0752438681270609, 'cat_emb_dim': 3, 'n_independent': 1, 'n_shared': 3, 'momentum': 0.013000735117312945, 'mask_type': 'entmax'}. Best is trial 1 with value: 15799481.447035799.
[I 2025-01-09 05:14:55,449] Trial 70 finished with value: 149777166.63493726 and parameters: {'n_d': 45, 'n_steps': 7, 'gamma': 1.1090008993595308, 'cat_emb_dim': 1, 'n_independent': 5, 'n_shared': 1, 'momentum': 0.008237362448087239, 'mask_type': 'sparsemax'}. Best is trial 1 with value: 15799481.447035799.
