[I 2025-01-10 06:37:16,542] Trial 0 finished with value: 1867292.3447598126 and parameters: {'n_d': 21, 'n_steps': 8, 'gamma': 1.6984843446896827, 'cat_emb_dim': 3, 'n_independent': 5, 'n_shared': 2, 'momentum': 0.19473225418743384, 'mask_type': 'sparsemax'}. Best is trial 0 with value: 1867292.3447598126.
[I 2025-01-10 06:39:28,335] Trial 1 finished with value: 1115679.6878646987 and parameters: {'n_d': 63, 'n_steps': 4, 'gamma': 1.4421423664320439, 'cat_emb_dim': 3, 'n_independent': 5, 'n_shared': 4, 'momentum': 0.15922368978451548, 'mask_type': 'entmax'}. Best is trial 1 with value: 1115679.6878646987.
[I 2025-01-10 06:43:19,021] Trial 2 finished with value: 6418723.7436031 and parameters: {'n_d': 58, 'n_steps': 8, 'gamma': 1.696776885983604, 'cat_emb_dim': 3, 'n_independent': 5, 'n_shared': 3, 'momentum': 0.174310130731116, 'mask_type': 'sparsemax'}. Best is trial 1 with value: 1115679.6878646987.
[I 2025-01-10 06:46:54,517] Trial 3 finished with value: 1446894.1428965947 and parameters: {'n_d': 24, 'n_steps': 9, 'gamma': 1.2335915833186768, 'cat_emb_dim': 3, 'n_independent': 3, 'n_shared': 2, 'momentum': 0.3953026775916156, 'mask_type': 'entmax'}. Best is trial 1 with value: 1115679.6878646987.
[I 2025-01-10 06:50:09,441] Trial 4 finished with value: 99929692.9546702 and parameters: {'n_d': 10, 'n_steps': 5, 'gamma': 1.4944829002774211, 'cat_emb_dim': 3, 'n_independent': 2, 'n_shared': 4, 'momentum': 0.020159823407471182, 'mask_type': 'sparsemax'}. Best is trial 1 with value: 1115679.6878646987.
[I 2025-01-10 06:53:26,068] Trial 5 finished with value: 1894236.4709686842 and parameters: {'n_d': 24, 'n_steps': 8, 'gamma': 1.3041942625501104, 'cat_emb_dim': 3, 'n_independent': 2, 'n_shared': 5, 'momentum': 0.25003455522007006, 'mask_type': 'entmax'}. Best is trial 1 with value: 1115679.6878646987.
[I 2025-01-10 06:57:15,196] Trial 6 finished with value: 2909697.8428332666 and parameters: {'n_d': 18, 'n_steps': 6, 'gamma': 1.4933545242266235, 'cat_emb_dim': 2, 'n_independent': 4, 'n_shared': 5, 'momentum': 0.02027723495837258, 'mask_type': 'sparsemax'}. Best is trial 1 with value: 1115679.6878646987.
[I 2025-01-10 06:59:29,304] Trial 7 finished with value: 98627723.68843827 and parameters: {'n_d': 33, 'n_steps': 9, 'gamma': 1.6475792532334372, 'cat_emb_dim': 3, 'n_independent': 2, 'n_shared': 1, 'momentum': 0.00989408049279962, 'mask_type': 'sparsemax'}. Best is trial 1 with value: 1115679.6878646987.
[I 2025-01-10 07:01:22,971] Trial 8 finished with value: 1593107.7026460061 and parameters: {'n_d': 37, 'n_steps': 6, 'gamma': 1.165860496347558, 'cat_emb_dim': 2, 'n_independent': 3, 'n_shared': 1, 'momentum': 0.06427863874352416, 'mask_type': 'sparsemax'}. Best is trial 1 with value: 1115679.6878646987.
[I 2025-01-10 07:06:34,580] Trial 9 finished with value: 33555890.48872714 and parameters: {'n_d': 25, 'n_steps': 9, 'gamma': 1.681946095737667, 'cat_emb_dim': 2, 'n_independent': 5, 'n_shared': 5, 'momentum': 0.1874122218350896, 'mask_type': 'sparsemax'}. Best is trial 1 with value: 1115679.6878646987.
[I 2025-01-10 07:07:15,075] Trial 10 finished with value: 161203629.778417 and parameters: {'n_d': 64, 'n_steps': 3, 'gamma': 1.9510978098941285, 'cat_emb_dim': 1, 'n_independent': 1, 'n_shared': 4, 'momentum': 0.0017615470850361518, 'mask_type': 'entmax'}. Best is trial 1 with value: 1115679.6878646987.
[I 2025-01-10 07:09:37,150] Trial 11 finished with value: 2075311.6304242443 and parameters: {'n_d': 49, 'n_steps': 3, 'gamma': 1.0159483744131248, 'cat_emb_dim': 1, 'n_independent': 4, 'n_shared': 3, 'momentum': 0.059579426656735046, 'mask_type': 'entmax'}. Best is trial 1 with value: 1115679.6878646987.
[I 2025-01-10 07:12:29,836] Trial 12 finished with value: 2831243.184299477 and parameters: {'n_d': 44, 'n_steps': 10, 'gamma': 1.3016572272576479, 'cat_emb_dim': 3, 'n_independent': 3, 'n_shared': 2, 'momentum': 0.07384667193095938, 'mask_type': 'entmax'}. Best is trial 1 with value: 1115679.6878646987.
[I 2025-01-10 07:14:50,085] Trial 13 finished with value: 1230565.3932545963 and parameters: {'n_d': 34, 'n_steps': 4, 'gamma': 1.331122951142225, 'cat_emb_dim': 2, 'n_independent': 4, 'n_shared': 2, 'momentum': 0.321690392199758, 'mask_type': 'entmax'}. Best is trial 1 with value: 1115679.6878646987.
[I 2025-01-10 07:15:52,937] Trial 14 finished with value: 302874208.6123727 and parameters: {'n_d': 51, 'n_steps': 4, 'gamma': 1.4340563334940817, 'cat_emb_dim': 2, 'n_independent': 4, 'n_shared': 4, 'momentum': 0.004379817842967793, 'mask_type': 'entmax'}. Best is trial 1 with value: 1115679.6878646987.
[I 2025-01-10 07:18:24,110] Trial 15 finished with value: 9572983.092076411 and parameters: {'n_d': 38, 'n_steps': 4, 'gamma': 1.096166597815288, 'cat_emb_dim': 1, 'n_independent': 4, 'n_shared': 3, 'momentum': 0.0930335575952972, 'mask_type': 'entmax'}. Best is trial 1 with value: 1115679.6878646987.
[I 2025-01-10 07:21:16,065] Trial 16 finished with value: 1258934.9585340356 and parameters: {'n_d': 32, 'n_steps': 5, 'gamma': 1.3751370013494697, 'cat_emb_dim': 2, 'n_independent': 5, 'n_shared': 2, 'momentum': 0.03430749518926619, 'mask_type': 'entmax'}. Best is trial 1 with value: 1115679.6878646987.
[I 2025-01-10 07:23:58,474] Trial 17 finished with value: 2598373.986795701 and parameters: {'n_d': 42, 'n_steps': 4, 'gamma': 1.5693878279747748, 'cat_emb_dim': 2, 'n_independent': 4, 'n_shared': 4, 'momentum': 0.3975620711737586, 'mask_type': 'entmax'}. Best is trial 1 with value: 1115679.6878646987.
[I 2025-01-10 07:25:58,051] Trial 18 finished with value: 12229918.04633091 and parameters: {'n_d': 54, 'n_steps': 5, 'gamma': 1.9052216008265714, 'cat_emb_dim': 2, 'n_independent': 5, 'n_shared': 3, 'momentum': 0.12822021816020143, 'mask_type': 'entmax'}. Best is trial 1 with value: 1115679.6878646987.
[I 2025-01-10 07:27:50,227] Trial 19 finished with value: 1367981.2244164567 and parameters: {'n_d': 63, 'n_steps': 3, 'gamma': 1.370464055833041, 'cat_emb_dim': 1, 'n_independent': 4, 'n_shared': 1, 'momentum': 0.04054362303017239, 'mask_type': 'entmax'}. Best is trial 1 with value: 1115679.6878646987.
[I 2025-01-10 07:29:40,258] Trial 20 finished with value: 183237166.81912997 and parameters: {'n_d': 29, 'n_steps': 7, 'gamma': 1.5599994461824591, 'cat_emb_dim': 2, 'n_independent': 3, 'n_shared': 3, 'momentum': 0.006996652168288335, 'mask_type': 'entmax'}. Best is trial 1 with value: 1115679.6878646987.
[I 2025-01-10 07:32:13,754] Trial 21 finished with value: 5424566.688832029 and parameters: {'n_d': 31, 'n_steps': 5, 'gamma': 1.3742353981737419, 'cat_emb_dim': 2, 'n_independent': 5, 'n_shared': 2, 'momentum': 0.034090322590923074, 'mask_type': 'entmax'}. Best is trial 1 with value: 1115679.6878646987.
[I 2025-01-10 07:34:38,413] Trial 22 finished with value: 2271240.3665945595 and parameters: {'n_d': 44, 'n_steps': 4, 'gamma': 1.217787501555249, 'cat_emb_dim': 2, 'n_independent': 5, 'n_shared': 2, 'momentum': 0.11345482352823702, 'mask_type': 'entmax'}. Best is trial 1 with value: 1115679.6878646987.
[I 2025-01-10 07:37:56,084] Trial 23 finished with value: 2474877.273889915 and parameters: {'n_d': 16, 'n_steps': 5, 'gamma': 1.39408156241291, 'cat_emb_dim': 2, 'n_independent': 5, 'n_shared': 2, 'momentum': 0.03087997189683634, 'mask_type': 'entmax'}. Best is trial 1 with value: 1115679.6878646987.
[I 2025-01-10 07:39:58,207] Trial 24 finished with value: 2850997.608735594 and parameters: {'n_d': 39, 'n_steps': 6, 'gamma': 1.29740086556322, 'cat_emb_dim': 2, 'n_independent': 4, 'n_shared': 1, 'momentum': 0.011368255323061327, 'mask_type': 'entmax'}. Best is trial 1 with value: 1115679.6878646987.
[I 2025-01-10 07:43:13,891] Trial 25 finished with value: 947617.2737359334 and parameters: {'n_d': 29, 'n_steps': 4, 'gamma': 1.4656192639903574, 'cat_emb_dim': 1, 'n_independent': 5, 'n_shared': 4, 'momentum': 0.2923411027862741, 'mask_type': 'entmax'}. Best is trial 25 with value: 947617.2737359334.
[I 2025-01-10 07:46:05,518] Trial 26 finished with value: 935010.0778342725 and parameters: {'n_d': 28, 'n_steps': 3, 'gamma': 1.779630880762908, 'cat_emb_dim': 1, 'n_independent': 4, 'n_shared': 4, 'momentum': 0.2568843766389231, 'mask_type': 'entmax'}. Best is trial 26 with value: 935010.0778342725.
[I 2025-01-10 07:50:11,612] Trial 27 finished with value: 1070912.6657738558 and parameters: {'n_d': 12, 'n_steps': 3, 'gamma': 1.8328595371872913, 'cat_emb_dim': 1, 'n_independent': 5, 'n_shared': 4, 'momentum': 0.13619432797436606, 'mask_type': 'entmax'}. Best is trial 26 with value: 935010.0778342725.
[I 2025-01-10 07:54:20,418] Trial 28 finished with value: 24935316.7812305 and parameters: {'n_d': 8, 'n_steps': 3, 'gamma': 1.8236036646049385, 'cat_emb_dim': 1, 'n_independent': 5, 'n_shared': 4, 'momentum': 0.24909637970983406, 'mask_type': 'entmax'}. Best is trial 26 with value: 935010.0778342725.
[I 2025-01-10 07:58:46,852] Trial 29 finished with value: 1583353.8689049887 and parameters: {'n_d': 13, 'n_steps': 3, 'gamma': 1.7981693522219837, 'cat_emb_dim': 1, 'n_independent': 4, 'n_shared': 5, 'momentum': 0.24653055679412875, 'mask_type': 'entmax'}. Best is trial 26 with value: 935010.0778342725.
[I 2025-01-10 08:02:04,392] Trial 30 finished with value: 934001.0649017667 and parameters: {'n_d': 20, 'n_steps': 3, 'gamma': 1.803917376707574, 'cat_emb_dim': 1, 'n_independent': 5, 'n_shared': 4, 'momentum': 0.11242063646695065, 'mask_type': 'entmax'}. Best is trial 30 with value: 934001.0649017667.
[I 2025-01-10 08:05:09,375] Trial 31 finished with value: 1621777.7669695485 and parameters: {'n_d': 20, 'n_steps': 3, 'gamma': 1.785929524117724, 'cat_emb_dim': 1, 'n_independent': 5, 'n_shared': 4, 'momentum': 0.1116910496286221, 'mask_type': 'entmax'}. Best is trial 30 with value: 934001.0649017667.
[I 2025-01-10 08:08:08,984] Trial 32 finished with value: 2090529.7040895391 and parameters: {'n_d': 28, 'n_steps': 3, 'gamma': 1.8909423215828678, 'cat_emb_dim': 1, 'n_independent': 5, 'n_shared': 4, 'momentum': 0.15568010915433225, 'mask_type': 'entmax'}. Best is trial 30 with value: 934001.0649017667.
[I 2025-01-10 08:12:22,843] Trial 33 finished with value: 919423.606712947 and parameters: {'n_d': 14, 'n_steps': 4, 'gamma': 1.615895469873231, 'cat_emb_dim': 1, 'n_independent': 5, 'n_shared': 4, 'momentum': 0.217531115319988, 'mask_type': 'entmax'}. Best is trial 33 with value: 919423.606712947.
[I 2025-01-10 08:16:08,343] Trial 34 finished with value: 936762.2470516909 and parameters: {'n_d': 16, 'n_steps': 4, 'gamma': 1.746207927676911, 'cat_emb_dim': 1, 'n_independent': 5, 'n_shared': 5, 'momentum': 0.24731342842957477, 'mask_type': 'entmax'}. Best is trial 33 with value: 919423.606712947.
[I 2025-01-10 08:19:16,530] Trial 35 finished with value: 944261.5573277005 and parameters: {'n_d': 21, 'n_steps': 4, 'gamma': 1.7531708349361246, 'cat_emb_dim': 1, 'n_independent': 5, 'n_shared': 5, 'momentum': 0.1917853467840993, 'mask_type': 'entmax'}. Best is trial 33 with value: 919423.606712947.
[I 2025-01-10 08:23:13,942] Trial 36 finished with value: 3284955.6607222026 and parameters: {'n_d': 15, 'n_steps': 4, 'gamma': 1.6153093990249807, 'cat_emb_dim': 1, 'n_independent': 4, 'n_shared': 5, 'momentum': 0.07855840923462057, 'mask_type': 'sparsemax'}. Best is trial 33 with value: 919423.606712947.
[I 2025-01-10 08:27:28,644] Trial 37 finished with value: 1186929.8979744003 and parameters: {'n_d': 23, 'n_steps': 7, 'gamma': 1.7294165388112228, 'cat_emb_dim': 1, 'n_independent': 5, 'n_shared': 5, 'momentum': 0.21507069952959787, 'mask_type': 'entmax'}. Best is trial 33 with value: 919423.606712947.
[I 2025-01-10 08:30:39,509] Trial 38 finished with value: 2470681.3638762194 and parameters: {'n_d': 18, 'n_steps': 5, 'gamma': 1.8681219049224072, 'cat_emb_dim': 1, 'n_independent': 1, 'n_shared': 3, 'momentum': 0.3314028098689531, 'mask_type': 'sparsemax'}. Best is trial 33 with value: 919423.606712947.
[I 2025-01-10 08:33:26,688] Trial 39 finished with value: 4485873.689193044 and parameters: {'n_d': 26, 'n_steps': 3, 'gamma': 1.9906045890800055, 'cat_emb_dim': 1, 'n_independent': 4, 'n_shared': 4, 'momentum': 0.05107569589613105, 'mask_type': 'entmax'}. Best is trial 33 with value: 919423.606712947.
[I 2025-01-10 08:38:18,050] Trial 40 finished with value: 4345929.25763483 and parameters: {'n_d': 11, 'n_steps': 6, 'gamma': 1.7009208164225795, 'cat_emb_dim': 1, 'n_independent': 5, 'n_shared': 5, 'momentum': 0.1650449996632838, 'mask_type': 'sparsemax'}. Best is trial 33 with value: 919423.606712947.
[I 2025-01-10 08:41:20,884] Trial 41 finished with value: 949683.6842994431 and parameters: {'n_d': 21, 'n_steps': 4, 'gamma': 1.7527057295271515, 'cat_emb_dim': 1, 'n_independent': 5, 'n_shared': 5, 'momentum': 0.19497513371793612, 'mask_type': 'entmax'}. Best is trial 33 with value: 919423.606712947.
[I 2025-01-10 08:44:16,215] Trial 42 finished with value: 1040409.6048035144 and parameters: {'n_d': 21, 'n_steps': 4, 'gamma': 1.634896913937776, 'cat_emb_dim': 1, 'n_independent': 5, 'n_shared': 5, 'momentum': 0.21367393514136257, 'mask_type': 'entmax'}. Best is trial 33 with value: 919423.606712947.
[I 2025-01-10 08:48:10,746] Trial 43 finished with value: 2473660.690772179 and parameters: {'n_d': 16, 'n_steps': 5, 'gamma': 1.7506448728465582, 'cat_emb_dim': 1, 'n_independent': 5, 'n_shared': 5, 'momentum': 0.3987069941785751, 'mask_type': 'entmax'}. Best is trial 33 with value: 919423.606712947.
[I 2025-01-10 08:50:58,850] Trial 44 finished with value: 2018928.8668065101 and parameters: {'n_d': 19, 'n_steps': 3, 'gamma': 1.558379246236772, 'cat_emb_dim': 1, 'n_independent': 3, 'n_shared': 5, 'momentum': 0.09418416757990916, 'mask_type': 'entmax'}. Best is trial 33 with value: 919423.606712947.
[I 2025-01-10 08:55:40,464] Trial 45 finished with value: 1436685.5754201405 and parameters: {'n_d': 8, 'n_steps': 4, 'gamma': 1.6594020590246807, 'cat_emb_dim': 1, 'n_independent': 5, 'n_shared': 4, 'momentum': 0.16415381810150345, 'mask_type': 'entmax'}. Best is trial 33 with value: 919423.606712947.
[I 2025-01-10 08:56:30,706] Trial 46 finished with value: 410375183.57061195 and parameters: {'n_d': 23, 'n_steps': 3, 'gamma': 1.5967687802923296, 'cat_emb_dim': 1, 'n_independent': 4, 'n_shared': 4, 'momentum': 0.0012572017697989708, 'mask_type': 'entmax'}. Best is trial 33 with value: 919423.606712947.
[I 2025-01-10 08:59:43,121] Trial 47 finished with value: 1064610.9773017988 and parameters: {'n_d': 14, 'n_steps': 4, 'gamma': 1.6993261379876372, 'cat_emb_dim': 1, 'n_independent': 2, 'n_shared': 3, 'momentum': 0.2780486462549142, 'mask_type': 'sparsemax'}. Best is trial 33 with value: 919423.606712947.
[I 2025-01-10 09:04:53,663] Trial 48 finished with value: 8499606.429350665 and parameters: {'n_d': 26, 'n_steps': 10, 'gamma': 1.9358555038565233, 'cat_emb_dim': 1, 'n_independent': 4, 'n_shared': 5, 'momentum': 0.09657448346009745, 'mask_type': 'entmax'}. Best is trial 33 with value: 919423.606712947.
[I 2025-01-10 09:08:09,172] Trial 49 finished with value: 2159295.4188375203 and parameters: {'n_d': 16, 'n_steps': 5, 'gamma': 1.5197085997280895, 'cat_emb_dim': 1, 'n_independent': 5, 'n_shared': 5, 'momentum': 0.1469874215622698, 'mask_type': 'entmax'}. Best is trial 33 with value: 919423.606712947.
[I 2025-01-10 09:13:07,823] Trial 50 finished with value: 2649058.7147736056 and parameters: {'n_d': 22, 'n_steps': 8, 'gamma': 1.8411972863351869, 'cat_emb_dim': 1, 'n_independent': 4, 'n_shared': 4, 'momentum': 0.3170384377274524, 'mask_type': 'entmax'}. Best is trial 33 with value: 919423.606712947.
[I 2025-01-10 09:15:59,372] Trial 51 finished with value: 6815914.326230139 and parameters: {'n_d': 35, 'n_steps': 4, 'gamma': 1.4790913332292905, 'cat_emb_dim': 1, 'n_independent': 5, 'n_shared': 4, 'momentum': 0.25792665428630546, 'mask_type': 'entmax'}. Best is trial 33 with value: 919423.606712947.
[I 2025-01-10 09:19:18,474] Trial 52 finished with value: 972486.5089295635 and parameters: {'n_d': 28, 'n_steps': 4, 'gamma': 1.7793235902275202, 'cat_emb_dim': 1, 'n_independent': 5, 'n_shared': 4, 'momentum': 0.2064651058425308, 'mask_type': 'entmax'}. Best is trial 33 with value: 919423.606712947.
[I 2025-01-10 09:22:12,701] Trial 53 finished with value: 938605.429330597 and parameters: {'n_d': 25, 'n_steps': 3, 'gamma': 1.7269044565367124, 'cat_emb_dim': 1, 'n_independent': 5, 'n_shared': 3, 'momentum': 0.30823894078861125, 'mask_type': 'entmax'}. Best is trial 33 with value: 919423.606712947.
[I 2025-01-10 09:25:23,672] Trial 54 finished with value: 2663075.5735684107 and parameters: {'n_d': 19, 'n_steps': 3, 'gamma': 1.7261926590753054, 'cat_emb_dim': 1, 'n_independent': 5, 'n_shared': 3, 'momentum': 0.34338679332399974, 'mask_type': 'entmax'}. Best is trial 33 with value: 919423.606712947.
[I 2025-01-10 09:28:21,786] Trial 55 finished with value: 924932.5907315284 and parameters: {'n_d': 24, 'n_steps': 3, 'gamma': 1.6621379801927656, 'cat_emb_dim': 1, 'n_independent': 5, 'n_shared': 3, 'momentum': 0.1967489741615259, 'mask_type': 'entmax'}. Best is trial 33 with value: 919423.606712947.
[I 2025-01-10 09:29:19,616] Trial 56 finished with value: 261352967.29307836 and parameters: {'n_d': 25, 'n_steps': 3, 'gamma': 1.66872264359672, 'cat_emb_dim': 3, 'n_independent': 5, 'n_shared': 3, 'momentum': 0.0032818119778814355, 'mask_type': 'entmax'}. Best is trial 33 with value: 919423.606712947.
[I 2025-01-10 09:31:57,264] Trial 57 finished with value: 1115051.4555965317 and parameters: {'n_d': 32, 'n_steps': 3, 'gamma': 1.608917461417579, 'cat_emb_dim': 1, 'n_independent': 3, 'n_shared': 3, 'momentum': 0.12297812506846531, 'mask_type': 'entmax'}. Best is trial 33 with value: 919423.606712947.
[I 2025-01-10 09:34:43,486] Trial 58 finished with value: 86037485.93370667 and parameters: {'n_d': 18, 'n_steps': 3, 'gamma': 1.523681767029122, 'cat_emb_dim': 1, 'n_independent': 4, 'n_shared': 3, 'momentum': 0.02441343624087183, 'mask_type': 'sparsemax'}. Best is trial 33 with value: 919423.606712947.
[I 2025-01-10 09:36:52,402] Trial 59 finished with value: 2138571.6600735197 and parameters: {'n_d': 30, 'n_steps': 3, 'gamma': 1.6465135548176835, 'cat_emb_dim': 1, 'n_independent': 2, 'n_shared': 3, 'momentum': 0.01432116672740266, 'mask_type': 'entmax'}. Best is trial 33 with value: 919423.606712947.
[I 2025-01-10 09:40:28,497] Trial 60 finished with value: 1025642.6369758106 and parameters: {'n_d': 10, 'n_steps': 3, 'gamma': 1.699256556310781, 'cat_emb_dim': 1, 'n_independent': 5, 'n_shared': 3, 'momentum': 0.07384684508464756, 'mask_type': 'entmax'}. Best is trial 33 with value: 919423.606712947.
[I 2025-01-10 09:43:20,446] Trial 61 finished with value: 992631.9532531447 and parameters: {'n_d': 25, 'n_steps': 4, 'gamma': 1.7578827283895428, 'cat_emb_dim': 1, 'n_independent': 5, 'n_shared': 3, 'momentum': 0.18814374702673722, 'mask_type': 'entmax'}. Best is trial 33 with value: 919423.606712947.
[I 2025-01-10 09:46:50,863] Trial 62 finished with value: 983704.1983760797 and parameters: {'n_d': 17, 'n_steps': 4, 'gamma': 1.862035494319367, 'cat_emb_dim': 1, 'n_independent': 5, 'n_shared': 3, 'momentum': 0.23466334405160402, 'mask_type': 'entmax'}. Best is trial 33 with value: 919423.606712947.
[I 2025-01-10 09:50:11,030] Trial 63 finished with value: 946399.9924844515 and parameters: {'n_d': 22, 'n_steps': 3, 'gamma': 1.718459091318511, 'cat_emb_dim': 1, 'n_independent': 5, 'n_shared': 4, 'momentum': 0.29483057747873437, 'mask_type': 'entmax'}. Best is trial 33 with value: 919423.606712947.
[I 2025-01-10 09:53:17,467] Trial 64 finished with value: 939727.8406648401 and parameters: {'n_d': 27, 'n_steps': 4, 'gamma': 1.8219922286802286, 'cat_emb_dim': 1, 'n_independent': 5, 'n_shared': 5, 'momentum': 0.14201708639938895, 'mask_type': 'entmax'}. Best is trial 33 with value: 919423.606712947.
[I 2025-01-10 09:55:39,580] Trial 65 finished with value: 89944484.39168087 and parameters: {'n_d': 27, 'n_steps': 5, 'gamma': 1.8100287973594569, 'cat_emb_dim': 1, 'n_independent': 5, 'n_shared': 4, 'momentum': 0.05644000989282842, 'mask_type': 'entmax'}. Best is trial 33 with value: 919423.606712947.
[I 2025-01-10 09:58:25,578] Trial 66 finished with value: 995615.5226518704 and parameters: {'n_d': 24, 'n_steps': 3, 'gamma': 1.9134128463431836, 'cat_emb_dim': 1, 'n_independent': 4, 'n_shared': 4, 'momentum': 0.11200605284518973, 'mask_type': 'entmax'}. Best is trial 33 with value: 919423.606712947.
[I 2025-01-10 10:01:45,771] Trial 67 finished with value: 10384441.915289253 and parameters: {'n_d': 13, 'n_steps': 4, 'gamma': 1.7958331231043738, 'cat_emb_dim': 1, 'n_independent': 5, 'n_shared': 5, 'momentum': 0.14696300698986975, 'mask_type': 'entmax'}. Best is trial 33 with value: 919423.606712947.
[I 2025-01-10 10:04:25,130] Trial 68 finished with value: 1113144.182260797 and parameters: {'n_d': 33, 'n_steps': 5, 'gamma': 1.8596644761542485, 'cat_emb_dim': 1, 'n_independent': 5, 'n_shared': 3, 'momentum': 0.33273314723376907, 'mask_type': 'entmax'}. Best is trial 33 with value: 919423.606712947.
[I 2025-01-10 10:06:57,485] Trial 69 finished with value: 906434.8486547305 and parameters: {'n_d': 37, 'n_steps': 3, 'gamma': 1.6749039824525354, 'cat_emb_dim': 1, 'n_independent': 4, 'n_shared': 2, 'momentum': 0.2491546234839367, 'mask_type': 'entmax'}. Best is trial 69 with value: 906434.8486547305.
[I 2025-01-10 10:09:27,792] Trial 70 finished with value: 922048.5559488308 and parameters: {'n_d': 39, 'n_steps': 3, 'gamma': 1.6290236933448348, 'cat_emb_dim': 1, 'n_independent': 4, 'n_shared': 2, 'momentum': 0.39092266104726997, 'mask_type': 'entmax'}. Best is trial 69 with value: 906434.8486547305.
[I 2025-01-10 10:11:47,060] Trial 71 finished with value: 1427848.5509497435 and parameters: {'n_d': 40, 'n_steps': 3, 'gamma': 1.575526597985445, 'cat_emb_dim': 1, 'n_independent': 4, 'n_shared': 2, 'momentum': 0.39218064620955595, 'mask_type': 'entmax'}. Best is trial 69 with value: 906434.8486547305.
