[I 2025-01-09 11:28:23,077] Trial 71 finished with value: 1422979.0324978523 and parameters: {'n_d': 23, 'n_steps': 8, 'gamma': 1.847141299626702, 'cat_emb_dim': 2, 'n_independent': 2, 'n_shared': 3, 'momentum': 0.20436850518694205, 'mask_type': 'entmax'}. Best is trial 58 with value: 1184616.8471968663.
[I 2025-01-09 11:42:08,423] Trial 72 finished with value: 1275592.9107846958 and parameters: {'n_d': 18, 'n_steps': 8, 'gamma': 1.7605164626641148, 'cat_emb_dim': 2, 'n_independent': 2, 'n_shared': 3, 'momentum': 0.3216288777328178, 'mask_type': 'entmax'}. Best is trial 58 with value: 1184616.8471968663.
[I 2025-01-09 11:55:19,461] Trial 73 finished with value: 1392664.9187439114 and parameters: {'n_d': 25, 'n_steps': 9, 'gamma': 1.96458614634378, 'cat_emb_dim': 2, 'n_independent': 2, 'n_shared': 3, 'momentum': 0.016065125056749865, 'mask_type': 'entmax'}. Best is trial 58 with value: 1184616.8471968663.
[I 2025-01-09 12:07:47,215] Trial 74 finished with value: 1280535.612810746 and parameters: {'n_d': 21, 'n_steps': 7, 'gamma': 1.9446932062390665, 'cat_emb_dim': 2, 'n_independent': 3, 'n_shared': 3, 'momentum': 0.21750361223377698, 'mask_type': 'entmax'}. Best is trial 58 with value: 1184616.8471968663.
[I 2025-01-09 12:11:08,973] Trial 75 finished with value: 6318287.230185387 and parameters: {'n_d': 31, 'n_steps': 5, 'gamma': 1.973893108166192, 'cat_emb_dim': 2, 'n_independent': 2, 'n_shared': 4, 'momentum': 0.0010244417981112649, 'mask_type': 'entmax'}. Best is trial 58 with value: 1184616.8471968663.
[I 2025-01-09 12:23:53,286] Trial 76 finished with value: 1272484.9677412435 and parameters: {'n_d': 33, 'n_steps': 8, 'gamma': 1.9218418646813713, 'cat_emb_dim': 2, 'n_independent': 3, 'n_shared': 3, 'momentum': 0.14284178723832605, 'mask_type': 'entmax'}. Best is trial 58 with value: 1184616.8471968663.
[I 2025-01-09 12:35:32,655] Trial 77 finished with value: 1302632.6050766192 and parameters: {'n_d': 13, 'n_steps': 9, 'gamma': 1.8135872105125852, 'cat_emb_dim': 2, 'n_independent': 2, 'n_shared': 1, 'momentum': 0.0839326481360865, 'mask_type': 'entmax'}. Best is trial 58 with value: 1184616.8471968663.
[I 2025-01-09 12:54:52,689] Trial 78 finished with value: 1263897.6289308337 and parameters: {'n_d': 24, 'n_steps': 9, 'gamma': 1.8986168462753747, 'cat_emb_dim': 2, 'n_independent': 5, 'n_shared': 3, 'momentum': 0.10899607507852402, 'mask_type': 'entmax'}. Best is trial 58 with value: 1184616.8471968663.
[I 2025-01-09 13:07:50,107] Trial 79 finished with value: 1279089.2533733079 and parameters: {'n_d': 27, 'n_steps': 6, 'gamma': 1.877805035680731, 'cat_emb_dim': 2, 'n_independent': 3, 'n_shared': 4, 'momentum': 0.18290327929397315, 'mask_type': 'entmax'}. Best is trial 58 with value: 1184616.8471968663.
[I 2025-01-09 13:28:44,107] Trial 80 finished with value: 1267422.697498525 and parameters: {'n_d': 15, 'n_steps': 10, 'gamma': 1.7503725858092947, 'cat_emb_dim': 2, 'n_independent': 3, 'n_shared': 3, 'momentum': 0.0661960471321349, 'mask_type': 'entmax'}. Best is trial 58 with value: 1184616.8471968663.
[I 2025-01-09 13:42:38,402] Trial 81 finished with value: 1292718.2693779585 and parameters: {'n_d': 56, 'n_steps': 9, 'gamma': 1.8318964528859794, 'cat_emb_dim': 2, 'n_independent': 3, 'n_shared': 3, 'momentum': 0.020441853297914925, 'mask_type': 'entmax'}. Best is trial 58 with value: 1184616.8471968663.
[I 2025-01-09 13:59:15,909] Trial 82 finished with value: 1332758.9286802588 and parameters: {'n_d': 52, 'n_steps': 8, 'gamma': 1.7899962835851957, 'cat_emb_dim': 2, 'n_independent': 3, 'n_shared': 5, 'momentum': 0.0061899704507053345, 'mask_type': 'entmax'}. Best is trial 58 with value: 1184616.8471968663.
[I 2025-01-09 14:17:12,637] Trial 83 finished with value: 1300216.1135375244 and parameters: {'n_d': 43, 'n_steps': 9, 'gamma': 1.846396175898233, 'cat_emb_dim': 2, 'n_independent': 3, 'n_shared': 5, 'momentum': 0.019357673185823134, 'mask_type': 'entmax'}. Best is trial 58 with value: 1184616.8471968663.
[I 2025-01-09 14:30:33,641] Trial 84 finished with value: 1282989.2622013772 and parameters: {'n_d': 62, 'n_steps': 8, 'gamma': 1.9106283720513166, 'cat_emb_dim': 2, 'n_independent': 2, 'n_shared': 2, 'momentum': 0.008674026008705938, 'mask_type': 'entmax'}. Best is trial 58 with value: 1184616.8471968663.
[I 2025-01-09 14:33:08,846] Trial 85 finished with value: 7402847.572513193 and parameters: {'n_d': 53, 'n_steps': 7, 'gamma': 1.9763338106887833, 'cat_emb_dim': 2, 'n_independent': 3, 'n_shared': 3, 'momentum': 0.0018840834301276671, 'mask_type': 'entmax'}. Best is trial 58 with value: 1184616.8471968663.
[I 2025-01-09 14:52:07,378] Trial 86 finished with value: 1304581.2457520114 and parameters: {'n_d': 48, 'n_steps': 10, 'gamma': 1.8284568714962197, 'cat_emb_dim': 2, 'n_independent': 1, 'n_shared': 5, 'momentum': 0.024640192658957605, 'mask_type': 'sparsemax'}. Best is trial 58 with value: 1184616.8471968663.
[I 2025-01-09 15:02:03,090] Trial 87 finished with value: 1378479.662342231 and parameters: {'n_d': 56, 'n_steps': 3, 'gamma': 1.9428151420699302, 'cat_emb_dim': 2, 'n_independent': 4, 'n_shared': 4, 'momentum': 0.0040147858566487215, 'mask_type': 'entmax'}. Best is trial 58 with value: 1184616.8471968663.
[I 2025-01-09 15:11:43,570] Trial 88 finished with value: 1267774.6386519307 and parameters: {'n_d': 61, 'n_steps': 4, 'gamma': 1.807981270216571, 'cat_emb_dim': 2, 'n_independent': 3, 'n_shared': 2, 'momentum': 0.28223927785346, 'mask_type': 'entmax'}. Best is trial 58 with value: 1184616.8471968663.
[I 2025-01-09 15:26:08,531] Trial 89 finished with value: 1299307.8453300905 and parameters: {'n_d': 54, 'n_steps': 9, 'gamma': 1.2804288911722213, 'cat_emb_dim': 3, 'n_independent': 3, 'n_shared': 3, 'momentum': 0.012129446143221598, 'mask_type': 'entmax'}. Best is trial 58 with value: 1184616.8471968663.
[I 2025-01-09 15:40:38,852] Trial 90 finished with value: 1291693.4100542713 and parameters: {'n_d': 30, 'n_steps': 8, 'gamma': 1.8644713817078866, 'cat_emb_dim': 2, 'n_independent': 2, 'n_shared': 3, 'momentum': 0.015531281094310522, 'mask_type': 'entmax'}. Best is trial 58 with value: 1184616.8471968663.
[I 2025-01-09 15:48:04,655] Trial 91 finished with value: 1310055.185237556 and parameters: {'n_d': 50, 'n_steps': 3, 'gamma': 1.8996920038506844, 'cat_emb_dim': 2, 'n_independent': 3, 'n_shared': 3, 'momentum': 0.009485779426824987, 'mask_type': 'entmax'}. Best is trial 58 with value: 1184616.8471968663.
[I 2025-01-09 15:54:41,971] Trial 92 finished with value: 1348372.3784723564 and parameters: {'n_d': 36, 'n_steps': 3, 'gamma': 1.8888464185006106, 'cat_emb_dim': 2, 'n_independent': 3, 'n_shared': 3, 'momentum': 0.0072627643443298785, 'mask_type': 'entmax'}. Best is trial 58 with value: 1184616.8471968663.
[I 2025-01-09 16:04:44,904] Trial 93 finished with value: 1348139.5308466754 and parameters: {'n_d': 35, 'n_steps': 4, 'gamma': 1.935324600815792, 'cat_emb_dim': 2, 'n_independent': 3, 'n_shared': 3, 'momentum': 0.00446316080694242, 'mask_type': 'entmax'}. Best is trial 58 with value: 1184616.8471968663.
[I 2025-01-09 16:11:32,298] Trial 94 finished with value: 1268706.788927563 and parameters: {'n_d': 64, 'n_steps': 3, 'gamma': 1.6906504864020995, 'cat_emb_dim': 2, 'n_independent': 3, 'n_shared': 3, 'momentum': 0.0423918840764956, 'mask_type': 'entmax'}. Best is trial 58 with value: 1184616.8471968663.
[I 2025-01-09 16:17:44,331] Trial 95 finished with value: 1267276.8581126416 and parameters: {'n_d': 39, 'n_steps': 3, 'gamma': 1.8589359020906842, 'cat_emb_dim': 2, 'n_independent': 3, 'n_shared': 3, 'momentum': 0.35071297992841827, 'mask_type': 'entmax'}. Best is trial 58 with value: 1184616.8471968663.
[I 2025-01-09 16:35:09,862] Trial 96 finished with value: 1292751.2060844414 and parameters: {'n_d': 33, 'n_steps': 10, 'gamma': 1.7870291304097086, 'cat_emb_dim': 2, 'n_independent': 4, 'n_shared': 2, 'momentum': 0.24280002958838917, 'mask_type': 'entmax'}. Best is trial 58 with value: 1184616.8471968663.
[I 2025-01-09 16:49:23,439] Trial 97 finished with value: 1207543.3511420754 and parameters: {'n_d': 27, 'n_steps': 7, 'gamma': 1.7375250369721258, 'cat_emb_dim': 2, 'n_independent': 3, 'n_shared': 3, 'momentum': 0.13160871130544122, 'mask_type': 'entmax'}. Best is trial 58 with value: 1184616.8471968663.
[I 2025-01-09 17:00:22,363] Trial 98 finished with value: 1353438.0547915709 and parameters: {'n_d': 27, 'n_steps': 7, 'gamma': 1.6771236165496188, 'cat_emb_dim': 2, 'n_independent': 3, 'n_shared': 2, 'momentum': 0.094366957609118, 'mask_type': 'entmax'}. Best is trial 58 with value: 1184616.8471968663.
[I 2025-01-09 17:14:07,077] Trial 99 finished with value: 1446781.3805197547 and parameters: {'n_d': 20, 'n_steps': 7, 'gamma': 1.6433682336795132, 'cat_emb_dim': 2, 'n_independent': 5, 'n_shared': 3, 'momentum': 0.12959299877353184, 'mask_type': 'sparsemax'}. Best is trial 58 with value: 1184616.8471968663.
[I 2025-01-09 17:32:45,556] A new study created in RDB with name: TabNet_Diamonds
[I 2025-01-09 18:42:11,625] Trial 0 finished with value: 317258.8783461479 and parameters: {'n_d': 19, 'n_steps': 4, 'gamma': 1.8150530743212734, 'cat_emb_dim': 2, 'n_independent': 5, 'n_shared': 1, 'momentum': 0.006292040386638625, 'mask_type': 'entmax'}. Best is trial 0 with value: 317258.8783461479.
[I 2025-01-09 21:15:08,921] Trial 1 finished with value: 450366.17703453836 and parameters: {'n_d': 39, 'n_steps': 10, 'gamma': 1.0634598729646807, 'cat_emb_dim': 3, 'n_independent': 1, 'n_shared': 5, 'momentum': 0.038753637160051806, 'mask_type': 'sparsemax'}. Best is trial 0 with value: 317258.8783461479.
[I 2025-01-09 22:39:07,939] Trial 2 finished with value: 325214.78235881333 and parameters: {'n_d': 61, 'n_steps': 10, 'gamma': 1.3380335669390315, 'cat_emb_dim': 2, 'n_independent': 3, 'n_shared': 1, 'momentum': 0.025592173419708434, 'mask_type': 'sparsemax'}. Best is trial 0 with value: 317258.8783461479.
[I 2025-01-09 23:15:40,095] Trial 3 finished with value: 309975.8429973352 and parameters: {'n_d': 29, 'n_steps': 3, 'gamma': 1.5306824105273478, 'cat_emb_dim': 2, 'n_independent': 1, 'n_shared': 2, 'momentum': 0.06195258858451898, 'mask_type': 'entmax'}. Best is trial 3 with value: 309975.8429973352.
[I 2025-01-10 00:12:38,274] Trial 4 finished with value: 355800.5526695895 and parameters: {'n_d': 43, 'n_steps': 4, 'gamma': 1.5754066064439813, 'cat_emb_dim': 1, 'n_independent': 3, 'n_shared': 2, 'momentum': 0.0034162157938299794, 'mask_type': 'sparsemax'}. Best is trial 3 with value: 309975.8429973352.
[I 2025-01-10 01:33:03,400] Trial 5 finished with value: 383654.6670881218 and parameters: {'n_d': 43, 'n_steps': 5, 'gamma': 1.2762377215239908, 'cat_emb_dim': 2, 'n_independent': 1, 'n_shared': 4, 'momentum': 0.013041237255931034, 'mask_type': 'entmax'}. Best is trial 3 with value: 309975.8429973352.
[I 2025-01-10 02:27:42,433] Trial 6 finished with value: 336187.1016892214 and parameters: {'n_d': 55, 'n_steps': 5, 'gamma': 1.8714327865715428, 'cat_emb_dim': 2, 'n_independent': 1, 'n_shared': 2, 'momentum': 0.006682139669043797, 'mask_type': 'sparsemax'}. Best is trial 3 with value: 309975.8429973352.
[I 2025-01-10 03:41:33,068] Trial 7 finished with value: 322995.68931416364 and parameters: {'n_d': 59, 'n_steps': 4, 'gamma': 1.6366889701127194, 'cat_emb_dim': 3, 'n_independent': 3, 'n_shared': 5, 'momentum': 0.036841780616224534, 'mask_type': 'entmax'}. Best is trial 3 with value: 309975.8429973352.
[I 2025-01-10 04:35:41,874] Trial 8 finished with value: 386275.69649988896 and parameters: {'n_d': 36, 'n_steps': 9, 'gamma': 1.0076465478368415, 'cat_emb_dim': 2, 'n_independent': 3, 'n_shared': 1, 'momentum': 0.024032976750486216, 'mask_type': 'sparsemax'}. Best is trial 3 with value: 309975.8429973352.
[I 2025-01-10 05:42:36,870] Trial 9 finished with value: 295682.9127177262 and parameters: {'n_d': 62, 'n_steps': 3, 'gamma': 1.2572287606402455, 'cat_emb_dim': 1, 'n_independent': 3, 'n_shared': 3, 'momentum': 0.2133074559228656, 'mask_type': 'entmax'}. Best is trial 9 with value: 295682.9127177262.
[I 2025-01-10 07:12:17,059] Trial 10 finished with value: 574367.0378224148 and parameters: {'n_d': 9, 'n_steps': 7, 'gamma': 1.2826765299617733, 'cat_emb_dim': 1, 'n_independent': 5, 'n_shared': 3, 'momentum': 0.31127427233958854, 'mask_type': 'entmax'}. Best is trial 9 with value: 295682.9127177262.
[I 2025-01-10 08:04:51,804] Trial 11 finished with value: 311355.3555643748 and parameters: {'n_d': 27, 'n_steps': 3, 'gamma': 1.4067815993921875, 'cat_emb_dim': 1, 'n_independent': 2, 'n_shared': 3, 'momentum': 0.21328342596856054, 'mask_type': 'entmax'}. Best is trial 9 with value: 295682.9127177262.
[I 2025-01-10 09:27:34,918] Trial 12 finished with value: 313890.0606320583 and parameters: {'n_d': 27, 'n_steps': 7, 'gamma': 1.1675700799421895, 'cat_emb_dim': 1, 'n_independent': 4, 'n_shared': 2, 'momentum': 0.11338076394815917, 'mask_type': 'entmax'}. Best is trial 9 with value: 295682.9127177262.
[I 2025-01-10 10:21:02,825] Trial 13 finished with value: 326440.9936868786 and parameters: {'n_d': 51, 'n_steps': 3, 'gamma': 1.7028924617615466, 'cat_emb_dim': 3, 'n_independent': 2, 'n_shared': 4, 'momentum': 0.10701886335939614, 'mask_type': 'entmax'}. Best is trial 9 with value: 295682.9127177262.
[I 2025-01-10 11:29:42,063] Trial 14 finished with value: 347718.8633449202 and parameters: {'n_d': 29, 'n_steps': 5, 'gamma': 1.4889152733324387, 'cat_emb_dim': 1, 'n_independent': 2, 'n_shared': 3, 'momentum': 0.08798147966328135, 'mask_type': 'entmax'}. Best is trial 9 with value: 295682.9127177262.
[I 2025-01-10 14:00:06,112] Trial 15 finished with value: 347359.6538321893 and parameters: {'n_d': 17, 'n_steps': 6, 'gamma': 1.999843911746629, 'cat_emb_dim': 1, 'n_independent': 4, 'n_shared': 4, 'momentum': 0.0010043702220693892, 'mask_type': 'entmax'}. Best is trial 9 with value: 295682.9127177262.
[I 2025-01-10 14:49:55,902] Trial 16 finished with value: 358285.836028952 and parameters: {'n_d': 50, 'n_steps': 3, 'gamma': 1.4494037391237657, 'cat_emb_dim': 3, 'n_independent': 4, 'n_shared': 2, 'momentum': 0.06758841747632065, 'mask_type': 'entmax'}. Best is trial 9 with value: 295682.9127177262.
[I 2025-01-10 15:50:51,778] Trial 17 finished with value: 450214.78088565153 and parameters: {'n_d': 64, 'n_steps': 6, 'gamma': 1.5656738110663184, 'cat_emb_dim': 2, 'n_independent': 2, 'n_shared': 2, 'momentum': 0.39945999741192784, 'mask_type': 'entmax'}. Best is trial 9 with value: 295682.9127177262.
[I 2025-01-10 17:26:04,870] Trial 18 finished with value: 335368.2741181194 and parameters: {'n_d': 33, 'n_steps': 8, 'gamma': 1.1426246065413492, 'cat_emb_dim': 1, 'n_independent': 1, 'n_shared': 3, 'momentum': 0.17827624058966085, 'mask_type': 'entmax'}. Best is trial 9 with value: 295682.9127177262.
[I 2025-01-10 19:04:53,439] Trial 19 finished with value: 307629.7808998086 and parameters: {'n_d': 20, 'n_steps': 3, 'gamma': 1.3212319756842408, 'cat_emb_dim': 2, 'n_independent': 4, 'n_shared': 4, 'momentum': 0.1758165897538257, 'mask_type': 'entmax'}. Best is trial 9 with value: 295682.9127177262.
[I 2025-01-10 20:12:31,060] Trial 20 finished with value: 343501.1998227358 and parameters: {'n_d': 21, 'n_steps': 4, 'gamma': 1.2188645773402937, 'cat_emb_dim': 3, 'n_independent': 4, 'n_shared': 4, 'momentum': 0.18840794101006458, 'mask_type': 'entmax'}. Best is trial 9 with value: 295682.9127177262.
[I 2025-01-10 21:14:27,069] Trial 21 finished with value: 326326.27113436424 and parameters: {'n_d': 10, 'n_steps': 3, 'gamma': 1.3732355588633407, 'cat_emb_dim': 2, 'n_independent': 5, 'n_shared': 4, 'momentum': 0.0653856956841543, 'mask_type': 'entmax'}. Best is trial 9 with value: 295682.9127177262.
[I 2025-01-10 22:06:20,460] Trial 22 finished with value: 360192.48348039476 and parameters: {'n_d': 17, 'n_steps': 3, 'gamma': 1.5185181865926607, 'cat_emb_dim': 2, 'n_independent': 4, 'n_shared': 3, 'momentum': 0.14023692282147798, 'mask_type': 'entmax'}. Best is trial 9 with value: 295682.9127177262.
[I 2025-01-10 23:23:16,619] Trial 23 finished with value: 327918.6825828107 and parameters: {'n_d': 23, 'n_steps': 4, 'gamma': 1.3065532636792632, 'cat_emb_dim': 2, 'n_independent': 2, 'n_shared': 5, 'momentum': 0.04631838020275406, 'mask_type': 'entmax'}. Best is trial 9 with value: 295682.9127177262.
[I 2025-01-11 00:38:24,694] Trial 24 finished with value: 329155.206106851 and parameters: {'n_d': 13, 'n_steps': 5, 'gamma': 1.2120017215251506, 'cat_emb_dim': 1, 'n_independent': 4, 'n_shared': 4, 'momentum': 0.2660895081711081, 'mask_type': 'entmax'}. Best is trial 9 with value: 295682.9127177262.
[I 2025-01-11 01:14:26,037] Trial 25 finished with value: 699676.3234032566 and parameters: {'n_d': 31, 'n_steps': 3, 'gamma': 1.708300786737535, 'cat_emb_dim': 2, 'n_independent': 5, 'n_shared': 3, 'momentum': 0.057882648096390564, 'mask_type': 'entmax'}. Best is trial 9 with value: 295682.9127177262.
[I 2025-01-11 02:10:40,460] Trial 26 finished with value: 321694.7323114125 and parameters: {'n_d': 25, 'n_steps': 4, 'gamma': 1.4128703902308901, 'cat_emb_dim': 2, 'n_independent': 3, 'n_shared': 2, 'momentum': 0.12511596872501898, 'mask_type': 'sparsemax'}. Best is trial 9 with value: 295682.9127177262.
[I 2025-01-11 03:29:08,042] Trial 27 finished with value: 295490.8463921569 and parameters: {'n_d': 42, 'n_steps': 3, 'gamma': 1.0904610963194203, 'cat_emb_dim': 3, 'n_independent': 3, 'n_shared': 3, 'momentum': 0.3839980757049156, 'mask_type': 'entmax'}. Best is trial 27 with value: 295490.8463921569.
[I 2025-01-11 05:06:15,564] Trial 28 finished with value: 312994.6690281894 and parameters: {'n_d': 47, 'n_steps': 6, 'gamma': 1.0839031726285433, 'cat_emb_dim': 3, 'n_independent': 3, 'n_shared': 3, 'momentum': 0.39098491710350664, 'mask_type': 'entmax'}. Best is trial 27 with value: 295490.8463921569.
[I 2025-01-11 06:31:23,775] Trial 29 finished with value: 345907.3142577014 and parameters: {'n_d': 39, 'n_steps': 5, 'gamma': 1.0999722557949245, 'cat_emb_dim': 3, 'n_independent': 3, 'n_shared': 4, 'momentum': 0.2578673169018165, 'mask_type': 'entmax'}. Best is trial 27 with value: 295490.8463921569.
[I 2025-01-11 08:14:53,690] Trial 30 finished with value: 305908.2247129232 and parameters: {'n_d': 57, 'n_steps': 4, 'gamma': 1.0120067150673604, 'cat_emb_dim': 3, 'n_independent': 4, 'n_shared': 5, 'momentum': 0.0126202851899162, 'mask_type': 'entmax'}. Best is trial 27 with value: 295490.8463921569.
[I 2025-01-11 09:16:16,787] Trial 31 finished with value: 329265.9370609892 and parameters: {'n_d': 57, 'n_steps': 4, 'gamma': 1.0111667551153678, 'cat_emb_dim': 3, 'n_independent': 4, 'n_shared': 5, 'momentum': 0.013181944353500518, 'mask_type': 'entmax'}. Best is trial 27 with value: 295490.8463921569.
[I 2025-01-11 10:02:42,415] Trial 32 finished with value: 337129.08306293737 and parameters: {'n_d': 54, 'n_steps': 3, 'gamma': 1.20714566187977, 'cat_emb_dim': 3, 'n_independent': 4, 'n_shared': 5, 'momentum': 0.010882247195414323, 'mask_type': 'entmax'}. Best is trial 27 with value: 295490.8463921569.
[I 2025-01-11 11:58:15,301] Trial 33 finished with value: 300981.0609497073 and parameters: {'n_d': 64, 'n_steps': 4, 'gamma': 1.1156670557366437, 'cat_emb_dim': 3, 'n_independent': 3, 'n_shared': 5, 'momentum': 0.003866236019905263, 'mask_type': 'entmax'}. Best is trial 27 with value: 295490.8463921569.
[I 2025-01-11 13:21:42,380] Trial 34 finished with value: 474484.1454340463 and parameters: {'n_d': 64, 'n_steps': 4, 'gamma': 1.059063457593097, 'cat_emb_dim': 3, 'n_independent': 3, 'n_shared': 5, 'momentum': 0.0027303189904142517, 'mask_type': 'sparsemax'}. Best is trial 27 with value: 295490.8463921569.
[I 2025-01-11 15:02:55,140] Trial 35 finished with value: 317942.30384991673 and parameters: {'n_d': 61, 'n_steps': 4, 'gamma': 1.130690194712447, 'cat_emb_dim': 3, 'n_independent': 3, 'n_shared': 5, 'momentum': 0.003374487651343684, 'mask_type': 'entmax'}. Best is trial 27 with value: 295490.8463921569.
[I 2025-01-11 16:31:11,327] Trial 36 finished with value: 372670.7168163941 and parameters: {'n_d': 60, 'n_steps': 5, 'gamma': 1.0504338013300898, 'cat_emb_dim': 3, 'n_independent': 3, 'n_shared': 5, 'momentum': 0.0018500342961514575, 'mask_type': 'sparsemax'}. Best is trial 27 with value: 295490.8463921569.
[I 2025-01-11 17:33:40,257] Trial 37 finished with value: 327820.0842955742 and parameters: {'n_d': 53, 'n_steps': 4, 'gamma': 1.2409058516714153, 'cat_emb_dim': 3, 'n_independent': 3, 'n_shared': 3, 'momentum': 0.006254712104933312, 'mask_type': 'entmax'}. Best is trial 27 with value: 295490.8463921569.
srun: Job step aborted: Waiting up to 32 seconds for job step to finish.
slurmstepd: error: *** STEP 949202.1 ON stud-000 CANCELLED AT 2025-01-11T18:37:29 DUE TO TIME LIMIT ***
slurmstepd: error: *** JOB 949202 ON stud-000 CANCELLED AT 2025-01-11T18:37:29 DUE TO TIME LIMIT ***
