[I 2025-01-10 10:14:02,500] Trial 72 finished with value: 946991.6592030115 and parameters: {'n_d': 47, 'n_steps': 3, 'gamma': 1.6811591346362105, 'cat_emb_dim': 1, 'n_independent': 3, 'n_shared': 2, 'momentum': 0.25837479389733486, 'mask_type': 'entmax'}. Best is trial 69 with value: 906434.8486547305.
[I 2025-01-10 10:16:32,907] Trial 73 finished with value: 964521.2321678242 and parameters: {'n_d': 41, 'n_steps': 3, 'gamma': 1.6405497958747126, 'cat_emb_dim': 1, 'n_independent': 4, 'n_shared': 2, 'momentum': 0.23200452194125915, 'mask_type': 'entmax'}. Best is trial 69 with value: 906434.8486547305.
[I 2025-01-10 10:18:47,312] Trial 74 finished with value: 3347042.520928414 and parameters: {'n_d': 36, 'n_steps': 3, 'gamma': 1.6220475824409164, 'cat_emb_dim': 1, 'n_independent': 3, 'n_shared': 1, 'momentum': 0.17085656718722475, 'mask_type': 'entmax'}. Best is trial 69 with value: 906434.8486547305.
[I 2025-01-10 10:21:09,310] Trial 75 finished with value: 934571.2282640254 and parameters: {'n_d': 38, 'n_steps': 3, 'gamma': 1.6736770096831355, 'cat_emb_dim': 1, 'n_independent': 4, 'n_shared': 2, 'momentum': 0.27901035232372623, 'mask_type': 'entmax'}. Best is trial 69 with value: 906434.8486547305.
[I 2025-01-10 10:23:47,472] Trial 76 finished with value: 1371224.170541164 and parameters: {'n_d': 42, 'n_steps': 7, 'gamma': 1.5863931677411576, 'cat_emb_dim': 1, 'n_independent': 4, 'n_shared': 2, 'momentum': 0.35517973611585757, 'mask_type': 'sparsemax'}. Best is trial 69 with value: 906434.8486547305.
[I 2025-01-10 10:26:11,801] Trial 77 finished with value: 914972.254624006 and parameters: {'n_d': 38, 'n_steps': 3, 'gamma': 1.5425398933817367, 'cat_emb_dim': 1, 'n_independent': 4, 'n_shared': 2, 'momentum': 0.2793291878521868, 'mask_type': 'entmax'}. Best is trial 69 with value: 906434.8486547305.
[I 2025-01-10 10:28:21,553] Trial 78 finished with value: 1022061.4991051123 and parameters: {'n_d': 45, 'n_steps': 3, 'gamma': 1.520816585967902, 'cat_emb_dim': 2, 'n_independent': 4, 'n_shared': 2, 'momentum': 0.2800568698829702, 'mask_type': 'entmax'}. Best is trial 69 with value: 906434.8486547305.
[I 2025-01-10 10:30:43,796] Trial 79 finished with value: 926017.0254942061 and parameters: {'n_d': 38, 'n_steps': 3, 'gamma': 1.5453243163519716, 'cat_emb_dim': 1, 'n_independent': 4, 'n_shared': 2, 'momentum': 0.1853359251377354, 'mask_type': 'entmax'}. Best is trial 69 with value: 906434.8486547305.
[I 2025-01-10 10:32:57,719] Trial 80 finished with value: 1022749.2431373916 and parameters: {'n_d': 38, 'n_steps': 3, 'gamma': 1.4619401569270871, 'cat_emb_dim': 1, 'n_independent': 4, 'n_shared': 2, 'momentum': 0.18238188161723398, 'mask_type': 'entmax'}. Best is trial 69 with value: 906434.8486547305.
[I 2025-01-10 10:35:24,346] Trial 81 finished with value: 4337472.34845817 and parameters: {'n_d': 36, 'n_steps': 3, 'gamma': 1.5492965391022877, 'cat_emb_dim': 1, 'n_independent': 4, 'n_shared': 2, 'momentum': 0.2129626643099161, 'mask_type': 'entmax'}. Best is trial 69 with value: 906434.8486547305.
[I 2025-01-10 10:37:46,768] Trial 82 finished with value: 3481127.9132509045 and parameters: {'n_d': 38, 'n_steps': 3, 'gamma': 1.5482149621003616, 'cat_emb_dim': 1, 'n_independent': 4, 'n_shared': 1, 'momentum': 0.399661918387692, 'mask_type': 'entmax'}. Best is trial 69 with value: 906434.8486547305.
[I 2025-01-10 10:40:15,957] Trial 83 finished with value: 1356120.8601040645 and parameters: {'n_d': 34, 'n_steps': 3, 'gamma': 1.6666448280435147, 'cat_emb_dim': 1, 'n_independent': 4, 'n_shared': 2, 'momentum': 0.28230523367954347, 'mask_type': 'entmax'}. Best is trial 69 with value: 906434.8486547305.
[I 2025-01-10 10:42:26,041] Trial 84 finished with value: 7458677.833868978 and parameters: {'n_d': 40, 'n_steps': 3, 'gamma': 1.4035051157864349, 'cat_emb_dim': 1, 'n_independent': 3, 'n_shared': 2, 'momentum': 0.131679384235556, 'mask_type': 'entmax'}. Best is trial 69 with value: 906434.8486547305.
[I 2025-01-10 10:44:52,482] Trial 85 finished with value: 2278966.5762145 and parameters: {'n_d': 43, 'n_steps': 3, 'gamma': 1.5911988395745875, 'cat_emb_dim': 1, 'n_independent': 4, 'n_shared': 2, 'momentum': 0.22645720521155852, 'mask_type': 'entmax'}. Best is trial 69 with value: 906434.8486547305.
[I 2025-01-10 10:47:02,318] Trial 86 finished with value: 2696519.229180803 and parameters: {'n_d': 37, 'n_steps': 4, 'gamma': 1.4921790288410453, 'cat_emb_dim': 1, 'n_independent': 4, 'n_shared': 1, 'momentum': 0.1732588892587854, 'mask_type': 'entmax'}. Best is trial 69 with value: 906434.8486547305.
[I 2025-01-10 10:49:32,266] Trial 87 finished with value: 4172935.073465839 and parameters: {'n_d': 34, 'n_steps': 3, 'gamma': 1.6228600817692758, 'cat_emb_dim': 1, 'n_independent': 4, 'n_shared': 2, 'momentum': 0.2001621601432092, 'mask_type': 'entmax'}. Best is trial 69 with value: 906434.8486547305.
[I 2025-01-10 10:51:46,754] Trial 88 finished with value: 6134735.703038795 and parameters: {'n_d': 45, 'n_steps': 4, 'gamma': 1.4337662534640745, 'cat_emb_dim': 1, 'n_independent': 4, 'n_shared': 2, 'momentum': 0.3427719193493433, 'mask_type': 'sparsemax'}. Best is trial 69 with value: 906434.8486547305.
[I 2025-01-10 10:55:11,429] Trial 89 finished with value: 5907548.439151816 and parameters: {'n_d': 39, 'n_steps': 9, 'gamma': 1.6823572277780896, 'cat_emb_dim': 2, 'n_independent': 4, 'n_shared': 2, 'momentum': 0.08261822218784871, 'mask_type': 'entmax'}. Best is trial 69 with value: 906434.8486547305.
[I 2025-01-10 10:57:37,944] Trial 90 finished with value: 2217861.145888961 and parameters: {'n_d': 31, 'n_steps': 3, 'gamma': 1.6498557245432983, 'cat_emb_dim': 1, 'n_independent': 4, 'n_shared': 2, 'momentum': 0.09876454646628453, 'mask_type': 'entmax'}. Best is trial 69 with value: 906434.8486547305.
[I 2025-01-10 11:00:13,121] Trial 91 finished with value: 2093039.7432022598 and parameters: {'n_d': 35, 'n_steps': 4, 'gamma': 1.770532317883152, 'cat_emb_dim': 1, 'n_independent': 3, 'n_shared': 2, 'momentum': 0.2563927020131695, 'mask_type': 'entmax'}. Best is trial 69 with value: 906434.8486547305.
[I 2025-01-10 11:02:05,151] Trial 92 finished with value: 10343626.858585985 and parameters: {'n_d': 58, 'n_steps': 3, 'gamma': 1.7152994073321615, 'cat_emb_dim': 1, 'n_independent': 4, 'n_shared': 1, 'momentum': 0.2286316404771252, 'mask_type': 'entmax'}. Best is trial 69 with value: 906434.8486547305.
[I 2025-01-10 11:05:31,187] Trial 93 finished with value: 3899869.7407090524 and parameters: {'n_d': 15, 'n_steps': 3, 'gamma': 1.7389181862153928, 'cat_emb_dim': 1, 'n_independent': 4, 'n_shared': 2, 'momentum': 0.29614462942341524, 'mask_type': 'entmax'}. Best is trial 69 with value: 906434.8486547305.
[I 2025-01-10 11:07:41,126] Trial 94 finished with value: 1100218.661390679 and parameters: {'n_d': 37, 'n_steps': 3, 'gamma': 1.6057830236670674, 'cat_emb_dim': 1, 'n_independent': 4, 'n_shared': 4, 'momentum': 0.16011223183368484, 'mask_type': 'entmax'}. Best is trial 69 with value: 906434.8486547305.
[I 2025-01-10 11:10:29,191] Trial 95 finished with value: 3152814.2204339416 and parameters: {'n_d': 41, 'n_steps': 4, 'gamma': 1.6879609113119036, 'cat_emb_dim': 1, 'n_independent': 5, 'n_shared': 2, 'momentum': 0.3585998678393959, 'mask_type': 'entmax'}. Best is trial 69 with value: 906434.8486547305.
[I 2025-01-10 11:13:24,507] Trial 96 finished with value: 2016633.1027070947 and parameters: {'n_d': 19, 'n_steps': 3, 'gamma': 1.5334867581100244, 'cat_emb_dim': 1, 'n_independent': 4, 'n_shared': 2, 'momentum': 0.26792157267468075, 'mask_type': 'entmax'}. Best is trial 69 with value: 906434.8486547305.
[I 2025-01-10 11:15:46,199] Trial 97 finished with value: 997730.7846525019 and parameters: {'n_d': 43, 'n_steps': 4, 'gamma': 1.0036986024938304, 'cat_emb_dim': 1, 'n_independent': 2, 'n_shared': 4, 'momentum': 0.1941317581341911, 'mask_type': 'entmax'}. Best is trial 69 with value: 906434.8486547305.
[I 2025-01-10 11:18:25,558] Trial 98 finished with value: 2474612.5117182615 and parameters: {'n_d': 38, 'n_steps': 3, 'gamma': 1.5687661696411241, 'cat_emb_dim': 1, 'n_independent': 5, 'n_shared': 2, 'momentum': 0.24024271080966197, 'mask_type': 'entmax'}. Best is trial 69 with value: 906434.8486547305.
[I 2025-01-10 11:21:54,413] Trial 99 finished with value: 1495216.506411568 and parameters: {'n_d': 12, 'n_steps': 6, 'gamma': 1.6633521769872202, 'cat_emb_dim': 3, 'n_independent': 3, 'n_shared': 4, 'momentum': 0.31024575820370026, 'mask_type': 'entmax'}. Best is trial 69 with value: 906434.8486547305.
slurmstepd: error: Detected 1 oom-kill event(s) in StepId=949201.batch. Some of your processes may have been killed by the cgroup out-of-memory handler.
