[I 2025-01-15 04:54:34,056] Using an existing study with name 'TabNet_MIP' instead of creating a new one.
[I 2025-01-15 04:56:33,557] Trial 100 finished with value: 24830264.996347368 and parameters: {'n_d': 20, 'n_steps': 3, 'gamma': 1.7752713632092463, 'cat_emb_dim': 1, 'n_independent': 5, 'n_shared': 2, 'momentum': 0.12263252545076794, 'mask_type': 'sparsemax'}. Best is trial 69 with value: 906434.8486547305.
[I 2025-01-15 04:58:31,875] Trial 101 finished with value: 7710607.8125570165 and parameters: {'n_d': 23, 'n_steps': 3, 'gamma': 1.714084858741709, 'cat_emb_dim': 1, 'n_independent': 5, 'n_shared': 3, 'momentum': 0.30348936782753266, 'mask_type': 'entmax'}. Best is trial 69 with value: 906434.8486547305.
[I 2025-01-15 05:00:28,947] Trial 102 finished with value: 2566549.1075155837 and parameters: {'n_d': 32, 'n_steps': 3, 'gamma': 1.74101294065536, 'cat_emb_dim': 1, 'n_independent': 5, 'n_shared': 3, 'momentum': 0.21333073478909353, 'mask_type': 'entmax'}. Best is trial 69 with value: 906434.8486547305.
[I 2025-01-15 05:02:30,299] Trial 103 finished with value: 98487897.36870301 and parameters: {'n_d': 17, 'n_steps': 3, 'gamma': 1.8063895103954128, 'cat_emb_dim': 1, 'n_independent': 5, 'n_shared': 3, 'momentum': 0.3578053504466829, 'mask_type': 'entmax'}. Best is trial 69 with value: 906434.8486547305.
[I 2025-01-15 05:04:32,802] Trial 104 finished with value: 1177556.8423305333 and parameters: {'n_d': 36, 'n_steps': 3, 'gamma': 1.6392520326485367, 'cat_emb_dim': 1, 'n_independent': 5, 'n_shared': 3, 'momentum': 0.256648335083589, 'mask_type': 'entmax'}. Best is trial 69 with value: 906434.8486547305.
[I 2025-01-15 05:07:03,789] Trial 105 finished with value: 1003695.5120725995 and parameters: {'n_d': 29, 'n_steps': 4, 'gamma': 1.8440852413745348, 'cat_emb_dim': 1, 'n_independent': 5, 'n_shared': 4, 'momentum': 0.15548747499644036, 'mask_type': 'entmax'}. Best is trial 69 with value: 906434.8486547305.
[I 2025-01-15 05:08:53,296] Trial 106 finished with value: 2633801.4721550853 and parameters: {'n_d': 40, 'n_steps': 3, 'gamma': 1.698866143039925, 'cat_emb_dim': 1, 'n_independent': 4, 'n_shared': 3, 'momentum': 0.18549696318469877, 'mask_type': 'entmax'}. Best is trial 69 with value: 906434.8486547305.
[I 2025-01-15 05:10:59,935] Trial 107 finished with value: 174037511.84007984 and parameters: {'n_d': 10, 'n_steps': 4, 'gamma': 1.7672234107089704, 'cat_emb_dim': 1, 'n_independent': 5, 'n_shared': 2, 'momentum': 0.3216918686145501, 'mask_type': 'entmax'}. Best is trial 69 with value: 906434.8486547305.
[I 2025-01-15 05:12:56,529] Trial 108 finished with value: 4259943.418868044 and parameters: {'n_d': 24, 'n_steps': 3, 'gamma': 1.6158171184928158, 'cat_emb_dim': 1, 'n_independent': 4, 'n_shared': 4, 'momentum': 0.2773893440909744, 'mask_type': 'entmax'}. Best is trial 69 with value: 906434.8486547305.
[I 2025-01-15 05:14:55,398] Trial 109 finished with value: 10734227.33078713 and parameters: {'n_d': 22, 'n_steps': 3, 'gamma': 1.4995538579890484, 'cat_emb_dim': 1, 'n_independent': 5, 'n_shared': 3, 'momentum': 0.21972642657840802, 'mask_type': 'entmax'}. Best is trial 69 with value: 906434.8486547305.
[I 2025-01-15 05:17:12,116] Trial 110 finished with value: 1621207.8307294413 and parameters: {'n_d': 39, 'n_steps': 4, 'gamma': 1.0894534065666246, 'cat_emb_dim': 1, 'n_independent': 5, 'n_shared': 2, 'momentum': 0.3758949204482507, 'mask_type': 'entmax'}. Best is trial 69 with value: 906434.8486547305.
[I 2025-01-15 05:19:38,354] Trial 111 finished with value: 1266516.5615574517 and parameters: {'n_d': 27, 'n_steps': 4, 'gamma': 1.818144469721061, 'cat_emb_dim': 1, 'n_independent': 5, 'n_shared': 5, 'momentum': 0.1396493995292751, 'mask_type': 'entmax'}. Best is trial 69 with value: 906434.8486547305.
[I 2025-01-15 05:21:46,341] Trial 112 finished with value: 2432145.58221603 and parameters: {'n_d': 30, 'n_steps': 3, 'gamma': 1.8781720225649126, 'cat_emb_dim': 1, 'n_independent': 5, 'n_shared': 5, 'momentum': 0.04367142409974379, 'mask_type': 'entmax'}. Best is trial 69 with value: 906434.8486547305.
[I 2025-01-15 05:23:00,258] Trial 113 finished with value: 281051060.1969034 and parameters: {'n_d': 26, 'n_steps': 4, 'gamma': 1.734219888117206, 'cat_emb_dim': 1, 'n_independent': 5, 'n_shared': 5, 'momentum': 0.005364531244764362, 'mask_type': 'entmax'}. Best is trial 69 with value: 906434.8486547305.
[I 2025-01-15 05:25:18,507] Trial 114 finished with value: 111746665.87995927 and parameters: {'n_d': 14, 'n_steps': 3, 'gamma': 1.788437505801, 'cat_emb_dim': 1, 'n_independent': 5, 'n_shared': 5, 'momentum': 0.17380377780853576, 'mask_type': 'entmax'}. Best is trial 69 with value: 906434.8486547305.
[I 2025-01-15 05:27:44,900] Trial 115 finished with value: 10362356.549346486 and parameters: {'n_d': 20, 'n_steps': 5, 'gamma': 1.8400571055659756, 'cat_emb_dim': 1, 'n_independent': 4, 'n_shared': 4, 'momentum': 0.14134933500466357, 'mask_type': 'entmax'}. Best is trial 69 with value: 906434.8486547305.
[I 2025-01-15 05:30:18,335] Trial 116 finished with value: 2824604.2992114727 and parameters: {'n_d': 41, 'n_steps': 4, 'gamma': 1.6778184741392295, 'cat_emb_dim': 1, 'n_independent': 4, 'n_shared': 5, 'momentum': 0.23854282403252688, 'mask_type': 'entmax'}. Best is trial 69 with value: 906434.8486547305.
[I 2025-01-15 05:32:29,328] Trial 117 finished with value: 999525.7911176777 and parameters: {'n_d': 33, 'n_steps': 3, 'gamma': 1.598516033428282, 'cat_emb_dim': 1, 'n_independent': 5, 'n_shared': 5, 'momentum': 0.19831980775929742, 'mask_type': 'entmax'}. Best is trial 69 with value: 906434.8486547305.
[I 2025-01-15 05:33:57,157] Trial 118 finished with value: 47937169.35184364 and parameters: {'n_d': 24, 'n_steps': 3, 'gamma': 1.631778303456653, 'cat_emb_dim': 1, 'n_independent': 1, 'n_shared': 2, 'momentum': 0.3095319053579887, 'mask_type': 'entmax'}. Best is trial 69 with value: 906434.8486547305.
[I 2025-01-15 05:35:58,236] Trial 119 finished with value: 7515567.930663156 and parameters: {'n_d': 27, 'n_steps': 3, 'gamma': 1.576706574708875, 'cat_emb_dim': 1, 'n_independent': 5, 'n_shared': 2, 'momentum': 0.11755976530648977, 'mask_type': 'sparsemax'}. Best is trial 69 with value: 906434.8486547305.
[I 2025-01-15 05:36:46,345] Trial 120 finished with value: 417602126.3101915 and parameters: {'n_d': 37, 'n_steps': 4, 'gamma': 1.7143513914778274, 'cat_emb_dim': 1, 'n_independent': 4, 'n_shared': 4, 'momentum': 0.002376355852935079, 'mask_type': 'entmax'}. Best is trial 69 with value: 906434.8486547305.
[I 2025-01-15 05:39:12,512] Trial 121 finished with value: 997490.2932322423 and parameters: {'n_d': 22, 'n_steps': 4, 'gamma': 1.7565784667405242, 'cat_emb_dim': 1, 'n_independent': 5, 'n_shared': 5, 'momentum': 0.16340366026181466, 'mask_type': 'entmax'}. Best is trial 69 with value: 906434.8486547305.
[I 2025-01-15 05:41:38,450] Trial 122 finished with value: 2978515.073571743 and parameters: {'n_d': 17, 'n_steps': 4, 'gamma': 1.7976434014865907, 'cat_emb_dim': 1, 'n_independent': 5, 'n_shared': 5, 'momentum': 0.26771624587555076, 'mask_type': 'entmax'}. Best is trial 69 with value: 906434.8486547305.
[I 2025-01-15 05:44:27,155] Trial 123 finished with value: 1330840.0244495422 and parameters: {'n_d': 21, 'n_steps': 5, 'gamma': 1.653669259100127, 'cat_emb_dim': 1, 'n_independent': 5, 'n_shared': 5, 'momentum': 0.19352088866178035, 'mask_type': 'entmax'}. Best is trial 69 with value: 906434.8486547305.
[I 2025-01-15 05:46:42,307] Trial 124 finished with value: 12145260.890942996 and parameters: {'n_d': 18, 'n_steps': 3, 'gamma': 1.747155973810863, 'cat_emb_dim': 1, 'n_independent': 5, 'n_shared': 5, 'momentum': 0.10305585133779743, 'mask_type': 'entmax'}. Best is trial 69 with value: 906434.8486547305.
[I 2025-01-15 05:49:19,737] Trial 125 finished with value: 966477.9899468161 and parameters: {'n_d': 35, 'n_steps': 4, 'gamma': 1.7073467364667525, 'cat_emb_dim': 1, 'n_independent': 4, 'n_shared': 5, 'momentum': 0.2368479117377107, 'mask_type': 'entmax'}. Best is trial 69 with value: 906434.8486547305.
[I 2025-01-15 05:51:25,715] Trial 126 finished with value: 4153340.1156084584 and parameters: {'n_d': 25, 'n_steps': 3, 'gamma': 1.7802578245642309, 'cat_emb_dim': 1, 'n_independent': 5, 'n_shared': 2, 'momentum': 0.1496127104241483, 'mask_type': 'entmax'}. Best is trial 69 with value: 906434.8486547305.
[I 2025-01-15 05:53:35,685] Trial 127 finished with value: 1170127.4594692728 and parameters: {'n_d': 28, 'n_steps': 3, 'gamma': 1.5388583327004715, 'cat_emb_dim': 3, 'n_independent': 5, 'n_shared': 3, 'momentum': 0.20763425363984322, 'mask_type': 'entmax'}. Best is trial 69 with value: 906434.8486547305.
[I 2025-01-15 05:55:37,401] Trial 128 finished with value: 94175474.38648996 and parameters: {'n_d': 15, 'n_steps': 3, 'gamma': 1.8186872069890736, 'cat_emb_dim': 1, 'n_independent': 4, 'n_shared': 5, 'momentum': 0.33766374289159773, 'mask_type': 'entmax'}. Best is trial 69 with value: 906434.8486547305.
[I 2025-01-15 05:57:53,902] Trial 129 finished with value: 10529100.204609029 and parameters: {'n_d': 20, 'n_steps': 4, 'gamma': 1.9066312166342474, 'cat_emb_dim': 1, 'n_independent': 5, 'n_shared': 2, 'momentum': 0.17884697939159547, 'mask_type': 'entmax'}. Best is trial 69 with value: 906434.8486547305.
[I 2025-01-15 05:59:42,453] Trial 130 finished with value: 1359528.8425345325 and parameters: {'n_d': 38, 'n_steps': 3, 'gamma': 1.6786507400765394, 'cat_emb_dim': 1, 'n_independent': 4, 'n_shared': 1, 'momentum': 0.08490392994250831, 'mask_type': 'entmax'}. Best is trial 69 with value: 906434.8486547305.
[I 2025-01-15 06:01:54,633] Trial 131 finished with value: 11772576.84029087 and parameters: {'n_d': 23, 'n_steps': 3, 'gamma': 1.7268043115439207, 'cat_emb_dim': 1, 'n_independent': 5, 'n_shared': 4, 'momentum': 0.28329810745305567, 'mask_type': 'entmax'}. Best is trial 69 with value: 906434.8486547305.
[I 2025-01-15 06:04:15,113] Trial 132 finished with value: 10417679.946327727 and parameters: {'n_d': 21, 'n_steps': 3, 'gamma': 1.7555801866121934, 'cat_emb_dim': 1, 'n_independent': 5, 'n_shared': 4, 'momentum': 0.3061271854835187, 'mask_type': 'entmax'}. Best is trial 69 with value: 906434.8486547305.
[I 2025-01-15 06:06:26,473] Trial 133 finished with value: 5754146.298886548 and parameters: {'n_d': 22, 'n_steps': 3, 'gamma': 1.7002476936916535, 'cat_emb_dim': 1, 'n_independent': 5, 'n_shared': 4, 'momentum': 0.39381168421377577, 'mask_type': 'entmax'}. Best is trial 69 with value: 906434.8486547305.
[I 2025-01-15 06:10:20,942] Trial 134 finished with value: 5622768.157974677 and parameters: {'n_d': 19, 'n_steps': 8, 'gamma': 1.7281615195276683, 'cat_emb_dim': 1, 'n_independent': 5, 'n_shared': 4, 'momentum': 0.23992765884188755, 'mask_type': 'entmax'}. Best is trial 69 with value: 906434.8486547305.
[I 2025-01-15 06:12:27,226] Trial 135 finished with value: 1946516.253649708 and parameters: {'n_d': 25, 'n_steps': 3, 'gamma': 1.6551133075685607, 'cat_emb_dim': 1, 'n_independent': 5, 'n_shared': 4, 'momentum': 0.2635026979265841, 'mask_type': 'entmax'}. Best is trial 69 with value: 906434.8486547305.
[I 2025-01-15 06:14:38,984] Trial 136 finished with value: 3951837.5442775553 and parameters: {'n_d': 36, 'n_steps': 3, 'gamma': 1.6262832738592228, 'cat_emb_dim': 1, 'n_independent': 5, 'n_shared': 4, 'momentum': 0.017514371294468947, 'mask_type': 'entmax'}. Best is trial 69 with value: 906434.8486547305.
[I 2025-01-15 06:16:21,234] Trial 137 finished with value: 23564937.55019988 and parameters: {'n_d': 26, 'n_steps': 3, 'gamma': 1.6887462481034634, 'cat_emb_dim': 1, 'n_independent': 2, 'n_shared': 2, 'momentum': 0.210835208613339, 'mask_type': 'entmax'}. Best is trial 69 with value: 906434.8486547305.
[I 2025-01-15 06:18:38,063] Trial 138 finished with value: 4296945.306753211 and parameters: {'n_d': 40, 'n_steps': 4, 'gamma': 1.5600070424502117, 'cat_emb_dim': 1, 'n_independent': 4, 'n_shared': 3, 'momentum': 0.3310675991749963, 'mask_type': 'sparsemax'}. Best is trial 69 with value: 906434.8486547305.
[I 2025-01-15 06:21:07,393] Trial 139 finished with value: 1168729.0648872983 and parameters: {'n_d': 34, 'n_steps': 3, 'gamma': 1.6641260207594681, 'cat_emb_dim': 1, 'n_independent': 5, 'n_shared': 5, 'momentum': 0.2974748231523415, 'mask_type': 'entmax'}. Best is trial 69 with value: 906434.8486547305.
[I 2025-01-15 06:23:13,313] Trial 140 finished with value: 2069157.9303873505 and parameters: {'n_d': 23, 'n_steps': 4, 'gamma': 1.7672482788380801, 'cat_emb_dim': 1, 'n_independent': 4, 'n_shared': 2, 'momentum': 0.13013687419603023, 'mask_type': 'entmax'}. Best is trial 69 with value: 906434.8486547305.
[I 2025-01-15 06:25:01,967] Trial 141 finished with value: 1837791.9689281066 and parameters: {'n_d': 49, 'n_steps': 3, 'gamma': 1.7392109424821196, 'cat_emb_dim': 1, 'n_independent': 3, 'n_shared': 2, 'momentum': 0.2611004277964314, 'mask_type': 'entmax'}. Best is trial 69 with value: 906434.8486547305.
[I 2025-01-15 06:26:49,569] Trial 142 finished with value: 966250.1414113659 and parameters: {'n_d': 51, 'n_steps': 3, 'gamma': 1.6805980292544935, 'cat_emb_dim': 1, 'n_independent': 3, 'n_shared': 2, 'momentum': 0.23136069748170604, 'mask_type': 'entmax'}. Best is trial 69 with value: 906434.8486547305.
[I 2025-01-15 06:28:35,201] Trial 143 finished with value: 4139589.535094732 and parameters: {'n_d': 55, 'n_steps': 3, 'gamma': 1.6055282232716905, 'cat_emb_dim': 1, 'n_independent': 3, 'n_shared': 2, 'momentum': 0.18080325282393547, 'mask_type': 'entmax'}. Best is trial 69 with value: 906434.8486547305.
[I 2025-01-15 06:30:37,567] Trial 144 finished with value: 1326707.3539009527 and parameters: {'n_d': 46, 'n_steps': 6, 'gamma': 1.7152709491164901, 'cat_emb_dim': 1, 'n_independent': 3, 'n_shared': 2, 'momentum': 0.27502176177958576, 'mask_type': 'entmax'}. Best is trial 69 with value: 906434.8486547305.
[I 2025-01-15 06:32:07,357] Trial 145 finished with value: 77229421.21298365 and parameters: {'n_d': 47, 'n_steps': 3, 'gamma': 1.8518405825387876, 'cat_emb_dim': 1, 'n_independent': 3, 'n_shared': 2, 'momentum': 0.008582412414785417, 'mask_type': 'entmax'}. Best is trial 69 with value: 906434.8486547305.
[I 2025-01-15 06:34:28,049] Trial 146 finished with value: 948273.5249763227 and parameters: {'n_d': 42, 'n_steps': 3, 'gamma': 1.7955436396578155, 'cat_emb_dim': 1, 'n_independent': 5, 'n_shared': 4, 'momentum': 0.3526641175143188, 'mask_type': 'entmax'}. Best is trial 69 with value: 906434.8486547305.
[I 2025-01-15 06:36:30,597] Trial 147 finished with value: 6301606.71445149 and parameters: {'n_d': 30, 'n_steps': 3, 'gamma': 1.8278311848011901, 'cat_emb_dim': 1, 'n_independent': 4, 'n_shared': 2, 'momentum': 0.2166513089171183, 'mask_type': 'entmax'}. Best is trial 69 with value: 906434.8486547305.
[I 2025-01-15 06:38:23,770] Trial 148 finished with value: 4789447.169589209 and parameters: {'n_d': 39, 'n_steps': 3, 'gamma': 1.5842954388122388, 'cat_emb_dim': 1, 'n_independent': 3, 'n_shared': 3, 'momentum': 0.06472748534593659, 'mask_type': 'entmax'}. Best is trial 69 with value: 906434.8486547305.
[I 2025-01-15 06:40:38,389] Trial 149 finished with value: 39507026.04929538 and parameters: {'n_d': 14, 'n_steps': 4, 'gamma': 1.6509701719190875, 'cat_emb_dim': 1, 'n_independent': 5, 'n_shared': 2, 'momentum': 0.2919546028975093, 'mask_type': 'entmax'}. Best is trial 69 with value: 906434.8486547305.
[I 2025-01-15 06:42:49,075] Trial 150 finished with value: 181054544.00841147 and parameters: {'n_d': 12, 'n_steps': 3, 'gamma': 1.5077675052358643, 'cat_emb_dim': 1, 'n_independent': 4, 'n_shared': 4, 'momentum': 0.16497901545413507, 'mask_type': 'entmax'}. Best is trial 69 with value: 906434.8486547305.
[I 2025-01-15 06:45:24,109] Trial 151 finished with value: 981576.3922420159 and parameters: {'n_d': 28, 'n_steps': 5, 'gamma': 1.4492779512800114, 'cat_emb_dim': 1, 'n_independent': 5, 'n_shared': 4, 'momentum': 0.3194113305489941, 'mask_type': 'entmax'}. Best is trial 69 with value: 906434.8486547305.
[I 2025-01-15 06:48:03,095] Trial 152 finished with value: 1054487.8605805032 and parameters: {'n_d': 29, 'n_steps': 4, 'gamma': 1.4165852519454287, 'cat_emb_dim': 1, 'n_independent': 5, 'n_shared': 4, 'momentum': 0.2443976610017025, 'mask_type': 'entmax'}. Best is trial 69 with value: 906434.8486547305.
[I 2025-01-15 06:50:43,160] Trial 153 finished with value: 3848739.711962346 and parameters: {'n_d': 25, 'n_steps': 4, 'gamma': 1.6934216511690108, 'cat_emb_dim': 1, 'n_independent': 5, 'n_shared': 4, 'momentum': 0.3976359736821348, 'mask_type': 'entmax'}. Best is trial 69 with value: 906434.8486547305.
[I 2025-01-15 06:53:55,273] Trial 154 finished with value: 1154588.12906062 and parameters: {'n_d': 32, 'n_steps': 7, 'gamma': 1.4727935616719714, 'cat_emb_dim': 1, 'n_independent': 5, 'n_shared': 4, 'momentum': 0.2559130282548554, 'mask_type': 'entmax'}. Best is trial 69 with value: 906434.8486547305.
[I 2025-01-15 06:55:57,144] Trial 155 finished with value: 1333613.680793356 and parameters: {'n_d': 27, 'n_steps': 3, 'gamma': 1.7540092997586085, 'cat_emb_dim': 1, 'n_independent': 2, 'n_shared': 4, 'momentum': 0.19900536903833466, 'mask_type': 'entmax'}. Best is trial 69 with value: 906434.8486547305.
[I 2025-01-15 06:58:15,246] Trial 156 finished with value: 1840108.1842296242 and parameters: {'n_d': 37, 'n_steps': 4, 'gamma': 1.484948478233814, 'cat_emb_dim': 1, 'n_independent': 5, 'n_shared': 5, 'momentum': 0.35173873482908724, 'mask_type': 'entmax'}. Best is trial 69 with value: 906434.8486547305.
[I 2025-01-15 07:00:16,680] Trial 157 finished with value: 12328618.551992195 and parameters: {'n_d': 24, 'n_steps': 3, 'gamma': 1.3255214597329672, 'cat_emb_dim': 1, 'n_independent': 4, 'n_shared': 2, 'momentum': 0.028392014676802416, 'mask_type': 'entmax'}. Best is trial 69 with value: 906434.8486547305.
[I 2025-01-15 07:02:23,276] Trial 158 finished with value: 76261869.9012183 and parameters: {'n_d': 16, 'n_steps': 3, 'gamma': 1.6341005739061016, 'cat_emb_dim': 1, 'n_independent': 5, 'n_shared': 4, 'momentum': 0.2910572644002909, 'mask_type': 'entmax'}. Best is trial 69 with value: 906434.8486547305.
[I 2025-01-15 07:04:30,457] Trial 159 finished with value: 1511992.83638185 and parameters: {'n_d': 26, 'n_steps': 4, 'gamma': 1.7779234660033976, 'cat_emb_dim': 1, 'n_independent': 4, 'n_shared': 3, 'momentum': 0.22342961398036823, 'mask_type': 'sparsemax'}. Best is trial 69 with value: 906434.8486547305.
[I 2025-01-15 07:08:14,159] Trial 160 finished with value: 6009174.335238723 and parameters: {'n_d': 29, 'n_steps': 10, 'gamma': 1.6729183383762272, 'cat_emb_dim': 1, 'n_independent': 5, 'n_shared': 2, 'momentum': 0.18751679370627442, 'mask_type': 'entmax'}. Best is trial 69 with value: 906434.8486547305.
[I 2025-01-15 07:10:28,125] Trial 161 finished with value: 1003185.3830455948 and parameters: {'n_d': 43, 'n_steps': 3, 'gamma': 1.7904386379539883, 'cat_emb_dim': 1, 'n_independent': 5, 'n_shared': 4, 'momentum': 0.35143576137182003, 'mask_type': 'entmax'}. Best is trial 69 with value: 906434.8486547305.
[I 2025-01-15 07:12:47,023] Trial 162 finished with value: 5342151.798782618 and parameters: {'n_d': 39, 'n_steps': 3, 'gamma': 1.812597783909347, 'cat_emb_dim': 1, 'n_independent': 5, 'n_shared': 4, 'momentum': 0.30354934891534935, 'mask_type': 'entmax'}. Best is trial 69 with value: 906434.8486547305.
[I 2025-01-15 07:15:08,388] Trial 163 finished with value: 982542.4263243725 and parameters: {'n_d': 42, 'n_steps': 3, 'gamma': 1.7274693460861823, 'cat_emb_dim': 1, 'n_independent': 5, 'n_shared': 4, 'momentum': 0.3601130075042587, 'mask_type': 'entmax'}. Best is trial 69 with value: 906434.8486547305.
[I 2025-01-15 07:17:24,952] Trial 164 finished with value: 1292058.1955464263 and parameters: {'n_d': 41, 'n_steps': 3, 'gamma': 1.7091946805773224, 'cat_emb_dim': 1, 'n_independent': 5, 'n_shared': 4, 'momentum': 0.258652450223932, 'mask_type': 'entmax'}. Best is trial 69 with value: 906434.8486547305.
[I 2025-01-15 07:19:45,570] Trial 165 finished with value: 1172228.218783375 and parameters: {'n_d': 35, 'n_steps': 3, 'gamma': 1.7966496165112626, 'cat_emb_dim': 1, 'n_independent': 5, 'n_shared': 4, 'momentum': 0.3275298998093328, 'mask_type': 'entmax'}. Best is trial 69 with value: 906434.8486547305.
[I 2025-01-15 07:22:09,886] Trial 166 finished with value: 977492.6734037222 and parameters: {'n_d': 37, 'n_steps': 3, 'gamma': 1.7642824634894707, 'cat_emb_dim': 1, 'n_independent': 5, 'n_shared': 5, 'momentum': 0.21836995332434644, 'mask_type': 'entmax'}. Best is trial 69 with value: 906434.8486547305.
[I 2025-01-15 07:24:06,889] Trial 167 finished with value: 5732661.271827647 and parameters: {'n_d': 23, 'n_steps': 3, 'gamma': 1.5248031457749942, 'cat_emb_dim': 1, 'n_independent': 4, 'n_shared': 4, 'momentum': 0.27463861921902694, 'mask_type': 'entmax'}. Best is trial 69 with value: 906434.8486547305.
[I 2025-01-15 07:26:32,894] Trial 168 finished with value: 10431432.422055773 and parameters: {'n_d': 22, 'n_steps': 4, 'gamma': 1.738564691618897, 'cat_emb_dim': 1, 'n_independent': 5, 'n_shared': 5, 'momentum': 0.1487307208614304, 'mask_type': 'entmax'}. Best is trial 69 with value: 906434.8486547305.
[I 2025-01-15 07:28:46,814] Trial 169 finished with value: 9927117.474944012 and parameters: {'n_d': 38, 'n_steps': 3, 'gamma': 1.8758291114414531, 'cat_emb_dim': 1, 'n_independent': 5, 'n_shared': 3, 'momentum': 0.39797085364152607, 'mask_type': 'entmax'}. Best is trial 69 with value: 906434.8486547305.
[I 2025-01-15 07:30:41,665] Trial 170 finished with value: 998708.2563418938 and parameters: {'n_d': 44, 'n_steps': 3, 'gamma': 1.691624299405358, 'cat_emb_dim': 1, 'n_independent': 4, 'n_shared': 2, 'momentum': 0.2405616531856306, 'mask_type': 'entmax'}. Best is trial 69 with value: 906434.8486547305.
