[I 2025-01-15 09:31:29,242] Trial 71 finished with value: 72.07243446410708 and parameters: {'n_d': 11, 'n_steps': 4, 'gamma': 1.1503954324652148, 'cat_emb_dim': 3, 'n_independent': 5, 'n_shared': 4, 'momentum': 0.1972680282182661, 'mask_type': 'entmax'}. Best is trial 65 with value: 70.66830121459937.
[I 2025-01-15 09:37:18,328] Trial 72 finished with value: 71.84674173233886 and parameters: {'n_d': 11, 'n_steps': 4, 'gamma': 1.1134632736300816, 'cat_emb_dim': 3, 'n_independent': 5, 'n_shared': 4, 'momentum': 0.10272407729019892, 'mask_type': 'entmax'}. Best is trial 65 with value: 70.66830121459937.
[I 2025-01-15 09:41:44,740] Trial 73 finished with value: 72.7752528668034 and parameters: {'n_d': 18, 'n_steps': 3, 'gamma': 1.1048443881658334, 'cat_emb_dim': 3, 'n_independent': 5, 'n_shared': 5, 'momentum': 0.09908534922544861, 'mask_type': 'entmax'}. Best is trial 65 with value: 70.66830121459937.
[I 2025-01-15 09:51:44,699] Trial 74 finished with value: 85.82249789354873 and parameters: {'n_d': 9, 'n_steps': 8, 'gamma': 1.2044457579659067, 'cat_emb_dim': 3, 'n_independent': 5, 'n_shared': 4, 'momentum': 0.06849437240290517, 'mask_type': 'entmax'}. Best is trial 65 with value: 70.66830121459937.
[I 2025-01-15 09:57:12,333] Trial 75 finished with value: 73.35290995838649 and parameters: {'n_d': 43, 'n_steps': 4, 'gamma': 1.033492170822166, 'cat_emb_dim': 3, 'n_independent': 5, 'n_shared': 3, 'momentum': 0.10691401059731304, 'mask_type': 'entmax'}. Best is trial 65 with value: 70.66830121459937.
[I 2025-01-15 10:03:51,739] Trial 76 finished with value: 73.07447291120606 and parameters: {'n_d': 35, 'n_steps': 4, 'gamma': 1.0747572129402578, 'cat_emb_dim': 3, 'n_independent': 5, 'n_shared': 5, 'momentum': 0.05853960390245949, 'mask_type': 'entmax'}. Best is trial 65 with value: 70.66830121459937.
[I 2025-01-15 10:10:07,003] Trial 77 finished with value: 73.3128066079931 and parameters: {'n_d': 12, 'n_steps': 5, 'gamma': 1.0225296274996714, 'cat_emb_dim': 3, 'n_independent': 3, 'n_shared': 4, 'momentum': 0.029440485411755476, 'mask_type': 'entmax'}. Best is trial 65 with value: 70.66830121459937.
[I 2025-01-15 10:14:51,057] Trial 78 finished with value: 73.2088404044794 and parameters: {'n_d': 28, 'n_steps': 3, 'gamma': 1.1234525033878517, 'cat_emb_dim': 3, 'n_independent': 5, 'n_shared': 5, 'momentum': 0.0772445963356661, 'mask_type': 'entmax'}. Best is trial 65 with value: 70.66830121459937.
[I 2025-01-15 10:22:34,601] Trial 79 finished with value: 74.59475224641847 and parameters: {'n_d': 15, 'n_steps': 6, 'gamma': 1.0595862487381127, 'cat_emb_dim': 3, 'n_independent': 4, 'n_shared': 3, 'momentum': 0.020929228775384737, 'mask_type': 'entmax'}. Best is trial 65 with value: 70.66830121459937.
[I 2025-01-15 10:26:20,203] Trial 80 finished with value: 72.36368344265802 and parameters: {'n_d': 32, 'n_steps': 3, 'gamma': 1.0885980535222282, 'cat_emb_dim': 3, 'n_independent': 5, 'n_shared': 2, 'momentum': 0.25541779676102194, 'mask_type': 'sparsemax'}. Best is trial 65 with value: 70.66830121459937.
[I 2025-01-15 10:32:36,368] Trial 81 finished with value: 72.6817832690136 and parameters: {'n_d': 11, 'n_steps': 4, 'gamma': 1.1552292315960435, 'cat_emb_dim': 3, 'n_independent': 5, 'n_shared': 4, 'momentum': 0.14590148892117996, 'mask_type': 'entmax'}. Best is trial 65 with value: 70.66830121459937.
[I 2025-01-15 10:39:48,648] Trial 82 finished with value: 299.9988582032158 and parameters: {'n_d': 9, 'n_steps': 4, 'gamma': 1.1538156417466707, 'cat_emb_dim': 3, 'n_independent': 5, 'n_shared': 4, 'momentum': 0.0015486623277950176, 'mask_type': 'entmax'}. Best is trial 65 with value: 70.66830121459937.
[I 2025-01-15 10:45:23,123] Trial 83 finished with value: 72.14860332476212 and parameters: {'n_d': 8, 'n_steps': 4, 'gamma': 1.0001195252522075, 'cat_emb_dim': 3, 'n_independent': 5, 'n_shared': 4, 'momentum': 0.1774597751335389, 'mask_type': 'entmax'}. Best is trial 65 with value: 70.66830121459937.
[I 2025-01-15 10:53:20,274] Trial 84 finished with value: 72.80967843186701 and parameters: {'n_d': 11, 'n_steps': 5, 'gamma': 1.0338648473684073, 'cat_emb_dim': 3, 'n_independent': 5, 'n_shared': 4, 'momentum': 0.12843683375649953, 'mask_type': 'entmax'}. Best is trial 65 with value: 70.66830121459937.
[I 2025-01-15 10:57:08,375] Trial 85 finished with value: 73.19051942668418 and parameters: {'n_d': 14, 'n_steps': 4, 'gamma': 1.0629776485485036, 'cat_emb_dim': 3, 'n_independent': 2, 'n_shared': 4, 'momentum': 0.1834806300506457, 'mask_type': 'entmax'}. Best is trial 65 with value: 70.66830121459937.
[I 2025-01-15 11:03:42,867] Trial 86 finished with value: 75.7432270261742 and parameters: {'n_d': 38, 'n_steps': 7, 'gamma': 1.1920563411446023, 'cat_emb_dim': 2, 'n_independent': 5, 'n_shared': 1, 'momentum': 0.22175177761118983, 'mask_type': 'entmax'}. Best is trial 65 with value: 70.66830121459937.
[I 2025-01-15 11:07:43,341] Trial 87 finished with value: 74.5299407603961 and parameters: {'n_d': 21, 'n_steps': 3, 'gamma': 1.1186048280512098, 'cat_emb_dim': 3, 'n_independent': 5, 'n_shared': 5, 'momentum': 0.04417311894414844, 'mask_type': 'entmax'}. Best is trial 65 with value: 70.66830121459937.
[I 2025-01-15 11:16:15,926] Trial 88 finished with value: 70.25355678476407 and parameters: {'n_d': 16, 'n_steps': 5, 'gamma': 1.0239150361392573, 'cat_emb_dim': 3, 'n_independent': 5, 'n_shared': 5, 'momentum': 0.11107074832862197, 'mask_type': 'entmax'}. Best is trial 88 with value: 70.25355678476407.
[I 2025-01-15 11:23:33,364] Trial 89 finished with value: 73.2086858111443 and parameters: {'n_d': 17, 'n_steps': 5, 'gamma': 1.016419466116665, 'cat_emb_dim': 3, 'n_independent': 5, 'n_shared': 5, 'momentum': 0.11767534222705642, 'mask_type': 'entmax'}. Best is trial 88 with value: 70.25355678476407.
[I 2025-01-15 11:31:09,218] Trial 90 finished with value: 75.48468400469737 and parameters: {'n_d': 56, 'n_steps': 6, 'gamma': 1.0505259198209578, 'cat_emb_dim': 2, 'n_independent': 4, 'n_shared': 5, 'momentum': 0.09173934896601825, 'mask_type': 'entmax'}. Best is trial 88 with value: 70.25355678476407.
[I 2025-01-15 11:39:03,970] Trial 91 finished with value: 71.01689316389367 and parameters: {'n_d': 13, 'n_steps': 4, 'gamma': 1.0836693299818796, 'cat_emb_dim': 3, 'n_independent': 5, 'n_shared': 5, 'momentum': 0.14267332330683408, 'mask_type': 'entmax'}. Best is trial 88 with value: 70.25355678476407.
[I 2025-01-15 11:49:12,940] Trial 92 finished with value: 72.93807176217531 and parameters: {'n_d': 19, 'n_steps': 5, 'gamma': 1.090125795167779, 'cat_emb_dim': 3, 'n_independent': 5, 'n_shared': 5, 'momentum': 0.14271882041918366, 'mask_type': 'entmax'}. Best is trial 88 with value: 70.25355678476407.
[I 2025-01-15 11:58:05,631] Trial 93 finished with value: 71.90009413576432 and parameters: {'n_d': 13, 'n_steps': 5, 'gamma': 1.025794227921189, 'cat_emb_dim': 3, 'n_independent': 5, 'n_shared': 5, 'momentum': 0.07470194096714279, 'mask_type': 'entmax'}. Best is trial 88 with value: 70.25355678476407.
[I 2025-01-15 12:04:29,340] Trial 94 finished with value: 73.20262133650715 and parameters: {'n_d': 13, 'n_steps': 5, 'gamma': 1.027456989829225, 'cat_emb_dim': 3, 'n_independent': 5, 'n_shared': 5, 'momentum': 0.10824470660582079, 'mask_type': 'entmax'}. Best is trial 88 with value: 70.25355678476407.
[I 2025-01-15 12:14:35,724] Trial 95 finished with value: 73.48212571885793 and parameters: {'n_d': 16, 'n_steps': 5, 'gamma': 1.0810830023150237, 'cat_emb_dim': 3, 'n_independent': 5, 'n_shared': 5, 'momentum': 0.01109505417533259, 'mask_type': 'entmax'}. Best is trial 88 with value: 70.25355678476407.
[I 2025-01-15 12:21:54,623] Trial 96 finished with value: 73.2124315183327 and parameters: {'n_d': 15, 'n_steps': 5, 'gamma': 1.0509186020194936, 'cat_emb_dim': 3, 'n_independent': 5, 'n_shared': 5, 'momentum': 0.16787749132600574, 'mask_type': 'entmax'}. Best is trial 88 with value: 70.25355678476407.
[I 2025-01-15 12:29:03,552] Trial 97 finished with value: 72.86338943091701 and parameters: {'n_d': 13, 'n_steps': 4, 'gamma': 1.1103810355672417, 'cat_emb_dim': 3, 'n_independent': 5, 'n_shared': 5, 'momentum': 0.07233080279789557, 'mask_type': 'entmax'}. Best is trial 88 with value: 70.25355678476407.
[I 2025-01-15 12:35:05,413] Trial 98 finished with value: 72.65195497617665 and parameters: {'n_d': 22, 'n_steps': 4, 'gamma': 1.025127734714732, 'cat_emb_dim': 3, 'n_independent': 5, 'n_shared': 5, 'momentum': 0.12703170259208446, 'mask_type': 'sparsemax'}. Best is trial 88 with value: 70.25355678476407.
[I 2025-01-15 12:42:39,840] Trial 99 finished with value: 72.3754342198653 and parameters: {'n_d': 18, 'n_steps': 5, 'gamma': 1.0587654280433914, 'cat_emb_dim': 3, 'n_independent': 5, 'n_shared': 5, 'momentum': 0.10363731486933221, 'mask_type': 'entmax'}. Best is trial 88 with value: 70.25355678476407.
