[I 2025-01-08 20:42:55,304] Trial 12 finished with value: 0.630429909865585 and parameters: {'n_d': 9, 'n_steps': 3, 'gamma': 1.659544981911087, 'cat_emb_dim': 2, 'n_independent': 3, 'n_shared': 5, 'momentum': 0.046260992185287654, 'mask_type': 'entmax'}. Best is trial 11 with value: 0.6142472026058163.
[I 2025-01-08 20:43:55,302] Trial 13 finished with value: 0.592368825911538 and parameters: {'n_d': 11, 'n_steps': 3, 'gamma': 1.6622555430896173, 'cat_emb_dim': 2, 'n_independent': 3, 'n_shared': 5, 'momentum': 0.047459670041427454, 'mask_type': 'entmax'}. Best is trial 13 with value: 0.592368825911538.
[I 2025-01-08 20:44:58,416] Trial 14 finished with value: 0.6365528670895045 and parameters: {'n_d': 17, 'n_steps': 3, 'gamma': 1.6336499219760467, 'cat_emb_dim': 2, 'n_independent': 4, 'n_shared': 5, 'momentum': 0.04487784638764042, 'mask_type': 'entmax'}. Best is trial 13 with value: 0.592368825911538.
[I 2025-01-08 20:46:10,648] Trial 15 finished with value: 0.6188568186384774 and parameters: {'n_d': 35, 'n_steps': 5, 'gamma': 1.5784454137699069, 'cat_emb_dim': 1, 'n_independent': 2, 'n_shared': 4, 'momentum': 0.03499655585011295, 'mask_type': 'entmax'}. Best is trial 13 with value: 0.592368825911538.
[I 2025-01-08 20:47:18,742] Trial 16 finished with value: 0.6532164502779446 and parameters: {'n_d': 16, 'n_steps': 5, 'gamma': 1.8510938535041779, 'cat_emb_dim': 2, 'n_independent': 3, 'n_shared': 5, 'momentum': 0.11883538090615432, 'mask_type': 'entmax'}. Best is trial 13 with value: 0.592368825911538.
[I 2025-01-08 20:48:12,523] Trial 17 finished with value: 15.639707856621857 and parameters: {'n_d': 53, 'n_steps': 3, 'gamma': 1.7437412687467706, 'cat_emb_dim': 2, 'n_independent': 2, 'n_shared': 4, 'momentum': 0.0020748802800577503, 'mask_type': 'entmax'}. Best is trial 13 with value: 0.592368825911538.
[I 2025-01-08 20:49:15,451] Trial 18 finished with value: 0.6690317122643483 and parameters: {'n_d': 37, 'n_steps': 5, 'gamma': 1.5129234346882494, 'cat_emb_dim': 1, 'n_independent': 4, 'n_shared': 1, 'momentum': 0.021267062191198016, 'mask_type': 'entmax'}. Best is trial 13 with value: 0.592368825911538.
[I 2025-01-08 20:51:07,141] Trial 19 finished with value: 7.1924752295160825 and parameters: {'n_d': 27, 'n_steps': 8, 'gamma': 1.335426353228222, 'cat_emb_dim': 2, 'n_independent': 4, 'n_shared': 5, 'momentum': 0.004235218421759673, 'mask_type': 'entmax'}. Best is trial 13 with value: 0.592368825911538.
[I 2025-01-08 20:52:20,565] Trial 20 finished with value: 0.7748180196666172 and parameters: {'n_d': 36, 'n_steps': 6, 'gamma': 1.9680041675813318, 'cat_emb_dim': 2, 'n_independent': 3, 'n_shared': 3, 'momentum': 0.025260601748424302, 'mask_type': 'entmax'}. Best is trial 13 with value: 0.592368825911538.
[I 2025-01-08 20:53:18,253] Trial 21 finished with value: 0.6055643361040822 and parameters: {'n_d': 15, 'n_steps': 3, 'gamma': 1.7037457709247708, 'cat_emb_dim': 1, 'n_independent': 2, 'n_shared': 5, 'momentum': 0.06524494421196993, 'mask_type': 'entmax'}. Best is trial 13 with value: 0.592368825911538.
[I 2025-01-08 20:54:11,862] Trial 22 finished with value: 0.6367910443593855 and parameters: {'n_d': 14, 'n_steps': 4, 'gamma': 1.7261257794965486, 'cat_emb_dim': 1, 'n_independent': 2, 'n_shared': 4, 'momentum': 0.07625986763217034, 'mask_type': 'entmax'}. Best is trial 13 with value: 0.592368825911538.
[I 2025-01-08 20:54:50,171] Trial 23 finished with value: 0.5857579557933873 and parameters: {'n_d': 23, 'n_steps': 3, 'gamma': 1.541257363397062, 'cat_emb_dim': 1, 'n_independent': 3, 'n_shared': 5, 'momentum': 0.20332771805016828, 'mask_type': 'entmax'}. Best is trial 23 with value: 0.5857579557933873.
[I 2025-01-08 20:55:30,707] Trial 24 finished with value: 0.5957603566470867 and parameters: {'n_d': 21, 'n_steps': 3, 'gamma': 1.5316868763404632, 'cat_emb_dim': 1, 'n_independent': 2, 'n_shared': 5, 'momentum': 0.26625560046896, 'mask_type': 'entmax'}. Best is trial 23 with value: 0.5857579557933873.
[I 2025-01-08 20:56:20,528] Trial 25 finished with value: 0.6288520856589441 and parameters: {'n_d': 22, 'n_steps': 4, 'gamma': 1.5541082824637558, 'cat_emb_dim': 1, 'n_independent': 3, 'n_shared': 5, 'momentum': 0.34235716943634864, 'mask_type': 'entmax'}. Best is trial 23 with value: 0.5857579557933873.
[I 2025-01-08 20:57:09,931] Trial 26 finished with value: 0.6548608643323012 and parameters: {'n_d': 21, 'n_steps': 5, 'gamma': 1.4795837653733444, 'cat_emb_dim': 1, 'n_independent': 3, 'n_shared': 4, 'momentum': 0.1917998160708633, 'mask_type': 'entmax'}. Best is trial 23 with value: 0.5857579557933873.
[I 2025-01-08 20:57:55,312] Trial 27 finished with value: 0.6144348044292742 and parameters: {'n_d': 11, 'n_steps': 3, 'gamma': 1.6006973132169768, 'cat_emb_dim': 1, 'n_independent': 1, 'n_shared': 5, 'momentum': 0.2190588110634708, 'mask_type': 'entmax'}. Best is trial 23 with value: 0.5857579557933873.
[I 2025-01-08 20:58:37,465] Trial 28 finished with value: 0.6221547495742381 and parameters: {'n_d': 29, 'n_steps': 4, 'gamma': 1.853096731479065, 'cat_emb_dim': 1, 'n_independent': 2, 'n_shared': 4, 'momentum': 0.13279694849095589, 'mask_type': 'entmax'}. Best is trial 23 with value: 0.5857579557933873.
[I 2025-01-08 20:59:16,356] Trial 29 finished with value: 0.5884460398001605 and parameters: {'n_d': 23, 'n_steps': 3, 'gamma': 1.0009241566322065, 'cat_emb_dim': 1, 'n_independent': 3, 'n_shared': 5, 'momentum': 0.30232985095625653, 'mask_type': 'entmax'}. Best is trial 23 with value: 0.5857579557933873.
[I 2025-01-08 21:00:13,531] Trial 30 finished with value: 0.63330554612468 and parameters: {'n_d': 13, 'n_steps': 6, 'gamma': 1.2267244629336054, 'cat_emb_dim': 1, 'n_independent': 3, 'n_shared': 3, 'momentum': 0.12038277997106338, 'mask_type': 'entmax'}. Best is trial 23 with value: 0.5857579557933873.
[I 2025-01-08 21:01:01,707] Trial 31 finished with value: 0.6081539220754717 and parameters: {'n_d': 24, 'n_steps': 4, 'gamma': 1.0714169199165153, 'cat_emb_dim': 1, 'n_independent': 3, 'n_shared': 5, 'momentum': 0.266333078282716, 'mask_type': 'entmax'}. Best is trial 23 with value: 0.5857579557933873.
[I 2025-01-08 21:01:44,965] Using an existing study with name 'TabNet_Moneyball' instead of creating a new one.
[I 2025-01-08 21:04:13,456] Trial 2 finished with value: 767.4537247846932 and parameters: {'n_d': 8, 'n_steps': 5, 'gamma': 1.809465122473925, 'cat_emb_dim': 2, 'n_independent': 5, 'n_shared': 3, 'momentum': 0.20866806552193903, 'mask_type': 'sparsemax'}. Best is trial 2 with value: 767.4537247846932.
[I 2025-01-08 21:07:59,504] Trial 3 finished with value: 745.2195813836257 and parameters: {'n_d': 43, 'n_steps': 7, 'gamma': 1.5668861877384987, 'cat_emb_dim': 3, 'n_independent': 4, 'n_shared': 5, 'momentum': 0.05136925832833022, 'mask_type': 'sparsemax'}. Best is trial 3 with value: 745.2195813836257.
[I 2025-01-08 21:10:29,859] Trial 4 finished with value: 654.3828013236541 and parameters: {'n_d': 55, 'n_steps': 9, 'gamma': 1.2218143160155686, 'cat_emb_dim': 3, 'n_independent': 2, 'n_shared': 3, 'momentum': 0.2270882325902849, 'mask_type': 'entmax'}. Best is trial 4 with value: 654.3828013236541.
[I 2025-01-08 21:12:10,477] Trial 5 finished with value: 557.2759011476558 and parameters: {'n_d': 50, 'n_steps': 4, 'gamma': 1.2070365750679004, 'cat_emb_dim': 1, 'n_independent': 4, 'n_shared': 1, 'momentum': 0.05240020346701663, 'mask_type': 'entmax'}. Best is trial 5 with value: 557.2759011476558.
[I 2025-01-08 21:13:15,854] Trial 6 finished with value: 257522.62731208978 and parameters: {'n_d': 37, 'n_steps': 7, 'gamma': 1.0014525270284809, 'cat_emb_dim': 3, 'n_independent': 5, 'n_shared': 3, 'momentum': 0.0010026149346307653, 'mask_type': 'entmax'}. Best is trial 5 with value: 557.2759011476558.
[I 2025-01-08 21:15:53,135] Trial 7 finished with value: 1512.9976830984824 and parameters: {'n_d': 41, 'n_steps': 3, 'gamma': 1.5905848635655158, 'cat_emb_dim': 2, 'n_independent': 4, 'n_shared': 5, 'momentum': 0.007978097176199647, 'mask_type': 'entmax'}. Best is trial 5 with value: 557.2759011476558.
[I 2025-01-08 21:18:12,418] Trial 8 finished with value: 543.0002993802785 and parameters: {'n_d': 55, 'n_steps': 4, 'gamma': 1.3548678767620057, 'cat_emb_dim': 3, 'n_independent': 5, 'n_shared': 1, 'momentum': 0.24488147555334566, 'mask_type': 'sparsemax'}. Best is trial 8 with value: 543.0002993802785.
[I 2025-01-08 21:19:57,574] Trial 9 finished with value: 5493.939560727507 and parameters: {'n_d': 48, 'n_steps': 4, 'gamma': 1.0273446253505036, 'cat_emb_dim': 2, 'n_independent': 4, 'n_shared': 2, 'momentum': 0.009717631069625617, 'mask_type': 'entmax'}. Best is trial 8 with value: 543.0002993802785.
[I 2025-01-08 21:21:14,706] Trial 10 finished with value: 8363.804621804273 and parameters: {'n_d': 15, 'n_steps': 5, 'gamma': 1.5195570209637386, 'cat_emb_dim': 1, 'n_independent': 2, 'n_shared': 4, 'momentum': 0.005098330946653416, 'mask_type': 'sparsemax'}. Best is trial 8 with value: 543.0002993802785.
[I 2025-01-08 21:24:35,290] Trial 11 finished with value: 604.2556658232115 and parameters: {'n_d': 38, 'n_steps': 8, 'gamma': 1.3396943728411164, 'cat_emb_dim': 2, 'n_independent': 5, 'n_shared': 2, 'momentum': 0.061039054976072746, 'mask_type': 'entmax'}. Best is trial 8 with value: 543.0002993802785.
[I 2025-01-08 21:26:59,267] Trial 12 finished with value: 875.3022823691945 and parameters: {'n_d': 25, 'n_steps': 10, 'gamma': 1.9371877111525804, 'cat_emb_dim': 3, 'n_independent': 1, 'n_shared': 1, 'momentum': 0.31228872284766074, 'mask_type': 'sparsemax'}. Best is trial 8 with value: 543.0002993802785.
[I 2025-01-08 21:28:35,173] Trial 13 finished with value: 620.8068675587774 and parameters: {'n_d': 63, 'n_steps': 3, 'gamma': 1.2633956784534726, 'cat_emb_dim': 1, 'n_independent': 3, 'n_shared': 1, 'momentum': 0.0599923024538139, 'mask_type': 'sparsemax'}. Best is trial 8 with value: 543.0002993802785.
[I 2025-01-08 21:30:28,277] Trial 14 finished with value: 559.5537065047222 and parameters: {'n_d': 56, 'n_steps': 5, 'gamma': 1.357409119712318, 'cat_emb_dim': 1, 'n_independent': 4, 'n_shared': 1, 'momentum': 0.1046115186791197, 'mask_type': 'entmax'}. Best is trial 8 with value: 543.0002993802785.
[I 2025-01-08 21:32:39,656] Trial 15 finished with value: 637.4039890018788 and parameters: {'n_d': 50, 'n_steps': 4, 'gamma': 1.1642472694504096, 'cat_emb_dim': 1, 'n_independent': 3, 'n_shared': 2, 'momentum': 0.023456681533843202, 'mask_type': 'sparsemax'}. Best is trial 8 with value: 543.0002993802785.
[I 2025-01-08 21:35:31,643] Trial 16 finished with value: 660.6863738731266 and parameters: {'n_d': 63, 'n_steps': 6, 'gamma': 1.4072729765035112, 'cat_emb_dim': 2, 'n_independent': 5, 'n_shared': 1, 'momentum': 0.022980000464133118, 'mask_type': 'entmax'}. Best is trial 8 with value: 543.0002993802785.
[I 2025-01-08 21:37:38,892] Trial 17 finished with value: 553.2217101820451 and parameters: {'n_d': 29, 'n_steps': 4, 'gamma': 1.6613112928737683, 'cat_emb_dim': 1, 'n_independent': 4, 'n_shared': 2, 'momentum': 0.12212292739414418, 'mask_type': 'sparsemax'}. Best is trial 8 with value: 543.0002993802785.
[I 2025-01-08 21:40:26,192] Trial 18 finished with value: 651.6888512155584 and parameters: {'n_d': 28, 'n_steps': 6, 'gamma': 1.7295623478387887, 'cat_emb_dim': 3, 'n_independent': 5, 'n_shared': 2, 'momentum': 0.13111387731031146, 'mask_type': 'sparsemax'}. Best is trial 8 with value: 543.0002993802785.
[I 2025-01-08 21:42:12,309] Trial 19 finished with value: 582.5548520842686 and parameters: {'n_d': 28, 'n_steps': 3, 'gamma': 1.6923425278028017, 'cat_emb_dim': 2, 'n_independent': 3, 'n_shared': 2, 'momentum': 0.13181289783872036, 'mask_type': 'sparsemax'}. Best is trial 8 with value: 543.0002993802785.
[I 2025-01-08 21:44:54,978] Trial 20 finished with value: 549.2891686048273 and parameters: {'n_d': 23, 'n_steps': 4, 'gamma': 1.9962575991858174, 'cat_emb_dim': 1, 'n_independent': 4, 'n_shared': 4, 'momentum': 0.3956287849276404, 'mask_type': 'sparsemax'}. Best is trial 8 with value: 543.0002993802785.
[I 2025-01-08 21:47:33,270] Trial 21 finished with value: 595.7314990972519 and parameters: {'n_d': 20, 'n_steps': 5, 'gamma': 1.9989022110971026, 'cat_emb_dim': 3, 'n_independent': 2, 'n_shared': 4, 'momentum': 0.3832452513983065, 'mask_type': 'sparsemax'}. Best is trial 8 with value: 543.0002993802785.
[I 2025-01-08 21:48:33,888] Trial 22 finished with value: 80748.46798764518 and parameters: {'n_d': 15, 'n_steps': 6, 'gamma': 1.838368720474231, 'cat_emb_dim': 2, 'n_independent': 5, 'n_shared': 4, 'momentum': 0.0015508492342933863, 'mask_type': 'sparsemax'}. Best is trial 8 with value: 543.0002993802785.
[I 2025-01-08 21:51:16,596] Trial 23 finished with value: 566.6206350957561 and parameters: {'n_d': 31, 'n_steps': 4, 'gamma': 1.4544065130459436, 'cat_emb_dim': 1, 'n_independent': 4, 'n_shared': 4, 'momentum': 0.19987671555896994, 'mask_type': 'sparsemax'}. Best is trial 8 with value: 543.0002993802785.
[I 2025-01-08 21:53:21,314] Trial 24 finished with value: 601.8683001755081 and parameters: {'n_d': 21, 'n_steps': 3, 'gamma': 1.691818437661048, 'cat_emb_dim': 1, 'n_independent': 4, 'n_shared': 2, 'momentum': 0.3521148906717722, 'mask_type': 'sparsemax'}. Best is trial 8 with value: 543.0002993802785.
[I 2025-01-08 21:55:22,749] Trial 25 finished with value: 616.0087948618285 and parameters: {'n_d': 31, 'n_steps': 4, 'gamma': 1.8879238767021433, 'cat_emb_dim': 1, 'n_independent': 3, 'n_shared': 3, 'momentum': 0.10045757670083681, 'mask_type': 'sparsemax'}. Best is trial 8 with value: 543.0002993802785.
[I 2025-01-08 21:57:53,678] Trial 26 finished with value: 598.9234542829297 and parameters: {'n_d': 33, 'n_steps': 5, 'gamma': 1.6159993954838228, 'cat_emb_dim': 1, 'n_independent': 4, 'n_shared': 1, 'momentum': 0.1839667233645347, 'mask_type': 'sparsemax'}. Best is trial 8 with value: 543.0002993802785.
[I 2025-01-08 22:00:04,398] Trial 27 finished with value: 729.1176624006137 and parameters: {'n_d': 22, 'n_steps': 4, 'gamma': 1.7564531289335976, 'cat_emb_dim': 1, 'n_independent': 5, 'n_shared': 5, 'momentum': 0.39668759446127405, 'mask_type': 'sparsemax'}. Best is trial 8 with value: 543.0002993802785.
[I 2025-01-08 22:02:19,555] Trial 28 finished with value: 642.7642191544885 and parameters: {'n_d': 10, 'n_steps': 3, 'gamma': 1.4823859413041887, 'cat_emb_dim': 2, 'n_independent': 4, 'n_shared': 4, 'momentum': 0.037195350754763094, 'mask_type': 'sparsemax'}. Best is trial 8 with value: 543.0002993802785.
[I 2025-01-08 22:05:03,973] Trial 29 finished with value: 612.7294122148596 and parameters: {'n_d': 17, 'n_steps': 5, 'gamma': 1.9969098867850723, 'cat_emb_dim': 1, 'n_independent': 5, 'n_shared': 2, 'momentum': 0.09119504629728889, 'mask_type': 'sparsemax'}. Best is trial 8 with value: 543.0002993802785.
[I 2025-01-08 22:07:44,624] Trial 30 finished with value: 597.4383275301765 and parameters: {'n_d': 26, 'n_steps': 6, 'gamma': 1.1161474759360086, 'cat_emb_dim': 3, 'n_independent': 3, 'n_shared': 3, 'momentum': 0.23001141531340796, 'mask_type': 'sparsemax'}. Best is trial 8 with value: 543.0002993802785.
[I 2025-01-08 22:10:48,117] Trial 31 finished with value: 834.5686912131703 and parameters: {'n_d': 9, 'n_steps': 7, 'gamma': 1.8231329235892964, 'cat_emb_dim': 2, 'n_independent': 5, 'n_shared': 3, 'momentum': 0.1635484844541436, 'mask_type': 'sparsemax'}. Best is trial 8 with value: 543.0002993802785.
[I 2025-01-08 22:13:10,924] Using an existing study with name 'TabNet_Black_Friday' instead of creating a new one.
[I 2025-01-09 01:25:25,285] Trial 2 finished with value: 12412431.55529416 and parameters: {'n_d': 39, 'n_steps': 10, 'gamma': 1.0682511031748487, 'cat_emb_dim': 2, 'n_independent': 1, 'n_shared': 1, 'momentum': 0.03098519971526965, 'mask_type': 'entmax'}. Best is trial 2 with value: 12412431.55529416.
