[I 2025-01-15 01:16:37,232] Using an existing study with name 'TabNet_Diamonds' instead of creating a new one.
[I 2025-01-15 03:07:28,721] Trial 39 finished with value: 464519.52626944165 and parameters: {'n_d': 46, 'n_steps': 10, 'gamma': 1.1569303629370262, 'cat_emb_dim': 3, 'n_independent': 2, 'n_shared': 4, 'momentum': 0.006610905379107259, 'mask_type': 'entmax'}. Best is trial 27 with value: 295490.8463921569.
[I 2025-01-15 04:13:48,794] Trial 40 finished with value: 322473.482951403 and parameters: {'n_d': 57, 'n_steps': 5, 'gamma': 1.0099894852884028, 'cat_emb_dim': 3, 'n_independent': 3, 'n_shared': 1, 'momentum': 0.009594888535369958, 'mask_type': 'sparsemax'}. Best is trial 27 with value: 295490.8463921569.
[I 2025-01-15 05:55:09,994] Trial 41 finished with value: 375000.3552800736 and parameters: {'n_d': 64, 'n_steps': 9, 'gamma': 1.0982829319013463, 'cat_emb_dim': 3, 'n_independent': 3, 'n_shared': 3, 'momentum': 0.019115544308408724, 'mask_type': 'entmax'}. Best is trial 27 with value: 295490.8463921569.
[I 2025-01-15 07:02:34,100] Trial 42 finished with value: 329980.28832548467 and parameters: {'n_d': 41, 'n_steps': 3, 'gamma': 1.2587623254188454, 'cat_emb_dim': 3, 'n_independent': 4, 'n_shared': 5, 'momentum': 0.005363196718993145, 'mask_type': 'entmax'}. Best is trial 27 with value: 295490.8463921569.
[I 2025-01-15 08:10:01,784] Trial 43 finished with value: 358429.29393130145 and parameters: {'n_d': 58, 'n_steps': 3, 'gamma': 1.3227703591854145, 'cat_emb_dim': 2, 'n_independent': 5, 'n_shared': 4, 'momentum': 0.030650753146174478, 'mask_type': 'entmax'}. Best is trial 27 with value: 295490.8463921569.
[I 2025-01-15 09:10:32,100] Trial 44 finished with value: 507519.5624049256 and parameters: {'n_d': 36, 'n_steps': 4, 'gamma': 1.1817768781200717, 'cat_emb_dim': 3, 'n_independent': 4, 'n_shared': 5, 'momentum': 0.019113086857213808, 'mask_type': 'entmax'}. Best is trial 27 with value: 295490.8463921569.
[I 2025-01-15 10:54:22,974] Trial 45 finished with value: 462370.3148887719 and parameters: {'n_d': 62, 'n_steps': 3, 'gamma': 1.1285942243715872, 'cat_emb_dim': 1, 'n_independent': 3, 'n_shared': 4, 'momentum': 0.001695042385670843, 'mask_type': 'entmax'}. Best is trial 27 with value: 295490.8463921569.
[I 2025-01-15 12:04:46,606] Trial 46 finished with value: 434191.75834009435 and parameters: {'n_d': 48, 'n_steps': 3, 'gamma': 1.3505464347480507, 'cat_emb_dim': 2, 'n_independent': 3, 'n_shared': 5, 'momentum': 0.15530512873192392, 'mask_type': 'entmax'}. Best is trial 27 with value: 295490.8463921569.
[I 2025-01-15 13:24:24,385] Trial 47 finished with value: 319466.5162209139 and parameters: {'n_d': 56, 'n_steps': 4, 'gamma': 1.056783981110702, 'cat_emb_dim': 2, 'n_independent': 4, 'n_shared': 3, 'momentum': 0.30934964833499534, 'mask_type': 'entmax'}. Best is trial 27 with value: 295490.8463921569.
[I 2025-01-15 14:30:34,927] Trial 48 finished with value: 372012.8370694886 and parameters: {'n_d': 52, 'n_steps': 3, 'gamma': 1.2649505646297334, 'cat_emb_dim': 2, 'n_independent': 2, 'n_shared': 4, 'momentum': 0.004477838817069673, 'mask_type': 'sparsemax'}. Best is trial 27 with value: 295490.8463921569.
[I 2025-01-15 15:41:33,766] Trial 49 finished with value: 396262.4061490501 and parameters: {'n_d': 45, 'n_steps': 5, 'gamma': 1.1846294020980421, 'cat_emb_dim': 3, 'n_independent': 4, 'n_shared': 3, 'momentum': 0.08598753799435166, 'mask_type': 'entmax'}. Best is trial 27 with value: 295490.8463921569.
[I 2025-01-15 16:48:43,780] Trial 50 finished with value: 327521.7467302914 and parameters: {'n_d': 60, 'n_steps': 3, 'gamma': 1.0322900775368427, 'cat_emb_dim': 1, 'n_independent': 5, 'n_shared': 4, 'momentum': 0.24716920606048964, 'mask_type': 'entmax'}. Best is trial 27 with value: 295490.8463921569.
[I 2025-01-15 17:58:19,232] Trial 51 finished with value: 432795.3054799911 and parameters: {'n_d': 49, 'n_steps': 4, 'gamma': 1.0912986946036125, 'cat_emb_dim': 3, 'n_independent': 3, 'n_shared': 2, 'momentum': 0.20912477932179568, 'mask_type': 'entmax'}. Best is trial 27 with value: 295490.8463921569.
[I 2025-01-15 18:32:55,993] Trial 52 finished with value: 303050.5896995556 and parameters: {'n_d': 33, 'n_steps': 3, 'gamma': 1.5582647042152291, 'cat_emb_dim': 2, 'n_independent': 1, 'n_shared': 1, 'momentum': 0.10052648819270729, 'mask_type': 'entmax'}. Best is trial 27 with value: 295490.8463921569.
[I 2025-01-15 19:10:19,762] Trial 53 finished with value: 412922.77944788476 and parameters: {'n_d': 33, 'n_steps': 3, 'gamma': 1.6442692192948336, 'cat_emb_dim': 2, 'n_independent': 1, 'n_shared': 1, 'momentum': 0.3483745328781203, 'mask_type': 'entmax'}. Best is trial 27 with value: 295490.8463921569.
[I 2025-01-15 19:45:58,962] Trial 54 finished with value: 325581.3350103361 and parameters: {'n_d': 42, 'n_steps': 3, 'gamma': 1.4818920855700068, 'cat_emb_dim': 2, 'n_independent': 1, 'n_shared': 1, 'momentum': 0.0984207712432805, 'mask_type': 'entmax'}. Best is trial 27 with value: 295490.8463921569.
[I 2025-01-15 20:35:05,399] Trial 55 finished with value: 314915.2586175145 and parameters: {'n_d': 38, 'n_steps': 4, 'gamma': 1.6398305492536396, 'cat_emb_dim': 2, 'n_independent': 2, 'n_shared': 2, 'momentum': 0.16814641237310143, 'mask_type': 'entmax'}. Best is trial 27 with value: 295490.8463921569.
[I 2025-01-15 21:54:12,590] Trial 56 finished with value: 310108.23306989175 and parameters: {'n_d': 62, 'n_steps': 3, 'gamma': 1.5632120848823485, 'cat_emb_dim': 1, 'n_independent': 5, 'n_shared': 5, 'momentum': 0.2109689057501646, 'mask_type': 'entmax'}. Best is trial 27 with value: 295490.8463921569.
[I 2025-01-15 22:59:50,833] Trial 57 finished with value: 314063.4107093434 and parameters: {'n_d': 19, 'n_steps': 4, 'gamma': 1.4238939760099332, 'cat_emb_dim': 2, 'n_independent': 1, 'n_shared': 2, 'momentum': 0.008664257591562688, 'mask_type': 'entmax'}. Best is trial 27 with value: 295490.8463921569.
[I 2025-01-16 00:59:33,282] Trial 58 finished with value: 320960.8699249354 and parameters: {'n_d': 13, 'n_steps': 7, 'gamma': 1.8671918955279385, 'cat_emb_dim': 2, 'n_independent': 2, 'n_shared': 5, 'momentum': 0.07986702269655835, 'mask_type': 'entmax'}. Best is trial 27 with value: 295490.8463921569.
[I 2025-01-16 02:00:44,136] Trial 59 finished with value: 319940.10839435284 and parameters: {'n_d': 28, 'n_steps': 3, 'gamma': 1.3667942001767117, 'cat_emb_dim': 1, 'n_independent': 4, 'n_shared': 3, 'momentum': 0.12993442122238333, 'mask_type': 'entmax'}. Best is trial 27 with value: 295490.8463921569.
[I 2025-01-16 03:14:25,250] Trial 60 finished with value: 300782.9828121708 and parameters: {'n_d': 25, 'n_steps': 4, 'gamma': 1.2933717560336726, 'cat_emb_dim': 3, 'n_independent': 4, 'n_shared': 1, 'momentum': 0.05014932935935607, 'mask_type': 'entmax'}. Best is trial 27 with value: 295490.8463921569.
[I 2025-01-16 03:57:20,092] Trial 61 finished with value: 422786.8216203939 and parameters: {'n_d': 25, 'n_steps': 6, 'gamma': 1.2980507182455467, 'cat_emb_dim': 3, 'n_independent': 2, 'n_shared': 1, 'momentum': 0.033994752998961306, 'mask_type': 'sparsemax'}. Best is trial 27 with value: 295490.8463921569.
[I 2025-01-16 04:38:44,528] Trial 62 finished with value: 423934.6516209957 and parameters: {'n_d': 31, 'n_steps': 4, 'gamma': 1.4525557785718637, 'cat_emb_dim': 3, 'n_independent': 4, 'n_shared': 1, 'momentum': 0.04591521452790249, 'mask_type': 'entmax'}. Best is trial 27 with value: 295490.8463921569.
[I 2025-01-16 05:21:22,336] Trial 63 finished with value: 341567.2722024596 and parameters: {'n_d': 22, 'n_steps': 3, 'gamma': 1.3825436522824677, 'cat_emb_dim': 3, 'n_independent': 4, 'n_shared': 1, 'momentum': 0.303285942687192, 'mask_type': 'entmax'}. Best is trial 27 with value: 295490.8463921569.
[I 2025-01-16 06:22:20,341] Trial 64 finished with value: 544472.9436083643 and parameters: {'n_d': 18, 'n_steps': 5, 'gamma': 1.1152960033899986, 'cat_emb_dim': 3, 'n_independent': 3, 'n_shared': 1, 'momentum': 0.025271149128145657, 'mask_type': 'entmax'}. Best is trial 27 with value: 295490.8463921569.
[I 2025-01-16 07:39:12,532] Trial 65 finished with value: 312641.460151717 and parameters: {'n_d': 35, 'n_steps': 4, 'gamma': 1.2277856276398118, 'cat_emb_dim': 3, 'n_independent': 4, 'n_shared': 2, 'momentum': 0.05833820025560204, 'mask_type': 'entmax'}. Best is trial 27 with value: 295490.8463921569.
[I 2025-01-16 08:29:22,029] Trial 66 finished with value: 431626.40378018544 and parameters: {'n_d': 24, 'n_steps': 3, 'gamma': 1.691757885159708, 'cat_emb_dim': 3, 'n_independent': 5, 'n_shared': 4, 'momentum': 0.10906052723563767, 'mask_type': 'entmax'}. Best is trial 27 with value: 295490.8463921569.
[I 2025-01-16 09:08:46,453] Trial 67 finished with value: 469031.95673243626 and parameters: {'n_d': 20, 'n_steps': 4, 'gamma': 1.587683406606061, 'cat_emb_dim': 3, 'n_independent': 4, 'n_shared': 3, 'momentum': 0.04558631153107006, 'mask_type': 'entmax'}. Best is trial 27 with value: 295490.8463921569.
[I 2025-01-16 09:57:32,634] Trial 68 finished with value: 297465.3249438008 and parameters: {'n_d': 15, 'n_steps': 3, 'gamma': 1.1547273615849214, 'cat_emb_dim': 2, 'n_independent': 3, 'n_shared': 1, 'momentum': 0.13843887521853776, 'mask_type': 'entmax'}. Best is trial 27 with value: 295490.8463921569.
[I 2025-01-16 10:42:59,402] Trial 69 finished with value: 318748.9275718284 and parameters: {'n_d': 8, 'n_steps': 3, 'gamma': 1.1336353059012303, 'cat_emb_dim': 1, 'n_independent': 3, 'n_shared': 1, 'momentum': 0.1442140682661213, 'mask_type': 'entmax'}. Best is trial 27 with value: 295490.8463921569.
[I 2025-01-16 12:03:32,139] Trial 70 finished with value: 436351.88640513236 and parameters: {'n_d': 15, 'n_steps': 4, 'gamma': 1.1665290587566777, 'cat_emb_dim': 2, 'n_independent': 3, 'n_shared': 1, 'momentum': 0.0010438548065516134, 'mask_type': 'entmax'}. Best is trial 27 with value: 295490.8463921569.
[I 2025-01-16 13:14:32,174] Trial 71 finished with value: 386137.3238737039 and parameters: {'n_d': 11, 'n_steps': 8, 'gamma': 1.0760084136147663, 'cat_emb_dim': 3, 'n_independent': 3, 'n_shared': 2, 'momentum': 0.014065426998884347, 'mask_type': 'entmax'}. Best is trial 27 with value: 295490.8463921569.
[I 2025-01-16 14:03:27,777] Trial 72 finished with value: 630963.6421652675 and parameters: {'n_d': 16, 'n_steps': 3, 'gamma': 1.1893534087545878, 'cat_emb_dim': 2, 'n_independent': 3, 'n_shared': 1, 'momentum': 0.18132480679846422, 'mask_type': 'entmax'}. Best is trial 27 with value: 295490.8463921569.
[I 2025-01-16 15:03:16,483] Trial 73 finished with value: 385561.3770086779 and parameters: {'n_d': 26, 'n_steps': 3, 'gamma': 1.2885369039227614, 'cat_emb_dim': 2, 'n_independent': 4, 'n_shared': 1, 'momentum': 0.24518501726137118, 'mask_type': 'entmax'}. Best is trial 27 with value: 295490.8463921569.
[I 2025-01-16 16:00:37,679] Trial 74 finished with value: 311996.87278925895 and parameters: {'n_d': 14, 'n_steps': 3, 'gamma': 1.0300335217322791, 'cat_emb_dim': 2, 'n_independent': 3, 'n_shared': 5, 'momentum': 0.12019288141427664, 'mask_type': 'entmax'}. Best is trial 27 with value: 295490.8463921569.
[I 2025-01-16 17:02:58,898] Trial 75 finished with value: 303120.54037679743 and parameters: {'n_d': 63, 'n_steps': 4, 'gamma': 1.2342588354147759, 'cat_emb_dim': 2, 'n_independent': 4, 'n_shared': 1, 'momentum': 0.09458777825510498, 'mask_type': 'entmax'}. Best is trial 27 with value: 295490.8463921569.
[I 2025-01-16 17:59:29,611] Trial 76 finished with value: 355459.4162114774 and parameters: {'n_d': 62, 'n_steps': 5, 'gamma': 1.2363075715200593, 'cat_emb_dim': 2, 'n_independent': 3, 'n_shared': 1, 'momentum': 0.07924575482944132, 'mask_type': 'entmax'}. Best is trial 27 with value: 295490.8463921569.
[I 2025-01-16 18:36:14,482] Trial 77 finished with value: 502349.4771702586 and parameters: {'n_d': 59, 'n_steps': 4, 'gamma': 1.001619071294634, 'cat_emb_dim': 3, 'n_independent': 4, 'n_shared': 1, 'momentum': 0.10002423505385626, 'mask_type': 'sparsemax'}. Best is trial 27 with value: 295490.8463921569.
[I 2025-01-16 19:20:14,931] Trial 78 finished with value: 367825.34324570047 and parameters: {'n_d': 55, 'n_steps': 4, 'gamma': 1.1976379390392071, 'cat_emb_dim': 2, 'n_independent': 2, 'n_shared': 1, 'momentum': 0.01645766739059006, 'mask_type': 'entmax'}. Best is trial 27 with value: 295490.8463921569.
[I 2025-01-16 20:26:00,557] Trial 79 finished with value: 397868.02157389524 and parameters: {'n_d': 63, 'n_steps': 5, 'gamma': 1.1451600192253708, 'cat_emb_dim': 3, 'n_independent': 3, 'n_shared': 2, 'momentum': 0.06687231591935086, 'mask_type': 'entmax'}. Best is trial 27 with value: 295490.8463921569.
[I 2025-01-16 21:23:51,577] Trial 80 finished with value: 318732.3946307586 and parameters: {'n_d': 60, 'n_steps': 4, 'gamma': 1.2556950507162083, 'cat_emb_dim': 2, 'n_independent': 4, 'n_shared': 1, 'momentum': 0.14165232071098147, 'mask_type': 'entmax'}. Best is trial 27 with value: 295490.8463921569.
[I 2025-01-16 22:17:50,238] Trial 81 finished with value: 379910.097685523 and parameters: {'n_d': 31, 'n_steps': 4, 'gamma': 1.102960879177306, 'cat_emb_dim': 3, 'n_independent': 3, 'n_shared': 1, 'momentum': 0.07394397463698141, 'mask_type': 'entmax'}. Best is trial 27 with value: 295490.8463921569.
[I 2025-01-16 23:16:35,944] Trial 82 finished with value: 310140.26102182607 and parameters: {'n_d': 20, 'n_steps': 3, 'gamma': 1.3380868716610597, 'cat_emb_dim': 2, 'n_independent': 4, 'n_shared': 3, 'momentum': 0.18700085777504422, 'mask_type': 'entmax'}. Best is trial 27 with value: 295490.8463921569.
[I 2025-01-16 23:56:12,574] Trial 83 finished with value: 457941.4908591526 and parameters: {'n_d': 63, 'n_steps': 3, 'gamma': 1.0433496847560306, 'cat_emb_dim': 2, 'n_independent': 4, 'n_shared': 5, 'momentum': 0.2908347041902888, 'mask_type': 'entmax'}. Best is trial 27 with value: 295490.8463921569.
[I 2025-01-17 00:52:37,184] Trial 84 finished with value: 308665.1504531018 and parameters: {'n_d': 58, 'n_steps': 3, 'gamma': 1.166966327585866, 'cat_emb_dim': 2, 'n_independent': 4, 'n_shared': 3, 'momentum': 0.053796168951042556, 'mask_type': 'entmax'}. Best is trial 27 with value: 295490.8463921569.
[I 2025-01-17 01:58:30,264] Trial 85 finished with value: 577198.486395117 and parameters: {'n_d': 64, 'n_steps': 4, 'gamma': 1.3170347676703469, 'cat_emb_dim': 2, 'n_independent': 4, 'n_shared': 4, 'momentum': 0.09438566367591524, 'mask_type': 'entmax'}. Best is trial 27 with value: 295490.8463921569.
[I 2025-01-17 03:03:26,253] Trial 86 finished with value: 302544.0561811487 and parameters: {'n_d': 23, 'n_steps': 3, 'gamma': 1.5330261700586671, 'cat_emb_dim': 2, 'n_independent': 3, 'n_shared': 1, 'momentum': 0.21350064705032634, 'mask_type': 'entmax'}. Best is trial 27 with value: 295490.8463921569.
[I 2025-01-17 03:50:44,812] Trial 87 finished with value: 366974.2573267968 and parameters: {'n_d': 34, 'n_steps': 3, 'gamma': 1.5394720664132817, 'cat_emb_dim': 3, 'n_independent': 3, 'n_shared': 1, 'momentum': 0.3840743040475317, 'mask_type': 'entmax'}. Best is trial 27 with value: 295490.8463921569.
[I 2025-01-17 04:52:22,210] Trial 88 finished with value: 366568.49684425996 and parameters: {'n_d': 29, 'n_steps': 6, 'gamma': 1.5941680884682103, 'cat_emb_dim': 2, 'n_independent': 3, 'n_shared': 1, 'momentum': 0.15775438402394243, 'mask_type': 'entmax'}. Best is trial 27 with value: 295490.8463921569.
[I 2025-01-17 05:26:30,306] Trial 89 finished with value: 439238.2667964993 and parameters: {'n_d': 38, 'n_steps': 3, 'gamma': 1.5322637171757212, 'cat_emb_dim': 1, 'n_independent': 3, 'n_shared': 1, 'momentum': 0.2065722290510415, 'mask_type': 'sparsemax'}. Best is trial 27 with value: 295490.8463921569.
[I 2025-01-17 06:25:17,688] Trial 90 finished with value: 310135.4010812771 and parameters: {'n_d': 23, 'n_steps': 4, 'gamma': 1.5010150384083285, 'cat_emb_dim': 2, 'n_independent': 3, 'n_shared': 2, 'momentum': 0.23843303902154067, 'mask_type': 'entmax'}. Best is trial 27 with value: 295490.8463921569.
[I 2025-01-17 07:16:45,984] Trial 91 finished with value: 316500.3166703807 and parameters: {'n_d': 45, 'n_steps': 3, 'gamma': 1.6130919953746115, 'cat_emb_dim': 2, 'n_independent': 3, 'n_shared': 1, 'momentum': 0.0027812937451910887, 'mask_type': 'entmax'}. Best is trial 27 with value: 295490.8463921569.
[I 2025-01-17 08:06:05,113] Trial 92 finished with value: 497554.511091508 and parameters: {'n_d': 22, 'n_steps': 3, 'gamma': 1.0713481395481712, 'cat_emb_dim': 2, 'n_independent': 4, 'n_shared': 5, 'momentum': 0.12751388772650757, 'mask_type': 'entmax'}. Best is trial 27 with value: 295490.8463921569.
[I 2025-01-17 09:27:25,801] Trial 93 finished with value: 308680.5484088548 and parameters: {'n_d': 17, 'n_steps': 3, 'gamma': 1.2770556764266912, 'cat_emb_dim': 2, 'n_independent': 5, 'n_shared': 4, 'momentum': 0.33151577675979627, 'mask_type': 'entmax'}. Best is trial 27 with value: 295490.8463921569.
[I 2025-01-17 10:02:59,978] Trial 94 finished with value: 315915.03980336006 and parameters: {'n_d': 61, 'n_steps': 3, 'gamma': 1.216808585000662, 'cat_emb_dim': 2, 'n_independent': 1, 'n_shared': 1, 'momentum': 0.00815360999755868, 'mask_type': 'entmax'}. Best is trial 27 with value: 295490.8463921569.
