[I 2025-01-15 07:33:07,880] Trial 171 finished with value: 2103721.2634214573 and parameters: {'n_d': 21, 'n_steps': 4, 'gamma': 1.8262456144616006, 'cat_emb_dim': 1, 'n_independent': 5, 'n_shared': 5, 'momentum': 0.19995889202850906, 'mask_type': 'entmax'}. Best is trial 69 with value: 906434.8486547305.
[I 2025-01-15 07:35:31,195] Trial 172 finished with value: 4926653.9089498175 and parameters: {'n_d': 19, 'n_steps': 4, 'gamma': 1.7525774570150154, 'cat_emb_dim': 1, 'n_independent': 5, 'n_shared': 5, 'momentum': 0.16997849278287636, 'mask_type': 'entmax'}. Best is trial 69 with value: 906434.8486547305.
[I 2025-01-15 07:37:55,441] Trial 173 finished with value: 2453339.379400959 and parameters: {'n_d': 21, 'n_steps': 4, 'gamma': 1.788300235625293, 'cat_emb_dim': 1, 'n_independent': 5, 'n_shared': 5, 'momentum': 0.29508038482702975, 'mask_type': 'entmax'}. Best is trial 69 with value: 906434.8486547305.
[I 2025-01-15 07:38:31,123] Trial 174 finished with value: 975921098.2320683 and parameters: {'n_d': 48, 'n_steps': 4, 'gamma': 1.7285056573048398, 'cat_emb_dim': 1, 'n_independent': 5, 'n_shared': 5, 'momentum': 0.0010442837205829154, 'mask_type': 'entmax'}. Best is trial 69 with value: 906434.8486547305.
[I 2025-01-15 07:41:16,445] Trial 175 finished with value: 1513872.1113293264 and parameters: {'n_d': 18, 'n_steps': 5, 'gamma': 1.7732933789780063, 'cat_emb_dim': 2, 'n_independent': 5, 'n_shared': 4, 'momentum': 0.24926741636211044, 'mask_type': 'entmax'}. Best is trial 69 with value: 906434.8486547305.
[I 2025-01-15 07:43:20,850] Trial 176 finished with value: 953578.8663844466 and parameters: {'n_d': 42, 'n_steps': 3, 'gamma': 1.669955386215316, 'cat_emb_dim': 1, 'n_independent': 5, 'n_shared': 2, 'momentum': 0.1916951772823739, 'mask_type': 'entmax'}. Best is trial 69 with value: 906434.8486547305.
[I 2025-01-15 07:46:02,782] Trial 177 finished with value: 992670.2095325727 and parameters: {'n_d': 40, 'n_steps': 4, 'gamma': 1.6377306642661007, 'cat_emb_dim': 1, 'n_independent': 5, 'n_shared': 5, 'momentum': 0.33497953054862023, 'mask_type': 'entmax'}. Best is trial 69 with value: 906434.8486547305.
[I 2025-01-15 07:48:07,749] Trial 178 finished with value: 9006483.022313584 and parameters: {'n_d': 24, 'n_steps': 3, 'gamma': 1.8094645110569152, 'cat_emb_dim': 1, 'n_independent': 4, 'n_shared': 2, 'momentum': 0.22816446594447665, 'mask_type': 'entmax'}. Best is trial 69 with value: 906434.8486547305.
[I 2025-01-15 07:50:35,423] Trial 179 finished with value: 6207397.444729684 and parameters: {'n_d': 20, 'n_steps': 3, 'gamma': 1.7145559593559603, 'cat_emb_dim': 1, 'n_independent': 5, 'n_shared': 5, 'momentum': 0.27440711904172566, 'mask_type': 'entmax'}. Best is trial 69 with value: 906434.8486547305.
[I 2025-01-15 07:53:07,722] Trial 180 finished with value: 1131968.7100498793 and parameters: {'n_d': 36, 'n_steps': 4, 'gamma': 1.6090124129535182, 'cat_emb_dim': 1, 'n_independent': 4, 'n_shared': 4, 'momentum': 0.1593229077211109, 'mask_type': 'entmax'}. Best is trial 69 with value: 906434.8486547305.
[I 2025-01-15 07:55:20,757] Trial 181 finished with value: 1480079.05803207 and parameters: {'n_d': 41, 'n_steps': 3, 'gamma': 1.6715010488868736, 'cat_emb_dim': 1, 'n_independent': 5, 'n_shared': 2, 'momentum': 0.18882777672639425, 'mask_type': 'entmax'}. Best is trial 69 with value: 906434.8486547305.
[I 2025-01-15 07:57:24,302] Trial 182 finished with value: 1448157.171070425 and parameters: {'n_d': 45, 'n_steps': 3, 'gamma': 1.6602898785010813, 'cat_emb_dim': 1, 'n_independent': 5, 'n_shared': 2, 'momentum': 0.2053646099842258, 'mask_type': 'entmax'}. Best is trial 69 with value: 906434.8486547305.
[I 2025-01-15 07:59:31,893] Trial 183 finished with value: 994078.0030040089 and parameters: {'n_d': 39, 'n_steps': 3, 'gamma': 1.6819529969248797, 'cat_emb_dim': 1, 'n_independent': 5, 'n_shared': 2, 'momentum': 0.1432188536032208, 'mask_type': 'entmax'}. Best is trial 69 with value: 906434.8486547305.
[I 2025-01-15 08:01:46,006] Trial 184 finished with value: 1556960.4477334633 and parameters: {'n_d': 42, 'n_steps': 3, 'gamma': 1.7007128882752915, 'cat_emb_dim': 1, 'n_independent': 5, 'n_shared': 2, 'momentum': 0.1706232571110976, 'mask_type': 'entmax'}. Best is trial 69 with value: 906434.8486547305.
[I 2025-01-15 08:03:56,770] Trial 185 finished with value: 2182409.8529286096 and parameters: {'n_d': 38, 'n_steps': 3, 'gamma': 1.5514351984440835, 'cat_emb_dim': 1, 'n_independent': 5, 'n_shared': 2, 'momentum': 0.22226587174699666, 'mask_type': 'entmax'}. Best is trial 69 with value: 906434.8486547305.
[I 2025-01-15 08:06:04,371] Trial 186 finished with value: 12533313.01543574 and parameters: {'n_d': 24, 'n_steps': 3, 'gamma': 1.6500620731217277, 'cat_emb_dim': 1, 'n_independent': 5, 'n_shared': 2, 'momentum': 0.25183117143187644, 'mask_type': 'entmax'}. Best is trial 69 with value: 906434.8486547305.
[I 2025-01-15 08:08:14,011] Trial 187 finished with value: 15075764.021832634 and parameters: {'n_d': 22, 'n_steps': 3, 'gamma': 1.2353025884246676, 'cat_emb_dim': 1, 'n_independent': 5, 'n_shared': 2, 'momentum': 0.3094495094058036, 'mask_type': 'entmax'}. Best is trial 69 with value: 906434.8486547305.
[I 2025-01-15 08:10:38,769] Trial 188 finished with value: 1006912.2935075571 and parameters: {'n_d': 52, 'n_steps': 4, 'gamma': 1.7496576453681518, 'cat_emb_dim': 1, 'n_independent': 4, 'n_shared': 4, 'momentum': 0.18952493446031363, 'mask_type': 'sparsemax'}. Best is trial 69 with value: 906434.8486547305.
[I 2025-01-15 08:12:51,446] Trial 189 finished with value: 4804284.331583935 and parameters: {'n_d': 27, 'n_steps': 3, 'gamma': 1.62003571123746, 'cat_emb_dim': 1, 'n_independent': 5, 'n_shared': 2, 'momentum': 0.28137637846096514, 'mask_type': 'entmax'}. Best is trial 69 with value: 906434.8486547305.
[I 2025-01-15 08:15:23,866] Trial 190 finished with value: 153537295.03016606 and parameters: {'n_d': 14, 'n_steps': 3, 'gamma': 1.7247161233848751, 'cat_emb_dim': 1, 'n_independent': 5, 'n_shared': 5, 'momentum': 0.12439154570702571, 'mask_type': 'entmax'}. Best is trial 69 with value: 906434.8486547305.
[I 2025-01-15 08:17:21,432] Trial 191 finished with value: 1404678.0272613529 and parameters: {'n_d': 42, 'n_steps': 3, 'gamma': 1.635219905320165, 'cat_emb_dim': 1, 'n_independent': 4, 'n_shared': 2, 'momentum': 0.23349397804456817, 'mask_type': 'entmax'}. Best is trial 69 with value: 906434.8486547305.
[I 2025-01-15 08:19:25,191] Trial 192 finished with value: 1478955.9726610514 and parameters: {'n_d': 40, 'n_steps': 3, 'gamma': 1.453500355940582, 'cat_emb_dim': 1, 'n_independent': 4, 'n_shared': 2, 'momentum': 0.20263403542487227, 'mask_type': 'entmax'}. Best is trial 69 with value: 906434.8486547305.
[I 2025-01-15 08:21:28,387] Trial 193 finished with value: 2046740.1916274268 and parameters: {'n_d': 39, 'n_steps': 3, 'gamma': 1.5817725226294326, 'cat_emb_dim': 1, 'n_independent': 4, 'n_shared': 2, 'momentum': 0.34672806202611456, 'mask_type': 'entmax'}. Best is trial 69 with value: 906434.8486547305.
[I 2025-01-15 08:23:35,827] Trial 194 finished with value: 1966235.0050167106 and parameters: {'n_d': 36, 'n_steps': 3, 'gamma': 1.6699895325426164, 'cat_emb_dim': 1, 'n_independent': 4, 'n_shared': 2, 'momentum': 0.2610668123968963, 'mask_type': 'entmax'}. Best is trial 69 with value: 906434.8486547305.
[I 2025-01-15 08:25:41,938] Trial 195 finished with value: 1125168.1212357855 and parameters: {'n_d': 43, 'n_steps': 3, 'gamma': 1.697362820860691, 'cat_emb_dim': 1, 'n_independent': 4, 'n_shared': 3, 'momentum': 0.22938225745819482, 'mask_type': 'entmax'}. Best is trial 69 with value: 906434.8486547305.
[I 2025-01-15 08:27:44,118] Trial 196 finished with value: 1308988.8012495155 and parameters: {'n_d': 41, 'n_steps': 3, 'gamma': 1.507058983290216, 'cat_emb_dim': 1, 'n_independent': 4, 'n_shared': 2, 'momentum': 0.1774613024674172, 'mask_type': 'entmax'}. Best is trial 69 with value: 906434.8486547305.
[I 2025-01-15 08:29:41,410] Trial 197 finished with value: 42052489.745477036 and parameters: {'n_d': 17, 'n_steps': 4, 'gamma': 1.6480608908994445, 'cat_emb_dim': 1, 'n_independent': 1, 'n_shared': 2, 'momentum': 0.3082097974380531, 'mask_type': 'entmax'}. Best is trial 69 with value: 906434.8486547305.
[I 2025-01-15 08:32:11,950] Trial 198 finished with value: 4936510.917254525 and parameters: {'n_d': 44, 'n_steps': 3, 'gamma': 1.8362681033593218, 'cat_emb_dim': 1, 'n_independent': 5, 'n_shared': 4, 'momentum': 0.21008613577629637, 'mask_type': 'entmax'}. Best is trial 69 with value: 906434.8486547305.
[I 2025-01-15 08:34:40,992] Trial 199 finished with value: 1369467.9578540064 and parameters: {'n_d': 37, 'n_steps': 4, 'gamma': 1.5959410444388074, 'cat_emb_dim': 1, 'n_independent': 5, 'n_shared': 2, 'momentum': 0.26287095023110296, 'mask_type': 'entmax'}. Best is trial 69 with value: 906434.8486547305.
