[I 2025-01-08 18:37:23,854] A new study created in RDB with name: TabNet_SAT11
[I 2025-01-08 19:05:11,635] Trial 0 finished with value: 1325935.8391694357 and parameters: {'n_d': 19, 'n_steps': 9, 'gamma': 1.2143274982605035, 'cat_emb_dim': 2, 'n_independent': 4, 'n_shared': 5, 'momentum': 0.10823367450013847, 'mask_type': 'sparsemax'}. Best is trial 0 with value: 1325935.8391694357.
[I 2025-01-08 19:15:29,496] Trial 1 finished with value: 1366662.5852569821 and parameters: {'n_d': 38, 'n_steps': 4, 'gamma': 1.4322510995321243, 'cat_emb_dim': 3, 'n_independent': 5, 'n_shared': 2, 'momentum': 0.007894557827801666, 'mask_type': 'sparsemax'}. Best is trial 0 with value: 1325935.8391694357.
[I 2025-01-08 19:37:07,039] Trial 2 finished with value: 1317896.121414265 and parameters: {'n_d': 22, 'n_steps': 10, 'gamma': 1.830494795756553, 'cat_emb_dim': 2, 'n_independent': 4, 'n_shared': 4, 'momentum': 0.03982952262384902, 'mask_type': 'entmax'}. Best is trial 2 with value: 1317896.121414265.
[I 2025-01-08 19:40:32,258] Trial 3 finished with value: 6857243.617268967 and parameters: {'n_d': 20, 'n_steps': 9, 'gamma': 1.7804810235134743, 'cat_emb_dim': 1, 'n_independent': 2, 'n_shared': 4, 'momentum': 0.0013206238772318817, 'mask_type': 'entmax'}. Best is trial 2 with value: 1317896.121414265.
[I 2025-01-08 19:59:03,572] Trial 4 finished with value: 1338596.8791484698 and parameters: {'n_d': 44, 'n_steps': 10, 'gamma': 1.3568174383488443, 'cat_emb_dim': 1, 'n_independent': 2, 'n_shared': 4, 'momentum': 0.03350610651725441, 'mask_type': 'sparsemax'}. Best is trial 2 with value: 1317896.121414265.
[I 2025-01-08 20:14:49,971] Trial 5 finished with value: 1304654.0699743344 and parameters: {'n_d': 44, 'n_steps': 9, 'gamma': 1.2376076873418511, 'cat_emb_dim': 3, 'n_independent': 2, 'n_shared': 4, 'momentum': 0.12325859043703769, 'mask_type': 'sparsemax'}. Best is trial 5 with value: 1304654.0699743344.
[I 2025-01-08 20:25:35,047] Trial 6 finished with value: 1353500.287671482 and parameters: {'n_d': 11, 'n_steps': 5, 'gamma': 1.480271970124337, 'cat_emb_dim': 2, 'n_independent': 4, 'n_shared': 3, 'momentum': 0.1461016457274227, 'mask_type': 'entmax'}. Best is trial 5 with value: 1304654.0699743344.
[I 2025-01-08 20:36:01,390] Trial 7 finished with value: 2086617.3826166242 and parameters: {'n_d': 45, 'n_steps': 7, 'gamma': 1.640909120238351, 'cat_emb_dim': 1, 'n_independent': 1, 'n_shared': 4, 'momentum': 0.0030434366653472387, 'mask_type': 'sparsemax'}. Best is trial 5 with value: 1304654.0699743344.
[I 2025-01-08 21:00:08,057] Trial 8 finished with value: 1336368.7864104158 and parameters: {'n_d': 10, 'n_steps': 9, 'gamma': 1.0873951402007695, 'cat_emb_dim': 3, 'n_independent': 4, 'n_shared': 2, 'momentum': 0.033988099576925716, 'mask_type': 'sparsemax'}. Best is trial 5 with value: 1304654.0699743344.
[I 2025-01-08 21:23:33,731] Trial 9 finished with value: 1453922.2498400672 and parameters: {'n_d': 35, 'n_steps': 9, 'gamma': 1.666011788049465, 'cat_emb_dim': 1, 'n_independent': 5, 'n_shared': 5, 'momentum': 0.004941396487690821, 'mask_type': 'entmax'}. Best is trial 5 with value: 1304654.0699743344.
[I 2025-01-08 21:33:33,127] Trial 10 finished with value: 1382726.8401305547 and parameters: {'n_d': 62, 'n_steps': 7, 'gamma': 1.0861640811036142, 'cat_emb_dim': 3, 'n_independent': 1, 'n_shared': 1, 'momentum': 0.37975416796747846, 'mask_type': 'sparsemax'}. Best is trial 5 with value: 1304654.0699743344.
[I 2025-01-08 21:54:34,659] Trial 11 finished with value: 1188569.9951356053 and parameters: {'n_d': 26, 'n_steps': 10, 'gamma': 1.9175941828171021, 'cat_emb_dim': 2, 'n_independent': 3, 'n_shared': 3, 'momentum': 0.09937981037149497, 'mask_type': 'entmax'}. Best is trial 11 with value: 1188569.9951356053.
[I 2025-01-08 22:04:30,445] Trial 12 finished with value: 1282571.8426151604 and parameters: {'n_d': 58, 'n_steps': 8, 'gamma': 1.9903315108276327, 'cat_emb_dim': 3, 'n_independent': 2, 'n_shared': 3, 'momentum': 0.11721159797674235, 'mask_type': 'entmax'}. Best is trial 11 with value: 1188569.9951356053.
[I 2025-01-08 22:15:39,712] Trial 13 finished with value: 1322318.4812957388 and parameters: {'n_d': 61, 'n_steps': 6, 'gamma': 1.9956460256015371, 'cat_emb_dim': 2, 'n_independent': 3, 'n_shared': 3, 'momentum': 0.33907233363668393, 'mask_type': 'entmax'}. Best is trial 11 with value: 1188569.9951356053.
[I 2025-01-08 22:28:57,021] Trial 14 finished with value: 1297032.6130599703 and parameters: {'n_d': 29, 'n_steps': 8, 'gamma': 1.9906752449647416, 'cat_emb_dim': 2, 'n_independent': 3, 'n_shared': 2, 'momentum': 0.07446281713835765, 'mask_type': 'entmax'}. Best is trial 11 with value: 1188569.9951356053.
[I 2025-01-08 22:36:53,499] Trial 15 finished with value: 1191508.185170157 and parameters: {'n_d': 58, 'n_steps': 3, 'gamma': 1.8756074059936014, 'cat_emb_dim': 3, 'n_independent': 2, 'n_shared': 3, 'momentum': 0.013743128745208586, 'mask_type': 'entmax'}. Best is trial 11 with value: 1188569.9951356053.
[I 2025-01-08 22:43:00,456] Trial 16 finished with value: 1266870.449581417 and parameters: {'n_d': 49, 'n_steps': 3, 'gamma': 1.8176647821615055, 'cat_emb_dim': 2, 'n_independent': 3, 'n_shared': 1, 'momentum': 0.01084778820179808, 'mask_type': 'entmax'}. Best is trial 11 with value: 1188569.9951356053.
[I 2025-01-08 22:50:34,095] Trial 17 finished with value: 1327580.8839841313 and parameters: {'n_d': 55, 'n_steps': 5, 'gamma': 1.6323002361578969, 'cat_emb_dim': 3, 'n_independent': 1, 'n_shared': 2, 'momentum': 0.016896027474281216, 'mask_type': 'entmax'}. Best is trial 11 with value: 1188569.9951356053.
[I 2025-01-08 22:58:54,372] Trial 18 finished with value: 1300995.523426638 and parameters: {'n_d': 29, 'n_steps': 3, 'gamma': 1.881692250403128, 'cat_emb_dim': 2, 'n_independent': 2, 'n_shared': 3, 'momentum': 0.01809981961023984, 'mask_type': 'entmax'}. Best is trial 11 with value: 1188569.9951356053.
[I 2025-01-08 23:08:37,118] Trial 19 finished with value: 1278152.7391957024 and parameters: {'n_d': 51, 'n_steps': 5, 'gamma': 1.7250002191594003, 'cat_emb_dim': 2, 'n_independent': 3, 'n_shared': 3, 'momentum': 0.04582105555372906, 'mask_type': 'entmax'}. Best is trial 11 with value: 1188569.9951356053.
[I 2025-01-08 23:12:40,429] Trial 20 finished with value: 3488412.8353322945 and parameters: {'n_d': 35, 'n_steps': 4, 'gamma': 1.892434338401445, 'cat_emb_dim': 3, 'n_independent': 2, 'n_shared': 2, 'momentum': 0.00222751117973475, 'mask_type': 'entmax'}. Best is trial 11 with value: 1188569.9951356053.
[I 2025-01-08 23:17:50,815] Trial 21 finished with value: 1263339.5905532027 and parameters: {'n_d': 51, 'n_steps': 3, 'gamma': 1.577434479772228, 'cat_emb_dim': 2, 'n_independent': 3, 'n_shared': 1, 'momentum': 0.010217644996507775, 'mask_type': 'entmax'}. Best is trial 11 with value: 1188569.9951356053.
[I 2025-01-08 23:27:23,291] Trial 22 finished with value: 1340023.1780106532 and parameters: {'n_d': 55, 'n_steps': 4, 'gamma': 1.5646445357783891, 'cat_emb_dim': 2, 'n_independent': 3, 'n_shared': 1, 'momentum': 0.008906289279938206, 'mask_type': 'entmax'}. Best is trial 11 with value: 1188569.9951356053.
[I 2025-01-08 23:33:44,547] Trial 23 finished with value: 1323923.475276885 and parameters: {'n_d': 64, 'n_steps': 3, 'gamma': 1.7296496373156491, 'cat_emb_dim': 2, 'n_independent': 3, 'n_shared': 1, 'momentum': 0.005478000114779541, 'mask_type': 'entmax'}. Best is trial 11 with value: 1188569.9951356053.
[I 2025-01-08 23:47:25,366] Trial 24 finished with value: 1230299.4775709002 and parameters: {'n_d': 28, 'n_steps': 6, 'gamma': 1.897874434532378, 'cat_emb_dim': 2, 'n_independent': 3, 'n_shared': 3, 'momentum': 0.016730975532933966, 'mask_type': 'entmax'}. Best is trial 11 with value: 1188569.9951356053.
[I 2025-01-09 00:00:28,360] Trial 25 finished with value: 1288560.7613443362 and parameters: {'n_d': 26, 'n_steps': 6, 'gamma': 1.889023238893535, 'cat_emb_dim': 1, 'n_independent': 4, 'n_shared': 3, 'momentum': 0.02222836885897166, 'mask_type': 'entmax'}. Best is trial 11 with value: 1188569.9951356053.
[I 2025-01-09 00:13:46,813] Trial 26 finished with value: 1259038.1586071458 and parameters: {'n_d': 16, 'n_steps': 8, 'gamma': 1.9329123124266414, 'cat_emb_dim': 2, 'n_independent': 2, 'n_shared': 3, 'momentum': 0.053193139282913006, 'mask_type': 'entmax'}. Best is trial 11 with value: 1188569.9951356053.
[I 2025-01-09 00:25:02,796] Trial 27 finished with value: 1316864.1313619583 and parameters: {'n_d': 31, 'n_steps': 6, 'gamma': 1.735445508888142, 'cat_emb_dim': 3, 'n_independent': 3, 'n_shared': 3, 'momentum': 0.025088866292243203, 'mask_type': 'entmax'}. Best is trial 11 with value: 1188569.9951356053.
[I 2025-01-09 00:36:37,544] Trial 28 finished with value: 1395917.8439234719 and parameters: {'n_d': 39, 'n_steps': 7, 'gamma': 1.8142864426044791, 'cat_emb_dim': 3, 'n_independent': 1, 'n_shared': 4, 'momentum': 0.014472132161349719, 'mask_type': 'entmax'}. Best is trial 11 with value: 1188569.9951356053.
[I 2025-01-09 01:03:27,363] Trial 29 finished with value: 1305219.6137308716 and parameters: {'n_d': 14, 'n_steps': 10, 'gamma': 1.9233732706075217, 'cat_emb_dim': 1, 'n_independent': 4, 'n_shared': 5, 'momentum': 0.06373551313899754, 'mask_type': 'entmax'}. Best is trial 11 with value: 1188569.9951356053.
[I 2025-01-09 01:13:38,031] Trial 30 finished with value: 1397039.1900807584 and parameters: {'n_d': 23, 'n_steps': 5, 'gamma': 1.761896013566291, 'cat_emb_dim': 2, 'n_independent': 2, 'n_shared': 2, 'momentum': 0.0052206130102603, 'mask_type': 'entmax'}. Best is trial 11 with value: 1188569.9951356053.
[I 2025-01-09 01:24:48,787] Trial 31 finished with value: 1418159.5794280241 and parameters: {'n_d': 16, 'n_steps': 8, 'gamma': 1.9210068312609447, 'cat_emb_dim': 2, 'n_independent': 2, 'n_shared': 3, 'momentum': 0.07301572580405753, 'mask_type': 'entmax'}. Best is trial 11 with value: 1188569.9951356053.
[I 2025-01-09 01:38:38,236] Trial 32 finished with value: 1255200.850810981 and parameters: {'n_d': 18, 'n_steps': 8, 'gamma': 1.9467893998372199, 'cat_emb_dim': 2, 'n_independent': 2, 'n_shared': 3, 'momentum': 0.2127433277828844, 'mask_type': 'entmax'}. Best is trial 11 with value: 1188569.9951356053.
[I 2025-01-09 02:00:28,515] Trial 33 finished with value: 1230972.9266502697 and parameters: {'n_d': 24, 'n_steps': 10, 'gamma': 1.8459383750120686, 'cat_emb_dim': 2, 'n_independent': 5, 'n_shared': 3, 'momentum': 0.1670814927605088, 'mask_type': 'entmax'}. Best is trial 11 with value: 1188569.9951356053.
[I 2025-01-09 02:22:15,486] Trial 34 finished with value: 1289670.8270396641 and parameters: {'n_d': 23, 'n_steps': 10, 'gamma': 1.8469523636182337, 'cat_emb_dim': 2, 'n_independent': 5, 'n_shared': 2, 'momentum': 0.18591295491892004, 'mask_type': 'entmax'}. Best is trial 11 with value: 1188569.9951356053.
[I 2025-01-09 02:45:00,014] Trial 35 finished with value: 1364252.3382299058 and parameters: {'n_d': 26, 'n_steps': 10, 'gamma': 1.8423417544162368, 'cat_emb_dim': 2, 'n_independent': 5, 'n_shared': 4, 'momentum': 0.08268969374934831, 'mask_type': 'sparsemax'}. Best is trial 11 with value: 1188569.9951356053.
[I 2025-01-09 03:03:09,592] Trial 36 finished with value: 1265770.8923653092 and parameters: {'n_d': 40, 'n_steps': 10, 'gamma': 1.3648430965900242, 'cat_emb_dim': 1, 'n_independent': 4, 'n_shared': 3, 'momentum': 0.20864278122858043, 'mask_type': 'entmax'}. Best is trial 11 with value: 1188569.9951356053.
[I 2025-01-09 03:12:02,171] Trial 37 finished with value: 1319895.266320886 and parameters: {'n_d': 32, 'n_steps': 4, 'gamma': 1.6896971884001986, 'cat_emb_dim': 2, 'n_independent': 3, 'n_shared': 4, 'momentum': 0.02526175367488181, 'mask_type': 'entmax'}. Best is trial 11 with value: 1188569.9951356053.
[I 2025-01-09 03:34:38,750] Trial 38 finished with value: 1347481.2351234534 and parameters: {'n_d': 21, 'n_steps': 9, 'gamma': 1.8185069763372406, 'cat_emb_dim': 2, 'n_independent': 5, 'n_shared': 4, 'momentum': 0.29984571569136115, 'mask_type': 'sparsemax'}. Best is trial 11 with value: 1188569.9951356053.
[I 2025-01-09 03:49:16,640] Trial 39 finished with value: 1321439.111189716 and parameters: {'n_d': 26, 'n_steps': 9, 'gamma': 1.7793694571902618, 'cat_emb_dim': 3, 'n_independent': 4, 'n_shared': 2, 'momentum': 0.033048191826763926, 'mask_type': 'entmax'}. Best is trial 11 with value: 1188569.9951356053.
[I 2025-01-09 04:01:20,397] Trial 40 finished with value: 1374878.639858799 and parameters: {'n_d': 33, 'n_steps': 7, 'gamma': 1.4542410444021336, 'cat_emb_dim': 2, 'n_independent': 3, 'n_shared': 3, 'momentum': 0.01411112657396741, 'mask_type': 'sparsemax'}. Best is trial 11 with value: 1188569.9951356053.
[I 2025-01-09 04:15:34,286] Trial 41 finished with value: 1315423.6337072162 and parameters: {'n_d': 19, 'n_steps': 9, 'gamma': 1.9329144784801904, 'cat_emb_dim': 2, 'n_independent': 2, 'n_shared': 3, 'momentum': 0.2259634889317816, 'mask_type': 'entmax'}. Best is trial 11 with value: 1188569.9951356053.
[I 2025-01-09 04:29:48,696] Trial 42 finished with value: 1286600.6465057856 and parameters: {'n_d': 13, 'n_steps': 10, 'gamma': 1.9594721820601957, 'cat_emb_dim': 2, 'n_independent': 2, 'n_shared': 3, 'momentum': 0.16170395611710153, 'mask_type': 'entmax'}. Best is trial 11 with value: 1188569.9951356053.
[I 2025-01-09 04:43:18,589] Trial 43 finished with value: 1307475.8362927816 and parameters: {'n_d': 17, 'n_steps': 8, 'gamma': 1.8733161718421927, 'cat_emb_dim': 2, 'n_independent': 1, 'n_shared': 3, 'momentum': 0.09555972588326556, 'mask_type': 'entmax'}. Best is trial 11 with value: 1188569.9951356053.
[I 2025-01-09 05:11:19,030] Trial 44 finished with value: 1354693.6851239973 and parameters: {'n_d': 8, 'n_steps': 10, 'gamma': 1.954468073818817, 'cat_emb_dim': 2, 'n_independent': 4, 'n_shared': 4, 'momentum': 0.26789421678599706, 'mask_type': 'entmax'}. Best is trial 11 with value: 1188569.9951356053.
[I 2025-01-09 05:27:26,953] Trial 45 finished with value: 1287703.8143387244 and parameters: {'n_d': 25, 'n_steps': 9, 'gamma': 1.0207030860574826, 'cat_emb_dim': 1, 'n_independent': 2, 'n_shared': 3, 'momentum': 0.12826110219465917, 'mask_type': 'entmax'}. Best is trial 11 with value: 1188569.9951356053.
[I 2025-01-09 05:39:59,595] Trial 46 finished with value: 1400334.2423981312 and parameters: {'n_d': 29, 'n_steps': 7, 'gamma': 1.860684623386433, 'cat_emb_dim': 2, 'n_independent': 3, 'n_shared': 4, 'momentum': 0.007041932039916199, 'mask_type': 'entmax'}. Best is trial 11 with value: 1188569.9951356053.
[I 2025-01-09 05:50:18,523] Trial 47 finished with value: 1452325.8390519877 and parameters: {'n_d': 19, 'n_steps': 6, 'gamma': 1.9997522600559205, 'cat_emb_dim': 3, 'n_independent': 2, 'n_shared': 2, 'momentum': 0.09873612914097646, 'mask_type': 'sparsemax'}. Best is trial 11 with value: 1188569.9951356053.
[I 2025-01-09 06:02:02,673] Trial 48 finished with value: 1286099.6358101217 and parameters: {'n_d': 41, 'n_steps': 9, 'gamma': 1.7890060215396903, 'cat_emb_dim': 2, 'n_independent': 1, 'n_shared': 3, 'momentum': 0.03563841818976225, 'mask_type': 'entmax'}. Best is trial 11 with value: 1188569.9951356053.
[I 2025-01-09 06:13:36,870] Trial 49 finished with value: 1298552.2250987196 and parameters: {'n_d': 37, 'n_steps': 5, 'gamma': 1.9044790305319053, 'cat_emb_dim': 2, 'n_independent': 4, 'n_shared': 3, 'momentum': 0.3850304428183592, 'mask_type': 'entmax'}. Best is trial 11 with value: 1188569.9951356053.
[I 2025-01-09 06:25:33,780] Trial 50 finished with value: 1231965.894329075 and parameters: {'n_d': 28, 'n_steps': 8, 'gamma': 1.6859964696580336, 'cat_emb_dim': 2, 'n_independent': 3, 'n_shared': 2, 'momentum': 0.15705583529720957, 'mask_type': 'entmax'}. Best is trial 11 with value: 1188569.9951356053.
[I 2025-01-09 06:40:14,107] Trial 51 finished with value: 1218340.246938698 and parameters: {'n_d': 29, 'n_steps': 8, 'gamma': 1.6840471874865663, 'cat_emb_dim': 2, 'n_independent': 3, 'n_shared': 2, 'momentum': 0.16226559650543618, 'mask_type': 'entmax'}. Best is trial 11 with value: 1188569.9951356053.
[I 2025-01-09 06:52:33,205] Trial 52 finished with value: 1290128.4963842763 and parameters: {'n_d': 28, 'n_steps': 7, 'gamma': 1.548395005234473, 'cat_emb_dim': 2, 'n_independent': 3, 'n_shared': 2, 'momentum': 0.15473741273579067, 'mask_type': 'entmax'}. Best is trial 11 with value: 1188569.9951356053.
[I 2025-01-09 07:04:17,429] Trial 53 finished with value: 1352020.4772075922 and parameters: {'n_d': 34, 'n_steps': 8, 'gamma': 1.6100848806210073, 'cat_emb_dim': 2, 'n_independent': 3, 'n_shared': 2, 'momentum': 0.1281166077918257, 'mask_type': 'entmax'}. Best is trial 11 with value: 1188569.9951356053.
[I 2025-01-09 07:18:13,776] Trial 54 finished with value: 1287253.896593626 and parameters: {'n_d': 31, 'n_steps': 9, 'gamma': 1.5183800470237392, 'cat_emb_dim': 2, 'n_independent': 3, 'n_shared': 2, 'momentum': 0.25782008397393, 'mask_type': 'entmax'}. Best is trial 11 with value: 1188569.9951356053.
[I 2025-01-09 07:32:35,123] Trial 55 finished with value: 1414541.3722536636 and parameters: {'n_d': 24, 'n_steps': 10, 'gamma': 1.668508805359885, 'cat_emb_dim': 2, 'n_independent': 3, 'n_shared': 2, 'momentum': 0.003447936833764249, 'mask_type': 'entmax'}. Best is trial 11 with value: 1188569.9951356053.
[I 2025-01-09 07:40:07,134] Trial 56 finished with value: 1350213.0751292885 and parameters: {'n_d': 28, 'n_steps': 4, 'gamma': 1.6856601295004383, 'cat_emb_dim': 2, 'n_independent': 3, 'n_shared': 2, 'momentum': 0.01113659371335924, 'mask_type': 'entmax'}. Best is trial 11 with value: 1188569.9951356053.
[I 2025-01-09 07:51:26,033] Trial 57 finished with value: 1370726.0476779987 and parameters: {'n_d': 22, 'n_steps': 6, 'gamma': 1.3873805476561838, 'cat_emb_dim': 3, 'n_independent': 3, 'n_shared': 1, 'momentum': 0.05679330948185335, 'mask_type': 'sparsemax'}. Best is trial 11 with value: 1188569.9951356053.
[I 2025-01-09 08:09:56,718] Trial 58 finished with value: 1184616.8471968663 and parameters: {'n_d': 43, 'n_steps': 9, 'gamma': 1.751938929868293, 'cat_emb_dim': 2, 'n_independent': 4, 'n_shared': 3, 'momentum': 0.10895265262047434, 'mask_type': 'entmax'}. Best is trial 58 with value: 1184616.8471968663.
[I 2025-01-09 08:27:51,164] Trial 59 finished with value: 1311063.9594457087 and parameters: {'n_d': 42, 'n_steps': 9, 'gamma': 1.2048197328738142, 'cat_emb_dim': 2, 'n_independent': 5, 'n_shared': 3, 'momentum': 0.09880800486990458, 'mask_type': 'entmax'}. Best is trial 58 with value: 1184616.8471968663.
[I 2025-01-09 08:45:00,183] Trial 60 finished with value: 1294753.4866938 and parameters: {'n_d': 47, 'n_steps': 10, 'gamma': 1.7442359959944058, 'cat_emb_dim': 1, 'n_independent': 4, 'n_shared': 3, 'momentum': 0.04772467102589252, 'mask_type': 'entmax'}. Best is trial 58 with value: 1184616.8471968663.
[I 2025-01-09 08:58:22,362] Trial 61 finished with value: 1269120.7391824587 and parameters: {'n_d': 58, 'n_steps': 8, 'gamma': 1.798586640233693, 'cat_emb_dim': 2, 'n_independent': 5, 'n_shared': 2, 'momentum': 0.16673013968684147, 'mask_type': 'entmax'}. Best is trial 58 with value: 1184616.8471968663.
[I 2025-01-09 09:16:01,372] Trial 62 finished with value: 1278600.8100566594 and parameters: {'n_d': 37, 'n_steps': 9, 'gamma': 1.7057019957927984, 'cat_emb_dim': 2, 'n_independent': 4, 'n_shared': 3, 'momentum': 0.1167070920867036, 'mask_type': 'entmax'}. Best is trial 58 with value: 1184616.8471968663.
[I 2025-01-09 09:34:12,971] Trial 63 finished with value: 1320295.461290231 and parameters: {'n_d': 31, 'n_steps': 10, 'gamma': 1.7718431053436492, 'cat_emb_dim': 2, 'n_independent': 4, 'n_shared': 3, 'momentum': 0.14061353743462462, 'mask_type': 'entmax'}. Best is trial 58 with value: 1184616.8471968663.
[I 2025-01-09 09:46:55,011] Trial 64 finished with value: 1339935.1458117757 and parameters: {'n_d': 29, 'n_steps': 8, 'gamma': 1.62776836661865, 'cat_emb_dim': 2, 'n_independent': 3, 'n_shared': 3, 'momentum': 0.012724302304261763, 'mask_type': 'entmax'}. Best is trial 58 with value: 1184616.8471968663.
[I 2025-01-09 10:06:08,623] Trial 65 finished with value: 1256333.2882435655 and parameters: {'n_d': 53, 'n_steps': 9, 'gamma': 1.8278989751816435, 'cat_emb_dim': 2, 'n_independent': 3, 'n_shared': 5, 'momentum': 0.020071837267179978, 'mask_type': 'entmax'}. Best is trial 58 with value: 1184616.8471968663.
[I 2025-01-09 10:23:09,986] Trial 66 finished with value: 1330620.446599826 and parameters: {'n_d': 27, 'n_steps': 10, 'gamma': 1.866936949326814, 'cat_emb_dim': 2, 'n_independent': 4, 'n_shared': 2, 'momentum': 0.028834590165486916, 'mask_type': 'entmax'}. Best is trial 58 with value: 1184616.8471968663.
[I 2025-01-09 10:32:01,894] Trial 67 finished with value: 1256426.0237784933 and parameters: {'n_d': 35, 'n_steps': 3, 'gamma': 1.8967523855444324, 'cat_emb_dim': 2, 'n_independent': 3, 'n_shared': 3, 'momentum': 0.007693848713027822, 'mask_type': 'entmax'}. Best is trial 58 with value: 1184616.8471968663.
[I 2025-01-09 10:48:31,121] Trial 68 finished with value: 1358894.632529301 and parameters: {'n_d': 21, 'n_steps': 8, 'gamma': 1.5963791137763326, 'cat_emb_dim': 2, 'n_independent': 5, 'n_shared': 4, 'momentum': 0.07601207705300965, 'mask_type': 'entmax'}. Best is trial 58 with value: 1184616.8471968663.
[I 2025-01-09 11:00:01,159] Trial 69 finished with value: 1258048.4050088555 and parameters: {'n_d': 59, 'n_steps': 7, 'gamma': 1.7148521386582676, 'cat_emb_dim': 3, 'n_independent': 3, 'n_shared': 2, 'momentum': 0.18293485975174031, 'mask_type': 'entmax'}. Best is trial 58 with value: 1184616.8471968663.
[I 2025-01-09 11:17:19,039] Trial 70 finished with value: 1346796.9594263083 and parameters: {'n_d': 46, 'n_steps': 10, 'gamma': 1.6450634819086842, 'cat_emb_dim': 2, 'n_independent': 4, 'n_shared': 3, 'momentum': 0.25330554602836614, 'mask_type': 'sparsemax'}. Best is trial 58 with value: 1184616.8471968663.
