[I 2025-01-09 05:29:15,956] Trial 71 finished with value: 160719093.9286818 and parameters: {'n_d': 37, 'n_steps': 4, 'gamma': 1.5206885446432934, 'cat_emb_dim': 2, 'n_independent': 5, 'n_shared': 4, 'momentum': 0.019048186108762764, 'mask_type': 'entmax'}. Best is trial 1 with value: 15799481.447035799.
[I 2025-01-09 05:42:33,321] Trial 72 finished with value: 132128090.90889244 and parameters: {'n_d': 34, 'n_steps': 4, 'gamma': 1.3489732497244313, 'cat_emb_dim': 2, 'n_independent': 5, 'n_shared': 4, 'momentum': 0.03124574692646791, 'mask_type': 'entmax'}. Best is trial 1 with value: 15799481.447035799.
[I 2025-01-09 05:51:27,595] Trial 73 finished with value: 171465532.32421988 and parameters: {'n_d': 32, 'n_steps': 3, 'gamma': 1.4431620101869853, 'cat_emb_dim': 2, 'n_independent': 5, 'n_shared': 4, 'momentum': 0.021576320388981635, 'mask_type': 'entmax'}. Best is trial 1 with value: 15799481.447035799.
[I 2025-01-09 06:02:25,273] Trial 74 finished with value: 154413134.51139164 and parameters: {'n_d': 31, 'n_steps': 5, 'gamma': 1.6336853892409393, 'cat_emb_dim': 2, 'n_independent': 5, 'n_shared': 5, 'momentum': 0.015211475403839941, 'mask_type': 'entmax'}. Best is trial 1 with value: 15799481.447035799.
[I 2025-01-09 06:10:48,817] Trial 75 finished with value: 134401032.09669617 and parameters: {'n_d': 43, 'n_steps': 4, 'gamma': 1.3957215387514768, 'cat_emb_dim': 2, 'n_independent': 4, 'n_shared': 4, 'momentum': 0.010749741758823005, 'mask_type': 'entmax'}. Best is trial 1 with value: 15799481.447035799.
[I 2025-01-09 06:21:23,124] Trial 76 finished with value: 55608193.77701233 and parameters: {'n_d': 36, 'n_steps': 4, 'gamma': 1.0318430299952743, 'cat_emb_dim': 2, 'n_independent': 5, 'n_shared': 4, 'momentum': 0.005082292942315431, 'mask_type': 'entmax'}. Best is trial 1 with value: 15799481.447035799.
[I 2025-01-09 06:39:09,107] Trial 77 finished with value: 49757453.93232508 and parameters: {'n_d': 38, 'n_steps': 9, 'gamma': 1.0616563148975109, 'cat_emb_dim': 3, 'n_independent': 3, 'n_shared': 3, 'momentum': 0.020087016950494235, 'mask_type': 'entmax'}. Best is trial 1 with value: 15799481.447035799.
[I 2025-01-09 06:48:44,084] Trial 78 finished with value: 187059385.2645689 and parameters: {'n_d': 41, 'n_steps': 10, 'gamma': 1.3484793631396967, 'cat_emb_dim': 2, 'n_independent': 4, 'n_shared': 1, 'momentum': 0.20169192240137654, 'mask_type': 'sparsemax'}. Best is trial 1 with value: 15799481.447035799.
[I 2025-01-09 06:59:02,352] Trial 79 finished with value: 72713004.53167503 and parameters: {'n_d': 47, 'n_steps': 3, 'gamma': 1.297106267122133, 'cat_emb_dim': 3, 'n_independent': 2, 'n_shared': 3, 'momentum': 0.006346222644840405, 'mask_type': 'entmax'}. Best is trial 1 with value: 15799481.447035799.
[I 2025-01-09 07:17:07,215] Trial 80 finished with value: 11513137.441205278 and parameters: {'n_d': 49, 'n_steps': 8, 'gamma': 1.031522844648987, 'cat_emb_dim': 2, 'n_independent': 1, 'n_shared': 4, 'momentum': 0.0015374105466576958, 'mask_type': 'entmax'}. Best is trial 80 with value: 11513137.441205278.
[I 2025-01-09 07:30:30,799] Trial 81 finished with value: 78811167.54834148 and parameters: {'n_d': 35, 'n_steps': 8, 'gamma': 1.0308092253625931, 'cat_emb_dim': 2, 'n_independent': 1, 'n_shared': 4, 'momentum': 0.0013406371938197747, 'mask_type': 'entmax'}. Best is trial 80 with value: 11513137.441205278.
[I 2025-01-09 07:41:26,786] Trial 82 finished with value: 87326882.7616756 and parameters: {'n_d': 52, 'n_steps': 8, 'gamma': 1.0851691808728725, 'cat_emb_dim': 2, 'n_independent': 1, 'n_shared': 4, 'momentum': 0.0017066897944730507, 'mask_type': 'entmax'}. Best is trial 80 with value: 11513137.441205278.
[I 2025-01-09 07:55:07,964] Trial 83 finished with value: 71622669.28997286 and parameters: {'n_d': 49, 'n_steps': 7, 'gamma': 1.0185487632341312, 'cat_emb_dim': 2, 'n_independent': 1, 'n_shared': 4, 'momentum': 0.0011327749998253057, 'mask_type': 'entmax'}. Best is trial 80 with value: 11513137.441205278.
[I 2025-01-09 08:11:11,302] Trial 84 finished with value: 50533308.844532415 and parameters: {'n_d': 53, 'n_steps': 9, 'gamma': 1.1225255829823413, 'cat_emb_dim': 2, 'n_independent': 1, 'n_shared': 4, 'momentum': 0.0020668495945480674, 'mask_type': 'entmax'}. Best is trial 80 with value: 11513137.441205278.
[I 2025-01-09 08:26:42,558] Trial 85 finished with value: 49211270.823768005 and parameters: {'n_d': 49, 'n_steps': 8, 'gamma': 1.0552633208016302, 'cat_emb_dim': 2, 'n_independent': 2, 'n_shared': 3, 'momentum': 0.0015036645643279965, 'mask_type': 'entmax'}. Best is trial 80 with value: 11513137.441205278.
[I 2025-01-09 08:38:04,775] Trial 86 finished with value: 128091994.4004041 and parameters: {'n_d': 39, 'n_steps': 4, 'gamma': 1.1447588746053907, 'cat_emb_dim': 3, 'n_independent': 1, 'n_shared': 5, 'momentum': 0.024334768775113834, 'mask_type': 'entmax'}. Best is trial 80 with value: 11513137.441205278.
[I 2025-01-09 08:51:04,533] Trial 87 finished with value: 83721480.08714914 and parameters: {'n_d': 13, 'n_steps': 9, 'gamma': 1.0189880715403332, 'cat_emb_dim': 2, 'n_independent': 1, 'n_shared': 1, 'momentum': 0.0027121532456041045, 'mask_type': 'entmax'}. Best is trial 80 with value: 11513137.441205278.
[I 2025-01-09 08:58:21,161] Trial 88 finished with value: 125972454.57275283 and parameters: {'n_d': 64, 'n_steps': 5, 'gamma': 1.1955030619983376, 'cat_emb_dim': 3, 'n_independent': 3, 'n_shared': 3, 'momentum': 0.013194057119617929, 'mask_type': 'sparsemax'}. Best is trial 80 with value: 11513137.441205278.
[I 2025-01-09 09:11:43,316] Trial 89 finished with value: 109990356.99788542 and parameters: {'n_d': 44, 'n_steps': 7, 'gamma': 1.2360457810066137, 'cat_emb_dim': 2, 'n_independent': 2, 'n_shared': 4, 'momentum': 0.0024700780513667356, 'mask_type': 'entmax'}. Best is trial 80 with value: 11513137.441205278.
[I 2025-01-09 09:27:16,290] Trial 90 finished with value: 45093022.887602724 and parameters: {'n_d': 28, 'n_steps': 8, 'gamma': 1.0744245703981998, 'cat_emb_dim': 2, 'n_independent': 4, 'n_shared': 3, 'momentum': 0.008677424242883779, 'mask_type': 'entmax'}. Best is trial 80 with value: 11513137.441205278.
[I 2025-01-09 09:39:06,838] Trial 91 finished with value: 138020435.5284498 and parameters: {'n_d': 25, 'n_steps': 8, 'gamma': 1.0741797288838686, 'cat_emb_dim': 2, 'n_independent': 4, 'n_shared': 3, 'momentum': 0.008889969285500966, 'mask_type': 'entmax'}. Best is trial 80 with value: 11513137.441205278.
[I 2025-01-09 09:52:49,475] Trial 92 finished with value: 43608944.50267504 and parameters: {'n_d': 55, 'n_steps': 8, 'gamma': 1.046765149226658, 'cat_emb_dim': 2, 'n_independent': 4, 'n_shared': 3, 'momentum': 0.003746193394104716, 'mask_type': 'entmax'}. Best is trial 80 with value: 11513137.441205278.
[I 2025-01-09 10:10:26,372] Trial 93 finished with value: 61207778.81963043 and parameters: {'n_d': 60, 'n_steps': 8, 'gamma': 1.0446823203385172, 'cat_emb_dim': 2, 'n_independent': 4, 'n_shared': 3, 'momentum': 0.0037223177306080616, 'mask_type': 'entmax'}. Best is trial 80 with value: 11513137.441205278.
[I 2025-01-09 10:27:27,431] Trial 94 finished with value: 85062605.2372421 and parameters: {'n_d': 33, 'n_steps': 9, 'gamma': 1.1024622003872717, 'cat_emb_dim': 2, 'n_independent': 4, 'n_shared': 2, 'momentum': 0.003086763503585652, 'mask_type': 'entmax'}. Best is trial 80 with value: 11513137.441205278.
[I 2025-01-09 10:41:46,405] Trial 95 finished with value: 34162051.27689425 and parameters: {'n_d': 54, 'n_steps': 6, 'gamma': 1.0149507870747196, 'cat_emb_dim': 2, 'n_independent': 5, 'n_shared': 3, 'momentum': 0.004498905764934449, 'mask_type': 'entmax'}. Best is trial 80 with value: 11513137.441205278.
[I 2025-01-09 10:55:16,781] Trial 96 finished with value: 48165267.54921408 and parameters: {'n_d': 55, 'n_steps': 6, 'gamma': 1.000179053856863, 'cat_emb_dim': 2, 'n_independent': 3, 'n_shared': 3, 'momentum': 0.004591328756096653, 'mask_type': 'entmax'}. Best is trial 80 with value: 11513137.441205278.
[I 2025-01-09 11:11:17,267] Trial 97 finished with value: 13915944.933465103 and parameters: {'n_d': 56, 'n_steps': 7, 'gamma': 1.0216310791675276, 'cat_emb_dim': 3, 'n_independent': 4, 'n_shared': 3, 'momentum': 0.003809687093879747, 'mask_type': 'entmax'}. Best is trial 80 with value: 11513137.441205278.
[I 2025-01-09 11:24:23,130] Trial 98 finished with value: 81444859.63186334 and parameters: {'n_d': 61, 'n_steps': 7, 'gamma': 1.0235216719045366, 'cat_emb_dim': 3, 'n_independent': 5, 'n_shared': 3, 'momentum': 0.005410428695415622, 'mask_type': 'sparsemax'}. Best is trial 80 with value: 11513137.441205278.
[I 2025-01-09 11:36:43,810] Trial 99 finished with value: 36605040.85221828 and parameters: {'n_d': 56, 'n_steps': 6, 'gamma': 1.0176666193327444, 'cat_emb_dim': 3, 'n_independent': 2, 'n_shared': 3, 'momentum': 0.0024917867346881564, 'mask_type': 'entmax'}. Best is trial 80 with value: 11513137.441205278.
[I 2025-01-09 11:54:55,598] A new study created in RDB with name: TabNet_Abalone
[I 2025-01-09 12:07:08,127] Trial 0 finished with value: 5.196635779669387 and parameters: {'n_d': 11, 'n_steps': 8, 'gamma': 1.5290093012112482, 'cat_emb_dim': 2, 'n_independent': 5, 'n_shared': 2, 'momentum': 0.0019238880545173395, 'mask_type': 'entmax'}. Best is trial 0 with value: 5.196635779669387.
[I 2025-01-09 12:14:02,455] Trial 1 finished with value: 5.345279943692075 and parameters: {'n_d': 42, 'n_steps': 5, 'gamma': 1.1785469673300868, 'cat_emb_dim': 3, 'n_independent': 3, 'n_shared': 2, 'momentum': 0.001634367433550785, 'mask_type': 'sparsemax'}. Best is trial 0 with value: 5.196635779669387.
[I 2025-01-09 12:21:28,754] Trial 2 finished with value: 4.313924851486233 and parameters: {'n_d': 12, 'n_steps': 5, 'gamma': 1.494331772565035, 'cat_emb_dim': 1, 'n_independent': 4, 'n_shared': 4, 'momentum': 0.06903117662293713, 'mask_type': 'entmax'}. Best is trial 2 with value: 4.313924851486233.
[I 2025-01-09 12:31:14,278] Trial 3 finished with value: 4.510259944393144 and parameters: {'n_d': 9, 'n_steps': 8, 'gamma': 1.7682795653110777, 'cat_emb_dim': 1, 'n_independent': 5, 'n_shared': 2, 'momentum': 0.36947443926570556, 'mask_type': 'sparsemax'}. Best is trial 2 with value: 4.313924851486233.
[I 2025-01-09 12:36:54,998] Trial 4 finished with value: 4.429419658159388 and parameters: {'n_d': 60, 'n_steps': 4, 'gamma': 1.50812109643863, 'cat_emb_dim': 3, 'n_independent': 5, 'n_shared': 1, 'momentum': 0.08448782530741226, 'mask_type': 'sparsemax'}. Best is trial 2 with value: 4.313924851486233.
[I 2025-01-09 12:48:04,502] Trial 5 finished with value: 4.617131211379677 and parameters: {'n_d': 24, 'n_steps': 9, 'gamma': 1.742500427958469, 'cat_emb_dim': 3, 'n_independent': 3, 'n_shared': 3, 'momentum': 0.02636403746462953, 'mask_type': 'sparsemax'}. Best is trial 2 with value: 4.313924851486233.
[I 2025-01-09 12:55:38,179] Trial 6 finished with value: 4.513375775622189 and parameters: {'n_d': 28, 'n_steps': 9, 'gamma': 1.1518013339323971, 'cat_emb_dim': 1, 'n_independent': 1, 'n_shared': 1, 'momentum': 0.002804056943060184, 'mask_type': 'entmax'}. Best is trial 2 with value: 4.313924851486233.
[I 2025-01-09 13:08:45,882] Trial 7 finished with value: 4.476219170304388 and parameters: {'n_d': 46, 'n_steps': 8, 'gamma': 1.543351572845897, 'cat_emb_dim': 3, 'n_independent': 4, 'n_shared': 5, 'momentum': 0.1412437737725295, 'mask_type': 'sparsemax'}. Best is trial 2 with value: 4.313924851486233.
[I 2025-01-09 13:14:50,630] Trial 8 finished with value: 4.334710058889374 and parameters: {'n_d': 24, 'n_steps': 6, 'gamma': 1.2224507295646365, 'cat_emb_dim': 3, 'n_independent': 1, 'n_shared': 2, 'momentum': 0.1178201878652642, 'mask_type': 'entmax'}. Best is trial 2 with value: 4.313924851486233.
[I 2025-01-09 13:27:24,586] Trial 9 finished with value: 4.425387192389861 and parameters: {'n_d': 21, 'n_steps': 9, 'gamma': 1.6787347636455694, 'cat_emb_dim': 2, 'n_independent': 3, 'n_shared': 4, 'momentum': 0.01564655548699386, 'mask_type': 'entmax'}. Best is trial 2 with value: 4.313924851486233.
[I 2025-01-09 13:31:35,507] Trial 10 finished with value: 4.366948929185573 and parameters: {'n_d': 62, 'n_steps': 3, 'gamma': 1.980117381857459, 'cat_emb_dim': 1, 'n_independent': 2, 'n_shared': 5, 'momentum': 0.010737671985562887, 'mask_type': 'entmax'}. Best is trial 2 with value: 4.313924851486233.
[I 2025-01-09 13:38:06,629] Trial 11 finished with value: 4.318246743746835 and parameters: {'n_d': 17, 'n_steps': 6, 'gamma': 1.3099540754409984, 'cat_emb_dim': 2, 'n_independent': 1, 'n_shared': 4, 'momentum': 0.059100972219517496, 'mask_type': 'entmax'}. Best is trial 2 with value: 4.313924851486233.
[I 2025-01-09 13:44:37,803] Trial 12 finished with value: 4.47152011951889 and parameters: {'n_d': 16, 'n_steps': 6, 'gamma': 1.353914302837437, 'cat_emb_dim': 2, 'n_independent': 4, 'n_shared': 4, 'momentum': 0.04715480409819253, 'mask_type': 'entmax'}. Best is trial 2 with value: 4.313924851486233.
[I 2025-01-09 13:50:34,200] Trial 13 finished with value: 4.295448051863898 and parameters: {'n_d': 33, 'n_steps': 5, 'gamma': 1.0019091108568736, 'cat_emb_dim': 1, 'n_independent': 2, 'n_shared': 4, 'momentum': 0.3569992306255552, 'mask_type': 'entmax'}. Best is trial 13 with value: 4.295448051863898.
[I 2025-01-09 13:55:05,528] Trial 14 finished with value: 4.35755297015521 and parameters: {'n_d': 33, 'n_steps': 4, 'gamma': 1.0054859002391099, 'cat_emb_dim': 1, 'n_independent': 2, 'n_shared': 3, 'momentum': 0.38594715002512175, 'mask_type': 'entmax'}. Best is trial 13 with value: 4.295448051863898.
[I 2025-01-09 14:01:13,716] Trial 15 finished with value: 4.288619590394546 and parameters: {'n_d': 49, 'n_steps': 5, 'gamma': 1.0175580054719289, 'cat_emb_dim': 1, 'n_independent': 2, 'n_shared': 4, 'momentum': 0.1988282522646898, 'mask_type': 'entmax'}. Best is trial 15 with value: 4.288619590394546.
[I 2025-01-09 14:07:46,914] Trial 16 finished with value: 4.295922459175441 and parameters: {'n_d': 51, 'n_steps': 4, 'gamma': 1.0022971488314538, 'cat_emb_dim': 1, 'n_independent': 2, 'n_shared': 5, 'momentum': 0.21018480355682603, 'mask_type': 'entmax'}. Best is trial 15 with value: 4.288619590394546.
[I 2025-01-09 14:16:19,055] Trial 17 finished with value: 4.478016833491979 and parameters: {'n_d': 38, 'n_steps': 7, 'gamma': 1.104971440509822, 'cat_emb_dim': 1, 'n_independent': 2, 'n_shared': 3, 'momentum': 0.005980988024359539, 'mask_type': 'entmax'}. Best is trial 15 with value: 4.288619590394546.
[I 2025-01-09 14:21:02,570] Trial 18 finished with value: 4.330474925393499 and parameters: {'n_d': 54, 'n_steps': 3, 'gamma': 1.3043599757939008, 'cat_emb_dim': 2, 'n_independent': 2, 'n_shared': 4, 'momentum': 0.21414358876021172, 'mask_type': 'entmax'}. Best is trial 15 with value: 4.288619590394546.
[I 2025-01-09 14:26:28,743] Trial 19 finished with value: 4.409011358890579 and parameters: {'n_d': 37, 'n_steps': 5, 'gamma': 1.085912065896093, 'cat_emb_dim': 1, 'n_independent': 3, 'n_shared': 5, 'momentum': 0.03351088595222059, 'mask_type': 'entmax'}. Best is trial 15 with value: 4.288619590394546.
[I 2025-01-09 14:34:00,892] Trial 20 finished with value: 4.34154640141719 and parameters: {'n_d': 47, 'n_steps': 7, 'gamma': 1.3904666049346088, 'cat_emb_dim': 1, 'n_independent': 1, 'n_shared': 3, 'momentum': 0.17608986667966184, 'mask_type': 'entmax'}. Best is trial 15 with value: 4.288619590394546.
[I 2025-01-09 14:39:16,008] Trial 21 finished with value: 4.320690106008696 and parameters: {'n_d': 53, 'n_steps': 4, 'gamma': 1.0142639696244682, 'cat_emb_dim': 1, 'n_independent': 2, 'n_shared': 5, 'momentum': 0.2524959133733254, 'mask_type': 'entmax'}. Best is trial 15 with value: 4.288619590394546.
[I 2025-01-09 14:45:26,172] Trial 22 finished with value: 4.359472808019069 and parameters: {'n_d': 54, 'n_steps': 5, 'gamma': 1.0074075243667258, 'cat_emb_dim': 1, 'n_independent': 2, 'n_shared': 5, 'momentum': 0.10763848735714558, 'mask_type': 'entmax'}. Best is trial 15 with value: 4.288619590394546.
[I 2025-01-09 14:51:16,447] Trial 23 finished with value: 4.331159425641664 and parameters: {'n_d': 48, 'n_steps': 4, 'gamma': 1.2045847200728608, 'cat_emb_dim': 1, 'n_independent': 2, 'n_shared': 4, 'momentum': 0.2965379011466926, 'mask_type': 'entmax'}. Best is trial 15 with value: 4.288619590394546.
[I 2025-01-09 14:55:30,067] Trial 24 finished with value: 4.309880649819621 and parameters: {'n_d': 32, 'n_steps': 3, 'gamma': 1.1063856135452053, 'cat_emb_dim': 2, 'n_independent': 3, 'n_shared': 5, 'momentum': 0.17352143502963152, 'mask_type': 'entmax'}. Best is trial 15 with value: 4.288619590394546.
[I 2025-01-09 15:01:56,385] Trial 25 finished with value: 4.32628127489225 and parameters: {'n_d': 43, 'n_steps': 5, 'gamma': 1.24664367666493, 'cat_emb_dim': 1, 'n_independent': 1, 'n_shared': 4, 'momentum': 0.23705210019839973, 'mask_type': 'entmax'}. Best is trial 15 with value: 4.288619590394546.
[I 2025-01-09 15:10:18,493] Trial 26 finished with value: 4.338858589943419 and parameters: {'n_d': 58, 'n_steps': 4, 'gamma': 1.0687994403600323, 'cat_emb_dim': 1, 'n_independent': 2, 'n_shared': 5, 'momentum': 0.10205396687804386, 'mask_type': 'sparsemax'}. Best is trial 15 with value: 4.288619590394546.
[I 2025-01-09 15:18:21,240] Trial 27 finished with value: 4.441303965755227 and parameters: {'n_d': 42, 'n_steps': 6, 'gamma': 1.1486691522996015, 'cat_emb_dim': 2, 'n_independent': 3, 'n_shared': 4, 'momentum': 0.040693192026921274, 'mask_type': 'entmax'}. Best is trial 15 with value: 4.288619590394546.
[I 2025-01-09 15:24:15,549] Trial 28 finished with value: 4.31738568209788 and parameters: {'n_d': 50, 'n_steps': 5, 'gamma': 1.4280989065298333, 'cat_emb_dim': 1, 'n_independent': 2, 'n_shared': 3, 'momentum': 0.387802427451575, 'mask_type': 'entmax'}. Best is trial 15 with value: 4.288619590394546.
[I 2025-01-09 15:31:32,382] Trial 29 finished with value: 5.777831921696734 and parameters: {'n_d': 39, 'n_steps': 7, 'gamma': 1.0464344981140428, 'cat_emb_dim': 2, 'n_independent': 1, 'n_shared': 4, 'momentum': 0.0010280586399094847, 'mask_type': 'entmax'}. Best is trial 15 with value: 4.288619590394546.
[I 2025-01-09 15:35:47,445] Trial 30 finished with value: 4.402734148654719 and parameters: {'n_d': 64, 'n_steps': 3, 'gamma': 1.2619580013996081, 'cat_emb_dim': 1, 'n_independent': 2, 'n_shared': 5, 'momentum': 0.1515282490886843, 'mask_type': 'entmax'}. Best is trial 15 with value: 4.288619590394546.
[I 2025-01-09 15:41:02,569] Trial 31 finished with value: 4.310253554112168 and parameters: {'n_d': 32, 'n_steps': 3, 'gamma': 1.1120583307188516, 'cat_emb_dim': 2, 'n_independent': 3, 'n_shared': 5, 'momentum': 0.1905628477604351, 'mask_type': 'entmax'}. Best is trial 15 with value: 4.288619590394546.
[I 2025-01-09 15:48:25,402] Trial 32 finished with value: 4.3039909678865325 and parameters: {'n_d': 29, 'n_steps': 4, 'gamma': 1.1510061441775583, 'cat_emb_dim': 2, 'n_independent': 3, 'n_shared': 5, 'momentum': 0.25400802316459237, 'mask_type': 'entmax'}. Best is trial 15 with value: 4.288619590394546.
[I 2025-01-09 15:54:56,109] Trial 33 finished with value: 4.2925557828171295 and parameters: {'n_d': 27, 'n_steps': 4, 'gamma': 1.1651580985783967, 'cat_emb_dim': 1, 'n_independent': 3, 'n_shared': 5, 'momentum': 0.3008255174350168, 'mask_type': 'entmax'}. Best is trial 15 with value: 4.288619590394546.
[I 2025-01-09 16:08:06,940] Trial 34 finished with value: 4.514184785928966 and parameters: {'n_d': 57, 'n_steps': 10, 'gamma': 1.050826300576758, 'cat_emb_dim': 1, 'n_independent': 4, 'n_shared': 4, 'momentum': 0.0727856158902746, 'mask_type': 'sparsemax'}. Best is trial 15 with value: 4.288619590394546.
[I 2025-01-09 16:13:01,971] Trial 35 finished with value: 4.42922966158022 and parameters: {'n_d': 35, 'n_steps': 4, 'gamma': 1.176395456686977, 'cat_emb_dim': 1, 'n_independent': 3, 'n_shared': 4, 'momentum': 0.3025866955399142, 'mask_type': 'entmax'}. Best is trial 15 with value: 4.288619590394546.
[I 2025-01-09 16:19:48,013] Trial 36 finished with value: 4.403118622389505 and parameters: {'n_d': 26, 'n_steps': 5, 'gamma': 1.0077483455120315, 'cat_emb_dim': 1, 'n_independent': 4, 'n_shared': 5, 'momentum': 0.09157677986018253, 'mask_type': 'sparsemax'}. Best is trial 15 with value: 4.288619590394546.
[I 2025-01-09 16:25:29,048] Trial 37 finished with value: 4.338530536659517 and parameters: {'n_d': 20, 'n_steps': 5, 'gamma': 1.076277866564581, 'cat_emb_dim': 1, 'n_independent': 2, 'n_shared': 3, 'momentum': 0.3982785357890024, 'mask_type': 'entmax'}. Best is trial 15 with value: 4.288619590394546.
[I 2025-01-09 16:31:24,444] Trial 38 finished with value: 4.290504457705431 and parameters: {'n_d': 43, 'n_steps': 5, 'gamma': 1.616650607533883, 'cat_emb_dim': 1, 'n_independent': 3, 'n_shared': 2, 'momentum': 0.12923249281770685, 'mask_type': 'entmax'}. Best is trial 15 with value: 4.288619590394546.
[I 2025-01-09 16:37:59,409] Trial 39 finished with value: 4.444681549546895 and parameters: {'n_d': 44, 'n_steps': 6, 'gamma': 1.6808440751047968, 'cat_emb_dim': 1, 'n_independent': 4, 'n_shared': 2, 'momentum': 0.1232336350251335, 'mask_type': 'sparsemax'}. Best is trial 15 with value: 4.288619590394546.
[I 2025-01-09 16:46:24,967] Trial 40 finished with value: 4.288678219543613 and parameters: {'n_d': 40, 'n_steps': 6, 'gamma': 1.580178874096612, 'cat_emb_dim': 1, 'n_independent': 5, 'n_shared': 1, 'momentum': 0.02052811852055741, 'mask_type': 'entmax'}. Best is trial 15 with value: 4.288619590394546.
[I 2025-01-09 16:53:35,224] Trial 41 finished with value: 4.795134227654254 and parameters: {'n_d': 40, 'n_steps': 6, 'gamma': 1.5640637184238806, 'cat_emb_dim': 1, 'n_independent': 5, 'n_shared': 1, 'momentum': 0.00364206619227517, 'mask_type': 'entmax'}. Best is trial 15 with value: 4.288619590394546.
