[I 2025-01-08 18:48:22,769] Using an existing study with name 'TabNet_Boston' instead of creating a new one.
[I 2025-01-08 18:50:39,633] Trial 2 finished with value: 13644.621211603346 and parameters: {'n_d': 26, 'n_steps': 9, 'gamma': 1.6808380789597384, 'cat_emb_dim': 2, 'n_independent': 5, 'n_shared': 5, 'momentum': 0.002645851676168012, 'mask_type': 'entmax'}. Best is trial 2 with value: 13644.621211603346.
[I 2025-01-08 18:52:07,464] Trial 3 finished with value: 17.262762705281318 and parameters: {'n_d': 56, 'n_steps': 10, 'gamma': 1.4003148115759712, 'cat_emb_dim': 3, 'n_independent': 5, 'n_shared': 2, 'momentum': 0.07214048447341355, 'mask_type': 'entmax'}. Best is trial 3 with value: 17.262762705281318.
[I 2025-01-08 18:52:35,371] Trial 4 finished with value: 1540.6772991257003 and parameters: {'n_d': 55, 'n_steps': 8, 'gamma': 1.7779673056985676, 'cat_emb_dim': 3, 'n_independent': 3, 'n_shared': 1, 'momentum': 0.0012794396756010702, 'mask_type': 'entmax'}. Best is trial 3 with value: 17.262762705281318.
[I 2025-01-08 18:53:39,012] Trial 5 finished with value: 17.82417264623889 and parameters: {'n_d': 20, 'n_steps': 10, 'gamma': 1.4882923062961337, 'cat_emb_dim': 1, 'n_independent': 1, 'n_shared': 4, 'momentum': 0.07723295100705448, 'mask_type': 'sparsemax'}. Best is trial 3 with value: 17.262762705281318.
[I 2025-01-08 18:55:09,422] Trial 6 finished with value: 2566.997577507972 and parameters: {'n_d': 62, 'n_steps': 5, 'gamma': 1.5969402280896554, 'cat_emb_dim': 1, 'n_independent': 5, 'n_shared': 5, 'momentum': 0.0018774405982574446, 'mask_type': 'entmax'}. Best is trial 3 with value: 17.262762705281318.
[I 2025-01-08 18:55:42,625] Trial 7 finished with value: 11.328193267717513 and parameters: {'n_d': 58, 'n_steps': 4, 'gamma': 1.9328955844602542, 'cat_emb_dim': 3, 'n_independent': 2, 'n_shared': 1, 'momentum': 0.05266367865618628, 'mask_type': 'entmax'}. Best is trial 7 with value: 11.328193267717513.
[I 2025-01-08 18:56:06,075] Trial 8 finished with value: 16158.507587205011 and parameters: {'n_d': 34, 'n_steps': 7, 'gamma': 1.5435584421106818, 'cat_emb_dim': 2, 'n_independent': 2, 'n_shared': 4, 'momentum': 0.0013121946202839672, 'mask_type': 'sparsemax'}. Best is trial 7 with value: 11.328193267717513.
[I 2025-01-08 18:56:59,424] Trial 9 finished with value: 10.311919737380117 and parameters: {'n_d': 52, 'n_steps': 6, 'gamma': 1.050413339231028, 'cat_emb_dim': 2, 'n_independent': 3, 'n_shared': 3, 'momentum': 0.07118274530382916, 'mask_type': 'sparsemax'}. Best is trial 9 with value: 10.311919737380117.
[I 2025-01-08 18:57:51,361] Trial 10 finished with value: 11.327769078766543 and parameters: {'n_d': 18, 'n_steps': 5, 'gamma': 1.0252599697414735, 'cat_emb_dim': 1, 'n_independent': 4, 'n_shared': 2, 'momentum': 0.10123579064232369, 'mask_type': 'sparsemax'}. Best is trial 9 with value: 10.311919737380117.
[I 2025-01-08 18:58:54,190] Trial 11 finished with value: 13.127049539110924 and parameters: {'n_d': 64, 'n_steps': 9, 'gamma': 1.410031498600164, 'cat_emb_dim': 2, 'n_independent': 2, 'n_shared': 3, 'momentum': 0.3646871175909174, 'mask_type': 'entmax'}. Best is trial 9 with value: 10.311919737380117.
[I 2025-01-08 18:59:49,399] Trial 12 finished with value: 17.694284171603805 and parameters: {'n_d': 45, 'n_steps': 3, 'gamma': 1.010438957306016, 'cat_emb_dim': 2, 'n_independent': 3, 'n_shared': 3, 'momentum': 0.008810280909385484, 'mask_type': 'sparsemax'}. Best is trial 9 with value: 10.311919737380117.
[I 2025-01-08 19:00:42,417] Trial 13 finished with value: 11.068459660000949 and parameters: {'n_d': 8, 'n_steps': 6, 'gamma': 1.0016369730475188, 'cat_emb_dim': 1, 'n_independent': 4, 'n_shared': 2, 'momentum': 0.2871157446920714, 'mask_type': 'sparsemax'}. Best is trial 9 with value: 10.311919737380117.
[I 2025-01-08 19:01:32,301] Trial 14 finished with value: 13.119902806923875 and parameters: {'n_d': 8, 'n_steps': 6, 'gamma': 1.1931924012631652, 'cat_emb_dim': 1, 'n_independent': 4, 'n_shared': 2, 'momentum': 0.346911156825506, 'mask_type': 'sparsemax'}. Best is trial 9 with value: 10.311919737380117.
[I 2025-01-08 19:02:50,929] Trial 15 finished with value: 16.859703507219457 and parameters: {'n_d': 44, 'n_steps': 7, 'gamma': 1.2128903374996518, 'cat_emb_dim': 1, 'n_independent': 4, 'n_shared': 3, 'momentum': 0.019415797006507057, 'mask_type': 'sparsemax'}. Best is trial 9 with value: 10.311919737380117.
[I 2025-01-08 19:03:34,896] Trial 16 finished with value: 13.248945535814661 and parameters: {'n_d': 45, 'n_steps': 6, 'gamma': 1.1821864065328271, 'cat_emb_dim': 2, 'n_independent': 3, 'n_shared': 2, 'momentum': 0.18714347382736612, 'mask_type': 'sparsemax'}. Best is trial 9 with value: 10.311919737380117.
[I 2025-01-08 19:04:38,792] Trial 17 finished with value: 13.47784642187205 and parameters: {'n_d': 9, 'n_steps': 5, 'gamma': 1.1085029566392302, 'cat_emb_dim': 1, 'n_independent': 4, 'n_shared': 4, 'momentum': 0.0390080188402051, 'mask_type': 'sparsemax'}. Best is trial 9 with value: 10.311919737380117.
[I 2025-01-08 19:05:08,546] Trial 18 finished with value: 11.22275440641993 and parameters: {'n_d': 34, 'n_steps': 3, 'gamma': 1.280326917915951, 'cat_emb_dim': 3, 'n_independent': 1, 'n_shared': 1, 'momentum': 0.1917270536350881, 'mask_type': 'sparsemax'}. Best is trial 9 with value: 10.311919737380117.
[I 2025-01-08 19:06:20,418] Trial 19 finished with value: 21.419447786916173 and parameters: {'n_d': 50, 'n_steps': 8, 'gamma': 1.321272584465915, 'cat_emb_dim': 2, 'n_independent': 4, 'n_shared': 2, 'momentum': 0.02418850376829837, 'mask_type': 'sparsemax'}. Best is trial 9 with value: 10.311919737380117.
[I 2025-01-08 19:07:09,569] Trial 20 finished with value: 12.421326474402031 and parameters: {'n_d': 27, 'n_steps': 6, 'gamma': 1.0701817889164569, 'cat_emb_dim': 1, 'n_independent': 3, 'n_shared': 3, 'momentum': 0.12682068811903746, 'mask_type': 'sparsemax'}. Best is trial 9 with value: 10.311919737380117.
[I 2025-01-08 19:08:11,048] Trial 21 finished with value: 22.215962280968775 and parameters: {'n_d': 41, 'n_steps': 4, 'gamma': 1.1359332385593657, 'cat_emb_dim': 2, 'n_independent': 3, 'n_shared': 3, 'momentum': 0.008731876920402911, 'mask_type': 'sparsemax'}. Best is trial 9 with value: 10.311919737380117.
[I 2025-01-08 19:09:05,300] Trial 22 finished with value: 15.004314148308424 and parameters: {'n_d': 15, 'n_steps': 7, 'gamma': 1.2809359616408238, 'cat_emb_dim': 3, 'n_independent': 2, 'n_shared': 4, 'momentum': 0.20084505878110076, 'mask_type': 'sparsemax'}. Best is trial 9 with value: 10.311919737380117.
[I 2025-01-08 19:09:28,333] Trial 23 finished with value: 17.585428352859605 and parameters: {'n_d': 34, 'n_steps': 3, 'gamma': 1.2655360147947197, 'cat_emb_dim': 3, 'n_independent': 1, 'n_shared': 1, 'momentum': 0.1960398434415317, 'mask_type': 'sparsemax'}. Best is trial 9 with value: 10.311919737380117.
[I 2025-01-08 19:10:00,315] Trial 24 finished with value: 11.229595135811538 and parameters: {'n_d': 28, 'n_steps': 4, 'gamma': 1.1058346534485364, 'cat_emb_dim': 3, 'n_independent': 1, 'n_shared': 1, 'momentum': 0.1412326018398311, 'mask_type': 'sparsemax'}. Best is trial 9 with value: 10.311919737380117.
[I 2025-01-08 19:10:26,787] Trial 25 finished with value: 11.93525634665243 and parameters: {'n_d': 51, 'n_steps': 5, 'gamma': 1.0004514036764687, 'cat_emb_dim': 3, 'n_independent': 2, 'n_shared': 1, 'momentum': 0.39301886247592527, 'mask_type': 'sparsemax'}. Best is trial 9 with value: 10.311919737380117.
[I 2025-01-08 19:10:56,279] Trial 26 finished with value: 11.089386504710614 and parameters: {'n_d': 38, 'n_steps': 3, 'gamma': 1.3783891739638303, 'cat_emb_dim': 2, 'n_independent': 1, 'n_shared': 2, 'momentum': 0.03862605241750386, 'mask_type': 'sparsemax'}. Best is trial 9 with value: 10.311919737380117.
[I 2025-01-08 19:12:00,033] Trial 27 finished with value: 18.312702983476207 and parameters: {'n_d': 37, 'n_steps': 8, 'gamma': 1.3750326436064506, 'cat_emb_dim': 2, 'n_independent': 4, 'n_shared': 2, 'momentum': 0.031019692016057386, 'mask_type': 'sparsemax'}. Best is trial 9 with value: 10.311919737380117.
[I 2025-01-08 19:13:15,211] Trial 28 finished with value: 24.20158414203366 and parameters: {'n_d': 39, 'n_steps': 6, 'gamma': 1.9918443968157213, 'cat_emb_dim': 2, 'n_independent': 5, 'n_shared': 3, 'momentum': 0.01910846830238138, 'mask_type': 'sparsemax'}. Best is trial 9 with value: 10.311919737380117.
[I 2025-01-08 19:14:08,126] Trial 29 finished with value: 21.442870963146852 and parameters: {'n_d': 49, 'n_steps': 4, 'gamma': 1.7111882197862784, 'cat_emb_dim': 1, 'n_independent': 3, 'n_shared': 2, 'momentum': 0.013327157134288016, 'mask_type': 'sparsemax'}. Best is trial 9 with value: 10.311919737380117.
[I 2025-01-08 19:15:21,151] Trial 30 finished with value: 145.35883941092374 and parameters: {'n_d': 30, 'n_steps': 7, 'gamma': 1.1599921898561019, 'cat_emb_dim': 2, 'n_independent': 4, 'n_shared': 2, 'momentum': 0.004728372229003477, 'mask_type': 'sparsemax'}. Best is trial 9 with value: 10.311919737380117.
[I 2025-01-08 19:17:21,557] Trial 31 finished with value: 18.26547947921575 and parameters: {'n_d': 24, 'n_steps': 9, 'gamma': 1.4895161256472869, 'cat_emb_dim': 2, 'n_independent': 5, 'n_shared': 5, 'momentum': 0.05482749040187737, 'mask_type': 'entmax'}. Best is trial 9 with value: 10.311919737380117.
[I 2025-01-08 19:18:19,731] Using an existing study with name 'TabNet_Socmob' instead of creating a new one.
[I 2025-01-08 19:19:21,736] Trial 2 finished with value: 6855.929962343667 and parameters: {'n_d': 64, 'n_steps': 3, 'gamma': 1.5519562457109517, 'cat_emb_dim': 3, 'n_independent': 4, 'n_shared': 2, 'momentum': 0.001702162235788082, 'mask_type': 'entmax'}. Best is trial 2 with value: 6855.929962343667.
[I 2025-01-08 19:20:05,454] Trial 3 finished with value: 1395.2840591371603 and parameters: {'n_d': 16, 'n_steps': 7, 'gamma': 1.2449946870625581, 'cat_emb_dim': 1, 'n_independent': 2, 'n_shared': 3, 'momentum': 0.001158699722161858, 'mask_type': 'entmax'}. Best is trial 3 with value: 1395.2840591371603.
[I 2025-01-08 19:23:38,402] Trial 4 finished with value: 131.07340519673642 and parameters: {'n_d': 35, 'n_steps': 8, 'gamma': 1.2175298200505318, 'cat_emb_dim': 3, 'n_independent': 3, 'n_shared': 5, 'momentum': 0.04645868647378726, 'mask_type': 'sparsemax'}. Best is trial 4 with value: 131.07340519673642.
[I 2025-01-08 19:24:13,580] Trial 5 finished with value: 4901.368174995926 and parameters: {'n_d': 61, 'n_steps': 3, 'gamma': 1.3215351332233374, 'cat_emb_dim': 1, 'n_independent': 2, 'n_shared': 2, 'momentum': 0.0012981433483976168, 'mask_type': 'sparsemax'}. Best is trial 4 with value: 131.07340519673642.
[I 2025-01-08 19:26:12,341] Trial 6 finished with value: 329.88172473006546 and parameters: {'n_d': 64, 'n_steps': 6, 'gamma': 1.5493166190453973, 'cat_emb_dim': 3, 'n_independent': 5, 'n_shared': 1, 'momentum': 0.0076649774555969195, 'mask_type': 'entmax'}. Best is trial 4 with value: 131.07340519673642.
[I 2025-01-08 19:28:12,897] Trial 7 finished with value: 370.24510821347565 and parameters: {'n_d': 59, 'n_steps': 4, 'gamma': 1.2349019221433053, 'cat_emb_dim': 1, 'n_independent': 5, 'n_shared': 5, 'momentum': 0.006508339342479301, 'mask_type': 'entmax'}. Best is trial 4 with value: 131.07340519673642.
[I 2025-01-08 19:30:05,305] Trial 8 finished with value: 247.72537340349436 and parameters: {'n_d': 50, 'n_steps': 7, 'gamma': 1.4303424983215556, 'cat_emb_dim': 2, 'n_independent': 3, 'n_shared': 4, 'momentum': 0.23834294342350426, 'mask_type': 'entmax'}. Best is trial 4 with value: 131.07340519673642.
[I 2025-01-08 19:32:16,050] Trial 9 finished with value: 220.28429062605306 and parameters: {'n_d': 45, 'n_steps': 7, 'gamma': 1.9189944180125285, 'cat_emb_dim': 3, 'n_independent': 3, 'n_shared': 3, 'momentum': 0.1847256587094684, 'mask_type': 'sparsemax'}. Best is trial 4 with value: 131.07340519673642.
[I 2025-01-08 19:34:09,701] Trial 10 finished with value: 468.78159269191326 and parameters: {'n_d': 48, 'n_steps': 10, 'gamma': 1.434777827138109, 'cat_emb_dim': 1, 'n_independent': 2, 'n_shared': 3, 'momentum': 0.0067386719117499645, 'mask_type': 'entmax'}. Best is trial 4 with value: 131.07340519673642.
[I 2025-01-08 19:35:30,382] Trial 11 finished with value: 10925.844574709337 and parameters: {'n_d': 52, 'n_steps': 9, 'gamma': 1.5148873753424887, 'cat_emb_dim': 2, 'n_independent': 3, 'n_shared': 4, 'momentum': 0.0028556091957701313, 'mask_type': 'entmax'}. Best is trial 4 with value: 131.07340519673642.
[I 2025-01-08 19:37:35,117] Trial 12 finished with value: 300.86340913499333 and parameters: {'n_d': 26, 'n_steps': 9, 'gamma': 1.0200435207020613, 'cat_emb_dim': 3, 'n_independent': 1, 'n_shared': 5, 'momentum': 0.06586624533480068, 'mask_type': 'sparsemax'}. Best is trial 4 with value: 131.07340519673642.
[I 2025-01-08 19:39:54,559] Trial 13 finished with value: 149.79068527358837 and parameters: {'n_d': 37, 'n_steps': 6, 'gamma': 1.8782629299438212, 'cat_emb_dim': 3, 'n_independent': 4, 'n_shared': 4, 'momentum': 0.06850688103039317, 'mask_type': 'sparsemax'}. Best is trial 4 with value: 131.07340519673642.
[I 2025-01-08 19:41:48,357] Trial 14 finished with value: 218.65531062069908 and parameters: {'n_d': 33, 'n_steps': 5, 'gamma': 1.9744307583799987, 'cat_emb_dim': 2, 'n_independent': 4, 'n_shared': 4, 'momentum': 0.03789649737820764, 'mask_type': 'sparsemax'}. Best is trial 4 with value: 131.07340519673642.
[I 2025-01-08 19:44:58,872] Trial 15 finished with value: 246.64996129219443 and parameters: {'n_d': 36, 'n_steps': 8, 'gamma': 1.7517313212985233, 'cat_emb_dim': 3, 'n_independent': 4, 'n_shared': 5, 'momentum': 0.08807593616458609, 'mask_type': 'sparsemax'}. Best is trial 4 with value: 131.07340519673642.
[I 2025-01-08 19:46:17,051] Trial 16 finished with value: 389.6683367681627 and parameters: {'n_d': 25, 'n_steps': 6, 'gamma': 1.0447990336182251, 'cat_emb_dim': 3, 'n_independent': 4, 'n_shared': 4, 'momentum': 0.02480754367688059, 'mask_type': 'sparsemax'}. Best is trial 4 with value: 131.07340519673642.
[I 2025-01-08 19:48:52,587] Trial 17 finished with value: 187.45424403213525 and parameters: {'n_d': 8, 'n_steps': 5, 'gamma': 1.744266848931545, 'cat_emb_dim': 2, 'n_independent': 5, 'n_shared': 5, 'momentum': 0.089515317986317, 'mask_type': 'sparsemax'}. Best is trial 4 with value: 131.07340519673642.
[I 2025-01-08 19:51:08,571] Trial 18 finished with value: 170.16846175030125 and parameters: {'n_d': 41, 'n_steps': 8, 'gamma': 1.688504168924019, 'cat_emb_dim': 3, 'n_independent': 1, 'n_shared': 4, 'momentum': 0.016234748263148736, 'mask_type': 'sparsemax'}. Best is trial 4 with value: 131.07340519673642.
[I 2025-01-08 19:55:00,798] Trial 19 finished with value: 124.51652140191399 and parameters: {'n_d': 28, 'n_steps': 8, 'gamma': 1.8543287956362964, 'cat_emb_dim': 2, 'n_independent': 4, 'n_shared': 5, 'momentum': 0.04418766718029858, 'mask_type': 'sparsemax'}. Best is trial 19 with value: 124.51652140191399.
[I 2025-01-08 19:57:56,234] Trial 20 finished with value: 512.4605240975786 and parameters: {'n_d': 27, 'n_steps': 10, 'gamma': 1.6477544685100778, 'cat_emb_dim': 2, 'n_independent': 3, 'n_shared': 5, 'momentum': 0.016089619907080344, 'mask_type': 'sparsemax'}. Best is trial 19 with value: 124.51652140191399.
[I 2025-01-08 20:00:48,281] Trial 21 finished with value: 297.54500967958575 and parameters: {'n_d': 19, 'n_steps': 8, 'gamma': 1.23987122694585, 'cat_emb_dim': 2, 'n_independent': 3, 'n_shared': 5, 'momentum': 0.038432943522122065, 'mask_type': 'sparsemax'}. Best is trial 19 with value: 124.51652140191399.
[I 2025-01-08 20:02:31,131] Trial 22 finished with value: 215.66395156725685 and parameters: {'n_d': 32, 'n_steps': 9, 'gamma': 1.1025788103497318, 'cat_emb_dim': 2, 'n_independent': 2, 'n_shared': 1, 'momentum': 0.3922626986723542, 'mask_type': 'sparsemax'}. Best is trial 19 with value: 124.51652140191399.
[I 2025-01-08 20:04:20,621] Trial 23 finished with value: 323.2269438195567 and parameters: {'n_d': 40, 'n_steps': 6, 'gamma': 1.8515291954297568, 'cat_emb_dim': 3, 'n_independent': 4, 'n_shared': 4, 'momentum': 0.04610915027280268, 'mask_type': 'sparsemax'}. Best is trial 19 with value: 124.51652140191399.
[I 2025-01-08 20:08:14,005] Trial 24 finished with value: 224.1918883342953 and parameters: {'n_d': 30, 'n_steps': 8, 'gamma': 1.852024024115296, 'cat_emb_dim': 3, 'n_independent': 4, 'n_shared': 5, 'momentum': 0.16636773173661346, 'mask_type': 'sparsemax'}. Best is trial 19 with value: 124.51652140191399.
[I 2025-01-08 20:10:35,602] Trial 25 finished with value: 179.86294297516326 and parameters: {'n_d': 21, 'n_steps': 5, 'gamma': 1.989408873188975, 'cat_emb_dim': 2, 'n_independent': 5, 'n_shared': 4, 'momentum': 0.10553584183809467, 'mask_type': 'sparsemax'}. Best is trial 19 with value: 124.51652140191399.
[I 2025-01-08 20:13:31,721] Trial 26 finished with value: 235.29198676667107 and parameters: {'n_d': 39, 'n_steps': 7, 'gamma': 1.830029459495767, 'cat_emb_dim': 2, 'n_independent': 4, 'n_shared': 5, 'momentum': 0.02598693838998723, 'mask_type': 'sparsemax'}. Best is trial 19 with value: 124.51652140191399.
[I 2025-01-08 20:16:15,706] Trial 27 finished with value: 211.49641207175986 and parameters: {'n_d': 35, 'n_steps': 9, 'gamma': 1.6413937687527684, 'cat_emb_dim': 3, 'n_independent': 3, 'n_shared': 3, 'momentum': 0.05621005252879335, 'mask_type': 'sparsemax'}. Best is trial 19 with value: 124.51652140191399.
[I 2025-01-08 20:17:53,332] Trial 28 finished with value: 674.6123048347763 and parameters: {'n_d': 13, 'n_steps': 8, 'gamma': 1.146297152315308, 'cat_emb_dim': 3, 'n_independent': 4, 'n_shared': 4, 'momentum': 0.01110505395373186, 'mask_type': 'sparsemax'}. Best is trial 19 with value: 124.51652140191399.
[I 2025-01-08 20:20:28,587] Trial 29 finished with value: 234.95150542111764 and parameters: {'n_d': 43, 'n_steps': 6, 'gamma': 1.3469933032496197, 'cat_emb_dim': 2, 'n_independent': 5, 'n_shared': 5, 'momentum': 0.030030349750783725, 'mask_type': 'sparsemax'}. Best is trial 19 with value: 124.51652140191399.
[I 2025-01-08 20:24:09,736] Trial 30 finished with value: 97.0297532025608 and parameters: {'n_d': 29, 'n_steps': 7, 'gamma': 1.7740361293896294, 'cat_emb_dim': 3, 'n_independent': 4, 'n_shared': 5, 'momentum': 0.13153313619311685, 'mask_type': 'sparsemax'}. Best is trial 30 with value: 97.0297532025608.
[I 2025-01-08 20:26:26,118] Trial 31 finished with value: 225.7163103508964 and parameters: {'n_d': 22, 'n_steps': 7, 'gamma': 1.7804437073606585, 'cat_emb_dim': 3, 'n_independent': 3, 'n_shared': 2, 'momentum': 0.1278471905704282, 'mask_type': 'sparsemax'}. Best is trial 30 with value: 97.0297532025608.
[I 2025-01-08 20:30:13,251] Using an existing study with name 'TabNet_Sensory' instead of creating a new one.
[I 2025-01-08 20:31:21,458] Trial 2 finished with value: 2.9536999137354334 and parameters: {'n_d': 62, 'n_steps': 4, 'gamma': 1.284851952475202, 'cat_emb_dim': 2, 'n_independent': 5, 'n_shared': 2, 'momentum': 0.007243977843279017, 'mask_type': 'sparsemax'}. Best is trial 2 with value: 2.9536999137354334.
[I 2025-01-08 20:32:12,327] Trial 3 finished with value: 2.1832985978516097 and parameters: {'n_d': 59, 'n_steps': 7, 'gamma': 1.8047525672319384, 'cat_emb_dim': 3, 'n_independent': 1, 'n_shared': 4, 'momentum': 0.013241556928550086, 'mask_type': 'sparsemax'}. Best is trial 3 with value: 2.1832985978516097.
[I 2025-01-08 20:33:23,869] Trial 4 finished with value: 2.796960723910871 and parameters: {'n_d': 26, 'n_steps': 4, 'gamma': 1.0991259901325048, 'cat_emb_dim': 3, 'n_independent': 5, 'n_shared': 2, 'momentum': 0.008060736705712356, 'mask_type': 'sparsemax'}. Best is trial 3 with value: 2.1832985978516097.
[I 2025-01-08 20:35:05,054] Trial 5 finished with value: 0.6851242871235752 and parameters: {'n_d': 8, 'n_steps': 10, 'gamma': 1.4213981589800861, 'cat_emb_dim': 3, 'n_independent': 4, 'n_shared': 3, 'momentum': 0.3939307871673897, 'mask_type': 'sparsemax'}. Best is trial 5 with value: 0.6851242871235752.
[I 2025-01-08 20:35:37,624] Trial 6 finished with value: 12.431582427123526 and parameters: {'n_d': 30, 'n_steps': 6, 'gamma': 1.9560498962769262, 'cat_emb_dim': 3, 'n_independent': 2, 'n_shared': 2, 'momentum': 0.0017474862947623624, 'mask_type': 'entmax'}. Best is trial 5 with value: 0.6851242871235752.
[I 2025-01-08 20:36:36,493] Trial 7 finished with value: 0.8393068224304615 and parameters: {'n_d': 50, 'n_steps': 10, 'gamma': 1.1813066019832537, 'cat_emb_dim': 1, 'n_independent': 1, 'n_shared': 2, 'momentum': 0.08258713192446203, 'mask_type': 'sparsemax'}. Best is trial 5 with value: 0.6851242871235752.
[I 2025-01-08 20:38:06,706] Trial 8 finished with value: 1.0958428229681854 and parameters: {'n_d': 21, 'n_steps': 8, 'gamma': 1.3096372237927867, 'cat_emb_dim': 2, 'n_independent': 5, 'n_shared': 2, 'momentum': 0.014418993698980977, 'mask_type': 'sparsemax'}. Best is trial 5 with value: 0.6851242871235752.
[I 2025-01-08 20:39:37,657] Trial 9 finished with value: 1.0476581591854628 and parameters: {'n_d': 44, 'n_steps': 10, 'gamma': 1.4486131924750691, 'cat_emb_dim': 1, 'n_independent': 3, 'n_shared': 3, 'momentum': 0.1777500005363947, 'mask_type': 'sparsemax'}. Best is trial 5 with value: 0.6851242871235752.
[I 2025-01-08 20:40:56,815] Trial 10 finished with value: 2.235010367717337 and parameters: {'n_d': 43, 'n_steps': 4, 'gamma': 1.1555572460191965, 'cat_emb_dim': 3, 'n_independent': 4, 'n_shared': 4, 'momentum': 0.006989167317429857, 'mask_type': 'entmax'}. Best is trial 5 with value: 0.6851242871235752.
[I 2025-01-08 20:42:00,248] Trial 11 finished with value: 0.6142472026058163 and parameters: {'n_d': 36, 'n_steps': 3, 'gamma': 1.388821763310974, 'cat_emb_dim': 2, 'n_independent': 4, 'n_shared': 5, 'momentum': 0.02703589407723621, 'mask_type': 'entmax'}. Best is trial 11 with value: 0.6142472026058163.
