[I 2025-01-09 17:00:49,501] Trial 42 finished with value: 4.320485751685985 and parameters: {'n_d': 30, 'n_steps': 5, 'gamma': 1.6567869549960623, 'cat_emb_dim': 1, 'n_independent': 5, 'n_shared': 1, 'momentum': 0.02206421281010475, 'mask_type': 'entmax'}. Best is trial 15 with value: 4.288619590394546.
[I 2025-01-09 17:07:44,567] Trial 43 finished with value: 4.510227838550787 and parameters: {'n_d': 35, 'n_steps': 6, 'gamma': 1.4672749264352793, 'cat_emb_dim': 1, 'n_independent': 3, 'n_shared': 2, 'momentum': 0.012728910240201459, 'mask_type': 'entmax'}. Best is trial 15 with value: 4.288619590394546.
[I 2025-01-09 17:14:46,091] Trial 44 finished with value: 4.4750593998364305 and parameters: {'n_d': 44, 'n_steps': 5, 'gamma': 1.6203025363933772, 'cat_emb_dim': 1, 'n_independent': 4, 'n_shared': 2, 'momentum': 0.008975423783462468, 'mask_type': 'entmax'}. Best is trial 15 with value: 4.288619590394546.
[I 2025-01-09 17:22:12,075] Trial 45 finished with value: 4.270730953306054 and parameters: {'n_d': 40, 'n_steps': 7, 'gamma': 1.6022311227375208, 'cat_emb_dim': 1, 'n_independent': 3, 'n_shared': 1, 'momentum': 0.29959147175211237, 'mask_type': 'entmax'}. Best is trial 45 with value: 4.270730953306054.
[I 2025-01-09 17:28:56,362] Trial 46 finished with value: 4.398544410924464 and parameters: {'n_d': 40, 'n_steps': 8, 'gamma': 1.7946754495089696, 'cat_emb_dim': 1, 'n_independent': 3, 'n_shared': 1, 'momentum': 0.06637333196768595, 'mask_type': 'entmax'}. Best is trial 45 with value: 4.270730953306054.
[I 2025-01-09 17:35:42,342] Trial 47 finished with value: 4.506155341478619 and parameters: {'n_d': 46, 'n_steps': 7, 'gamma': 1.8186250251246987, 'cat_emb_dim': 3, 'n_independent': 4, 'n_shared': 1, 'momentum': 0.12715255923093174, 'mask_type': 'sparsemax'}. Best is trial 45 with value: 4.270730953306054.
[I 2025-01-09 17:43:24,385] Trial 48 finished with value: 4.536049937042199 and parameters: {'n_d': 50, 'n_steps': 7, 'gamma': 1.5650106506525527, 'cat_emb_dim': 1, 'n_independent': 3, 'n_shared': 1, 'momentum': 0.0054234929124173095, 'mask_type': 'entmax'}. Best is trial 45 with value: 4.270730953306054.
[I 2025-01-09 17:49:57,367] Trial 49 finished with value: 4.311272179889096 and parameters: {'n_d': 9, 'n_steps': 6, 'gamma': 1.72792787660769, 'cat_emb_dim': 1, 'n_independent': 5, 'n_shared': 2, 'momentum': 0.048561703964474456, 'mask_type': 'entmax'}. Best is trial 45 with value: 4.270730953306054.
[I 2025-01-09 17:57:15,258] Trial 50 finished with value: 4.426837283825995 and parameters: {'n_d': 42, 'n_steps': 8, 'gamma': 1.504150499357845, 'cat_emb_dim': 1, 'n_independent': 3, 'n_shared': 1, 'momentum': 0.029709404169910268, 'mask_type': 'entmax'}. Best is trial 45 with value: 4.270730953306054.
[I 2025-01-09 18:02:27,290] Trial 51 finished with value: 4.3656485825134626 and parameters: {'n_d': 26, 'n_steps': 6, 'gamma': 1.6112612180777612, 'cat_emb_dim': 1, 'n_independent': 3, 'n_shared': 2, 'momentum': 0.2985884297306278, 'mask_type': 'entmax'}. Best is trial 45 with value: 4.270730953306054.
[I 2025-01-09 18:08:38,329] Trial 52 finished with value: 4.282623612042941 and parameters: {'n_d': 35, 'n_steps': 5, 'gamma': 1.625179901902365, 'cat_emb_dim': 1, 'n_independent': 4, 'n_shared': 1, 'momentum': 0.3081240130044959, 'mask_type': 'entmax'}. Best is trial 45 with value: 4.270730953306054.
[I 2025-01-09 18:15:16,588] Trial 53 finished with value: 4.2565001165593985 and parameters: {'n_d': 36, 'n_steps': 5, 'gamma': 1.8688056230129764, 'cat_emb_dim': 1, 'n_independent': 5, 'n_shared': 1, 'momentum': 0.1437247242671164, 'mask_type': 'entmax'}. Best is trial 53 with value: 4.2565001165593985.
[I 2025-01-09 18:22:09,353] Trial 54 finished with value: 4.299590493845742 and parameters: {'n_d': 37, 'n_steps': 5, 'gamma': 1.8639368361389117, 'cat_emb_dim': 1, 'n_independent': 5, 'n_shared': 1, 'momentum': 0.14776637614311108, 'mask_type': 'entmax'}. Best is trial 53 with value: 4.2565001165593985.
[I 2025-01-09 18:30:29,035] Trial 55 finished with value: 4.277197707529931 and parameters: {'n_d': 40, 'n_steps': 7, 'gamma': 1.9769507703641984, 'cat_emb_dim': 1, 'n_independent': 5, 'n_shared': 1, 'momentum': 0.0875328475708486, 'mask_type': 'entmax'}. Best is trial 53 with value: 4.2565001165593985.
[I 2025-01-09 18:37:18,366] Trial 56 finished with value: 4.3249945406018995 and parameters: {'n_d': 36, 'n_steps': 7, 'gamma': 1.9282088329371416, 'cat_emb_dim': 1, 'n_independent': 5, 'n_shared': 1, 'momentum': 0.0796618913356499, 'mask_type': 'entmax'}. Best is trial 53 with value: 4.2565001165593985.
[I 2025-01-09 18:44:31,929] Trial 57 finished with value: 4.317476974345447 and parameters: {'n_d': 34, 'n_steps': 7, 'gamma': 1.9885209344883816, 'cat_emb_dim': 1, 'n_independent': 5, 'n_shared': 1, 'momentum': 0.1838995433868495, 'mask_type': 'entmax'}. Best is trial 53 with value: 4.2565001165593985.
[I 2025-01-09 18:54:00,612] Trial 58 finished with value: 4.421582577000864 and parameters: {'n_d': 40, 'n_steps': 9, 'gamma': 1.896561716819527, 'cat_emb_dim': 3, 'n_independent': 5, 'n_shared': 1, 'momentum': 0.01703766743061781, 'mask_type': 'entmax'}. Best is trial 53 with value: 4.2565001165593985.
[I 2025-01-09 19:03:17,878] Trial 59 finished with value: 4.262116611554103 and parameters: {'n_d': 45, 'n_steps': 6, 'gamma': 1.9417195553627524, 'cat_emb_dim': 1, 'n_independent': 5, 'n_shared': 1, 'momentum': 0.2216973795669414, 'mask_type': 'entmax'}. Best is trial 53 with value: 4.2565001165593985.
[I 2025-01-09 19:13:58,633] Trial 60 finished with value: 4.35826713535536 and parameters: {'n_d': 47, 'n_steps': 8, 'gamma': 1.9545699155901939, 'cat_emb_dim': 1, 'n_independent': 5, 'n_shared': 1, 'momentum': 0.231614009461914, 'mask_type': 'sparsemax'}. Best is trial 53 with value: 4.2565001165593985.
[I 2025-01-09 19:22:45,455] Trial 61 finished with value: 4.325571234219858 and parameters: {'n_d': 45, 'n_steps': 6, 'gamma': 1.8372180428333125, 'cat_emb_dim': 1, 'n_independent': 5, 'n_shared': 1, 'momentum': 0.1665787877326505, 'mask_type': 'entmax'}. Best is trial 53 with value: 4.2565001165593985.
[I 2025-01-09 19:30:23,031] Trial 62 finished with value: 4.300127510986391 and parameters: {'n_d': 41, 'n_steps': 6, 'gamma': 1.7323748601370375, 'cat_emb_dim': 1, 'n_independent': 5, 'n_shared': 1, 'momentum': 0.22198548222623923, 'mask_type': 'entmax'}. Best is trial 53 with value: 4.2565001165593985.
[I 2025-01-09 19:39:02,775] Trial 63 finished with value: 4.279296709459192 and parameters: {'n_d': 38, 'n_steps': 7, 'gamma': 1.7658952065107467, 'cat_emb_dim': 1, 'n_independent': 5, 'n_shared': 1, 'momentum': 0.10141316756689624, 'mask_type': 'entmax'}. Best is trial 53 with value: 4.2565001165593985.
[I 2025-01-09 19:45:48,134] Trial 64 finished with value: 4.360860369555202 and parameters: {'n_d': 38, 'n_steps': 7, 'gamma': 1.903018100086237, 'cat_emb_dim': 1, 'n_independent': 4, 'n_shared': 1, 'momentum': 0.09966535689203618, 'mask_type': 'entmax'}. Best is trial 53 with value: 4.2565001165593985.
[I 2025-01-09 19:53:54,726] Trial 65 finished with value: 4.350785492423375 and parameters: {'n_d': 31, 'n_steps': 7, 'gamma': 1.9533320706062818, 'cat_emb_dim': 1, 'n_independent': 4, 'n_shared': 1, 'momentum': 0.05224901174493804, 'mask_type': 'entmax'}. Best is trial 53 with value: 4.2565001165593985.
[I 2025-01-09 20:02:25,802] Trial 66 finished with value: 4.261971393551037 and parameters: {'n_d': 48, 'n_steps': 7, 'gamma': 1.8698082497070838, 'cat_emb_dim': 1, 'n_independent': 5, 'n_shared': 2, 'momentum': 0.2688664091800091, 'mask_type': 'entmax'}. Best is trial 53 with value: 4.2565001165593985.
[I 2025-01-09 20:10:30,399] Trial 67 finished with value: 4.303002232690098 and parameters: {'n_d': 37, 'n_steps': 7, 'gamma': 1.7748053899400023, 'cat_emb_dim': 1, 'n_independent': 5, 'n_shared': 2, 'momentum': 0.33366789689789655, 'mask_type': 'entmax'}. Best is trial 53 with value: 4.2565001165593985.
[I 2025-01-09 20:18:38,180] Trial 68 finished with value: 4.266678920089242 and parameters: {'n_d': 52, 'n_steps': 8, 'gamma': 1.8863092703408746, 'cat_emb_dim': 1, 'n_independent': 5, 'n_shared': 1, 'momentum': 0.25082885368888036, 'mask_type': 'entmax'}. Best is trial 53 with value: 4.2565001165593985.
[I 2025-01-09 20:29:46,216] Trial 69 finished with value: 4.309738675906593 and parameters: {'n_d': 52, 'n_steps': 8, 'gamma': 1.854775941369081, 'cat_emb_dim': 1, 'n_independent': 5, 'n_shared': 2, 'momentum': 0.16001442291774842, 'mask_type': 'entmax'}. Best is trial 53 with value: 4.2565001165593985.
[I 2025-01-09 20:37:50,939] Trial 70 finished with value: 4.439144954148992 and parameters: {'n_d': 48, 'n_steps': 8, 'gamma': 1.8842983645559588, 'cat_emb_dim': 1, 'n_independent': 5, 'n_shared': 1, 'momentum': 0.269891809363747, 'mask_type': 'entmax'}. Best is trial 53 with value: 4.2565001165593985.
[I 2025-01-09 20:46:01,110] Trial 71 finished with value: 4.336016167634251 and parameters: {'n_d': 46, 'n_steps': 7, 'gamma': 1.9470061865340622, 'cat_emb_dim': 1, 'n_independent': 5, 'n_shared': 1, 'momentum': 0.19873840454507571, 'mask_type': 'entmax'}. Best is trial 53 with value: 4.2565001165593985.
[I 2025-01-09 20:54:50,543] Trial 72 finished with value: 4.321907115705454 and parameters: {'n_d': 56, 'n_steps': 9, 'gamma': 1.9996087531424263, 'cat_emb_dim': 1, 'n_independent': 5, 'n_shared': 1, 'momentum': 0.2472819837931043, 'mask_type': 'entmax'}. Best is trial 53 with value: 4.2565001165593985.
[I 2025-01-09 21:05:55,073] Trial 73 finished with value: 4.268410958472717 and parameters: {'n_d': 34, 'n_steps': 8, 'gamma': 1.9193511323595405, 'cat_emb_dim': 1, 'n_independent': 5, 'n_shared': 1, 'momentum': 0.1137239955529668, 'mask_type': 'entmax'}. Best is trial 53 with value: 4.2565001165593985.
[I 2025-01-09 21:15:39,837] Trial 74 finished with value: 4.3370233408924905 and parameters: {'n_d': 38, 'n_steps': 8, 'gamma': 1.9219843704670925, 'cat_emb_dim': 1, 'n_independent': 5, 'n_shared': 1, 'momentum': 0.09241798463429508, 'mask_type': 'entmax'}. Best is trial 53 with value: 4.2565001165593985.
[I 2025-01-09 21:25:02,768] Trial 75 finished with value: 4.310779258574928 and parameters: {'n_d': 49, 'n_steps': 8, 'gamma': 1.8190822964628295, 'cat_emb_dim': 1, 'n_independent': 5, 'n_shared': 1, 'momentum': 0.06387531270571024, 'mask_type': 'entmax'}. Best is trial 53 with value: 4.2565001165593985.
[I 2025-01-09 21:37:15,521] Trial 76 finished with value: 4.229906542148475 and parameters: {'n_d': 33, 'n_steps': 9, 'gamma': 1.8704976362400025, 'cat_emb_dim': 1, 'n_independent': 5, 'n_shared': 2, 'momentum': 0.1107777730479582, 'mask_type': 'entmax'}. Best is trial 76 with value: 4.229906542148475.
[I 2025-01-09 21:48:07,714] Trial 77 finished with value: 4.5303401962800365 and parameters: {'n_d': 33, 'n_steps': 9, 'gamma': 1.873384396600527, 'cat_emb_dim': 1, 'n_independent': 5, 'n_shared': 2, 'momentum': 0.14044058687758046, 'mask_type': 'entmax'}. Best is trial 76 with value: 4.229906542148475.
[I 2025-01-09 22:01:31,182] Trial 78 finished with value: 4.557380925670965 and parameters: {'n_d': 55, 'n_steps': 10, 'gamma': 1.9749674816446068, 'cat_emb_dim': 2, 'n_independent': 5, 'n_shared': 2, 'momentum': 0.11532739634299592, 'mask_type': 'sparsemax'}. Best is trial 76 with value: 4.229906542148475.
[I 2025-01-09 22:11:57,853] Trial 79 finished with value: 4.317818495468063 and parameters: {'n_d': 29, 'n_steps': 9, 'gamma': 1.9167785771918247, 'cat_emb_dim': 1, 'n_independent': 5, 'n_shared': 2, 'momentum': 0.2013059317967327, 'mask_type': 'entmax'}. Best is trial 76 with value: 4.229906542148475.
[I 2025-01-09 22:23:31,296] Trial 80 finished with value: 4.283026026177531 and parameters: {'n_d': 51, 'n_steps': 8, 'gamma': 1.8466969930548138, 'cat_emb_dim': 2, 'n_independent': 5, 'n_shared': 3, 'momentum': 0.3536530384258791, 'mask_type': 'entmax'}. Best is trial 76 with value: 4.229906542148475.
[I 2025-01-09 22:33:21,322] Trial 81 finished with value: 4.273195350118219 and parameters: {'n_d': 60, 'n_steps': 7, 'gamma': 1.7668653642072543, 'cat_emb_dim': 1, 'n_independent': 5, 'n_shared': 1, 'momentum': 0.10789319153666062, 'mask_type': 'entmax'}. Best is trial 76 with value: 4.229906542148475.
[I 2025-01-09 22:41:46,971] Trial 82 finished with value: 4.394660008505424 and parameters: {'n_d': 61, 'n_steps': 7, 'gamma': 1.811229140168992, 'cat_emb_dim': 1, 'n_independent': 5, 'n_shared': 1, 'momentum': 0.07722469389097594, 'mask_type': 'entmax'}. Best is trial 76 with value: 4.229906542148475.
[I 2025-01-09 22:51:04,370] Trial 83 finished with value: 4.386348497387918 and parameters: {'n_d': 59, 'n_steps': 8, 'gamma': 1.9665011825837018, 'cat_emb_dim': 1, 'n_independent': 5, 'n_shared': 1, 'momentum': 0.14919444380262517, 'mask_type': 'entmax'}. Best is trial 76 with value: 4.229906542148475.
[I 2025-01-09 23:03:09,467] Trial 84 finished with value: 4.33133130669109 and parameters: {'n_d': 44, 'n_steps': 10, 'gamma': 1.9391841972345765, 'cat_emb_dim': 1, 'n_independent': 5, 'n_shared': 1, 'momentum': 0.11769612235047235, 'mask_type': 'entmax'}. Best is trial 76 with value: 4.229906542148475.
[I 2025-01-09 23:11:00,122] Trial 85 finished with value: 4.404725774338796 and parameters: {'n_d': 42, 'n_steps': 8, 'gamma': 1.8837762221799685, 'cat_emb_dim': 1, 'n_independent': 5, 'n_shared': 1, 'momentum': 0.037086348819720096, 'mask_type': 'entmax'}. Best is trial 76 with value: 4.229906542148475.
[I 2025-01-09 23:20:26,169] Trial 86 finished with value: 4.3206570343054445 and parameters: {'n_d': 64, 'n_steps': 7, 'gamma': 1.716935093091572, 'cat_emb_dim': 1, 'n_independent': 4, 'n_shared': 3, 'momentum': 0.08525523373413538, 'mask_type': 'entmax'}. Best is trial 76 with value: 4.229906542148475.
[I 2025-01-09 23:27:22,438] Trial 87 finished with value: 4.478399871332712 and parameters: {'n_d': 62, 'n_steps': 7, 'gamma': 1.7784464665033635, 'cat_emb_dim': 1, 'n_independent': 5, 'n_shared': 1, 'momentum': 0.05569977218813148, 'mask_type': 'entmax'}. Best is trial 76 with value: 4.229906542148475.
[I 2025-01-09 23:38:06,346] Trial 88 finished with value: 4.322219426010458 and parameters: {'n_d': 53, 'n_steps': 8, 'gamma': 1.9043192270595128, 'cat_emb_dim': 1, 'n_independent': 5, 'n_shared': 2, 'momentum': 0.2566787418645493, 'mask_type': 'entmax'}. Best is trial 76 with value: 4.229906542148475.
[I 2025-01-09 23:51:01,750] Trial 89 finished with value: 4.326506640105366 and parameters: {'n_d': 32, 'n_steps': 9, 'gamma': 1.8358488838165326, 'cat_emb_dim': 1, 'n_independent': 5, 'n_shared': 1, 'momentum': 0.17764579777236894, 'mask_type': 'entmax'}. Best is trial 76 with value: 4.229906542148475.
[I 2025-01-09 23:58:40,973] Trial 90 finished with value: 4.406033841636853 and parameters: {'n_d': 34, 'n_steps': 6, 'gamma': 1.6983734246526168, 'cat_emb_dim': 1, 'n_independent': 5, 'n_shared': 1, 'momentum': 0.13261049374630365, 'mask_type': 'sparsemax'}. Best is trial 76 with value: 4.229906542148475.
[I 2025-01-10 00:05:44,905] Trial 91 finished with value: 4.263335577069915 and parameters: {'n_d': 39, 'n_steps': 7, 'gamma': 1.8766347457334076, 'cat_emb_dim': 1, 'n_independent': 5, 'n_shared': 1, 'momentum': 0.21608013040412805, 'mask_type': 'entmax'}. Best is trial 76 with value: 4.229906542148475.
[I 2025-01-10 00:13:08,210] Trial 92 finished with value: 4.383985358551213 and parameters: {'n_d': 41, 'n_steps': 7, 'gamma': 1.8723180022228012, 'cat_emb_dim': 1, 'n_independent': 5, 'n_shared': 1, 'momentum': 0.20622329334472972, 'mask_type': 'entmax'}. Best is trial 76 with value: 4.229906542148475.
[I 2025-01-10 00:21:35,301] Trial 93 finished with value: 4.275522214323575 and parameters: {'n_d': 43, 'n_steps': 7, 'gamma': 1.9236112458117538, 'cat_emb_dim': 1, 'n_independent': 5, 'n_shared': 1, 'momentum': 0.2767591295746588, 'mask_type': 'entmax'}. Best is trial 76 with value: 4.229906542148475.
[I 2025-01-10 00:28:53,767] Trial 94 finished with value: 4.310038553376665 and parameters: {'n_d': 36, 'n_steps': 7, 'gamma': 1.7543766935612606, 'cat_emb_dim': 1, 'n_independent': 5, 'n_shared': 1, 'momentum': 0.27714902414135956, 'mask_type': 'entmax'}. Best is trial 76 with value: 4.229906542148475.
[I 2025-01-10 00:36:12,121] Trial 95 finished with value: 4.326227888904965 and parameters: {'n_d': 43, 'n_steps': 6, 'gamma': 1.8070338591575827, 'cat_emb_dim': 1, 'n_independent': 5, 'n_shared': 1, 'momentum': 0.3444844549079972, 'mask_type': 'entmax'}. Best is trial 76 with value: 4.229906542148475.
[I 2025-01-10 00:43:55,764] Trial 96 finished with value: 4.293065357805221 and parameters: {'n_d': 39, 'n_steps': 8, 'gamma': 1.9301789252549495, 'cat_emb_dim': 1, 'n_independent': 4, 'n_shared': 1, 'momentum': 0.22249450361153145, 'mask_type': 'entmax'}. Best is trial 76 with value: 4.229906542148475.
[I 2025-01-10 00:50:23,774] Trial 97 finished with value: 4.450878829525855 and parameters: {'n_d': 45, 'n_steps': 7, 'gamma': 1.8391903382178605, 'cat_emb_dim': 1, 'n_independent': 5, 'n_shared': 1, 'momentum': 0.16687300636816857, 'mask_type': 'entmax'}. Best is trial 76 with value: 4.229906542148475.
[I 2025-01-10 01:04:10,339] Trial 98 finished with value: 4.252669624953028 and parameters: {'n_d': 49, 'n_steps': 9, 'gamma': 1.790510529278699, 'cat_emb_dim': 1, 'n_independent': 5, 'n_shared': 2, 'momentum': 0.30291550861989824, 'mask_type': 'entmax'}. Best is trial 76 with value: 4.229906542148475.
[I 2025-01-10 01:15:29,706] Trial 99 finished with value: 4.349564562597713 and parameters: {'n_d': 48, 'n_steps': 9, 'gamma': 1.7880658505871092, 'cat_emb_dim': 1, 'n_independent': 5, 'n_shared': 2, 'momentum': 0.39340632965746397, 'mask_type': 'entmax'}. Best is trial 76 with value: 4.229906542148475.
[I 2025-01-10 01:28:07,021] A new study created in RDB with name: TabNet_NYC_Taxi
slurmstepd: error: Detected 1 oom-kill event(s) in StepId=949201.2. Some of your processes may have been killed by the cgroup out-of-memory handler.
srun: error: stud-000: task 0: Out Of Memory
[I 2025-01-10 04:48:17,319] A new study created in RDB with name: TabNet_House_Sales
[I 2025-01-10 05:11:19,462] Trial 0 finished with value: 16980127798.010761 and parameters: {'n_d': 32, 'n_steps': 4, 'gamma': 1.4288853107115478, 'cat_emb_dim': 1, 'n_independent': 1, 'n_shared': 1, 'momentum': 0.010351672909306607, 'mask_type': 'entmax'}. Best is trial 0 with value: 16980127798.010761.
[I 2025-01-10 05:54:50,988] Trial 1 finished with value: 15097435312.279827 and parameters: {'n_d': 55, 'n_steps': 7, 'gamma': 1.4741351670576621, 'cat_emb_dim': 2, 'n_independent': 5, 'n_shared': 5, 'momentum': 0.35283418501370656, 'mask_type': 'entmax'}. Best is trial 1 with value: 15097435312.279827.
