[I 2025-01-23 13:45:08,091] Using an existing study with name 'TabNet_Diamonds' instead of creating a new one.
[I 2025-01-23 14:56:23,547] Trial 111 finished with value: 321382.71927076613 and parameters: {'n_d': 27, 'n_steps': 3, 'gamma': 1.180198536690575, 'cat_emb_dim': 2, 'n_independent': 4, 'n_shared': 5, 'momentum': 0.030416282273883672, 'mask_type': 'entmax'}. Best is trial 27 with value: 295490.8463921569.
[I 2025-01-23 16:52:25,504] Trial 112 finished with value: 331636.1317874281 and parameters: {'n_d': 62, 'n_steps': 8, 'gamma': 1.3623761987708853, 'cat_emb_dim': 3, 'n_independent': 3, 'n_shared': 3, 'momentum': 0.0024411570142905377, 'mask_type': 'entmax'}. Best is trial 27 with value: 295490.8463921569.
[I 2025-01-23 17:47:25,986] Trial 113 finished with value: 334799.8324966035 and parameters: {'n_d': 57, 'n_steps': 3, 'gamma': 1.1739134608976016, 'cat_emb_dim': 2, 'n_independent': 4, 'n_shared': 3, 'momentum': 0.005429475942919865, 'mask_type': 'entmax'}. Best is trial 27 with value: 295490.8463921569.
[I 2025-01-23 18:43:06,041] Trial 114 finished with value: 305634.77658504236 and parameters: {'n_d': 59, 'n_steps': 3, 'gamma': 1.160414979979283, 'cat_emb_dim': 2, 'n_independent': 4, 'n_shared': 3, 'momentum': 0.1360410314653014, 'mask_type': 'entmax'}. Best is trial 27 with value: 295490.8463921569.
[I 2025-01-23 19:45:04,493] Trial 115 finished with value: 304524.06098699477 and parameters: {'n_d': 64, 'n_steps': 3, 'gamma': 1.1180350889243347, 'cat_emb_dim': 2, 'n_independent': 4, 'n_shared': 3, 'momentum': 0.17022960027236486, 'mask_type': 'entmax'}. Best is trial 27 with value: 295490.8463921569.
[I 2025-01-23 20:43:27,506] Trial 116 finished with value: 313272.56572566065 and parameters: {'n_d': 63, 'n_steps': 3, 'gamma': 1.092315554079956, 'cat_emb_dim': 2, 'n_independent': 4, 'n_shared': 3, 'momentum': 0.14303451341020573, 'mask_type': 'entmax'}. Best is trial 27 with value: 295490.8463921569.
[I 2025-01-23 22:06:32,142] Trial 117 finished with value: 296127.17066064035 and parameters: {'n_d': 61, 'n_steps': 3, 'gamma': 1.118866027918218, 'cat_emb_dim': 2, 'n_independent': 4, 'n_shared': 3, 'momentum': 0.17533567314912962, 'mask_type': 'entmax'}. Best is trial 27 with value: 295490.8463921569.
[I 2025-01-23 23:18:27,709] Trial 118 finished with value: 306359.3064120016 and parameters: {'n_d': 64, 'n_steps': 3, 'gamma': 1.1186496952553877, 'cat_emb_dim': 2, 'n_independent': 4, 'n_shared': 3, 'momentum': 0.17353992313500882, 'mask_type': 'entmax'}. Best is trial 27 with value: 295490.8463921569.
[I 2025-01-23 23:58:07,654] Trial 119 finished with value: 326605.0833572241 and parameters: {'n_d': 60, 'n_steps': 3, 'gamma': 1.0660410779761473, 'cat_emb_dim': 2, 'n_independent': 4, 'n_shared': 3, 'momentum': 0.11826467293146682, 'mask_type': 'entmax'}. Best is trial 27 with value: 295490.8463921569.
[I 2025-01-24 01:16:43,291] Trial 120 finished with value: 297797.818082712 and parameters: {'n_d': 62, 'n_steps': 3, 'gamma': 1.1484170073111823, 'cat_emb_dim': 2, 'n_independent': 4, 'n_shared': 3, 'momentum': 0.22725510587429543, 'mask_type': 'entmax'}. Best is trial 27 with value: 295490.8463921569.
[I 2025-01-24 02:19:35,267] Trial 121 finished with value: 608260.3500612517 and parameters: {'n_d': 62, 'n_steps': 3, 'gamma': 1.1419077998069134, 'cat_emb_dim': 2, 'n_independent': 4, 'n_shared': 3, 'momentum': 0.23366289388696151, 'mask_type': 'entmax'}. Best is trial 27 with value: 295490.8463921569.
[I 2025-01-24 03:19:23,925] Trial 122 finished with value: 402312.76752147696 and parameters: {'n_d': 61, 'n_steps': 3, 'gamma': 1.2021028035407952, 'cat_emb_dim': 2, 'n_independent': 4, 'n_shared': 3, 'momentum': 0.13439665307016324, 'mask_type': 'entmax'}. Best is trial 27 with value: 295490.8463921569.
[I 2025-01-24 04:15:54,622] Trial 123 finished with value: 322382.13034395635 and parameters: {'n_d': 64, 'n_steps': 3, 'gamma': 1.9960976045279124, 'cat_emb_dim': 2, 'n_independent': 4, 'n_shared': 3, 'momentum': 0.15651006927011585, 'mask_type': 'entmax'}. Best is trial 27 with value: 295490.8463921569.
[I 2025-01-24 05:38:22,550] Trial 124 finished with value: 312035.3944428288 and parameters: {'n_d': 61, 'n_steps': 3, 'gamma': 1.1562808429660585, 'cat_emb_dim': 2, 'n_independent': 4, 'n_shared': 3, 'momentum': 0.1892111610696083, 'mask_type': 'entmax'}. Best is trial 27 with value: 295490.8463921569.
[I 2025-01-24 07:00:28,167] Trial 125 finished with value: 379923.38385495276 and parameters: {'n_d': 59, 'n_steps': 3, 'gamma': 1.0861507703919315, 'cat_emb_dim': 2, 'n_independent': 4, 'n_shared': 3, 'momentum': 0.2817944922065579, 'mask_type': 'entmax'}. Best is trial 27 with value: 295490.8463921569.
[I 2025-01-24 08:08:43,787] Trial 126 finished with value: 309052.5054812722 and parameters: {'n_d': 32, 'n_steps': 3, 'gamma': 1.111574881892305, 'cat_emb_dim': 3, 'n_independent': 4, 'n_shared': 3, 'momentum': 0.3506609580596395, 'mask_type': 'entmax'}. Best is trial 27 with value: 295490.8463921569.
[I 2025-01-24 09:24:04,773] Trial 127 finished with value: 309351.3131337734 and parameters: {'n_d': 36, 'n_steps': 3, 'gamma': 1.0616252397892794, 'cat_emb_dim': 2, 'n_independent': 4, 'n_shared': 3, 'momentum': 0.22371312014504244, 'mask_type': 'entmax'}. Best is trial 27 with value: 295490.8463921569.
[I 2025-01-24 10:47:14,534] Trial 128 finished with value: 461280.3056031053 and parameters: {'n_d': 63, 'n_steps': 7, 'gamma': 1.1339835748238747, 'cat_emb_dim': 3, 'n_independent': 4, 'n_shared': 3, 'momentum': 0.10478749049541879, 'mask_type': 'entmax'}. Best is trial 27 with value: 295490.8463921569.
[I 2025-01-24 11:44:34,150] Trial 129 finished with value: 381681.29094128136 and parameters: {'n_d': 43, 'n_steps': 3, 'gamma': 1.2299399433807519, 'cat_emb_dim': 1, 'n_independent': 4, 'n_shared': 3, 'momentum': 0.0728500986610196, 'mask_type': 'sparsemax'}. Best is trial 27 with value: 295490.8463921569.
[I 2025-01-24 12:32:05,652] Trial 130 finished with value: 331447.87611055817 and parameters: {'n_d': 56, 'n_steps': 3, 'gamma': 1.0498418831621832, 'cat_emb_dim': 2, 'n_independent': 3, 'n_shared': 3, 'momentum': 0.052696400679945195, 'mask_type': 'entmax'}. Best is trial 27 with value: 295490.8463921569.
[I 2025-01-24 13:43:49,000] Trial 131 finished with value: 314406.9702232792 and parameters: {'n_d': 62, 'n_steps': 3, 'gamma': 1.1948869561500666, 'cat_emb_dim': 2, 'n_independent': 4, 'n_shared': 3, 'momentum': 0.17832358527959538, 'mask_type': 'entmax'}. Best is trial 27 with value: 295490.8463921569.
[I 2025-01-24 14:34:45,138] Trial 132 finished with value: 433939.41935510066 and parameters: {'n_d': 64, 'n_steps': 3, 'gamma': 1.1602788017273726, 'cat_emb_dim': 3, 'n_independent': 4, 'n_shared': 3, 'momentum': 0.2577139457429334, 'mask_type': 'entmax'}. Best is trial 27 with value: 295490.8463921569.
[I 2025-01-24 15:38:53,894] Trial 133 finished with value: 310707.84491090185 and parameters: {'n_d': 64, 'n_steps': 3, 'gamma': 1.1215612113492655, 'cat_emb_dim': 2, 'n_independent': 4, 'n_shared': 3, 'momentum': 0.15944623547386397, 'mask_type': 'entmax'}. Best is trial 27 with value: 295490.8463921569.
[I 2025-01-24 18:02:34,812] Trial 134 finished with value: 372107.49648766534 and parameters: {'n_d': 59, 'n_steps': 10, 'gamma': 1.101901783260593, 'cat_emb_dim': 2, 'n_independent': 4, 'n_shared': 3, 'momentum': 0.19551406228995438, 'mask_type': 'entmax'}. Best is trial 27 with value: 295490.8463921569.
[I 2025-01-24 19:21:05,870] Trial 135 finished with value: 303486.47778184514 and parameters: {'n_d': 61, 'n_steps': 3, 'gamma': 1.124983663778471, 'cat_emb_dim': 2, 'n_independent': 4, 'n_shared': 3, 'momentum': 0.1304662066586345, 'mask_type': 'entmax'}. Best is trial 27 with value: 295490.8463921569.
[I 2025-01-24 20:35:55,504] Trial 136 finished with value: 377000.11279391916 and parameters: {'n_d': 62, 'n_steps': 3, 'gamma': 1.0207009112286516, 'cat_emb_dim': 2, 'n_independent': 4, 'n_shared': 3, 'momentum': 0.11671750218527464, 'mask_type': 'entmax'}. Best is trial 27 with value: 295490.8463921569.
[I 2025-01-24 21:33:06,176] Trial 137 finished with value: 319168.5578098837 and parameters: {'n_d': 60, 'n_steps': 4, 'gamma': 1.0823471953502266, 'cat_emb_dim': 2, 'n_independent': 3, 'n_shared': 3, 'momentum': 0.13170171212114168, 'mask_type': 'entmax'}. Best is trial 27 with value: 295490.8463921569.
[I 2025-01-24 22:57:43,069] Trial 138 finished with value: 380461.427702939 and parameters: {'n_d': 61, 'n_steps': 3, 'gamma': 1.139543155155904, 'cat_emb_dim': 2, 'n_independent': 4, 'n_shared': 2, 'momentum': 0.00124975376530503, 'mask_type': 'entmax'}. Best is trial 27 with value: 295490.8463921569.
[I 2025-01-24 23:44:44,965] Trial 139 finished with value: 677318.7829846354 and parameters: {'n_d': 63, 'n_steps': 3, 'gamma': 1.1701084273356135, 'cat_emb_dim': 2, 'n_independent': 4, 'n_shared': 3, 'momentum': 0.09172338068337209, 'mask_type': 'entmax'}. Best is trial 27 with value: 295490.8463921569.
[I 2025-01-25 00:44:56,746] Trial 140 finished with value: 357678.82888464216 and parameters: {'n_d': 58, 'n_steps': 4, 'gamma': 1.0444431810668835, 'cat_emb_dim': 2, 'n_independent': 3, 'n_shared': 3, 'momentum': 0.14102939420902805, 'mask_type': 'entmax'}. Best is trial 27 with value: 295490.8463921569.
[I 2025-01-25 01:46:28,402] Trial 141 finished with value: 330395.20049428166 and parameters: {'n_d': 59, 'n_steps': 3, 'gamma': 1.2403307863641317, 'cat_emb_dim': 3, 'n_independent': 5, 'n_shared': 3, 'momentum': 0.20996495090253323, 'mask_type': 'entmax'}. Best is trial 27 with value: 295490.8463921569.
[I 2025-01-25 02:27:15,699] Trial 142 finished with value: 469117.97555853537 and parameters: {'n_d': 60, 'n_steps': 3, 'gamma': 1.6593243119531387, 'cat_emb_dim': 2, 'n_independent': 4, 'n_shared': 2, 'momentum': 0.10352047906643705, 'mask_type': 'entmax'}. Best is trial 27 with value: 295490.8463921569.
[I 2025-01-25 03:26:55,349] Trial 143 finished with value: 642431.019410337 and parameters: {'n_d': 64, 'n_steps': 3, 'gamma': 1.1213581680959668, 'cat_emb_dim': 2, 'n_independent': 4, 'n_shared': 3, 'momentum': 0.17348486622033382, 'mask_type': 'entmax'}. Best is trial 27 with value: 295490.8463921569.
[I 2025-01-25 04:34:01,662] Trial 144 finished with value: 446365.8908218405 and parameters: {'n_d': 62, 'n_steps': 3, 'gamma': 1.1083494052909264, 'cat_emb_dim': 2, 'n_independent': 4, 'n_shared': 3, 'momentum': 0.17050108362359268, 'mask_type': 'entmax'}. Best is trial 27 with value: 295490.8463921569.
[I 2025-01-25 05:34:32,649] Trial 145 finished with value: 305968.873134161 and parameters: {'n_d': 63, 'n_steps': 3, 'gamma': 1.1499686598873191, 'cat_emb_dim': 2, 'n_independent': 4, 'n_shared': 3, 'momentum': 0.12647106151284995, 'mask_type': 'entmax'}. Best is trial 27 with value: 295490.8463921569.
[I 2025-01-25 06:43:49,371] Trial 146 finished with value: 294781.5985836337 and parameters: {'n_d': 61, 'n_steps': 3, 'gamma': 1.147944036256181, 'cat_emb_dim': 2, 'n_independent': 4, 'n_shared': 3, 'momentum': 0.08408169068858896, 'mask_type': 'entmax'}. Best is trial 146 with value: 294781.5985836337.
[I 2025-01-25 08:05:48,427] Trial 147 finished with value: 336967.614753268 and parameters: {'n_d': 57, 'n_steps': 4, 'gamma': 1.5480112932308518, 'cat_emb_dim': 2, 'n_independent': 4, 'n_shared': 3, 'momentum': 0.06257936431743719, 'mask_type': 'entmax'}. Best is trial 146 with value: 294781.5985836337.
[I 2025-01-25 09:04:16,022] Trial 148 finished with value: 310014.31351349875 and parameters: {'n_d': 61, 'n_steps': 3, 'gamma': 1.1826348218659501, 'cat_emb_dim': 2, 'n_independent': 3, 'n_shared': 1, 'momentum': 0.08312440722533686, 'mask_type': 'entmax'}. Best is trial 146 with value: 294781.5985836337.
[I 2025-01-25 09:56:05,383] Trial 149 finished with value: 329778.32621550414 and parameters: {'n_d': 61, 'n_steps': 3, 'gamma': 1.51455431702317, 'cat_emb_dim': 2, 'n_independent': 4, 'n_shared': 3, 'momentum': 0.14690058705227327, 'mask_type': 'sparsemax'}. Best is trial 146 with value: 294781.5985836337.
[I 2025-01-25 11:14:28,652] Trial 150 finished with value: 347598.63608251663 and parameters: {'n_d': 57, 'n_steps': 4, 'gamma': 1.5782022519604497, 'cat_emb_dim': 3, 'n_independent': 3, 'n_shared': 1, 'momentum': 0.09890891939239393, 'mask_type': 'entmax'}. Best is trial 146 with value: 294781.5985836337.
[I 2025-01-25 12:43:06,666] Trial 151 finished with value: 357261.5480732169 and parameters: {'n_d': 24, 'n_steps': 9, 'gamma': 1.2822986320838115, 'cat_emb_dim': 2, 'n_independent': 4, 'n_shared': 3, 'momentum': 0.11456520564426673, 'mask_type': 'entmax'}. Best is trial 146 with value: 294781.5985836337.
[I 2025-01-25 13:24:04,664] Trial 152 finished with value: 338474.3070712815 and parameters: {'n_d': 54, 'n_steps': 3, 'gamma': 1.0782357680844514, 'cat_emb_dim': 2, 'n_independent': 3, 'n_shared': 3, 'momentum': 0.3258690795887642, 'mask_type': 'entmax'}. Best is trial 146 with value: 294781.5985836337.
[I 2025-01-25 14:06:20,872] Trial 153 finished with value: 420625.9561403557 and parameters: {'n_d': 63, 'n_steps': 3, 'gamma': 1.1549506392752724, 'cat_emb_dim': 2, 'n_independent': 4, 'n_shared': 3, 'momentum': 0.12927294479349216, 'mask_type': 'entmax'}. Best is trial 146 with value: 294781.5985836337.
[I 2025-01-25 15:14:43,102] Trial 154 finished with value: 349753.33787052776 and parameters: {'n_d': 62, 'n_steps': 3, 'gamma': 1.2128135534821705, 'cat_emb_dim': 2, 'n_independent': 4, 'n_shared': 3, 'momentum': 0.12358474669695782, 'mask_type': 'entmax'}. Best is trial 146 with value: 294781.5985836337.
[I 2025-01-25 16:18:06,979] Trial 155 finished with value: 805532.3503066907 and parameters: {'n_d': 60, 'n_steps': 3, 'gamma': 1.1353324340392437, 'cat_emb_dim': 2, 'n_independent': 4, 'n_shared': 3, 'momentum': 0.0912711012764584, 'mask_type': 'entmax'}. Best is trial 146 with value: 294781.5985836337.
[I 2025-01-25 17:12:49,593] Trial 156 finished with value: 372355.9501497331 and parameters: {'n_d': 13, 'n_steps': 3, 'gamma': 1.0992116703838324, 'cat_emb_dim': 2, 'n_independent': 4, 'n_shared': 3, 'momentum': 0.15042534292720414, 'mask_type': 'entmax'}. Best is trial 146 with value: 294781.5985836337.
[I 2025-01-25 18:25:58,819] Trial 157 finished with value: 297725.1023262233 and parameters: {'n_d': 30, 'n_steps': 3, 'gamma': 1.195507548738311, 'cat_emb_dim': 2, 'n_independent': 4, 'n_shared': 3, 'momentum': 0.07633276825858244, 'mask_type': 'entmax'}. Best is trial 146 with value: 294781.5985836337.
[I 2025-01-25 19:43:02,056] Trial 158 finished with value: 312030.6222865496 and parameters: {'n_d': 30, 'n_steps': 3, 'gamma': 1.6104541361910802, 'cat_emb_dim': 1, 'n_independent': 4, 'n_shared': 1, 'momentum': 0.08188010614896747, 'mask_type': 'entmax'}. Best is trial 146 with value: 294781.5985836337.
[I 2025-01-25 21:02:15,833] Trial 159 finished with value: 367776.545812335 and parameters: {'n_d': 28, 'n_steps': 3, 'gamma': 1.1925282766321335, 'cat_emb_dim': 2, 'n_independent': 4, 'n_shared': 3, 'momentum': 0.07813923032360269, 'mask_type': 'entmax'}. Best is trial 146 with value: 294781.5985836337.
[I 2025-01-25 22:28:24,847] Trial 160 finished with value: 324783.5891316202 and parameters: {'n_d': 33, 'n_steps': 4, 'gamma': 1.2530810048443728, 'cat_emb_dim': 3, 'n_independent': 3, 'n_shared': 5, 'momentum': 0.06926372235140411, 'mask_type': 'entmax'}. Best is trial 146 with value: 294781.5985836337.
[I 2025-01-25 23:28:12,171] Trial 161 finished with value: 424919.79410697415 and parameters: {'n_d': 34, 'n_steps': 3, 'gamma': 1.1760981114530242, 'cat_emb_dim': 2, 'n_independent': 4, 'n_shared': 4, 'momentum': 0.22085707156448814, 'mask_type': 'entmax'}. Best is trial 146 with value: 294781.5985836337.
[I 2025-01-26 00:30:44,977] Trial 162 finished with value: 296541.39863908745 and parameters: {'n_d': 37, 'n_steps': 3, 'gamma': 1.2262317794197561, 'cat_emb_dim': 2, 'n_independent': 4, 'n_shared': 1, 'momentum': 0.1034784600544405, 'mask_type': 'entmax'}. Best is trial 146 with value: 294781.5985836337.
[I 2025-01-26 01:11:23,314] Trial 163 finished with value: 458085.8574105275 and parameters: {'n_d': 37, 'n_steps': 3, 'gamma': 1.2210158950989283, 'cat_emb_dim': 2, 'n_independent': 4, 'n_shared': 1, 'momentum': 0.09716128064361976, 'mask_type': 'entmax'}. Best is trial 146 with value: 294781.5985836337.
[I 2025-01-26 02:01:15,034] Trial 164 finished with value: 321690.62456319365 and parameters: {'n_d': 35, 'n_steps': 3, 'gamma': 1.2009964388178653, 'cat_emb_dim': 2, 'n_independent': 4, 'n_shared': 1, 'momentum': 0.10301931188158818, 'mask_type': 'entmax'}. Best is trial 146 with value: 294781.5985836337.
[I 2025-01-26 03:12:16,921] Trial 165 finished with value: 364495.4197894589 and parameters: {'n_d': 32, 'n_steps': 3, 'gamma': 1.1621722073649705, 'cat_emb_dim': 2, 'n_independent': 4, 'n_shared': 1, 'momentum': 0.05851410457483751, 'mask_type': 'entmax'}. Best is trial 146 with value: 294781.5985836337.
[I 2025-01-26 04:20:57,609] Trial 166 finished with value: 306008.6719717042 and parameters: {'n_d': 30, 'n_steps': 3, 'gamma': 1.2668521626871991, 'cat_emb_dim': 2, 'n_independent': 4, 'n_shared': 1, 'momentum': 0.11509711919870633, 'mask_type': 'entmax'}. Best is trial 146 with value: 294781.5985836337.
[I 2025-01-26 05:27:42,496] Trial 167 finished with value: 292832.36431554076 and parameters: {'n_d': 42, 'n_steps': 4, 'gamma': 1.1388910288548508, 'cat_emb_dim': 2, 'n_independent': 4, 'n_shared': 1, 'momentum': 0.39257840463645827, 'mask_type': 'entmax'}. Best is trial 167 with value: 292832.36431554076.
[I 2025-01-26 06:21:35,995] Trial 168 finished with value: 302672.8604198273 and parameters: {'n_d': 44, 'n_steps': 3, 'gamma': 1.122876971867477, 'cat_emb_dim': 2, 'n_independent': 4, 'n_shared': 1, 'momentum': 0.38231957766237834, 'mask_type': 'entmax'}. Best is trial 167 with value: 292832.36431554076.
[I 2025-01-26 06:58:42,253] Trial 169 finished with value: 327852.2727726346 and parameters: {'n_d': 39, 'n_steps': 3, 'gamma': 1.1317012501460066, 'cat_emb_dim': 2, 'n_independent': 4, 'n_shared': 1, 'momentum': 0.39422902887168765, 'mask_type': 'entmax'}. Best is trial 167 with value: 292832.36431554076.
[I 2025-01-26 07:46:24,637] Trial 170 finished with value: 461954.9987822571 and parameters: {'n_d': 40, 'n_steps': 4, 'gamma': 1.1149380737941919, 'cat_emb_dim': 2, 'n_independent': 4, 'n_shared': 1, 'momentum': 0.3564344963196678, 'mask_type': 'entmax'}. Best is trial 167 with value: 292832.36431554076.
[I 2025-01-26 08:39:39,969] Trial 171 finished with value: 479338.4659453271 and parameters: {'n_d': 43, 'n_steps': 3, 'gamma': 1.2314187665976541, 'cat_emb_dim': 2, 'n_independent': 4, 'n_shared': 1, 'momentum': 0.3084965194111006, 'mask_type': 'entmax'}. Best is trial 167 with value: 292832.36431554076.
[I 2025-01-26 09:18:08,154] Trial 172 finished with value: 411885.3481916462 and parameters: {'n_d': 38, 'n_steps': 3, 'gamma': 1.0932798185817088, 'cat_emb_dim': 2, 'n_independent': 4, 'n_shared': 1, 'momentum': 0.25488873360199, 'mask_type': 'entmax'}. Best is trial 167 with value: 292832.36431554076.
[I 2025-01-26 10:06:18,445] Trial 173 finished with value: 380101.55604554794 and parameters: {'n_d': 41, 'n_steps': 3, 'gamma': 1.1564564780309627, 'cat_emb_dim': 2, 'n_independent': 4, 'n_shared': 1, 'momentum': 0.2979738879856567, 'mask_type': 'entmax'}. Best is trial 167 with value: 292832.36431554076.
[I 2025-01-26 10:56:27,431] Trial 174 finished with value: 402703.8965323748 and parameters: {'n_d': 45, 'n_steps': 3, 'gamma': 1.130600779304831, 'cat_emb_dim': 2, 'n_independent': 4, 'n_shared': 1, 'momentum': 0.37133582358922224, 'mask_type': 'entmax'}. Best is trial 167 with value: 292832.36431554076.
[I 2025-01-26 11:43:05,991] Trial 175 finished with value: 311817.4870104451 and parameters: {'n_d': 46, 'n_steps': 3, 'gamma': 1.1829456061306305, 'cat_emb_dim': 2, 'n_independent': 4, 'n_shared': 1, 'momentum': 0.3222998679188688, 'mask_type': 'entmax'}. Best is trial 167 with value: 292832.36431554076.
[I 2025-01-26 12:58:59,634] Trial 176 finished with value: 324009.8555210653 and parameters: {'n_d': 42, 'n_steps': 6, 'gamma': 1.7612203130230835, 'cat_emb_dim': 2, 'n_independent': 4, 'n_shared': 1, 'momentum': 0.19267892807926312, 'mask_type': 'entmax'}. Best is trial 167 with value: 292832.36431554076.
[I 2025-01-26 13:44:50,841] Trial 177 finished with value: 424753.68173072534 and parameters: {'n_d': 37, 'n_steps': 3, 'gamma': 1.1395869418557936, 'cat_emb_dim': 2, 'n_independent': 4, 'n_shared': 1, 'momentum': 0.24970432449795088, 'mask_type': 'entmax'}. Best is trial 167 with value: 292832.36431554076.
srun: Job step aborted: Waiting up to 32 seconds for job step to finish.
slurmstepd: error: *** JOB 969665 ON stud-000 CANCELLED AT 2025-01-26T13:44:57 DUE TO TIME LIMIT ***
slurmstepd: error: *** STEP 969665.0 ON stud-000 CANCELLED AT 2025-01-26T13:44:57 DUE TO TIME LIMIT ***
