[I 2025-01-15 08:33:59,159] Trial 71 finished with value: 1167087502.5641396 and parameters: {'n_d': 32, 'n_steps': 10, 'gamma': 1.0657323747046208, 'cat_emb_dim': 1, 'n_independent': 5, 'n_shared': 2, 'momentum': 0.14319498875650732, 'mask_type': 'entmax'}. Best is trial 48 with value: 879288441.7589414.
[I 2025-01-15 08:40:56,427] Trial 72 finished with value: 1085551502.545652 and parameters: {'n_d': 37, 'n_steps': 10, 'gamma': 1.0088131514745897, 'cat_emb_dim': 1, 'n_independent': 5, 'n_shared': 2, 'momentum': 0.07079961668617091, 'mask_type': 'entmax'}. Best is trial 48 with value: 879288441.7589414.
[I 2025-01-15 08:47:43,269] Trial 73 finished with value: 1158061561.5494604 and parameters: {'n_d': 41, 'n_steps': 10, 'gamma': 1.0334778336588932, 'cat_emb_dim': 1, 'n_independent': 5, 'n_shared': 2, 'momentum': 0.27115727023980846, 'mask_type': 'entmax'}. Best is trial 48 with value: 879288441.7589414.
[I 2025-01-15 08:54:31,520] Trial 74 finished with value: 1316441051.2467136 and parameters: {'n_d': 29, 'n_steps': 9, 'gamma': 1.1507874806154907, 'cat_emb_dim': 1, 'n_independent': 5, 'n_shared': 2, 'momentum': 0.19686552802643456, 'mask_type': 'entmax'}. Best is trial 48 with value: 879288441.7589414.
[I 2025-01-15 09:01:54,095] Trial 75 finished with value: 985532000.1206459 and parameters: {'n_d': 35, 'n_steps': 10, 'gamma': 1.1005742827735014, 'cat_emb_dim': 1, 'n_independent': 5, 'n_shared': 2, 'momentum': 0.33990688981586753, 'mask_type': 'entmax'}. Best is trial 48 with value: 879288441.7589414.
[I 2025-01-15 09:08:55,142] Trial 76 finished with value: 1017605178.2856181 and parameters: {'n_d': 35, 'n_steps': 10, 'gamma': 1.0978182162305787, 'cat_emb_dim': 1, 'n_independent': 5, 'n_shared': 2, 'momentum': 0.3661320267075777, 'mask_type': 'entmax'}. Best is trial 48 with value: 879288441.7589414.
[I 2025-01-15 09:14:42,858] Trial 77 finished with value: 1031373072.086661 and parameters: {'n_d': 38, 'n_steps': 9, 'gamma': 1.0554124954541346, 'cat_emb_dim': 1, 'n_independent': 4, 'n_shared': 2, 'momentum': 0.126484263312044, 'mask_type': 'entmax'}. Best is trial 48 with value: 879288441.7589414.
[I 2025-01-15 09:20:10,575] Trial 78 finished with value: 1720720632.218101 and parameters: {'n_d': 27, 'n_steps': 10, 'gamma': 1.2061616225479885, 'cat_emb_dim': 1, 'n_independent': 2, 'n_shared': 2, 'momentum': 0.3296646262325729, 'mask_type': 'entmax'}. Best is trial 48 with value: 879288441.7589414.
[I 2025-01-15 09:26:56,678] Trial 79 finished with value: 7711467354.070867 and parameters: {'n_d': 8, 'n_steps': 9, 'gamma': 1.0727603778701018, 'cat_emb_dim': 1, 'n_independent': 5, 'n_shared': 2, 'momentum': 0.15166367065063732, 'mask_type': 'entmax'}. Best is trial 48 with value: 879288441.7589414.
[I 2025-01-15 09:33:53,264] Trial 80 finished with value: 1117065324.2106872 and parameters: {'n_d': 32, 'n_steps': 10, 'gamma': 1.0274437648064354, 'cat_emb_dim': 2, 'n_independent': 5, 'n_shared': 2, 'momentum': 0.09574719046573975, 'mask_type': 'entmax'}. Best is trial 48 with value: 879288441.7589414.
[I 2025-01-15 09:41:37,105] Trial 81 finished with value: 1100547286.84965 and parameters: {'n_d': 35, 'n_steps': 10, 'gamma': 1.1384761455282002, 'cat_emb_dim': 1, 'n_independent': 5, 'n_shared': 2, 'momentum': 0.25252016603477373, 'mask_type': 'entmax'}. Best is trial 48 with value: 879288441.7589414.
[I 2025-01-15 09:49:14,719] Trial 82 finished with value: 1090085067.9366663 and parameters: {'n_d': 50, 'n_steps': 10, 'gamma': 1.1023083695309952, 'cat_emb_dim': 1, 'n_independent': 5, 'n_shared': 1, 'momentum': 0.20991955361349296, 'mask_type': 'entmax'}. Best is trial 48 with value: 879288441.7589414.
[I 2025-01-15 09:57:29,802] Trial 83 finished with value: 1226771040.9174454 and parameters: {'n_d': 39, 'n_steps': 10, 'gamma': 1.187111528611008, 'cat_emb_dim': 1, 'n_independent': 5, 'n_shared': 2, 'momentum': 0.3294203702916157, 'mask_type': 'sparsemax'}. Best is trial 48 with value: 879288441.7589414.
[I 2025-01-15 10:06:25,928] Trial 84 finished with value: 1087802265.86575 and parameters: {'n_d': 62, 'n_steps': 10, 'gamma': 1.2447316830275454, 'cat_emb_dim': 1, 'n_independent': 5, 'n_shared': 3, 'momentum': 0.24753675991251872, 'mask_type': 'entmax'}. Best is trial 48 with value: 879288441.7589414.
[I 2025-01-15 10:12:15,111] Trial 85 finished with value: 1526726379.2328568 and parameters: {'n_d': 34, 'n_steps': 10, 'gamma': 1.0156698086357785, 'cat_emb_dim': 1, 'n_independent': 3, 'n_shared': 1, 'momentum': 0.012888748404808624, 'mask_type': 'sparsemax'}. Best is trial 48 with value: 879288441.7589414.
[I 2025-01-15 10:19:49,749] Trial 86 finished with value: 4796195373.400714 and parameters: {'n_d': 12, 'n_steps': 9, 'gamma': 1.0475585441513626, 'cat_emb_dim': 1, 'n_independent': 5, 'n_shared': 2, 'momentum': 0.11704176627957517, 'mask_type': 'entmax'}. Best is trial 48 with value: 879288441.7589414.
[I 2025-01-15 10:27:11,693] Trial 87 finished with value: 1126653729.9767764 and parameters: {'n_d': 55, 'n_steps': 10, 'gamma': 1.1094365311194325, 'cat_emb_dim': 1, 'n_independent': 5, 'n_shared': 1, 'momentum': 0.15621368337510594, 'mask_type': 'sparsemax'}. Best is trial 48 with value: 879288441.7589414.
[I 2025-01-15 10:36:10,262] Trial 88 finished with value: 951219548.1883268 and parameters: {'n_d': 44, 'n_steps': 10, 'gamma': 1.1654004742862973, 'cat_emb_dim': 1, 'n_independent': 5, 'n_shared': 4, 'momentum': 0.39510024510641206, 'mask_type': 'entmax'}. Best is trial 48 with value: 879288441.7589414.
[I 2025-01-15 10:45:23,716] Trial 89 finished with value: 1327643846.9496815 and parameters: {'n_d': 44, 'n_steps': 9, 'gamma': 1.078938381659914, 'cat_emb_dim': 3, 'n_independent': 5, 'n_shared': 5, 'momentum': 0.3992389285500102, 'mask_type': 'entmax'}. Best is trial 48 with value: 879288441.7589414.
[I 2025-01-15 10:55:29,278] Trial 90 finished with value: 676661232.5118308 and parameters: {'n_d': 41, 'n_steps': 10, 'gamma': 1.1224322533685716, 'cat_emb_dim': 1, 'n_independent': 5, 'n_shared': 4, 'momentum': 0.32030669497532765, 'mask_type': 'entmax'}. Best is trial 90 with value: 676661232.5118308.
[I 2025-01-15 11:05:13,122] Trial 91 finished with value: 1015108438.3066097 and parameters: {'n_d': 41, 'n_steps': 10, 'gamma': 1.1268177735150278, 'cat_emb_dim': 1, 'n_independent': 5, 'n_shared': 4, 'momentum': 0.35735515813019764, 'mask_type': 'entmax'}. Best is trial 90 with value: 676661232.5118308.
[I 2025-01-15 11:14:17,947] Trial 92 finished with value: 1116068336.8510642 and parameters: {'n_d': 37, 'n_steps': 10, 'gamma': 1.0394448998063868, 'cat_emb_dim': 1, 'n_independent': 5, 'n_shared': 4, 'momentum': 0.3011427902289933, 'mask_type': 'entmax'}. Best is trial 90 with value: 676661232.5118308.
[I 2025-01-15 11:20:16,307] Trial 93 finished with value: 3641319703.7035966 and parameters: {'n_d': 45, 'n_steps': 10, 'gamma': 1.1576972024621035, 'cat_emb_dim': 1, 'n_independent': 5, 'n_shared': 4, 'momentum': 0.00653494233130502, 'mask_type': 'entmax'}. Best is trial 90 with value: 676661232.5118308.
[I 2025-01-15 11:29:58,365] Trial 94 finished with value: 1087270837.2388425 and parameters: {'n_d': 36, 'n_steps': 10, 'gamma': 1.3799033113507109, 'cat_emb_dim': 1, 'n_independent': 5, 'n_shared': 4, 'momentum': 0.2183540014504247, 'mask_type': 'entmax'}. Best is trial 90 with value: 676661232.5118308.
[I 2025-01-15 11:39:50,560] Trial 95 finished with value: 1041036040.8753283 and parameters: {'n_d': 39, 'n_steps': 10, 'gamma': 1.57416558299909, 'cat_emb_dim': 1, 'n_independent': 5, 'n_shared': 4, 'momentum': 0.32672837853101316, 'mask_type': 'entmax'}. Best is trial 90 with value: 676661232.5118308.
[I 2025-01-15 11:49:14,667] Trial 96 finished with value: 1145767299.6839273 and parameters: {'n_d': 43, 'n_steps': 10, 'gamma': 1.0643116306223077, 'cat_emb_dim': 1, 'n_independent': 5, 'n_shared': 5, 'momentum': 0.045943580188398954, 'mask_type': 'entmax'}. Best is trial 90 with value: 676661232.5118308.
[I 2025-01-15 11:57:37,098] Trial 97 finished with value: 1332835253.7858472 and parameters: {'n_d': 48, 'n_steps': 9, 'gamma': 1.0162885063911962, 'cat_emb_dim': 1, 'n_independent': 5, 'n_shared': 4, 'momentum': 0.27342439304816474, 'mask_type': 'entmax'}. Best is trial 90 with value: 676661232.5118308.
[I 2025-01-15 12:01:51,631] Trial 98 finished with value: 3973243320.783361 and parameters: {'n_d': 42, 'n_steps': 10, 'gamma': 1.093328231857694, 'cat_emb_dim': 3, 'n_independent': 5, 'n_shared': 2, 'momentum': 0.0014075059400001655, 'mask_type': 'entmax'}. Best is trial 90 with value: 676661232.5118308.
[I 2025-01-15 12:07:26,510] Trial 99 finished with value: 2438845959.3477445 and parameters: {'n_d': 32, 'n_steps': 5, 'gamma': 1.1898551464169398, 'cat_emb_dim': 1, 'n_independent': 5, 'n_shared': 3, 'momentum': 0.1746232412100506, 'mask_type': 'entmax'}. Best is trial 90 with value: 676661232.5118308.
