[I 2025-01-15 02:09:06,624] A new study created in RDB with name: TabNet_House_Prices_Nominal
[I 2025-01-15 02:12:24,008] Trial 0 finished with value: 3053304248.548082 and parameters: {'n_d': 38, 'n_steps': 5, 'gamma': 1.8026203708232909, 'cat_emb_dim': 3, 'n_independent': 5, 'n_shared': 1, 'momentum': 0.0048425118432533915, 'mask_type': 'entmax'}. Best is trial 0 with value: 3053304248.548082.
[I 2025-01-15 02:15:24,041] Trial 1 finished with value: 2771579182.372863 and parameters: {'n_d': 49, 'n_steps': 9, 'gamma': 1.4567342000695709, 'cat_emb_dim': 3, 'n_independent': 1, 'n_shared': 1, 'momentum': 0.0017140497135051866, 'mask_type': 'entmax'}. Best is trial 1 with value: 2771579182.372863.
[I 2025-01-15 02:19:11,228] Trial 2 finished with value: 2207860567.0790877 and parameters: {'n_d': 54, 'n_steps': 4, 'gamma': 1.0571513465239093, 'cat_emb_dim': 1, 'n_independent': 5, 'n_shared': 3, 'momentum': 0.019204663915732407, 'mask_type': 'entmax'}. Best is trial 2 with value: 2207860567.0790877.
[I 2025-01-15 02:22:36,670] Trial 3 finished with value: 7546819047.296048 and parameters: {'n_d': 27, 'n_steps': 8, 'gamma': 1.9091375149074727, 'cat_emb_dim': 1, 'n_independent': 1, 'n_shared': 1, 'momentum': 0.06875712974949925, 'mask_type': 'sparsemax'}. Best is trial 2 with value: 2207860567.0790877.
[I 2025-01-15 02:25:47,917] Trial 4 finished with value: 3898522139.673012 and parameters: {'n_d': 15, 'n_steps': 4, 'gamma': 1.0911726048298243, 'cat_emb_dim': 2, 'n_independent': 5, 'n_shared': 1, 'momentum': 0.0019176859477808526, 'mask_type': 'entmax'}. Best is trial 2 with value: 2207860567.0790877.
[I 2025-01-15 02:29:19,281] Trial 5 finished with value: 1971636205.9519894 and parameters: {'n_d': 55, 'n_steps': 3, 'gamma': 1.7177957051282093, 'cat_emb_dim': 1, 'n_independent': 5, 'n_shared': 3, 'momentum': 0.01317727979367213, 'mask_type': 'entmax'}. Best is trial 5 with value: 1971636205.9519894.
[I 2025-01-15 02:33:00,701] Trial 6 finished with value: 3813777409.245324 and parameters: {'n_d': 41, 'n_steps': 6, 'gamma': 1.0269062646939173, 'cat_emb_dim': 3, 'n_independent': 5, 'n_shared': 5, 'momentum': 0.009350423951696177, 'mask_type': 'entmax'}. Best is trial 5 with value: 1971636205.9519894.
[I 2025-01-15 02:37:21,007] Trial 7 finished with value: 1933955002.4713807 and parameters: {'n_d': 21, 'n_steps': 6, 'gamma': 1.6260083526839262, 'cat_emb_dim': 2, 'n_independent': 2, 'n_shared': 5, 'momentum': 0.008674491572661723, 'mask_type': 'sparsemax'}. Best is trial 7 with value: 1933955002.4713807.
[I 2025-01-15 02:41:10,168] Trial 8 finished with value: 3198716510.9816904 and parameters: {'n_d': 23, 'n_steps': 8, 'gamma': 1.589172468068216, 'cat_emb_dim': 2, 'n_independent': 1, 'n_shared': 3, 'momentum': 0.003964837462553885, 'mask_type': 'entmax'}. Best is trial 7 with value: 1933955002.4713807.
[I 2025-01-15 02:45:27,240] Trial 9 finished with value: 3684140127.1727715 and parameters: {'n_d': 28, 'n_steps': 5, 'gamma': 1.6449154051521688, 'cat_emb_dim': 3, 'n_independent': 3, 'n_shared': 5, 'momentum': 0.0682646052869389, 'mask_type': 'entmax'}. Best is trial 7 with value: 1933955002.4713807.
[I 2025-01-15 02:52:04,912] Trial 10 finished with value: 5799323825.571221 and parameters: {'n_d': 14, 'n_steps': 10, 'gamma': 1.3333965862952781, 'cat_emb_dim': 2, 'n_independent': 3, 'n_shared': 4, 'momentum': 0.2536859637439934, 'mask_type': 'sparsemax'}. Best is trial 7 with value: 1933955002.4713807.
[I 2025-01-15 02:55:21,657] Trial 11 finished with value: 3900428178.5343523 and parameters: {'n_d': 58, 'n_steps': 3, 'gamma': 1.7529786785009642, 'cat_emb_dim': 1, 'n_independent': 2, 'n_shared': 4, 'momentum': 0.021941124492299794, 'mask_type': 'sparsemax'}. Best is trial 7 with value: 1933955002.4713807.
[I 2025-01-15 02:59:34,570] Trial 12 finished with value: 2025606703.4915016 and parameters: {'n_d': 63, 'n_steps': 7, 'gamma': 1.9971392614444163, 'cat_emb_dim': 1, 'n_independent': 4, 'n_shared': 2, 'momentum': 0.017061470624228407, 'mask_type': 'sparsemax'}. Best is trial 7 with value: 1933955002.4713807.
[I 2025-01-15 03:02:48,837] Trial 13 finished with value: 30887551682.079906 and parameters: {'n_d': 8, 'n_steps': 3, 'gamma': 1.3897967480679072, 'cat_emb_dim': 2, 'n_independent': 2, 'n_shared': 4, 'momentum': 0.050949719312801386, 'mask_type': 'sparsemax'}. Best is trial 7 with value: 1933955002.4713807.
[I 2025-01-15 03:06:19,194] Trial 14 finished with value: 2321177721.651375 and parameters: {'n_d': 47, 'n_steps': 6, 'gamma': 1.620562912875391, 'cat_emb_dim': 1, 'n_independent': 4, 'n_shared': 2, 'momentum': 0.006448067403885128, 'mask_type': 'sparsemax'}. Best is trial 7 with value: 1933955002.4713807.
[I 2025-01-15 03:09:43,659] Trial 15 finished with value: 6817050597.053029 and parameters: {'n_d': 33, 'n_steps': 5, 'gamma': 1.7621577365302457, 'cat_emb_dim': 2, 'n_independent': 2, 'n_shared': 2, 'momentum': 0.03383178356142115, 'mask_type': 'sparsemax'}. Best is trial 7 with value: 1933955002.4713807.
[I 2025-01-15 03:13:56,690] Trial 16 finished with value: 4516267711.599543 and parameters: {'n_d': 17, 'n_steps': 4, 'gamma': 1.2595998291637005, 'cat_emb_dim': 1, 'n_independent': 4, 'n_shared': 4, 'momentum': 0.011160500153713606, 'mask_type': 'sparsemax'}. Best is trial 7 with value: 1933955002.4713807.
[I 2025-01-15 03:15:48,801] Trial 17 finished with value: 6283466066.112062 and parameters: {'n_d': 44, 'n_steps': 7, 'gamma': 1.5249418522910365, 'cat_emb_dim': 2, 'n_independent': 3, 'n_shared': 5, 'momentum': 0.0010034450821023223, 'mask_type': 'entmax'}. Best is trial 7 with value: 1933955002.4713807.
[I 2025-01-15 03:18:49,890] Trial 18 finished with value: 17267204918.16961 and parameters: {'n_d': 33, 'n_steps': 3, 'gamma': 1.7032316978329727, 'cat_emb_dim': 2, 'n_independent': 2, 'n_shared': 3, 'momentum': 0.1608974388316096, 'mask_type': 'sparsemax'}. Best is trial 7 with value: 1933955002.4713807.
[I 2025-01-15 03:21:56,673] Trial 19 finished with value: 3944993888.699692 and parameters: {'n_d': 64, 'n_steps': 10, 'gamma': 1.8520155240477483, 'cat_emb_dim': 1, 'n_independent': 3, 'n_shared': 3, 'momentum': 0.002996541277819247, 'mask_type': 'entmax'}. Best is trial 7 with value: 1933955002.4713807.
[I 2025-01-15 03:27:21,929] Trial 20 finished with value: 2533624443.582347 and parameters: {'n_d': 22, 'n_steps': 8, 'gamma': 1.5379668496179024, 'cat_emb_dim': 2, 'n_independent': 4, 'n_shared': 4, 'momentum': 0.009535447202238315, 'mask_type': 'entmax'}. Best is trial 7 with value: 1933955002.4713807.
[I 2025-01-15 03:32:01,311] Trial 21 finished with value: 1657989299.1007283 and parameters: {'n_d': 63, 'n_steps': 7, 'gamma': 1.9966149041919627, 'cat_emb_dim': 1, 'n_independent': 4, 'n_shared': 3, 'momentum': 0.01742067466109101, 'mask_type': 'sparsemax'}. Best is trial 21 with value: 1657989299.1007283.
[I 2025-01-15 03:36:57,338] Trial 22 finished with value: 1877308688.4195614 and parameters: {'n_d': 55, 'n_steps': 7, 'gamma': 1.9599026686707297, 'cat_emb_dim': 1, 'n_independent': 4, 'n_shared': 3, 'momentum': 0.029424334380031454, 'mask_type': 'sparsemax'}. Best is trial 21 with value: 1657989299.1007283.
[I 2025-01-15 03:41:29,955] Trial 23 finished with value: 1772122063.838747 and parameters: {'n_d': 50, 'n_steps': 7, 'gamma': 1.9994648502580024, 'cat_emb_dim': 1, 'n_independent': 4, 'n_shared': 2, 'momentum': 0.030219833984565063, 'mask_type': 'sparsemax'}. Best is trial 21 with value: 1657989299.1007283.
[I 2025-01-15 03:46:01,180] Trial 24 finished with value: 1255788737.6646454 and parameters: {'n_d': 59, 'n_steps': 7, 'gamma': 1.98958290100846, 'cat_emb_dim': 1, 'n_independent': 4, 'n_shared': 2, 'momentum': 0.028520873185479908, 'mask_type': 'sparsemax'}. Best is trial 24 with value: 1255788737.6646454.
[I 2025-01-15 03:51:39,916] Trial 25 finished with value: 1508383133.5661151 and parameters: {'n_d': 60, 'n_steps': 9, 'gamma': 1.8934204778502959, 'cat_emb_dim': 1, 'n_independent': 4, 'n_shared': 2, 'momentum': 0.10478039351994792, 'mask_type': 'sparsemax'}. Best is trial 24 with value: 1255788737.6646454.
[I 2025-01-15 03:57:23,530] Trial 26 finished with value: 1135351629.0118957 and parameters: {'n_d': 60, 'n_steps': 9, 'gamma': 1.8733517432332785, 'cat_emb_dim': 1, 'n_independent': 4, 'n_shared': 2, 'momentum': 0.13552860005164605, 'mask_type': 'sparsemax'}. Best is trial 26 with value: 1135351629.0118957.
[I 2025-01-15 04:03:03,655] Trial 27 finished with value: 1178469895.1612623 and parameters: {'n_d': 59, 'n_steps': 9, 'gamma': 1.8645173338509764, 'cat_emb_dim': 1, 'n_independent': 4, 'n_shared': 2, 'momentum': 0.14727208168269282, 'mask_type': 'sparsemax'}. Best is trial 26 with value: 1135351629.0118957.
[I 2025-01-15 04:08:08,898] Trial 28 finished with value: 1263796448.769134 and parameters: {'n_d': 52, 'n_steps': 9, 'gamma': 1.8272636986711324, 'cat_emb_dim': 1, 'n_independent': 3, 'n_shared': 2, 'momentum': 0.343669543406149, 'mask_type': 'sparsemax'}. Best is trial 26 with value: 1135351629.0118957.
[I 2025-01-15 04:14:22,671] Trial 29 finished with value: 1188070770.568542 and parameters: {'n_d': 58, 'n_steps': 10, 'gamma': 1.9111242950240617, 'cat_emb_dim': 1, 'n_independent': 5, 'n_shared': 1, 'momentum': 0.1648456811727605, 'mask_type': 'sparsemax'}. Best is trial 26 with value: 1135351629.0118957.
[I 2025-01-15 04:20:32,947] Trial 30 finished with value: 1390234171.794185 and parameters: {'n_d': 45, 'n_steps': 10, 'gamma': 1.8277140666606762, 'cat_emb_dim': 1, 'n_independent': 5, 'n_shared': 1, 'momentum': 0.24108226821377987, 'mask_type': 'sparsemax'}. Best is trial 26 with value: 1135351629.0118957.
[I 2025-01-15 04:26:16,451] Trial 31 finished with value: 1102802801.2052937 and parameters: {'n_d': 59, 'n_steps': 9, 'gamma': 1.9105757106026862, 'cat_emb_dim': 1, 'n_independent': 5, 'n_shared': 1, 'momentum': 0.1339485963952607, 'mask_type': 'sparsemax'}. Best is trial 31 with value: 1102802801.2052937.
[I 2025-01-15 04:32:01,504] Trial 32 finished with value: 1161384504.892695 and parameters: {'n_d': 57, 'n_steps': 9, 'gamma': 1.9211884986848222, 'cat_emb_dim': 1, 'n_independent': 5, 'n_shared': 1, 'momentum': 0.11658965738487503, 'mask_type': 'sparsemax'}. Best is trial 31 with value: 1102802801.2052937.
[I 2025-01-15 04:37:43,545] Trial 33 finished with value: 1321030454.8584785 and parameters: {'n_d': 52, 'n_steps': 9, 'gamma': 1.8761473063944765, 'cat_emb_dim': 1, 'n_independent': 5, 'n_shared': 1, 'momentum': 0.16113829655538062, 'mask_type': 'sparsemax'}. Best is trial 31 with value: 1102802801.2052937.
[I 2025-01-15 04:42:59,645] Trial 34 finished with value: 1429370228.685361 and parameters: {'n_d': 60, 'n_steps': 8, 'gamma': 1.7779631070005957, 'cat_emb_dim': 1, 'n_independent': 5, 'n_shared': 1, 'momentum': 0.10413890941575939, 'mask_type': 'sparsemax'}. Best is trial 31 with value: 1102802801.2052937.
[I 2025-01-15 04:48:29,887] Trial 35 finished with value: 1367529295.159078 and parameters: {'n_d': 56, 'n_steps': 9, 'gamma': 1.9346959867328646, 'cat_emb_dim': 1, 'n_independent': 5, 'n_shared': 1, 'momentum': 0.1067306928237495, 'mask_type': 'sparsemax'}. Best is trial 31 with value: 1102802801.2052937.
[I 2025-01-15 04:53:39,253] Trial 36 finished with value: 1291188983.983459 and parameters: {'n_d': 49, 'n_steps': 8, 'gamma': 1.714455983862784, 'cat_emb_dim': 1, 'n_independent': 5, 'n_shared': 1, 'momentum': 0.05070041558514837, 'mask_type': 'sparsemax'}. Best is trial 31 with value: 1102802801.2052937.
[I 2025-01-15 04:59:24,639] Trial 37 finished with value: 1515111364.7551465 and parameters: {'n_d': 39, 'n_steps': 9, 'gamma': 1.8223010901176, 'cat_emb_dim': 3, 'n_independent': 5, 'n_shared': 1, 'momentum': 0.3862689225042208, 'mask_type': 'sparsemax'}. Best is trial 31 with value: 1102802801.2052937.
[I 2025-01-15 05:05:59,801] Trial 38 finished with value: 992269262.3750031 and parameters: {'n_d': 53, 'n_steps': 10, 'gamma': 1.132682465671675, 'cat_emb_dim': 1, 'n_independent': 5, 'n_shared': 2, 'momentum': 0.22372984871937135, 'mask_type': 'sparsemax'}. Best is trial 38 with value: 992269262.3750031.
[I 2025-01-15 05:12:05,568] Trial 39 finished with value: 992090395.338665 and parameters: {'n_d': 53, 'n_steps': 10, 'gamma': 1.164725684898305, 'cat_emb_dim': 1, 'n_independent': 5, 'n_shared': 1, 'momentum': 0.2562140827807233, 'mask_type': 'sparsemax'}. Best is trial 39 with value: 992090395.338665.
[I 2025-01-15 05:18:45,299] Trial 40 finished with value: 953747322.4669183 and parameters: {'n_d': 53, 'n_steps': 10, 'gamma': 1.1520954661076181, 'cat_emb_dim': 1, 'n_independent': 5, 'n_shared': 2, 'momentum': 0.20836368674759556, 'mask_type': 'sparsemax'}. Best is trial 40 with value: 953747322.4669183.
[I 2025-01-15 05:25:24,666] Trial 41 finished with value: 1138266506.3185253 and parameters: {'n_d': 51, 'n_steps': 10, 'gamma': 1.121836687128323, 'cat_emb_dim': 1, 'n_independent': 5, 'n_shared': 2, 'momentum': 0.2349311177230832, 'mask_type': 'sparsemax'}. Best is trial 40 with value: 953747322.4669183.
[I 2025-01-15 05:32:01,438] Trial 42 finished with value: 1015885369.1101954 and parameters: {'n_d': 54, 'n_steps': 10, 'gamma': 1.1900763572245696, 'cat_emb_dim': 1, 'n_independent': 5, 'n_shared': 2, 'momentum': 0.2931704525492107, 'mask_type': 'sparsemax'}. Best is trial 40 with value: 953747322.4669183.
[I 2025-01-15 05:38:07,005] Trial 43 finished with value: 1012326645.4763829 and parameters: {'n_d': 43, 'n_steps': 10, 'gamma': 1.1758152001618627, 'cat_emb_dim': 1, 'n_independent': 5, 'n_shared': 1, 'momentum': 0.2881019116148947, 'mask_type': 'sparsemax'}. Best is trial 40 with value: 953747322.4669183.
[I 2025-01-15 05:44:57,432] Trial 44 finished with value: 1017644244.0245726 and parameters: {'n_d': 43, 'n_steps': 10, 'gamma': 1.1678488615088236, 'cat_emb_dim': 1, 'n_independent': 5, 'n_shared': 2, 'momentum': 0.31205431477548623, 'mask_type': 'sparsemax'}. Best is trial 40 with value: 953747322.4669183.
[I 2025-01-15 05:51:04,998] Trial 45 finished with value: 1133699401.1198583 and parameters: {'n_d': 48, 'n_steps': 10, 'gamma': 1.2142758301677028, 'cat_emb_dim': 2, 'n_independent': 5, 'n_shared': 1, 'momentum': 0.22646659337253008, 'mask_type': 'sparsemax'}. Best is trial 40 with value: 953747322.4669183.
[I 2025-01-15 05:57:56,249] Trial 46 finished with value: 947793087.3552185 and parameters: {'n_d': 53, 'n_steps': 10, 'gamma': 1.0002050510076144, 'cat_emb_dim': 1, 'n_independent': 5, 'n_shared': 2, 'momentum': 0.19991730039457326, 'mask_type': 'sparsemax'}. Best is trial 46 with value: 947793087.3552185.
[I 2025-01-15 06:04:01,812] Trial 47 finished with value: 1004790356.5931499 and parameters: {'n_d': 40, 'n_steps': 10, 'gamma': 1.0269616529147296, 'cat_emb_dim': 1, 'n_independent': 5, 'n_shared': 1, 'momentum': 0.20661428500511334, 'mask_type': 'entmax'}. Best is trial 46 with value: 947793087.3552185.
[I 2025-01-15 06:10:41,559] Trial 48 finished with value: 879288441.7589414 and parameters: {'n_d': 35, 'n_steps': 10, 'gamma': 1.0443289493367565, 'cat_emb_dim': 1, 'n_independent': 5, 'n_shared': 2, 'momentum': 0.07587736971019664, 'mask_type': 'entmax'}. Best is trial 48 with value: 879288441.7589414.
[I 2025-01-15 06:18:05,180] Trial 49 finished with value: 1010311330.9865625 and parameters: {'n_d': 47, 'n_steps': 10, 'gamma': 1.0871839413464466, 'cat_emb_dim': 2, 'n_independent': 5, 'n_shared': 3, 'momentum': 0.07780495978098464, 'mask_type': 'entmax'}. Best is trial 48 with value: 879288441.7589414.
[I 2025-01-15 06:24:52,319] Trial 50 finished with value: 881328412.0022856 and parameters: {'n_d': 36, 'n_steps': 10, 'gamma': 1.0005745966118642, 'cat_emb_dim': 3, 'n_independent': 5, 'n_shared': 2, 'momentum': 0.0801047880406803, 'mask_type': 'entmax'}. Best is trial 48 with value: 879288441.7589414.
[I 2025-01-15 06:31:18,028] Trial 51 finished with value: 1150993047.510787 and parameters: {'n_d': 35, 'n_steps': 10, 'gamma': 1.0018642828672457, 'cat_emb_dim': 3, 'n_independent': 5, 'n_shared': 2, 'momentum': 0.0805246064492897, 'mask_type': 'entmax'}. Best is trial 48 with value: 879288441.7589414.
[I 2025-01-15 06:37:52,779] Trial 52 finished with value: 975269158.0765154 and parameters: {'n_d': 37, 'n_steps': 10, 'gamma': 1.0690477292362146, 'cat_emb_dim': 3, 'n_independent': 5, 'n_shared': 2, 'momentum': 0.048826841175242074, 'mask_type': 'entmax'}. Best is trial 48 with value: 879288441.7589414.
[I 2025-01-15 06:44:57,787] Trial 53 finished with value: 1017868056.3102491 and parameters: {'n_d': 28, 'n_steps': 10, 'gamma': 1.0592224682542333, 'cat_emb_dim': 3, 'n_independent': 5, 'n_shared': 3, 'momentum': 0.05592296928345496, 'mask_type': 'entmax'}. Best is trial 48 with value: 879288441.7589414.
[I 2025-01-15 06:49:26,237] Trial 54 finished with value: 1140798450.3625636 and parameters: {'n_d': 36, 'n_steps': 10, 'gamma': 1.248025563645875, 'cat_emb_dim': 3, 'n_independent': 1, 'n_shared': 2, 'momentum': 0.043361598239679486, 'mask_type': 'entmax'}. Best is trial 48 with value: 879288441.7589414.
[I 2025-01-15 06:56:08,114] Trial 55 finished with value: 1054959954.7751118 and parameters: {'n_d': 31, 'n_steps': 9, 'gamma': 1.063013436051211, 'cat_emb_dim': 3, 'n_independent': 5, 'n_shared': 3, 'momentum': 0.06911241070131972, 'mask_type': 'entmax'}. Best is trial 48 with value: 879288441.7589414.
[I 2025-01-15 07:02:22,943] Trial 56 finished with value: 1494862899.0677073 and parameters: {'n_d': 25, 'n_steps': 10, 'gamma': 1.3199054527877334, 'cat_emb_dim': 3, 'n_independent': 4, 'n_shared': 2, 'momentum': 0.18669158080879195, 'mask_type': 'entmax'}. Best is trial 48 with value: 879288441.7589414.
[I 2025-01-15 07:08:06,011] Trial 57 finished with value: 1265012716.0726943 and parameters: {'n_d': 38, 'n_steps': 8, 'gamma': 1.1185906711961047, 'cat_emb_dim': 3, 'n_independent': 5, 'n_shared': 2, 'momentum': 0.09476658936070391, 'mask_type': 'entmax'}. Best is trial 48 with value: 879288441.7589414.
[I 2025-01-15 07:14:49,709] Trial 58 finished with value: 1033201609.017618 and parameters: {'n_d': 30, 'n_steps': 9, 'gamma': 1.0005968922923245, 'cat_emb_dim': 2, 'n_independent': 5, 'n_shared': 3, 'momentum': 0.05519708059668206, 'mask_type': 'entmax'}. Best is trial 48 with value: 879288441.7589414.
[I 2025-01-15 07:20:57,921] Trial 59 finished with value: 1500843131.7544339 and parameters: {'n_d': 19, 'n_steps': 10, 'gamma': 1.0885707001776568, 'cat_emb_dim': 3, 'n_independent': 4, 'n_shared': 2, 'momentum': 0.04045307853550103, 'mask_type': 'entmax'}. Best is trial 48 with value: 879288441.7589414.
[I 2025-01-15 07:26:29,862] Trial 60 finished with value: 1191817036.4334655 and parameters: {'n_d': 33, 'n_steps': 9, 'gamma': 1.042208552540524, 'cat_emb_dim': 2, 'n_independent': 5, 'n_shared': 2, 'momentum': 0.024383971041702767, 'mask_type': 'entmax'}. Best is trial 48 with value: 879288441.7589414.
[I 2025-01-15 07:32:44,856] Trial 61 finished with value: 1101169183.5313232 and parameters: {'n_d': 53, 'n_steps': 10, 'gamma': 1.133871732259995, 'cat_emb_dim': 3, 'n_independent': 5, 'n_shared': 2, 'momentum': 0.18459088245460256, 'mask_type': 'entmax'}. Best is trial 48 with value: 879288441.7589414.
[I 2025-01-15 07:39:14,723] Trial 62 finished with value: 1246615427.3222141 and parameters: {'n_d': 37, 'n_steps': 10, 'gamma': 1.1544506211148184, 'cat_emb_dim': 1, 'n_independent': 5, 'n_shared': 2, 'momentum': 0.08615582963170747, 'mask_type': 'entmax'}. Best is trial 48 with value: 879288441.7589414.
[I 2025-01-15 07:46:02,840] Trial 63 finished with value: 970860896.458821 and parameters: {'n_d': 41, 'n_steps': 10, 'gamma': 1.0989921957721207, 'cat_emb_dim': 1, 'n_independent': 5, 'n_shared': 2, 'momentum': 0.37136896367308575, 'mask_type': 'entmax'}. Best is trial 48 with value: 879288441.7589414.
[I 2025-01-15 07:52:54,945] Trial 64 finished with value: 1173973181.9850585 and parameters: {'n_d': 42, 'n_steps': 10, 'gamma': 1.4417985531232655, 'cat_emb_dim': 1, 'n_independent': 5, 'n_shared': 2, 'momentum': 0.12249725284974071, 'mask_type': 'entmax'}. Best is trial 48 with value: 879288441.7589414.
[I 2025-01-15 07:59:00,805] Trial 65 finished with value: 1163203678.070208 and parameters: {'n_d': 34, 'n_steps': 9, 'gamma': 1.0829598633375948, 'cat_emb_dim': 3, 'n_independent': 4, 'n_shared': 3, 'momentum': 0.2857204087654789, 'mask_type': 'entmax'}. Best is trial 48 with value: 879288441.7589414.
[I 2025-01-15 08:05:44,545] Trial 66 finished with value: 1143805535.532498 and parameters: {'n_d': 46, 'n_steps': 10, 'gamma': 1.2193724503153462, 'cat_emb_dim': 1, 'n_independent': 5, 'n_shared': 2, 'momentum': 0.38326795453285883, 'mask_type': 'entmax'}. Best is trial 48 with value: 879288441.7589414.
[I 2025-01-15 08:10:13,720] Trial 67 finished with value: 1794440342.8456109 and parameters: {'n_d': 40, 'n_steps': 6, 'gamma': 1.0354657597655517, 'cat_emb_dim': 1, 'n_independent': 5, 'n_shared': 2, 'momentum': 0.1748327069185115, 'mask_type': 'entmax'}. Best is trial 48 with value: 879288441.7589414.
[I 2025-01-15 08:13:47,611] Trial 68 finished with value: 4072740442.1390495 and parameters: {'n_d': 30, 'n_steps': 4, 'gamma': 1.292265056506721, 'cat_emb_dim': 2, 'n_independent': 4, 'n_shared': 2, 'momentum': 0.0385282502993004, 'mask_type': 'entmax'}. Best is trial 48 with value: 879288441.7589414.
[I 2025-01-15 08:20:34,081] Trial 69 finished with value: 1229669607.449265 and parameters: {'n_d': 25, 'n_steps': 9, 'gamma': 1.10701405174267, 'cat_emb_dim': 1, 'n_independent': 5, 'n_shared': 3, 'momentum': 0.06075155234452796, 'mask_type': 'entmax'}. Best is trial 48 with value: 879288441.7589414.
[I 2025-01-15 08:27:23,794] Trial 70 finished with value: 932985614.6821184 and parameters: {'n_d': 31, 'n_steps': 10, 'gamma': 1.0649222612910842, 'cat_emb_dim': 1, 'n_independent': 5, 'n_shared': 2, 'momentum': 0.14227552308538238, 'mask_type': 'entmax'}. Best is trial 48 with value: 879288441.7589414.
