[I 2025-01-15 02:25:39,927] A new study created in RDB with name: TabNet_Mercedes_Benz
[I 2025-01-15 02:28:58,530] Trial 0 finished with value: 81.11754521437311 and parameters: {'n_d': 38, 'n_steps': 3, 'gamma': 1.236205877214998, 'cat_emb_dim': 1, 'n_independent': 1, 'n_shared': 2, 'momentum': 0.007450090592673791, 'mask_type': 'sparsemax'}. Best is trial 0 with value: 81.11754521437311.
[I 2025-01-15 02:37:42,518] Trial 1 finished with value: 78.8727006647819 and parameters: {'n_d': 19, 'n_steps': 10, 'gamma': 1.7659837587496505, 'cat_emb_dim': 3, 'n_independent': 3, 'n_shared': 3, 'momentum': 0.04724891263052116, 'mask_type': 'entmax'}. Best is trial 1 with value: 78.8727006647819.
[I 2025-01-15 02:42:18,042] Trial 2 finished with value: 76.11829225556144 and parameters: {'n_d': 37, 'n_steps': 5, 'gamma': 1.5418476918413568, 'cat_emb_dim': 2, 'n_independent': 1, 'n_shared': 4, 'momentum': 0.026544957363664592, 'mask_type': 'entmax'}. Best is trial 2 with value: 76.11829225556144.
[I 2025-01-15 02:47:55,557] Trial 3 finished with value: 75.64454339761119 and parameters: {'n_d': 29, 'n_steps': 6, 'gamma': 1.7459457276387949, 'cat_emb_dim': 1, 'n_independent': 1, 'n_shared': 5, 'momentum': 0.0825113077247021, 'mask_type': 'entmax'}. Best is trial 3 with value: 75.64454339761119.
[I 2025-01-15 02:58:45,207] Trial 4 finished with value: 79.93600945004266 and parameters: {'n_d': 61, 'n_steps': 10, 'gamma': 1.850493808936265, 'cat_emb_dim': 1, 'n_independent': 4, 'n_shared': 1, 'momentum': 0.0043581063707074895, 'mask_type': 'sparsemax'}. Best is trial 3 with value: 75.64454339761119.
[I 2025-01-15 03:02:22,104] Trial 5 finished with value: 79.15821186377596 and parameters: {'n_d': 26, 'n_steps': 3, 'gamma': 1.9972296033073467, 'cat_emb_dim': 2, 'n_independent': 3, 'n_shared': 5, 'momentum': 0.016454569697271375, 'mask_type': 'entmax'}. Best is trial 3 with value: 75.64454339761119.
[I 2025-01-15 03:09:22,585] Trial 6 finished with value: 78.06055287720385 and parameters: {'n_d': 17, 'n_steps': 8, 'gamma': 1.5954903860635667, 'cat_emb_dim': 2, 'n_independent': 5, 'n_shared': 3, 'momentum': 0.292102788468035, 'mask_type': 'sparsemax'}. Best is trial 3 with value: 75.64454339761119.
[I 2025-01-15 03:17:07,702] Trial 7 finished with value: 77.2029265196675 and parameters: {'n_d': 28, 'n_steps': 9, 'gamma': 1.8387252936115046, 'cat_emb_dim': 3, 'n_independent': 2, 'n_shared': 3, 'momentum': 0.3170742886804577, 'mask_type': 'entmax'}. Best is trial 3 with value: 75.64454339761119.
[I 2025-01-15 03:22:31,473] Trial 8 finished with value: 81.17770518129987 and parameters: {'n_d': 38, 'n_steps': 10, 'gamma': 1.5205716129861497, 'cat_emb_dim': 1, 'n_independent': 2, 'n_shared': 1, 'momentum': 0.3580319899668655, 'mask_type': 'entmax'}. Best is trial 3 with value: 75.64454339761119.
[I 2025-01-15 03:31:22,353] Trial 9 finished with value: 75.00072954803832 and parameters: {'n_d': 16, 'n_steps': 10, 'gamma': 1.4085809194984513, 'cat_emb_dim': 3, 'n_independent': 4, 'n_shared': 1, 'momentum': 0.05279800692544786, 'mask_type': 'sparsemax'}. Best is trial 9 with value: 75.00072954803832.
[I 2025-01-15 03:42:04,803] Trial 10 finished with value: 183.6319455984796 and parameters: {'n_d': 9, 'n_steps': 7, 'gamma': 1.2096014892291886, 'cat_emb_dim': 3, 'n_independent': 5, 'n_shared': 2, 'momentum': 0.0010120813298252597, 'mask_type': 'sparsemax'}. Best is trial 9 with value: 75.00072954803832.
[I 2025-01-15 03:48:57,424] Trial 11 finished with value: 75.72985211493261 and parameters: {'n_d': 48, 'n_steps': 5, 'gamma': 1.349323393665748, 'cat_emb_dim': 2, 'n_independent': 4, 'n_shared': 5, 'momentum': 0.07604073553809136, 'mask_type': 'sparsemax'}. Best is trial 9 with value: 75.00072954803832.
[I 2025-01-15 03:56:00,382] Trial 12 finished with value: 74.89943251559853 and parameters: {'n_d': 12, 'n_steps': 6, 'gamma': 1.367539072648147, 'cat_emb_dim': 3, 'n_independent': 4, 'n_shared': 4, 'momentum': 0.09891415068212532, 'mask_type': 'entmax'}. Best is trial 12 with value: 74.89943251559853.
[I 2025-01-15 04:05:46,706] Trial 13 finished with value: 75.4163642239525 and parameters: {'n_d': 8, 'n_steps': 7, 'gamma': 1.044594479580603, 'cat_emb_dim': 3, 'n_independent': 4, 'n_shared': 4, 'momentum': 0.09724945889430626, 'mask_type': 'sparsemax'}. Best is trial 12 with value: 74.89943251559853.
[I 2025-01-15 04:10:56,291] Trial 14 finished with value: 74.03760774566834 and parameters: {'n_d': 17, 'n_steps': 5, 'gamma': 1.3612898649294085, 'cat_emb_dim': 3, 'n_independent': 4, 'n_shared': 4, 'momentum': 0.11476070650657906, 'mask_type': 'entmax'}. Best is trial 14 with value: 74.03760774566834.
[I 2025-01-15 04:17:48,768] Trial 15 finished with value: 71.72734869502119 and parameters: {'n_d': 20, 'n_steps': 5, 'gamma': 1.0138857864391857, 'cat_emb_dim': 3, 'n_independent': 5, 'n_shared': 4, 'momentum': 0.16019204782136584, 'mask_type': 'entmax'}. Best is trial 15 with value: 71.72734869502119.
[I 2025-01-15 04:22:24,891] Trial 16 finished with value: 72.12436686648815 and parameters: {'n_d': 23, 'n_steps': 4, 'gamma': 1.0464496254829871, 'cat_emb_dim': 3, 'n_independent': 5, 'n_shared': 4, 'momentum': 0.1893250453863416, 'mask_type': 'entmax'}. Best is trial 15 with value: 71.72734869502119.
[I 2025-01-15 04:27:05,513] Trial 17 finished with value: 74.40988387625198 and parameters: {'n_d': 25, 'n_steps': 4, 'gamma': 1.002477234414176, 'cat_emb_dim': 2, 'n_independent': 5, 'n_shared': 4, 'momentum': 0.15391100982636738, 'mask_type': 'entmax'}. Best is trial 15 with value: 71.72734869502119.
[I 2025-01-15 04:30:45,093] Trial 18 finished with value: 73.33372579621222 and parameters: {'n_d': 46, 'n_steps': 4, 'gamma': 1.160369220431526, 'cat_emb_dim': 3, 'n_independent': 5, 'n_shared': 2, 'momentum': 0.18469827784411139, 'mask_type': 'entmax'}. Best is trial 15 with value: 71.72734869502119.
[I 2025-01-15 04:36:36,661] Trial 19 finished with value: 72.51674981640524 and parameters: {'n_d': 23, 'n_steps': 4, 'gamma': 1.0856909712729317, 'cat_emb_dim': 3, 'n_independent': 5, 'n_shared': 5, 'momentum': 0.026705908821899407, 'mask_type': 'entmax'}. Best is trial 15 with value: 71.72734869502119.
[I 2025-01-15 04:40:13,575] Trial 20 finished with value: 83.66120940074309 and parameters: {'n_d': 32, 'n_steps': 3, 'gamma': 1.1187125651739112, 'cat_emb_dim': 2, 'n_independent': 3, 'n_shared': 4, 'momentum': 0.011880550153801926, 'mask_type': 'entmax'}. Best is trial 15 with value: 71.72734869502119.
[I 2025-01-15 04:44:29,167] Trial 21 finished with value: 75.26184393380777 and parameters: {'n_d': 22, 'n_steps': 4, 'gamma': 1.0939378922584677, 'cat_emb_dim': 3, 'n_independent': 5, 'n_shared': 5, 'momentum': 0.03298707078738598, 'mask_type': 'entmax'}. Best is trial 15 with value: 71.72734869502119.
[I 2025-01-15 04:52:16,465] Trial 22 finished with value: 129.97553374043002 and parameters: {'n_d': 23, 'n_steps': 4, 'gamma': 1.2573069799284349, 'cat_emb_dim': 3, 'n_independent': 5, 'n_shared': 5, 'momentum': 0.0025034406114909117, 'mask_type': 'entmax'}. Best is trial 15 with value: 71.72734869502119.
[I 2025-01-15 04:58:08,596] Trial 23 finished with value: 71.82460131637227 and parameters: {'n_d': 34, 'n_steps': 5, 'gamma': 1.0498576569818443, 'cat_emb_dim': 3, 'n_independent': 5, 'n_shared': 4, 'momentum': 0.19203469428988398, 'mask_type': 'entmax'}. Best is trial 15 with value: 71.72734869502119.
[I 2025-01-15 05:03:58,856] Trial 24 finished with value: 73.2100392268591 and parameters: {'n_d': 42, 'n_steps': 6, 'gamma': 1.0363829505061228, 'cat_emb_dim': 3, 'n_independent': 5, 'n_shared': 3, 'momentum': 0.1848886684657223, 'mask_type': 'entmax'}. Best is trial 15 with value: 71.72734869502119.
[I 2025-01-15 05:08:26,923] Trial 25 finished with value: 74.71249701994309 and parameters: {'n_d': 31, 'n_steps': 5, 'gamma': 1.1803902188451079, 'cat_emb_dim': 3, 'n_independent': 4, 'n_shared': 4, 'momentum': 0.22671121931774638, 'mask_type': 'entmax'}. Best is trial 15 with value: 71.72734869502119.
[I 2025-01-15 05:13:34,429] Trial 26 finished with value: 74.0843987945636 and parameters: {'n_d': 54, 'n_steps': 5, 'gamma': 1.27686776481531, 'cat_emb_dim': 2, 'n_independent': 5, 'n_shared': 3, 'momentum': 0.05417907604440197, 'mask_type': 'entmax'}. Best is trial 15 with value: 71.72734869502119.
[I 2025-01-15 05:18:49,027] Trial 27 finished with value: 73.30221630141241 and parameters: {'n_d': 33, 'n_steps': 6, 'gamma': 1.0082001603730224, 'cat_emb_dim': 3, 'n_independent': 3, 'n_shared': 4, 'momentum': 0.13287728458326345, 'mask_type': 'entmax'}. Best is trial 15 with value: 71.72734869502119.
[I 2025-01-15 05:28:07,547] Trial 28 finished with value: 73.78900387344648 and parameters: {'n_d': 13, 'n_steps': 7, 'gamma': 1.1332362621501468, 'cat_emb_dim': 2, 'n_independent': 5, 'n_shared': 3, 'momentum': 0.3826711583281101, 'mask_type': 'entmax'}. Best is trial 15 with value: 71.72734869502119.
[I 2025-01-15 05:31:02,806] Trial 29 finished with value: 73.22593827681521 and parameters: {'n_d': 42, 'n_steps': 3, 'gamma': 1.2993935360323063, 'cat_emb_dim': 3, 'n_independent': 4, 'n_shared': 4, 'momentum': 0.22409966887637672, 'mask_type': 'entmax'}. Best is trial 15 with value: 71.72734869502119.
[I 2025-01-15 05:35:20,712] Trial 30 finished with value: 83.00492069775655 and parameters: {'n_d': 35, 'n_steps': 5, 'gamma': 1.2064937675319993, 'cat_emb_dim': 3, 'n_independent': 2, 'n_shared': 3, 'momentum': 0.008346296278787147, 'mask_type': 'entmax'}. Best is trial 15 with value: 71.72734869502119.
[I 2025-01-15 05:40:31,560] Trial 31 finished with value: 71.83408518602141 and parameters: {'n_d': 21, 'n_steps': 4, 'gamma': 1.0845459008005778, 'cat_emb_dim': 3, 'n_independent': 5, 'n_shared': 5, 'momentum': 0.03459225232304088, 'mask_type': 'entmax'}. Best is trial 15 with value: 71.72734869502119.
[I 2025-01-15 05:45:31,615] Trial 32 finished with value: 72.87515475126787 and parameters: {'n_d': 20, 'n_steps': 4, 'gamma': 1.0897609713822098, 'cat_emb_dim': 3, 'n_independent': 5, 'n_shared': 5, 'momentum': 0.05198165270865695, 'mask_type': 'entmax'}. Best is trial 15 with value: 71.72734869502119.
[I 2025-01-15 05:49:26,650] Trial 33 finished with value: 74.57394800185307 and parameters: {'n_d': 13, 'n_steps': 3, 'gamma': 1.0723929541214223, 'cat_emb_dim': 3, 'n_independent': 5, 'n_shared': 4, 'momentum': 0.03685303296239314, 'mask_type': 'entmax'}. Best is trial 15 with value: 71.72734869502119.
[I 2025-01-15 05:55:59,481] Trial 34 finished with value: 77.1548949612301 and parameters: {'n_d': 27, 'n_steps': 5, 'gamma': 1.1453678898065642, 'cat_emb_dim': 3, 'n_independent': 5, 'n_shared': 5, 'momentum': 0.07422425958205534, 'mask_type': 'entmax'}. Best is trial 15 with value: 71.72734869502119.
[I 2025-01-15 06:00:14,448] Trial 35 finished with value: 78.83435923842953 and parameters: {'n_d': 20, 'n_steps': 4, 'gamma': 1.4346987788693466, 'cat_emb_dim': 3, 'n_independent': 4, 'n_shared': 4, 'momentum': 0.01579082464121951, 'mask_type': 'entmax'}. Best is trial 15 with value: 71.72734869502119.
[I 2025-01-15 06:03:49,972] Trial 36 finished with value: 71.85286899477971 and parameters: {'n_d': 30, 'n_steps': 3, 'gamma': 1.0114648464161384, 'cat_emb_dim': 3, 'n_independent': 5, 'n_shared': 5, 'momentum': 0.13122543377349247, 'mask_type': 'entmax'}. Best is trial 15 with value: 71.72734869502119.
[I 2025-01-15 06:07:12,976] Trial 37 finished with value: 73.44372535968009 and parameters: {'n_d': 29, 'n_steps': 3, 'gamma': 1.0075000765317659, 'cat_emb_dim': 2, 'n_independent': 4, 'n_shared': 5, 'momentum': 0.13016837106714757, 'mask_type': 'entmax'}. Best is trial 15 with value: 71.72734869502119.
[I 2025-01-15 06:11:02,065] Trial 38 finished with value: 73.03763684497005 and parameters: {'n_d': 39, 'n_steps': 3, 'gamma': 1.579663723949926, 'cat_emb_dim': 1, 'n_independent': 5, 'n_shared': 5, 'momentum': 0.27150088459764216, 'mask_type': 'sparsemax'}. Best is trial 15 with value: 71.72734869502119.
[I 2025-01-15 06:18:24,563] Trial 39 finished with value: 75.08079628476136 and parameters: {'n_d': 29, 'n_steps': 6, 'gamma': 1.6332004931254316, 'cat_emb_dim': 2, 'n_independent': 3, 'n_shared': 5, 'momentum': 0.06852829191289932, 'mask_type': 'entmax'}. Best is trial 15 with value: 71.72734869502119.
[I 2025-01-15 06:25:08,329] Trial 40 finished with value: 74.45193433022112 and parameters: {'n_d': 34, 'n_steps': 5, 'gamma': 1.6784894210247634, 'cat_emb_dim': 3, 'n_independent': 5, 'n_shared': 5, 'momentum': 0.019538493725273137, 'mask_type': 'entmax'}. Best is trial 15 with value: 71.72734869502119.
[I 2025-01-15 06:29:43,166] Trial 41 finished with value: 72.69976391534057 and parameters: {'n_d': 25, 'n_steps': 4, 'gamma': 1.0620126888280754, 'cat_emb_dim': 3, 'n_independent': 5, 'n_shared': 4, 'momentum': 0.174489040849892, 'mask_type': 'entmax'}. Best is trial 15 with value: 71.72734869502119.
[I 2025-01-15 06:32:08,855] Trial 42 finished with value: 74.56477954966797 and parameters: {'n_d': 19, 'n_steps': 3, 'gamma': 1.1325476125920055, 'cat_emb_dim': 3, 'n_independent': 1, 'n_shared': 4, 'momentum': 0.2410971223940687, 'mask_type': 'entmax'}. Best is trial 15 with value: 71.72734869502119.
[I 2025-01-15 06:36:42,043] Trial 43 finished with value: 72.5378414180997 and parameters: {'n_d': 30, 'n_steps': 4, 'gamma': 1.2128973913849417, 'cat_emb_dim': 3, 'n_independent': 5, 'n_shared': 5, 'momentum': 0.10357896667999258, 'mask_type': 'entmax'}. Best is trial 15 with value: 71.72734869502119.
[I 2025-01-15 06:40:39,338] Trial 44 finished with value: 73.46480265820894 and parameters: {'n_d': 15, 'n_steps': 3, 'gamma': 1.0386215728453558, 'cat_emb_dim': 3, 'n_independent': 5, 'n_shared': 5, 'momentum': 0.3912283277681905, 'mask_type': 'sparsemax'}. Best is trial 15 with value: 71.72734869502119.
[I 2025-01-15 06:50:12,095] Trial 45 finished with value: 96.44031659689328 and parameters: {'n_d': 22, 'n_steps': 9, 'gamma': 1.9391822797447245, 'cat_emb_dim': 3, 'n_independent': 4, 'n_shared': 3, 'momentum': 0.004927824721673261, 'mask_type': 'entmax'}. Best is trial 15 with value: 71.72734869502119.
[I 2025-01-15 06:56:10,803] Trial 46 finished with value: 75.22615823701753 and parameters: {'n_d': 27, 'n_steps': 5, 'gamma': 1.1798052146812033, 'cat_emb_dim': 3, 'n_independent': 5, 'n_shared': 4, 'momentum': 0.03876982649873784, 'mask_type': 'entmax'}. Best is trial 15 with value: 71.72734869502119.
[I 2025-01-15 07:00:21,004] Trial 47 finished with value: 74.09936375723531 and parameters: {'n_d': 63, 'n_steps': 4, 'gamma': 1.110521248903824, 'cat_emb_dim': 3, 'n_independent': 4, 'n_shared': 4, 'momentum': 0.14264679445769632, 'mask_type': 'sparsemax'}. Best is trial 15 with value: 71.72734869502119.
[I 2025-01-15 07:07:05,683] Trial 48 finished with value: 71.28680723450536 and parameters: {'n_d': 38, 'n_steps': 6, 'gamma': 1.0048216589523016, 'cat_emb_dim': 2, 'n_independent': 5, 'n_shared': 3, 'momentum': 0.08870750405639888, 'mask_type': 'entmax'}. Best is trial 48 with value: 71.28680723450536.
[I 2025-01-15 07:11:38,339] Trial 49 finished with value: 71.97292109333887 and parameters: {'n_d': 38, 'n_steps': 7, 'gamma': 1.003537640246538, 'cat_emb_dim': 2, 'n_independent': 2, 'n_shared': 2, 'momentum': 0.07991883219519182, 'mask_type': 'entmax'}. Best is trial 48 with value: 71.28680723450536.
[I 2025-01-15 07:17:59,903] Trial 50 finished with value: 75.08561437459298 and parameters: {'n_d': 41, 'n_steps': 6, 'gamma': 1.3244138919795985, 'cat_emb_dim': 1, 'n_independent': 4, 'n_shared': 3, 'momentum': 0.06056654851650863, 'mask_type': 'entmax'}. Best is trial 48 with value: 71.28680723450536.
[I 2025-01-15 07:22:29,993] Trial 51 finished with value: 74.43809838099892 and parameters: {'n_d': 39, 'n_steps': 7, 'gamma': 1.0225316810975857, 'cat_emb_dim': 2, 'n_independent': 2, 'n_shared': 2, 'momentum': 0.09377809931708433, 'mask_type': 'entmax'}. Best is trial 48 with value: 71.28680723450536.
[I 2025-01-15 07:26:21,592] Trial 52 finished with value: 74.06278101527414 and parameters: {'n_d': 36, 'n_steps': 7, 'gamma': 1.0455519495899885, 'cat_emb_dim': 2, 'n_independent': 2, 'n_shared': 1, 'momentum': 0.08154430409970045, 'mask_type': 'entmax'}. Best is trial 48 with value: 71.28680723450536.
[I 2025-01-15 07:29:48,916] Trial 53 finished with value: 75.82400674989802 and parameters: {'n_d': 46, 'n_steps': 6, 'gamma': 1.0025283869310277, 'cat_emb_dim': 2, 'n_independent': 1, 'n_shared': 2, 'momentum': 0.04072988828030864, 'mask_type': 'entmax'}. Best is trial 48 with value: 71.28680723450536.
[I 2025-01-15 07:34:57,122] Trial 54 finished with value: 73.72105359375793 and parameters: {'n_d': 37, 'n_steps': 6, 'gamma': 1.0763402931015142, 'cat_emb_dim': 2, 'n_independent': 3, 'n_shared': 2, 'momentum': 0.11654489549018499, 'mask_type': 'entmax'}. Best is trial 48 with value: 71.28680723450536.
[I 2025-01-15 07:39:20,530] Trial 55 finished with value: 75.8691645667222 and parameters: {'n_d': 50, 'n_steps': 8, 'gamma': 1.4567138028427553, 'cat_emb_dim': 2, 'n_independent': 2, 'n_shared': 1, 'momentum': 0.3121593615688262, 'mask_type': 'entmax'}. Best is trial 48 with value: 71.28680723450536.
[I 2025-01-15 07:51:58,106] Trial 56 finished with value: 77.09520413832746 and parameters: {'n_d': 33, 'n_steps': 8, 'gamma': 1.1102605594901793, 'cat_emb_dim': 2, 'n_independent': 5, 'n_shared': 2, 'momentum': 0.027107051890266954, 'mask_type': 'sparsemax'}. Best is trial 48 with value: 71.28680723450536.
[I 2025-01-15 08:01:23,844] Trial 57 finished with value: 76.08397013862835 and parameters: {'n_d': 40, 'n_steps': 7, 'gamma': 1.2427689466814422, 'cat_emb_dim': 2, 'n_independent': 5, 'n_shared': 3, 'momentum': 0.08946531874559567, 'mask_type': 'entmax'}. Best is trial 48 with value: 71.28680723450536.
[I 2025-01-15 08:07:29,690] Trial 58 finished with value: 73.05860459432763 and parameters: {'n_d': 43, 'n_steps': 5, 'gamma': 1.1707899771905268, 'cat_emb_dim': 2, 'n_independent': 5, 'n_shared': 3, 'momentum': 0.15309582471575414, 'mask_type': 'entmax'}. Best is trial 48 with value: 71.28680723450536.
[I 2025-01-15 08:10:51,384] Trial 59 finished with value: 74.19323298975988 and parameters: {'n_d': 37, 'n_steps': 6, 'gamma': 1.061160892640471, 'cat_emb_dim': 2, 'n_independent': 1, 'n_shared': 2, 'momentum': 0.06357235812631949, 'mask_type': 'entmax'}. Best is trial 48 with value: 71.28680723450536.
[I 2025-01-15 08:18:00,823] Trial 60 finished with value: 74.53246935546917 and parameters: {'n_d': 31, 'n_steps': 5, 'gamma': 1.7805828975729816, 'cat_emb_dim': 1, 'n_independent': 5, 'n_shared': 5, 'momentum': 0.20748531473040815, 'mask_type': 'entmax'}. Best is trial 48 with value: 71.28680723450536.
[I 2025-01-15 08:24:05,330] Trial 61 finished with value: 72.82957043342643 and parameters: {'n_d': 24, 'n_steps': 4, 'gamma': 1.0378480582494836, 'cat_emb_dim': 3, 'n_independent': 5, 'n_shared': 4, 'momentum': 0.1698505541328797, 'mask_type': 'entmax'}. Best is trial 48 with value: 71.28680723450536.
[I 2025-01-15 08:29:49,326] Trial 62 finished with value: 72.93628559001313 and parameters: {'n_d': 17, 'n_steps': 4, 'gamma': 1.0985576577290403, 'cat_emb_dim': 3, 'n_independent': 5, 'n_shared': 4, 'momentum': 0.11612329406925503, 'mask_type': 'entmax'}. Best is trial 48 with value: 71.28680723450536.
[I 2025-01-15 08:36:16,242] Trial 63 finished with value: 73.61142848333841 and parameters: {'n_d': 26, 'n_steps': 5, 'gamma': 1.0666562529736037, 'cat_emb_dim': 3, 'n_independent': 5, 'n_shared': 3, 'momentum': 0.2945618603870864, 'mask_type': 'entmax'}. Best is trial 48 with value: 71.28680723450536.
[I 2025-01-15 08:46:16,427] Trial 64 finished with value: 75.37265478077121 and parameters: {'n_d': 10, 'n_steps': 7, 'gamma': 1.0293577677437933, 'cat_emb_dim': 3, 'n_independent': 5, 'n_shared': 4, 'momentum': 0.20465423671732672, 'mask_type': 'entmax'}. Best is trial 48 with value: 71.28680723450536.
[I 2025-01-15 08:52:46,039] Trial 65 finished with value: 70.66830121459937 and parameters: {'n_d': 18, 'n_steps': 4, 'gamma': 1.0002210363788324, 'cat_emb_dim': 3, 'n_independent': 5, 'n_shared': 5, 'momentum': 0.13656563814026673, 'mask_type': 'entmax'}. Best is trial 65 with value: 70.66830121459937.
[I 2025-01-15 08:57:15,064] Trial 66 finished with value: 73.46534180647686 and parameters: {'n_d': 16, 'n_steps': 3, 'gamma': 1.004172317795204, 'cat_emb_dim': 3, 'n_independent': 5, 'n_shared': 5, 'momentum': 0.04795337728630177, 'mask_type': 'entmax'}. Best is trial 65 with value: 70.66830121459937.
[I 2025-01-15 09:03:34,867] Trial 67 finished with value: 74.70835054702411 and parameters: {'n_d': 21, 'n_steps': 5, 'gamma': 1.1341580342135036, 'cat_emb_dim': 2, 'n_independent': 4, 'n_shared': 5, 'momentum': 0.12655760988071257, 'mask_type': 'entmax'}. Best is trial 65 with value: 70.66830121459937.
[I 2025-01-15 09:10:01,612] Trial 68 finished with value: 73.7236950070107 and parameters: {'n_d': 19, 'n_steps': 4, 'gamma': 1.087955687989813, 'cat_emb_dim': 3, 'n_independent': 5, 'n_shared': 5, 'momentum': 0.08551728388673088, 'mask_type': 'sparsemax'}. Best is trial 65 with value: 70.66830121459937.
[I 2025-01-15 09:18:17,209] Trial 69 finished with value: 72.79924066777735 and parameters: {'n_d': 34, 'n_steps': 6, 'gamma': 1.0010014459026293, 'cat_emb_dim': 3, 'n_independent': 4, 'n_shared': 5, 'momentum': 0.2643667291723006, 'mask_type': 'entmax'}. Best is trial 65 with value: 70.66830121459937.
[I 2025-01-15 09:25:37,100] Trial 70 finished with value: 74.25350532850949 and parameters: {'n_d': 14, 'n_steps': 5, 'gamma': 1.0499912604784738, 'cat_emb_dim': 2, 'n_independent': 5, 'n_shared': 5, 'momentum': 0.15633999104232005, 'mask_type': 'entmax'}. Best is trial 65 with value: 70.66830121459937.
