[I 2025-03-30 21:09:57,844] Trial 26 finished with value: 2.7718399999999996 and parameters: {'n_d': 46, 'n_steps': 5, 'gamma': 1.471200891735509, 'cat_emb_dim': 2, 'n_independent': 4, 'n_shared': 3, 'momentum': 0.0027252183571674837, 'mask_type': 'sparsemax'}. Best is trial 24 with value: 5.95272.
[I 2025-03-30 21:12:46,635] Trial 27 finished with value: 5.2507 and parameters: {'n_d': 57, 'n_steps': 7, 'gamma': 1.5664882825587034, 'cat_emb_dim': 2, 'n_independent': 5, 'n_shared': 4, 'momentum': 0.002035717575277045, 'mask_type': 'sparsemax'}. Best is trial 24 with value: 5.95272.
[I 2025-03-30 21:15:22,856] Trial 28 finished with value: 4.141360000000001 and parameters: {'n_d': 57, 'n_steps': 7, 'gamma': 1.6188973235322506, 'cat_emb_dim': 2, 'n_independent': 4, 'n_shared': 4, 'momentum': 0.002060466731645818, 'mask_type': 'sparsemax'}. Best is trial 24 with value: 5.95272.
[I 2025-03-30 21:19:07,842] Trial 29 finished with value: 6.266540000000001 and parameters: {'n_d': 49, 'n_steps': 9, 'gamma': 1.820101820369483, 'cat_emb_dim': 2, 'n_independent': 5, 'n_shared': 5, 'momentum': 0.0018869371374293576, 'mask_type': 'sparsemax'}. Best is trial 29 with value: 6.266540000000001.
[I 2025-03-30 21:22:21,227] Trial 30 finished with value: 1.1865400000000002 and parameters: {'n_d': 47, 'n_steps': 9, 'gamma': 1.8506955921540937, 'cat_emb_dim': 2, 'n_independent': 3, 'n_shared': 5, 'momentum': 0.0218579683050388, 'mask_type': 'sparsemax'}. Best is trial 29 with value: 6.266540000000001.
[I 2025-03-30 21:26:52,839] Trial 31 finished with value: 1.85002 and parameters: {'n_d': 42, 'n_steps': 9, 'gamma': 1.828132319606915, 'cat_emb_dim': 1, 'n_independent': 5, 'n_shared': 5, 'momentum': 0.006173085113436942, 'mask_type': 'sparsemax'}. Best is trial 29 with value: 6.266540000000001.
[I 2025-03-30 21:29:38,284] Trial 32 finished with value: 5.779120000000001 and parameters: {'n_d': 50, 'n_steps': 7, 'gamma': 1.6427411972326458, 'cat_emb_dim': 2, 'n_independent': 4, 'n_shared': 5, 'momentum': 0.001815486434622925, 'mask_type': 'sparsemax'}. Best is trial 29 with value: 6.266540000000001.
[I 2025-03-30 21:33:07,476] Trial 33 finished with value: 1.33206 and parameters: {'n_d': 52, 'n_steps': 8, 'gamma': 1.673722582713457, 'cat_emb_dim': 2, 'n_independent': 4, 'n_shared': 5, 'momentum': 0.011024253512167424, 'mask_type': 'sparsemax'}. Best is trial 29 with value: 6.266540000000001.
[I 2025-03-30 21:37:00,073] Trial 34 finished with value: 6.02958 and parameters: {'n_d': 61, 'n_steps': 9, 'gamma': 1.7904217418045594, 'cat_emb_dim': 2, 'n_independent': 5, 'n_shared': 5, 'momentum': 0.0017133986377712135, 'mask_type': 'sparsemax'}. Best is trial 29 with value: 6.266540000000001.
[I 2025-03-30 21:40:44,318] Trial 35 finished with value: 6.4826999999999995 and parameters: {'n_d': 61, 'n_steps': 9, 'gamma': 1.7997799634044145, 'cat_emb_dim': 2, 'n_independent': 4, 'n_shared': 5, 'momentum': 0.001574696816883576, 'mask_type': 'sparsemax'}. Best is trial 35 with value: 6.4826999999999995.
[I 2025-03-30 21:43:53,940] Trial 36 finished with value: 7.22178 and parameters: {'n_d': 61, 'n_steps': 9, 'gamma': 1.793948107179346, 'cat_emb_dim': 2, 'n_independent': 4, 'n_shared': 5, 'momentum': 0.0010414004281684049, 'mask_type': 'sparsemax'}. Best is trial 36 with value: 7.22178.
[I 2025-03-30 21:47:00,021] Trial 37 finished with value: 6.22484 and parameters: {'n_d': 62, 'n_steps': 9, 'gamma': 1.7843870415856113, 'cat_emb_dim': 2, 'n_independent': 3, 'n_shared': 5, 'momentum': 0.0011814445995475796, 'mask_type': 'sparsemax'}. Best is trial 36 with value: 7.22178.
[I 2025-03-30 21:50:23,495] Trial 38 finished with value: 6.703239999999999 and parameters: {'n_d': 60, 'n_steps': 10, 'gamma': 1.7620460525630879, 'cat_emb_dim': 1, 'n_independent': 3, 'n_shared': 5, 'momentum': 0.0010177972460107929, 'mask_type': 'sparsemax'}. Best is trial 36 with value: 7.22178.
[I 2025-03-30 21:53:41,429] Trial 39 finished with value: 6.58696 and parameters: {'n_d': 47, 'n_steps': 10, 'gamma': 1.902215060078871, 'cat_emb_dim': 1, 'n_independent': 3, 'n_shared': 5, 'momentum': 0.001038105924700357, 'mask_type': 'entmax'}. Best is trial 36 with value: 7.22178.
[I 2025-03-30 21:56:38,535] Trial 40 finished with value: 6.840339999999999 and parameters: {'n_d': 42, 'n_steps': 10, 'gamma': 1.9171058649071901, 'cat_emb_dim': 1, 'n_independent': 3, 'n_shared': 5, 'momentum': 0.0011119995539739258, 'mask_type': 'entmax'}. Best is trial 36 with value: 7.22178.
[I 2025-03-30 21:59:19,965] Trial 41 finished with value: 6.23982 and parameters: {'n_d': 42, 'n_steps': 10, 'gamma': 1.9145588283185577, 'cat_emb_dim': 1, 'n_independent': 2, 'n_shared': 5, 'momentum': 0.0010645073583523481, 'mask_type': 'entmax'}. Best is trial 36 with value: 7.22178.
[I 2025-03-30 22:02:17,574] Trial 42 finished with value: 6.613159999999999 and parameters: {'n_d': 38, 'n_steps': 10, 'gamma': 1.9200541365086368, 'cat_emb_dim': 1, 'n_independent': 3, 'n_shared': 5, 'momentum': 0.0010911055910111812, 'mask_type': 'entmax'}. Best is trial 36 with value: 7.22178.
[I 2025-03-30 22:04:12,725] Trial 43 finished with value: 1.56304 and parameters: {'n_d': 36, 'n_steps': 10, 'gamma': 1.976672570586954, 'cat_emb_dim': 1, 'n_independent': 3, 'n_shared': 1, 'momentum': 0.0049363665945971235, 'mask_type': 'entmax'}. Best is trial 36 with value: 7.22178.
[I 2025-03-30 22:07:16,686] Trial 44 finished with value: 7.064019999999999 and parameters: {'n_d': 39, 'n_steps': 10, 'gamma': 1.9069059128848214, 'cat_emb_dim': 1, 'n_independent': 3, 'n_shared': 5, 'momentum': 0.0010384037486032584, 'mask_type': 'entmax'}. Best is trial 36 with value: 7.22178.
[I 2025-03-30 22:10:13,544] Trial 45 finished with value: 5.338139999999999 and parameters: {'n_d': 39, 'n_steps': 10, 'gamma': 1.743781988333024, 'cat_emb_dim': 1, 'n_independent': 2, 'n_shared': 5, 'momentum': 0.0013480861594712666, 'mask_type': 'entmax'}. Best is trial 36 with value: 7.22178.
[I 2025-03-30 22:13:09,236] Trial 46 finished with value: 6.49358 and parameters: {'n_d': 33, 'n_steps': 10, 'gamma': 1.8879576659726742, 'cat_emb_dim': 1, 'n_independent': 3, 'n_shared': 5, 'momentum': 0.001039680513014902, 'mask_type': 'entmax'}. Best is trial 36 with value: 7.22178.
[I 2025-03-30 22:15:36,659] Trial 47 finished with value: 5.8468800000000005 and parameters: {'n_d': 28, 'n_steps': 10, 'gamma': 1.7490215023481377, 'cat_emb_dim': 1, 'n_independent': 2, 'n_shared': 5, 'momentum': 0.001443567742781615, 'mask_type': 'entmax'}. Best is trial 36 with value: 7.22178.
[I 2025-03-30 22:17:02,567] Trial 48 finished with value: 5.072699999999999 and parameters: {'n_d': 13, 'n_steps': 10, 'gamma': 1.9351687669734547, 'cat_emb_dim': 1, 'n_independent': 3, 'n_shared': 5, 'momentum': 0.0010115715367209931, 'mask_type': 'entmax'}. Best is trial 36 with value: 7.22178.
[I 2025-03-30 22:19:27,068] Trial 49 finished with value: 3.3260799999999997 and parameters: {'n_d': 39, 'n_steps': 9, 'gamma': 1.9826823067475992, 'cat_emb_dim': 1, 'n_independent': 3, 'n_shared': 4, 'momentum': 0.0027698954020263463, 'mask_type': 'entmax'}. Best is trial 36 with value: 7.22178.
[I 2025-03-30 22:22:41,957] Trial 50 finished with value: 6.23926 and parameters: {'n_d': 43, 'n_steps': 10, 'gamma': 1.8721091688804399, 'cat_emb_dim': 1, 'n_independent': 3, 'n_shared': 5, 'momentum': 0.0014154316877710924, 'mask_type': 'entmax'}. Best is trial 36 with value: 7.22178.
[I 2025-03-30 22:27:25,304] Trial 51 finished with value: 1.0534200000000002 and parameters: {'n_d': 22, 'n_steps': 10, 'gamma': 1.697286918510957, 'cat_emb_dim': 1, 'n_independent': 3, 'n_shared': 5, 'momentum': 0.09174809203195965, 'mask_type': 'entmax'}. Best is trial 36 with value: 7.22178.
[I 2025-03-30 22:28:37,884] Trial 52 finished with value: 2.02434 and parameters: {'n_d': 44, 'n_steps': 9, 'gamma': 1.9383312314774555, 'cat_emb_dim': 1, 'n_independent': 1, 'n_shared': 2, 'momentum': 0.0013680110543716822, 'mask_type': 'entmax'}. Best is trial 36 with value: 7.22178.
