[I 2025-03-30 23:26:24,804] Trial 75 finished with value: 3.17742 and parameters: {'n_d': 39, 'n_steps': 9, 'gamma': 1.382974456419626, 'cat_emb_dim': 2, 'n_independent': 4, 'n_shared': 4, 'momentum': 0.0012197446924228034, 'mask_type': 'entmax'}. Best is trial 38 with value: 3.8623800000000004.
[I 2025-03-30 23:39:52,541] Trial 76 finished with value: 3.5959599999999994 and parameters: {'n_d': 44, 'n_steps': 10, 'gamma': 1.4408878816644008, 'cat_emb_dim': 2, 'n_independent': 4, 'n_shared': 4, 'momentum': 0.0010113307885259485, 'mask_type': 'entmax'}. Best is trial 38 with value: 3.8623800000000004.
[I 2025-03-30 23:50:44,516] Trial 77 finished with value: 2.90076 and parameters: {'n_d': 43, 'n_steps': 9, 'gamma': 1.5101287887706434, 'cat_emb_dim': 2, 'n_independent': 4, 'n_shared': 4, 'momentum': 0.0015345785595309908, 'mask_type': 'entmax'}. Best is trial 38 with value: 3.8623800000000004.
[I 2025-03-31 00:03:55,142] Trial 78 finished with value: 2.9075999999999995 and parameters: {'n_d': 47, 'n_steps': 10, 'gamma': 1.4548359922472442, 'cat_emb_dim': 2, 'n_independent': 3, 'n_shared': 5, 'momentum': 0.0018870111661891177, 'mask_type': 'entmax'}. Best is trial 38 with value: 3.8623800000000004.
[I 2025-03-31 00:17:27,358] Trial 79 finished with value: 2.8474600000000003 and parameters: {'n_d': 44, 'n_steps': 9, 'gamma': 1.5740834322065793, 'cat_emb_dim': 2, 'n_independent': 5, 'n_shared': 4, 'momentum': 0.001561987015240773, 'mask_type': 'sparsemax'}. Best is trial 38 with value: 3.8623800000000004.
[I 2025-03-31 00:30:48,036] Trial 80 finished with value: 3.0188 and parameters: {'n_d': 40, 'n_steps': 10, 'gamma': 1.3969130163293575, 'cat_emb_dim': 2, 'n_independent': 4, 'n_shared': 4, 'momentum': 0.0012223776497843923, 'mask_type': 'entmax'}. Best is trial 38 with value: 3.8623800000000004.
[I 2025-03-31 00:40:34,282] Trial 81 finished with value: 2.57988 and parameters: {'n_d': 32, 'n_steps': 9, 'gamma': 1.4331968721818311, 'cat_emb_dim': 2, 'n_independent': 4, 'n_shared': 4, 'momentum': 0.01009988666248188, 'mask_type': 'entmax'}. Best is trial 38 with value: 3.8623800000000004.
[I 2025-03-31 00:47:10,779] Trial 82 finished with value: 2.5599 and parameters: {'n_d': 47, 'n_steps': 8, 'gamma': 1.4914913118433026, 'cat_emb_dim': 3, 'n_independent': 3, 'n_shared': 5, 'momentum': 0.29001968373953596, 'mask_type': 'entmax'}. Best is trial 38 with value: 3.8623800000000004.
[I 2025-03-31 00:56:43,989] Trial 83 finished with value: 2.5977400000000004 and parameters: {'n_d': 38, 'n_steps': 10, 'gamma': 1.4686387865734911, 'cat_emb_dim': 2, 'n_independent': 5, 'n_shared': 4, 'momentum': 0.030008015565534982, 'mask_type': 'entmax'}. Best is trial 38 with value: 3.8623800000000004.
[I 2025-03-31 01:07:48,579] Trial 84 finished with value: 3.40064 and parameters: {'n_d': 53, 'n_steps': 10, 'gamma': 1.3302480775577703, 'cat_emb_dim': 2, 'n_independent': 4, 'n_shared': 3, 'momentum': 0.0010073168832722527, 'mask_type': 'entmax'}. Best is trial 38 with value: 3.8623800000000004.
[I 2025-03-31 01:18:00,952] Trial 85 finished with value: 3.2781600000000006 and parameters: {'n_d': 53, 'n_steps': 10, 'gamma': 1.3323578465096109, 'cat_emb_dim': 2, 'n_independent': 4, 'n_shared': 3, 'momentum': 0.0011983260718107978, 'mask_type': 'entmax'}. Best is trial 38 with value: 3.8623800000000004.
[I 2025-03-31 01:28:13,465] Trial 86 finished with value: 3.26226 and parameters: {'n_d': 52, 'n_steps': 10, 'gamma': 1.329930992437017, 'cat_emb_dim': 2, 'n_independent': 4, 'n_shared': 3, 'momentum': 0.0011842677970799003, 'mask_type': 'entmax'}. Best is trial 38 with value: 3.8623800000000004.
[I 2025-03-31 01:40:22,035] Trial 87 finished with value: 3.3334400000000004 and parameters: {'n_d': 49, 'n_steps': 9, 'gamma': 1.262303898790672, 'cat_emb_dim': 2, 'n_independent': 4, 'n_shared': 4, 'momentum': 0.0010257872686922453, 'mask_type': 'entmax'}. Best is trial 38 with value: 3.8623800000000004.
[I 2025-03-31 01:49:33,260] Trial 88 finished with value: 2.6111600000000004 and parameters: {'n_d': 49, 'n_steps': 9, 'gamma': 1.2723198197120802, 'cat_emb_dim': 2, 'n_independent': 4, 'n_shared': 4, 'momentum': 0.07699346911524793, 'mask_type': 'entmax'}. Best is trial 38 with value: 3.8623800000000004.
[I 2025-03-31 02:01:53,253] Trial 89 finished with value: 3.3857600000000003 and parameters: {'n_d': 45, 'n_steps': 9, 'gamma': 1.2470344157767268, 'cat_emb_dim': 2, 'n_independent': 4, 'n_shared': 4, 'momentum': 0.001013946539586227, 'mask_type': 'entmax'}. Best is trial 38 with value: 3.8623800000000004.
[I 2025-03-31 02:13:38,058] Trial 90 finished with value: 3.0059 and parameters: {'n_d': 43, 'n_steps': 9, 'gamma': 1.122773644965957, 'cat_emb_dim': 2, 'n_independent': 4, 'n_shared': 4, 'momentum': 0.0014593517365900314, 'mask_type': 'entmax'}. Best is trial 38 with value: 3.8623800000000004.
[I 2025-03-31 02:27:17,438] Trial 91 finished with value: 3.15332 and parameters: {'n_d': 46, 'n_steps': 8, 'gamma': 1.1926363638807773, 'cat_emb_dim': 2, 'n_independent': 5, 'n_shared': 4, 'momentum': 0.0010112084449608754, 'mask_type': 'sparsemax'}. Best is trial 38 with value: 3.8623800000000004.
[I 2025-03-31 02:37:28,518] Trial 92 finished with value: 2.88708 and parameters: {'n_d': 50, 'n_steps': 9, 'gamma': 1.2480195325029482, 'cat_emb_dim': 2, 'n_independent': 3, 'n_shared': 4, 'momentum': 0.0017036107128293703, 'mask_type': 'entmax'}. Best is trial 38 with value: 3.8623800000000004.
[I 2025-03-31 02:51:31,620] Trial 93 finished with value: 3.28844 and parameters: {'n_d': 41, 'n_steps': 8, 'gamma': 1.2942437378255673, 'cat_emb_dim': 2, 'n_independent': 5, 'n_shared': 5, 'momentum': 0.001493927140610739, 'mask_type': 'entmax'}. Best is trial 38 with value: 3.8623800000000004.
[I 2025-03-31 03:04:36,048] Trial 94 finished with value: 3.3673200000000003 and parameters: {'n_d': 31, 'n_steps': 9, 'gamma': 1.3981088080204453, 'cat_emb_dim': 2, 'n_independent': 4, 'n_shared': 4, 'momentum': 0.0010003145785615413, 'mask_type': 'entmax'}. Best is trial 38 with value: 3.8623800000000004.
[I 2025-03-31 03:16:59,128] Trial 95 finished with value: 3.16952 and parameters: {'n_d': 32, 'n_steps': 9, 'gamma': 1.2358040289235968, 'cat_emb_dim': 2, 'n_independent': 4, 'n_shared': 4, 'momentum': 0.0011802543586120742, 'mask_type': 'entmax'}. Best is trial 38 with value: 3.8623800000000004.
[I 2025-03-31 03:27:12,304] Trial 96 finished with value: 2.8502 and parameters: {'n_d': 37, 'n_steps': 9, 'gamma': 1.3921518963643005, 'cat_emb_dim': 2, 'n_independent': 4, 'n_shared': 4, 'momentum': 0.002092408200917484, 'mask_type': 'entmax'}. Best is trial 38 with value: 3.8623800000000004.
[I 2025-03-31 03:37:34,917] Trial 97 finished with value: 3.31516 and parameters: {'n_d': 34, 'n_steps': 9, 'gamma': 1.87367745992159, 'cat_emb_dim': 2, 'n_independent': 4, 'n_shared': 4, 'momentum': 0.0010068539922345736, 'mask_type': 'entmax'}. Best is trial 38 with value: 3.8623800000000004.
[I 2025-03-31 03:48:43,349] Trial 98 finished with value: 3.1892400000000003 and parameters: {'n_d': 27, 'n_steps': 9, 'gamma': 1.2625534820754296, 'cat_emb_dim': 2, 'n_independent': 4, 'n_shared': 4, 'momentum': 0.0014627421718908227, 'mask_type': 'entmax'}. Best is trial 38 with value: 3.8623800000000004.
[I 2025-03-31 03:57:29,806] Trial 99 finished with value: 3.23946 and parameters: {'n_d': 46, 'n_steps': 8, 'gamma': 1.2194476409241426, 'cat_emb_dim': 2, 'n_independent': 4, 'n_shared': 4, 'momentum': 0.0012024029084121317, 'mask_type': 'entmax'}. Best is trial 38 with value: 3.8623800000000004.
[I 2025-03-31 04:07:19,061] Trial 100 finished with value: 3.0048399999999997 and parameters: {'n_d': 25, 'n_steps': 9, 'gamma': 1.406687401302002, 'cat_emb_dim': 2, 'n_independent': 4, 'n_shared': 4, 'momentum': 0.0017402981953569148, 'mask_type': 'entmax'}. Best is trial 38 with value: 3.8623800000000004.
[I 2025-03-31 04:18:04,771] Trial 101 finished with value: 3.2013000000000007 and parameters: {'n_d': 31, 'n_steps': 9, 'gamma': 1.1584864121238745, 'cat_emb_dim': 2, 'n_independent': 4, 'n_shared': 4, 'momentum': 0.00112609071341789, 'mask_type': 'entmax'}. Best is trial 38 with value: 3.8623800000000004.
