[I 2025-03-30 13:45:37,860] Using an existing study with name 'TabNet_Mercedes_Benz' instead of creating a new one.
[I 2025-03-30 13:48:48,846] Trial 3 finished with value: 2.5573200000000003 and parameters: {'n_d': 30, 'n_steps': 4, 'gamma': 1.3745221206498017, 'cat_emb_dim': 3, 'n_independent': 5, 'n_shared': 2, 'momentum': 0.38225763990203965, 'mask_type': 'entmax'}. Best is trial 3 with value: 2.5573200000000003.
[I 2025-03-30 13:51:44,738] Trial 4 finished with value: 2.5635 and parameters: {'n_d': 21, 'n_steps': 4, 'gamma': 1.3277621645912028, 'cat_emb_dim': 1, 'n_independent': 2, 'n_shared': 3, 'momentum': 0.04859529602388707, 'mask_type': 'entmax'}. Best is trial 4 with value: 2.5635.
[I 2025-03-30 13:56:09,732] Trial 5 finished with value: 2.5654399999999997 and parameters: {'n_d': 31, 'n_steps': 8, 'gamma': 1.9448754430788666, 'cat_emb_dim': 2, 'n_independent': 2, 'n_shared': 2, 'momentum': 0.22301300765811563, 'mask_type': 'sparsemax'}. Best is trial 5 with value: 2.5654399999999997.
[I 2025-03-30 13:59:07,871] Trial 6 finished with value: 2.6142200000000004 and parameters: {'n_d': 45, 'n_steps': 3, 'gamma': 1.3360243554480589, 'cat_emb_dim': 2, 'n_independent': 5, 'n_shared': 2, 'momentum': 0.007760497522232479, 'mask_type': 'entmax'}. Best is trial 6 with value: 2.6142200000000004.
[I 2025-03-30 14:07:59,971] Trial 7 finished with value: 2.5909199999999997 and parameters: {'n_d': 45, 'n_steps': 9, 'gamma': 1.3995975194223993, 'cat_emb_dim': 2, 'n_independent': 4, 'n_shared': 3, 'momentum': 0.11909378922311181, 'mask_type': 'sparsemax'}. Best is trial 6 with value: 2.6142200000000004.
[I 2025-03-30 14:11:36,594] Trial 8 finished with value: 2.6816000000000004 and parameters: {'n_d': 59, 'n_steps': 8, 'gamma': 1.744291955180405, 'cat_emb_dim': 1, 'n_independent': 1, 'n_shared': 1, 'momentum': 0.0013769835506139347, 'mask_type': 'entmax'}. Best is trial 8 with value: 2.6816000000000004.
[I 2025-03-30 14:17:32,910] Trial 9 finished with value: 2.60346 and parameters: {'n_d': 60, 'n_steps': 8, 'gamma': 1.7297101379334294, 'cat_emb_dim': 1, 'n_independent': 4, 'n_shared': 2, 'momentum': 0.32168581167704224, 'mask_type': 'sparsemax'}. Best is trial 8 with value: 2.6816000000000004.
[I 2025-03-30 14:21:26,479] Trial 10 finished with value: 2.60222 and parameters: {'n_d': 47, 'n_steps': 4, 'gamma': 1.5264172293327891, 'cat_emb_dim': 1, 'n_independent': 3, 'n_shared': 4, 'momentum': 0.006943158484882356, 'mask_type': 'sparsemax'}. Best is trial 8 with value: 2.6816000000000004.
[I 2025-03-30 14:30:45,890] Trial 11 finished with value: 2.5669600000000004 and parameters: {'n_d': 12, 'n_steps': 8, 'gamma': 1.9072862728003077, 'cat_emb_dim': 3, 'n_independent': 4, 'n_shared': 5, 'momentum': 0.0072061670671011565, 'mask_type': 'sparsemax'}. Best is trial 8 with value: 2.6816000000000004.
[I 2025-03-30 14:33:57,828] Trial 12 finished with value: 2.61902 and parameters: {'n_d': 61, 'n_steps': 3, 'gamma': 1.1486621362933618, 'cat_emb_dim': 1, 'n_independent': 3, 'n_shared': 4, 'momentum': 0.006611657110949439, 'mask_type': 'sparsemax'}. Best is trial 8 with value: 2.6816000000000004.
[I 2025-03-30 14:36:25,367] Trial 13 finished with value: 2.84374 and parameters: {'n_d': 64, 'n_steps': 6, 'gamma': 1.6624667182113564, 'cat_emb_dim': 1, 'n_independent': 1, 'n_shared': 1, 'momentum': 0.001122467395277083, 'mask_type': 'entmax'}. Best is trial 13 with value: 2.84374.
[I 2025-03-30 14:39:02,414] Trial 14 finished with value: 2.71954 and parameters: {'n_d': 61, 'n_steps': 6, 'gamma': 1.6747856154966008, 'cat_emb_dim': 1, 'n_independent': 1, 'n_shared': 1, 'momentum': 0.0011071585585191086, 'mask_type': 'entmax'}. Best is trial 13 with value: 2.84374.
[I 2025-03-30 14:41:50,485] Trial 15 finished with value: 2.6963600000000003 and parameters: {'n_d': 52, 'n_steps': 6, 'gamma': 1.6218263269612005, 'cat_emb_dim': 1, 'n_independent': 1, 'n_shared': 1, 'momentum': 0.0011436862788461498, 'mask_type': 'entmax'}. Best is trial 13 with value: 2.84374.
[I 2025-03-30 14:44:36,526] Trial 16 finished with value: 2.6752399999999996 and parameters: {'n_d': 53, 'n_steps': 6, 'gamma': 1.7491603825773485, 'cat_emb_dim': 2, 'n_independent': 1, 'n_shared': 1, 'momentum': 0.0023729964530028644, 'mask_type': 'entmax'}. Best is trial 13 with value: 2.84374.
[I 2025-03-30 14:48:17,166] Trial 17 finished with value: 2.6946 and parameters: {'n_d': 63, 'n_steps': 6, 'gamma': 1.5853288434615507, 'cat_emb_dim': 1, 'n_independent': 2, 'n_shared': 1, 'momentum': 0.0031970269384127645, 'mask_type': 'entmax'}. Best is trial 13 with value: 2.84374.
[I 2025-03-30 14:50:26,377] Trial 18 finished with value: 2.6012 and parameters: {'n_d': 36, 'n_steps': 5, 'gamma': 1.8157963627525109, 'cat_emb_dim': 2, 'n_independent': 1, 'n_shared': 1, 'momentum': 0.03931861850324238, 'mask_type': 'entmax'}. Best is trial 13 with value: 2.84374.
[I 2025-03-30 14:57:15,603] Trial 19 finished with value: 2.68734 and parameters: {'n_d': 54, 'n_steps': 10, 'gamma': 1.0970097875126745, 'cat_emb_dim': 1, 'n_independent': 2, 'n_shared': 2, 'momentum': 0.0028364173930218468, 'mask_type': 'entmax'}. Best is trial 13 with value: 2.84374.
[I 2025-03-30 15:01:35,634] Trial 20 finished with value: 2.5976600000000003 and parameters: {'n_d': 63, 'n_steps': 7, 'gamma': 1.6288562107074205, 'cat_emb_dim': 3, 'n_independent': 1, 'n_shared': 3, 'momentum': 0.019568068630498515, 'mask_type': 'entmax'}. Best is trial 13 with value: 2.84374.
[I 2025-03-30 15:06:31,667] Trial 21 finished with value: 3.1108199999999995 and parameters: {'n_d': 39, 'n_steps': 5, 'gamma': 1.466057330560596, 'cat_emb_dim': 1, 'n_independent': 2, 'n_shared': 4, 'momentum': 0.0011021390841495084, 'mask_type': 'entmax'}. Best is trial 21 with value: 3.1108199999999995.
[I 2025-03-30 15:11:26,628] Trial 22 finished with value: 2.5744000000000002 and parameters: {'n_d': 21, 'n_steps': 5, 'gamma': 1.4615689893375514, 'cat_emb_dim': 2, 'n_independent': 2, 'n_shared': 5, 'momentum': 0.016584271618465696, 'mask_type': 'entmax'}. Best is trial 21 with value: 3.1108199999999995.
[I 2025-03-30 15:17:00,022] Trial 23 finished with value: 2.83216 and parameters: {'n_d': 37, 'n_steps': 5, 'gamma': 1.2080041781100723, 'cat_emb_dim': 2, 'n_independent': 3, 'n_shared': 4, 'momentum': 0.0022871132558785773, 'mask_type': 'entmax'}. Best is trial 21 with value: 3.1108199999999995.
[I 2025-03-30 15:21:35,574] Trial 24 finished with value: 2.9369199999999998 and parameters: {'n_d': 39, 'n_steps': 5, 'gamma': 1.2289179839491686, 'cat_emb_dim': 2, 'n_independent': 3, 'n_shared': 4, 'momentum': 0.002022037659112602, 'mask_type': 'entmax'}. Best is trial 21 with value: 3.1108199999999995.
[I 2025-03-30 15:28:24,378] Trial 25 finished with value: 2.6913799999999997 and parameters: {'n_d': 38, 'n_steps': 7, 'gamma': 1.2058686700682033, 'cat_emb_dim': 1, 'n_independent': 3, 'n_shared': 4, 'momentum': 0.004157936791785834, 'mask_type': 'entmax'}. Best is trial 21 with value: 3.1108199999999995.
[I 2025-03-30 15:33:17,645] Trial 26 finished with value: 2.77988 and parameters: {'n_d': 26, 'n_steps': 5, 'gamma': 1.002724087829592, 'cat_emb_dim': 2, 'n_independent': 2, 'n_shared': 5, 'momentum': 0.0018711747902091119, 'mask_type': 'entmax'}. Best is trial 21 with value: 3.1108199999999995.
[I 2025-03-30 15:37:31,919] Trial 27 finished with value: 2.60134 and parameters: {'n_d': 8, 'n_steps': 4, 'gamma': 1.496319632771074, 'cat_emb_dim': 3, 'n_independent': 3, 'n_shared': 4, 'momentum': 0.004364669892049052, 'mask_type': 'entmax'}. Best is trial 21 with value: 3.1108199999999995.
[I 2025-03-30 15:43:02,433] Trial 28 finished with value: 2.87914 and parameters: {'n_d': 41, 'n_steps': 7, 'gamma': 1.2754916960774951, 'cat_emb_dim': 1, 'n_independent': 2, 'n_shared': 3, 'momentum': 0.0016567014863744583, 'mask_type': 'entmax'}. Best is trial 21 with value: 3.1108199999999995.
[I 2025-03-30 15:49:46,234] Trial 29 finished with value: 2.9184200000000002 and parameters: {'n_d': 42, 'n_steps': 7, 'gamma': 1.28170820375696, 'cat_emb_dim': 2, 'n_independent': 3, 'n_shared': 3, 'momentum': 0.001596193699950806, 'mask_type': 'entmax'}. Best is trial 21 with value: 3.1108199999999995.
[I 2025-03-30 15:54:08,337] Trial 30 finished with value: 2.62068 and parameters: {'n_d': 33, 'n_steps': 5, 'gamma': 1.250286177437282, 'cat_emb_dim': 2, 'n_independent': 4, 'n_shared': 4, 'momentum': 0.013261586032860434, 'mask_type': 'entmax'}. Best is trial 21 with value: 3.1108199999999995.
[I 2025-03-30 15:59:43,869] Trial 31 finished with value: 2.6674800000000003 and parameters: {'n_d': 41, 'n_steps': 7, 'gamma': 1.0665132111687616, 'cat_emb_dim': 3, 'n_independent': 3, 'n_shared': 3, 'momentum': 0.003940116605410917, 'mask_type': 'entmax'}. Best is trial 21 with value: 3.1108199999999995.
[I 2025-03-30 16:03:06,986] Trial 32 finished with value: 2.57454 and parameters: {'n_d': 28, 'n_steps': 3, 'gamma': 1.4153659325994044, 'cat_emb_dim': 3, 'n_independent': 5, 'n_shared': 5, 'momentum': 0.03598652513296931, 'mask_type': 'entmax'}. Best is trial 21 with value: 3.1108199999999995.
[I 2025-03-30 16:13:36,099] Trial 33 finished with value: 2.8837599999999997 and parameters: {'n_d': 50, 'n_steps': 9, 'gamma': 1.3151849937463562, 'cat_emb_dim': 2, 'n_independent': 3, 'n_shared': 4, 'momentum': 0.001692775970620105, 'mask_type': 'entmax'}. Best is trial 21 with value: 3.1108199999999995.
[I 2025-03-30 16:24:36,097] Trial 34 finished with value: 2.92394 and parameters: {'n_d': 48, 'n_steps': 10, 'gamma': 1.3199133373678735, 'cat_emb_dim': 2, 'n_independent': 3, 'n_shared': 4, 'momentum': 0.0016835506882264758, 'mask_type': 'entmax'}. Best is trial 21 with value: 3.1108199999999995.
[I 2025-03-30 16:35:36,839] Trial 35 finished with value: 3.0700600000000002 and parameters: {'n_d': 42, 'n_steps': 10, 'gamma': 1.3744839382284701, 'cat_emb_dim': 2, 'n_independent': 4, 'n_shared': 3, 'momentum': 0.0010061495007734728, 'mask_type': 'entmax'}. Best is trial 21 with value: 3.1108199999999995.
[I 2025-03-30 16:48:24,492] Trial 36 finished with value: 3.5682199999999993 and parameters: {'n_d': 48, 'n_steps': 10, 'gamma': 1.371148667135836, 'cat_emb_dim': 2, 'n_independent': 4, 'n_shared': 4, 'momentum': 0.00103370387338046, 'mask_type': 'entmax'}. Best is trial 36 with value: 3.5682199999999993.
[I 2025-03-30 16:59:19,746] Trial 37 finished with value: 3.45714 and parameters: {'n_d': 34, 'n_steps': 9, 'gamma': 1.3827508781871085, 'cat_emb_dim': 2, 'n_independent': 5, 'n_shared': 3, 'momentum': 0.001086935775186214, 'mask_type': 'entmax'}. Best is trial 36 with value: 3.5682199999999993.
[I 2025-03-30 17:08:12,382] Trial 38 finished with value: 3.8623800000000004 and parameters: {'n_d': 33, 'n_steps': 9, 'gamma': 1.3877609999918645, 'cat_emb_dim': 2, 'n_independent': 5, 'n_shared': 3, 'momentum': 0.001069771757489611, 'mask_type': 'entmax'}. Best is trial 38 with value: 3.8623800000000004.
[I 2025-03-30 17:19:49,489] Trial 39 finished with value: 2.66236 and parameters: {'n_d': 33, 'n_steps': 9, 'gamma': 1.450932117550024, 'cat_emb_dim': 2, 'n_independent': 5, 'n_shared': 3, 'momentum': 0.0030231270705775542, 'mask_type': 'sparsemax'}. Best is trial 38 with value: 3.8623800000000004.
[I 2025-03-30 17:26:38,547] Trial 40 finished with value: 2.5789999999999997 and parameters: {'n_d': 24, 'n_steps': 9, 'gamma': 1.5448122484799565, 'cat_emb_dim': 2, 'n_independent': 5, 'n_shared': 2, 'momentum': 0.08957591556602379, 'mask_type': 'entmax'}. Best is trial 38 with value: 3.8623800000000004.
[I 2025-03-30 17:36:44,658] Trial 41 finished with value: 2.5877600000000003 and parameters: {'n_d': 32, 'n_steps': 10, 'gamma': 1.3908238435723475, 'cat_emb_dim': 2, 'n_independent': 5, 'n_shared': 3, 'momentum': 0.01132002064746678, 'mask_type': 'sparsemax'}. Best is trial 38 with value: 3.8623800000000004.
[I 2025-03-30 17:44:31,056] Trial 42 finished with value: 2.6502600000000003 and parameters: {'n_d': 45, 'n_steps': 8, 'gamma': 1.48280575157114, 'cat_emb_dim': 3, 'n_independent': 5, 'n_shared': 3, 'momentum': 0.004870277922476148, 'mask_type': 'entmax'}. Best is trial 38 with value: 3.8623800000000004.
[I 2025-03-30 17:54:40,299] Trial 43 finished with value: 2.86542 and parameters: {'n_d': 21, 'n_steps': 9, 'gamma': 1.340842850961838, 'cat_emb_dim': 2, 'n_independent': 4, 'n_shared': 2, 'momentum': 0.0012730140626951347, 'mask_type': 'sparsemax'}. Best is trial 38 with value: 3.8623800000000004.
[I 2025-03-30 18:05:42,384] Trial 44 finished with value: 3.16148 and parameters: {'n_d': 56, 'n_steps': 10, 'gamma': 1.3610788812221521, 'cat_emb_dim': 2, 'n_independent': 4, 'n_shared': 3, 'momentum': 0.001068257442227396, 'mask_type': 'entmax'}. Best is trial 38 with value: 3.8623800000000004.
[I 2025-03-30 18:17:49,115] Trial 45 finished with value: 3.3141 and parameters: {'n_d': 57, 'n_steps': 10, 'gamma': 1.4314505039701069, 'cat_emb_dim': 2, 'n_independent': 4, 'n_shared': 3, 'momentum': 0.001023515812184018, 'mask_type': 'entmax'}. Best is trial 38 with value: 3.8623800000000004.
[I 2025-03-30 18:27:38,799] Trial 46 finished with value: 3.0559000000000003 and parameters: {'n_d': 58, 'n_steps': 10, 'gamma': 1.411362844190699, 'cat_emb_dim': 2, 'n_independent': 4, 'n_shared': 3, 'momentum': 0.0014894688111660882, 'mask_type': 'entmax'}. Best is trial 38 with value: 3.8623800000000004.
[I 2025-03-30 18:36:33,212] Trial 47 finished with value: 2.78296 and parameters: {'n_d': 56, 'n_steps': 9, 'gamma': 1.5374201010450121, 'cat_emb_dim': 2, 'n_independent': 5, 'n_shared': 2, 'momentum': 0.0026600047581945754, 'mask_type': 'entmax'}. Best is trial 38 with value: 3.8623800000000004.
[I 2025-03-30 18:47:16,960] Trial 48 finished with value: 3.1771800000000003 and parameters: {'n_d': 56, 'n_steps': 10, 'gamma': 1.3576074826302327, 'cat_emb_dim': 2, 'n_independent': 4, 'n_shared': 3, 'momentum': 0.001381102484450947, 'mask_type': 'entmax'}. Best is trial 38 with value: 3.8623800000000004.
[I 2025-03-30 18:55:29,763] Trial 49 finished with value: 3.05136 and parameters: {'n_d': 50, 'n_steps': 8, 'gamma': 1.4078183374489446, 'cat_emb_dim': 2, 'n_independent': 4, 'n_shared': 3, 'momentum': 0.001359825223972418, 'mask_type': 'entmax'}. Best is trial 38 with value: 3.8623800000000004.
[I 2025-03-30 19:03:26,191] Trial 50 finished with value: 2.5839 and parameters: {'n_d': 28, 'n_steps': 10, 'gamma': 1.1729946294141342, 'cat_emb_dim': 2, 'n_independent': 5, 'n_shared': 2, 'momentum': 0.1559182620720599, 'mask_type': 'sparsemax'}. Best is trial 38 with value: 3.8623800000000004.
[I 2025-03-30 19:12:09,631] Trial 51 finished with value: 2.81264 and parameters: {'n_d': 48, 'n_steps': 9, 'gamma': 1.2818237156673453, 'cat_emb_dim': 2, 'n_independent': 4, 'n_shared': 3, 'momentum': 0.0022074761400034853, 'mask_type': 'entmax'}. Best is trial 38 with value: 3.8623800000000004.
[I 2025-03-30 19:20:22,578] Trial 52 finished with value: 2.66458 and parameters: {'n_d': 35, 'n_steps': 9, 'gamma': 1.4363674637802677, 'cat_emb_dim': 2, 'n_independent': 5, 'n_shared': 2, 'momentum': 0.005558419745195866, 'mask_type': 'entmax'}. Best is trial 38 with value: 3.8623800000000004.
[I 2025-03-30 19:29:02,523] Trial 53 finished with value: 2.6028000000000002 and parameters: {'n_d': 58, 'n_steps': 10, 'gamma': 1.5113068742349822, 'cat_emb_dim': 2, 'n_independent': 4, 'n_shared': 3, 'momentum': 0.3970178689319408, 'mask_type': 'entmax'}. Best is trial 38 with value: 3.8623800000000004.
[I 2025-03-30 19:41:22,314] Trial 54 finished with value: 3.2291600000000003 and parameters: {'n_d': 57, 'n_steps': 10, 'gamma': 1.3604265242246416, 'cat_emb_dim': 2, 'n_independent': 4, 'n_shared': 3, 'momentum': 0.0010202305938392178, 'mask_type': 'entmax'}. Best is trial 38 with value: 3.8623800000000004.
[I 2025-03-30 19:53:25,942] Trial 55 finished with value: 3.17326 and parameters: {'n_d': 55, 'n_steps': 10, 'gamma': 1.3536161707328518, 'cat_emb_dim': 2, 'n_independent': 4, 'n_shared': 3, 'momentum': 0.0013078775307390825, 'mask_type': 'entmax'}. Best is trial 38 with value: 3.8623800000000004.
[I 2025-03-30 20:03:24,999] Trial 56 finished with value: 3.00614 and parameters: {'n_d': 60, 'n_steps': 9, 'gamma': 1.5704570117310037, 'cat_emb_dim': 2, 'n_independent': 4, 'n_shared': 3, 'momentum': 0.001354138169287561, 'mask_type': 'entmax'}. Best is trial 38 with value: 3.8623800000000004.
[I 2025-03-30 20:14:22,130] Trial 57 finished with value: 2.6477999999999997 and parameters: {'n_d': 16, 'n_steps': 10, 'gamma': 1.3114369909654107, 'cat_emb_dim': 2, 'n_independent': 5, 'n_shared': 3, 'momentum': 0.0033916048965179206, 'mask_type': 'entmax'}. Best is trial 38 with value: 3.8623800000000004.
[I 2025-03-30 20:22:17,479] Trial 58 finished with value: 2.81188 and parameters: {'n_d': 53, 'n_steps': 8, 'gamma': 1.3779715060230402, 'cat_emb_dim': 2, 'n_independent': 4, 'n_shared': 3, 'momentum': 0.0019821668141246007, 'mask_type': 'entmax'}. Best is trial 38 with value: 3.8623800000000004.
[I 2025-03-30 20:32:47,244] Trial 59 finished with value: 3.1208600000000004 and parameters: {'n_d': 45, 'n_steps': 10, 'gamma': 1.475037913507634, 'cat_emb_dim': 2, 'n_independent': 5, 'n_shared': 2, 'momentum': 0.0011119508052290458, 'mask_type': 'entmax'}. Best is trial 38 with value: 3.8623800000000004.
[I 2025-03-30 20:42:16,502] Trial 60 finished with value: 3.08688 and parameters: {'n_d': 51, 'n_steps': 9, 'gamma': 1.419435342658046, 'cat_emb_dim': 2, 'n_independent': 4, 'n_shared': 3, 'momentum': 0.001018189528531778, 'mask_type': 'sparsemax'}. Best is trial 38 with value: 3.8623800000000004.
[I 2025-03-30 20:55:23,163] Trial 61 finished with value: 2.78842 and parameters: {'n_d': 30, 'n_steps': 10, 'gamma': 1.2614527111013296, 'cat_emb_dim': 2, 'n_independent': 5, 'n_shared': 4, 'momentum': 0.00247362692858938, 'mask_type': 'entmax'}. Best is trial 38 with value: 3.8623800000000004.
[I 2025-03-30 21:07:45,019] Trial 62 finished with value: 3.02744 and parameters: {'n_d': 62, 'n_steps': 9, 'gamma': 1.148125149516113, 'cat_emb_dim': 2, 'n_independent': 4, 'n_shared': 3, 'momentum': 0.001423577464783558, 'mask_type': 'entmax'}. Best is trial 38 with value: 3.8623800000000004.
[I 2025-03-30 21:17:53,872] Trial 63 finished with value: 3.06312 and parameters: {'n_d': 64, 'n_steps': 8, 'gamma': 1.320706148934024, 'cat_emb_dim': 2, 'n_independent': 5, 'n_shared': 4, 'momentum': 0.0019588713627585568, 'mask_type': 'entmax'}. Best is trial 38 with value: 3.8623800000000004.
[I 2025-03-30 21:27:06,741] Trial 64 finished with value: 3.08904 and parameters: {'n_d': 56, 'n_steps': 10, 'gamma': 1.9916242604313399, 'cat_emb_dim': 2, 'n_independent': 4, 'n_shared': 3, 'momentum': 0.0013160275625103354, 'mask_type': 'entmax'}. Best is trial 38 with value: 3.8623800000000004.
[I 2025-03-30 21:36:39,866] Trial 65 finished with value: 3.2400399999999996 and parameters: {'n_d': 55, 'n_steps': 10, 'gamma': 1.3623402266508604, 'cat_emb_dim': 2, 'n_independent': 4, 'n_shared': 3, 'momentum': 0.0012800149032577408, 'mask_type': 'entmax'}. Best is trial 38 with value: 3.8623800000000004.
[I 2025-03-30 21:46:28,479] Trial 66 finished with value: 2.96962 and parameters: {'n_d': 59, 'n_steps': 10, 'gamma': 1.4389926254638667, 'cat_emb_dim': 2, 'n_independent': 4, 'n_shared': 3, 'momentum': 0.001676667183231763, 'mask_type': 'entmax'}. Best is trial 38 with value: 3.8623800000000004.
[I 2025-03-30 21:56:02,959] Trial 67 finished with value: 3.2129 and parameters: {'n_d': 35, 'n_steps': 10, 'gamma': 1.3510786652652123, 'cat_emb_dim': 2, 'n_independent': 4, 'n_shared': 3, 'momentum': 0.0011881245703558388, 'mask_type': 'entmax'}. Best is trial 38 with value: 3.8623800000000004.
[I 2025-03-30 22:08:06,200] Trial 68 finished with value: 3.22292 and parameters: {'n_d': 36, 'n_steps': 9, 'gamma': 1.29703535361028, 'cat_emb_dim': 2, 'n_independent': 4, 'n_shared': 4, 'momentum': 0.001041464129358, 'mask_type': 'entmax'}. Best is trial 38 with value: 3.8623800000000004.
[I 2025-03-30 22:20:58,923] Trial 69 finished with value: 2.92688 and parameters: {'n_d': 30, 'n_steps': 9, 'gamma': 1.213649375839314, 'cat_emb_dim': 2, 'n_independent': 5, 'n_shared': 4, 'momentum': 0.002190562210910511, 'mask_type': 'entmax'}. Best is trial 38 with value: 3.8623800000000004.
[I 2025-03-30 22:31:42,287] Trial 70 finished with value: 2.9802400000000002 and parameters: {'n_d': 37, 'n_steps': 8, 'gamma': 1.3027684291880457, 'cat_emb_dim': 2, 'n_independent': 3, 'n_shared': 5, 'momentum': 0.0017486070656397197, 'mask_type': 'entmax'}. Best is trial 38 with value: 3.8623800000000004.
[I 2025-03-30 22:44:42,987] Trial 71 finished with value: 3.34016 and parameters: {'n_d': 34, 'n_steps': 9, 'gamma': 1.2423026696267394, 'cat_emb_dim': 2, 'n_independent': 4, 'n_shared': 4, 'momentum': 0.0010162568954881, 'mask_type': 'entmax'}. Best is trial 38 with value: 3.8623800000000004.
[I 2025-03-30 22:56:20,231] Trial 72 finished with value: 2.8095799999999995 and parameters: {'n_d': 28, 'n_steps': 9, 'gamma': 1.2367444697240475, 'cat_emb_dim': 2, 'n_independent': 5, 'n_shared': 4, 'momentum': 0.003338969657722393, 'mask_type': 'entmax'}. Best is trial 38 with value: 3.8623800000000004.
[I 2025-03-30 23:04:45,368] Trial 73 finished with value: 2.7512 and parameters: {'n_d': 34, 'n_steps': 8, 'gamma': 1.1821287263071492, 'cat_emb_dim': 2, 'n_independent': 4, 'n_shared': 4, 'momentum': 0.0024735860418554165, 'mask_type': 'entmax'}. Best is trial 38 with value: 3.8623800000000004.
[I 2025-03-30 23:13:58,738] Trial 74 finished with value: 3.6081199999999995 and parameters: {'n_d': 39, 'n_steps': 9, 'gamma': 1.3885865921431209, 'cat_emb_dim': 2, 'n_independent': 4, 'n_shared': 4, 'momentum': 0.0010394769817895198, 'mask_type': 'entmax'}. Best is trial 38 with value: 3.8623800000000004.
