[I 2025-03-30 05:19:09,639] Trial 68 finished with value: 8.137539999999998 and parameters: {'n_d': 64, 'n_steps': 10, 'gamma': 1.211061603325134, 'cat_emb_dim': 2, 'n_independent': 5, 'n_shared': 3, 'momentum': 0.001316009608336931, 'mask_type': 'sparsemax'}. Best is trial 66 with value: 8.4962.
[I 2025-03-30 05:20:11,259] Trial 69 finished with value: 8.39604 and parameters: {'n_d': 64, 'n_steps': 10, 'gamma': 1.211105308615448, 'cat_emb_dim': 2, 'n_independent': 5, 'n_shared': 3, 'momentum': 0.0012586450376016539, 'mask_type': 'sparsemax'}. Best is trial 66 with value: 8.4962.
[I 2025-03-30 05:22:01,816] Trial 70 finished with value: 6.739880000000001 and parameters: {'n_d': 64, 'n_steps': 10, 'gamma': 1.2260181840456312, 'cat_emb_dim': 2, 'n_independent': 5, 'n_shared': 3, 'momentum': 0.002198550432531702, 'mask_type': 'sparsemax'}. Best is trial 66 with value: 8.4962.
[I 2025-03-30 05:24:35,284] Trial 71 finished with value: 6.20962 and parameters: {'n_d': 55, 'n_steps': 10, 'gamma': 1.2185858581746434, 'cat_emb_dim': 2, 'n_independent': 5, 'n_shared': 3, 'momentum': 0.0017628671914367703, 'mask_type': 'sparsemax'}. Best is trial 66 with value: 8.4962.
[I 2025-03-30 05:26:04,940] Trial 72 finished with value: 8.05486 and parameters: {'n_d': 62, 'n_steps': 10, 'gamma': 1.2701921640334934, 'cat_emb_dim': 2, 'n_independent': 5, 'n_shared': 3, 'momentum': 0.0012373491723207905, 'mask_type': 'sparsemax'}. Best is trial 66 with value: 8.4962.
[I 2025-03-30 05:27:11,227] Trial 73 finished with value: 8.230279999999999 and parameters: {'n_d': 62, 'n_steps': 10, 'gamma': 1.2639485437799236, 'cat_emb_dim': 2, 'n_independent': 5, 'n_shared': 3, 'momentum': 0.0011676853707624974, 'mask_type': 'sparsemax'}. Best is trial 66 with value: 8.4962.
[I 2025-03-30 05:28:03,980] Trial 74 finished with value: 8.35404 and parameters: {'n_d': 62, 'n_steps': 10, 'gamma': 1.2759996778908247, 'cat_emb_dim': 2, 'n_independent': 5, 'n_shared': 3, 'momentum': 0.0016178910247710097, 'mask_type': 'sparsemax'}. Best is trial 66 with value: 8.4962.
[I 2025-03-30 05:30:15,998] Trial 75 finished with value: 6.37622 and parameters: {'n_d': 62, 'n_steps': 10, 'gamma': 1.2542001758473953, 'cat_emb_dim': 2, 'n_independent': 5, 'n_shared': 2, 'momentum': 0.0015614193085610904, 'mask_type': 'sparsemax'}. Best is trial 66 with value: 8.4962.
[I 2025-03-30 05:32:12,425] Trial 76 finished with value: 6.0122599999999995 and parameters: {'n_d': 62, 'n_steps': 10, 'gamma': 1.1534599107522814, 'cat_emb_dim': 2, 'n_independent': 5, 'n_shared': 3, 'momentum': 0.0028705934075859275, 'mask_type': 'sparsemax'}. Best is trial 66 with value: 8.4962.
[I 2025-03-30 05:34:22,593] Trial 77 finished with value: 5.06586 and parameters: {'n_d': 64, 'n_steps': 10, 'gamma': 1.2673323588811096, 'cat_emb_dim': 2, 'n_independent': 5, 'n_shared': 3, 'momentum': 0.003432757648680839, 'mask_type': 'sparsemax'}. Best is trial 66 with value: 8.4962.
[I 2025-03-30 05:35:50,135] Trial 78 finished with value: 7.326480000000001 and parameters: {'n_d': 53, 'n_steps': 10, 'gamma': 1.2055764145672994, 'cat_emb_dim': 2, 'n_independent': 5, 'n_shared': 3, 'momentum': 0.0021759064937912223, 'mask_type': 'sparsemax'}. Best is trial 66 with value: 8.4962.
[I 2025-03-30 05:36:47,114] Trial 79 finished with value: 8.34956 and parameters: {'n_d': 57, 'n_steps': 10, 'gamma': 1.2903370178664273, 'cat_emb_dim': 2, 'n_independent': 5, 'n_shared': 3, 'momentum': 0.001340565897440363, 'mask_type': 'sparsemax'}. Best is trial 66 with value: 8.4962.
[I 2025-03-30 05:38:41,886] Trial 80 finished with value: 7.2448999999999995 and parameters: {'n_d': 57, 'n_steps': 10, 'gamma': 1.1757504435441408, 'cat_emb_dim': 2, 'n_independent': 5, 'n_shared': 3, 'momentum': 0.0016734710957950895, 'mask_type': 'sparsemax'}. Best is trial 66 with value: 8.4962.
[I 2025-03-30 05:40:17,476] Trial 81 finished with value: 7.19978 and parameters: {'n_d': 58, 'n_steps': 10, 'gamma': 1.3662519680177883, 'cat_emb_dim': 2, 'n_independent': 5, 'n_shared': 2, 'momentum': 0.0014163486609128904, 'mask_type': 'sparsemax'}. Best is trial 66 with value: 8.4962.
[I 2025-03-30 05:42:02,271] Trial 82 finished with value: 7.868080000000001 and parameters: {'n_d': 62, 'n_steps': 10, 'gamma': 1.2858473026434523, 'cat_emb_dim': 2, 'n_independent': 5, 'n_shared': 3, 'momentum': 0.0012070252393868437, 'mask_type': 'sparsemax'}. Best is trial 66 with value: 8.4962.
[I 2025-03-30 05:43:48,690] Trial 83 finished with value: 7.778699999999999 and parameters: {'n_d': 64, 'n_steps': 10, 'gamma': 1.2512878894345145, 'cat_emb_dim': 2, 'n_independent': 5, 'n_shared': 3, 'momentum': 0.0013659910535344503, 'mask_type': 'sparsemax'}. Best is trial 66 with value: 8.4962.
[I 2025-03-30 05:45:48,133] Trial 84 finished with value: 6.891380000000001 and parameters: {'n_d': 61, 'n_steps': 10, 'gamma': 1.208460600879384, 'cat_emb_dim': 2, 'n_independent': 5, 'n_shared': 3, 'momentum': 0.001959959891328266, 'mask_type': 'sparsemax'}. Best is trial 66 with value: 8.4962.
[I 2025-03-30 05:46:45,761] Trial 85 finished with value: 8.21744 and parameters: {'n_d': 58, 'n_steps': 10, 'gamma': 1.2839975934136119, 'cat_emb_dim': 2, 'n_independent': 5, 'n_shared': 3, 'momentum': 0.0011813951981113175, 'mask_type': 'sparsemax'}. Best is trial 66 with value: 8.4962.
[I 2025-03-30 05:48:17,173] Trial 86 finished with value: 7.69852 and parameters: {'n_d': 54, 'n_steps': 10, 'gamma': 1.348290443238197, 'cat_emb_dim': 2, 'n_independent': 5, 'n_shared': 3, 'momentum': 0.0015465821104784262, 'mask_type': 'sparsemax'}. Best is trial 66 with value: 8.4962.
[I 2025-03-30 05:50:21,259] Trial 87 finished with value: 7.738720000000001 and parameters: {'n_d': 56, 'n_steps': 10, 'gamma': 1.2978798449885924, 'cat_emb_dim': 2, 'n_independent': 5, 'n_shared': 3, 'momentum': 0.0011155011836914276, 'mask_type': 'sparsemax'}. Best is trial 66 with value: 8.4962.
[I 2025-03-30 05:52:14,238] Trial 88 finished with value: 7.32282 and parameters: {'n_d': 58, 'n_steps': 10, 'gamma': 1.170835989257335, 'cat_emb_dim': 2, 'n_independent': 5, 'n_shared': 3, 'momentum': 0.0016753963197639662, 'mask_type': 'sparsemax'}. Best is trial 66 with value: 8.4962.
[I 2025-03-30 05:53:40,960] Trial 89 finished with value: 6.2197000000000005 and parameters: {'n_d': 50, 'n_steps': 9, 'gamma': 1.2478438469970219, 'cat_emb_dim': 2, 'n_independent': 5, 'n_shared': 2, 'momentum': 0.0020897499117787373, 'mask_type': 'sparsemax'}. Best is trial 66 with value: 8.4962.
[I 2025-03-30 05:56:04,613] Trial 90 finished with value: 3.3465000000000003 and parameters: {'n_d': 64, 'n_steps': 9, 'gamma': 1.1366060258307915, 'cat_emb_dim': 2, 'n_independent': 5, 'n_shared': 3, 'momentum': 0.00443802912662633, 'mask_type': 'sparsemax'}. Best is trial 66 with value: 8.4962.
[I 2025-03-30 05:57:17,622] Trial 91 finished with value: 7.66296 and parameters: {'n_d': 59, 'n_steps': 10, 'gamma': 1.881203229528297, 'cat_emb_dim': 1, 'n_independent': 5, 'n_shared': 2, 'momentum': 0.0013161720137645206, 'mask_type': 'sparsemax'}. Best is trial 66 with value: 8.4962.
[I 2025-03-30 05:58:45,185] Trial 92 finished with value: 8.251900000000001 and parameters: {'n_d': 63, 'n_steps': 10, 'gamma': 1.2726715279017493, 'cat_emb_dim': 2, 'n_independent': 5, 'n_shared': 3, 'momentum': 0.001187576088046189, 'mask_type': 'sparsemax'}. Best is trial 66 with value: 8.4962.
[I 2025-03-30 05:59:49,672] Trial 93 finished with value: 8.341980000000001 and parameters: {'n_d': 63, 'n_steps': 10, 'gamma': 1.2311664036883216, 'cat_emb_dim': 2, 'n_independent': 5, 'n_shared': 3, 'momentum': 0.0011394293461219434, 'mask_type': 'sparsemax'}. Best is trial 66 with value: 8.4962.
[I 2025-03-30 06:00:45,415] Trial 94 finished with value: 8.47252 and parameters: {'n_d': 61, 'n_steps': 10, 'gamma': 1.2949929102899935, 'cat_emb_dim': 2, 'n_independent': 5, 'n_shared': 3, 'momentum': 0.0011262520461844327, 'mask_type': 'sparsemax'}. Best is trial 66 with value: 8.4962.
[I 2025-03-30 06:01:36,469] Trial 95 finished with value: 8.31758 and parameters: {'n_d': 61, 'n_steps': 10, 'gamma': 1.3014678622269198, 'cat_emb_dim': 2, 'n_independent': 5, 'n_shared': 3, 'momentum': 0.0011228873111937725, 'mask_type': 'sparsemax'}. Best is trial 66 with value: 8.4962.
[I 2025-03-30 06:02:41,360] Trial 96 finished with value: 8.246500000000001 and parameters: {'n_d': 63, 'n_steps': 10, 'gamma': 1.2321970998626646, 'cat_emb_dim': 2, 'n_independent': 5, 'n_shared': 3, 'momentum': 0.0010020354026859283, 'mask_type': 'sparsemax'}. Best is trial 66 with value: 8.4962.
[I 2025-03-30 06:04:27,673] Trial 97 finished with value: 1.69324 and parameters: {'n_d': 61, 'n_steps': 10, 'gamma': 1.2289798549170807, 'cat_emb_dim': 2, 'n_independent': 5, 'n_shared': 3, 'momentum': 0.1398011911245908, 'mask_type': 'sparsemax'}. Best is trial 66 with value: 8.4962.
[I 2025-03-30 06:05:21,180] Trial 98 finished with value: 8.451899999999998 and parameters: {'n_d': 63, 'n_steps': 10, 'gamma': 1.1927411378696273, 'cat_emb_dim': 2, 'n_independent': 5, 'n_shared': 3, 'momentum': 0.0010014015421866032, 'mask_type': 'sparsemax'}. Best is trial 66 with value: 8.4962.
[I 2025-03-30 06:07:24,144] Trial 99 finished with value: 2.4032199999999997 and parameters: {'n_d': 59, 'n_steps': 9, 'gamma': 1.3031497112790704, 'cat_emb_dim': 2, 'n_independent': 5, 'n_shared': 3, 'momentum': 0.006653144659920557, 'mask_type': 'sparsemax'}. Best is trial 66 with value: 8.4962.
[I 2025-03-30 06:09:07,408] Trial 100 finished with value: 7.63026 and parameters: {'n_d': 56, 'n_steps': 10, 'gamma': 1.1890546867992524, 'cat_emb_dim': 2, 'n_independent': 5, 'n_shared': 3, 'momentum': 0.0015029595442201313, 'mask_type': 'sparsemax'}. Best is trial 66 with value: 8.4962.
[I 2025-03-30 06:10:01,954] Using an existing study with name 'TabNet_Moneyball' instead of creating a new one.
[W 2025-03-30 06:10:23,425] Trial 2 failed with parameters: {'n_d': 38, 'n_steps': 9, 'gamma': 1.614298119008528, 'cat_emb_dim': 2, 'n_independent': 3, 'n_shared': 2, 'momentum': 0.3315307948008887, 'mask_type': 'sparsemax'} because of the following error: TypeError("object of type 'NoneType' has no len()").
Traceback (most recent call last):
  File "/home/mburu/.local/lib/python3.8/site-packages/optuna/study/_optimize.py", line 197, in _run_trial
    value_or_values = func(trial)
  File "train.py", line 415, in __call__
    sc, time = cross_validation(model, self.X, self.y, args_cp, visual=False, save_model=False)#Dont save model during HPT
  File "train.py", line 334, in cross_validation
    print(f"Class label len :{len(args.bin_alt)}")
TypeError: object of type 'NoneType' has no len()
[W 2025-03-30 06:10:23,425] Trial 2 failed with value None.
Traceback (most recent call last):
  File "train.py", line 474, in <module>
    main(arguments)
  File "train.py", line 437, in main
    study.optimize(Objective(args, model_name, X, y), n_trials=args.n_trials)
  File "/home/mburu/.local/lib/python3.8/site-packages/optuna/study/study.py", line 475, in optimize
    _optimize(
  File "/home/mburu/.local/lib/python3.8/site-packages/optuna/study/_optimize.py", line 63, in _optimize
    _optimize_sequential(
  File "/home/mburu/.local/lib/python3.8/site-packages/optuna/study/_optimize.py", line 160, in _optimize_sequential
    frozen_trial = _run_trial(study, func, catch)
  File "/home/mburu/.local/lib/python3.8/site-packages/optuna/study/_optimize.py", line 248, in _run_trial
    raise func_err
  File "/home/mburu/.local/lib/python3.8/site-packages/optuna/study/_optimize.py", line 197, in _run_trial
    value_or_values = func(trial)
  File "train.py", line 415, in __call__
    sc, time = cross_validation(model, self.X, self.y, args_cp, visual=False, save_model=False)#Dont save model during HPT
  File "train.py", line 334, in cross_validation
    print(f"Class label len :{len(args.bin_alt)}")
TypeError: object of type 'NoneType' has no len()
srun: error: stud-000: task 0: Exited with exit code 1
