[I 2025-04-17 02:04:08,073] A new study created in RDB with name: TabNet_Brazillian_Houses
[I 2025-04-17 02:56:36,980] Trial 0 finished with value: 6.337771999999999 and parameters: {'n_d': 48, 'n_steps': 5, 'gamma': 1.9520099500097805, 'cat_emb_dim': 2, 'n_independent': 3, 'n_shared': 5, 'momentum': 0.07305855743866718, 'mask_type': 'entmax'}. Best is trial 0 with value: 6.337771999999999.
[I 2025-04-17 03:52:50,303] Trial 1 finished with value: 6.455998000000001 and parameters: {'n_d': 55, 'n_steps': 9, 'gamma': 1.1455337893697712, 'cat_emb_dim': 1, 'n_independent': 5, 'n_shared': 1, 'momentum': 0.008360047444617469, 'mask_type': 'sparsemax'}. Best is trial 0 with value: 6.337771999999999.
[I 2025-04-17 04:52:06,780] Trial 2 finished with value: 6.269916 and parameters: {'n_d': 39, 'n_steps': 8, 'gamma': 1.1822389378652154, 'cat_emb_dim': 1, 'n_independent': 5, 'n_shared': 5, 'momentum': 0.19641780475877807, 'mask_type': 'entmax'}. Best is trial 2 with value: 6.269916.
[I 2025-04-17 05:52:31,948] Trial 3 finished with value: 6.4168199999999995 and parameters: {'n_d': 49, 'n_steps': 8, 'gamma': 1.676662653986508, 'cat_emb_dim': 3, 'n_independent': 4, 'n_shared': 4, 'momentum': 0.005927085986935725, 'mask_type': 'sparsemax'}. Best is trial 2 with value: 6.269916.
[I 2025-04-17 06:48:59,209] Trial 4 finished with value: 7.43479 and parameters: {'n_d': 44, 'n_steps': 5, 'gamma': 1.6399797355668357, 'cat_emb_dim': 1, 'n_independent': 2, 'n_shared': 4, 'momentum': 0.0017728653955596937, 'mask_type': 'entmax'}. Best is trial 2 with value: 6.269916.
[I 2025-04-17 07:44:37,671] Trial 5 finished with value: 7.597036 and parameters: {'n_d': 63, 'n_steps': 5, 'gamma': 1.6432101615592254, 'cat_emb_dim': 2, 'n_independent': 5, 'n_shared': 2, 'momentum': 0.0020327341651904373, 'mask_type': 'sparsemax'}. Best is trial 2 with value: 6.269916.
[I 2025-04-17 08:34:25,286] Trial 6 finished with value: 7.8509199999999995 and parameters: {'n_d': 50, 'n_steps': 6, 'gamma': 1.7384274134276265, 'cat_emb_dim': 3, 'n_independent': 2, 'n_shared': 2, 'momentum': 0.0011841742325889846, 'mask_type': 'sparsemax'}. Best is trial 2 with value: 6.269916.
[I 2025-04-17 09:25:07,134] Trial 7 finished with value: 6.358298 and parameters: {'n_d': 60, 'n_steps': 7, 'gamma': 1.704334617685995, 'cat_emb_dim': 3, 'n_independent': 1, 'n_shared': 3, 'momentum': 0.08825404558897303, 'mask_type': 'entmax'}. Best is trial 2 with value: 6.269916.
[I 2025-04-17 10:20:19,946] Trial 8 finished with value: 6.3655100000000004 and parameters: {'n_d': 27, 'n_steps': 9, 'gamma': 1.9068053963189873, 'cat_emb_dim': 3, 'n_independent': 4, 'n_shared': 1, 'momentum': 0.009243964958595495, 'mask_type': 'sparsemax'}. Best is trial 2 with value: 6.269916.
[I 2025-04-17 11:09:58,350] Trial 9 finished with value: 6.250224 and parameters: {'n_d': 53, 'n_steps': 3, 'gamma': 1.459960282626319, 'cat_emb_dim': 1, 'n_independent': 3, 'n_shared': 5, 'momentum': 0.3278483939232435, 'mask_type': 'sparsemax'}. Best is trial 9 with value: 6.250224.
[I 2025-04-17 12:00:47,596] Trial 10 finished with value: 6.193766000000001 and parameters: {'n_d': 10, 'n_steps': 3, 'gamma': 1.334647738799387, 'cat_emb_dim': 1, 'n_independent': 3, 'n_shared': 4, 'momentum': 0.34757884003458206, 'mask_type': 'sparsemax'}. Best is trial 10 with value: 6.193766000000001.
[I 2025-04-17 12:50:16,637] Trial 11 finished with value: 6.2429939999999995 and parameters: {'n_d': 13, 'n_steps': 3, 'gamma': 1.369560073014145, 'cat_emb_dim': 1, 'n_independent': 3, 'n_shared': 4, 'momentum': 0.3952811274359008, 'mask_type': 'sparsemax'}. Best is trial 10 with value: 6.193766000000001.
[I 2025-04-17 13:40:28,611] Trial 12 finished with value: 6.077744000000001 and parameters: {'n_d': 8, 'n_steps': 3, 'gamma': 1.3494247778267496, 'cat_emb_dim': 2, 'n_independent': 2, 'n_shared': 4, 'momentum': 0.04378624342715862, 'mask_type': 'sparsemax'}. Best is trial 12 with value: 6.077744000000001.
[I 2025-04-17 14:29:42,541] Trial 13 finished with value: 6.220772 and parameters: {'n_d': 9, 'n_steps': 3, 'gamma': 1.3028575944658467, 'cat_emb_dim': 2, 'n_independent': 1, 'n_shared': 3, 'momentum': 0.033307814865238566, 'mask_type': 'sparsemax'}. Best is trial 12 with value: 6.077744000000001.
[I 2025-04-17 15:20:27,643] Trial 14 finished with value: 6.212908 and parameters: {'n_d': 18, 'n_steps': 4, 'gamma': 1.0444564854480967, 'cat_emb_dim': 2, 'n_independent': 2, 'n_shared': 4, 'momentum': 0.02884089081948446, 'mask_type': 'sparsemax'}. Best is trial 12 with value: 6.077744000000001.
[I 2025-04-17 16:10:01,700] Trial 15 finished with value: 6.350746000000001 and parameters: {'n_d': 24, 'n_steps': 4, 'gamma': 1.3132088402712574, 'cat_emb_dim': 2, 'n_independent': 2, 'n_shared': 3, 'momentum': 0.10264060975057895, 'mask_type': 'sparsemax'}. Best is trial 12 with value: 6.077744000000001.
[I 2025-04-17 17:01:10,751] Trial 16 finished with value: 6.192618 and parameters: {'n_d': 29, 'n_steps': 4, 'gamma': 1.478600164519261, 'cat_emb_dim': 1, 'n_independent': 4, 'n_shared': 4, 'momentum': 0.04752997148048363, 'mask_type': 'sparsemax'}. Best is trial 12 with value: 6.077744000000001.
[I 2025-04-17 17:51:58,505] Trial 17 finished with value: 6.116652 and parameters: {'n_d': 29, 'n_steps': 4, 'gamma': 1.49894981643185, 'cat_emb_dim': 2, 'n_independent': 4, 'n_shared': 2, 'momentum': 0.017265392553697943, 'mask_type': 'sparsemax'}. Best is trial 12 with value: 6.077744000000001.
[I 2025-04-17 18:43:11,748] Trial 18 finished with value: 6.204428 and parameters: {'n_d': 35, 'n_steps': 6, 'gamma': 1.521055345431819, 'cat_emb_dim': 2, 'n_independent': 4, 'n_shared': 2, 'momentum': 0.015878119915425246, 'mask_type': 'entmax'}. Best is trial 12 with value: 6.077744000000001.
[I 2025-04-17 19:35:58,811] Trial 19 finished with value: 6.322274000000001 and parameters: {'n_d': 19, 'n_steps': 10, 'gamma': 1.2020626964179226, 'cat_emb_dim': 2, 'n_independent': 1, 'n_shared': 3, 'momentum': 0.016906326009913895, 'mask_type': 'sparsemax'}. Best is trial 12 with value: 6.077744000000001.
[I 2025-04-17 20:25:03,148] Trial 20 finished with value: 6.567632000000001 and parameters: {'n_d': 33, 'n_steps': 4, 'gamma': 1.5420712659252498, 'cat_emb_dim': 3, 'n_independent': 2, 'n_shared': 2, 'momentum': 0.004964223956694829, 'mask_type': 'sparsemax'}. Best is trial 12 with value: 6.077744000000001.
[I 2025-04-17 21:15:47,876] Trial 21 finished with value: 6.271929999999999 and parameters: {'n_d': 29, 'n_steps': 4, 'gamma': 1.4604513840892974, 'cat_emb_dim': 2, 'n_independent': 4, 'n_shared': 4, 'momentum': 0.05526739049849532, 'mask_type': 'sparsemax'}. Best is trial 12 with value: 6.077744000000001.
[I 2025-04-17 22:06:18,689] Trial 22 finished with value: 6.15663 and parameters: {'n_d': 21, 'n_steps': 5, 'gamma': 1.4142630642277856, 'cat_emb_dim': 1, 'n_independent': 4, 'n_shared': 3, 'momentum': 0.038300912882223315, 'mask_type': 'sparsemax'}. Best is trial 12 with value: 6.077744000000001.
[I 2025-04-17 22:53:53,908] Trial 23 finished with value: 6.222764 and parameters: {'n_d': 18, 'n_steps': 5, 'gamma': 1.3658700318062231, 'cat_emb_dim': 2, 'n_independent': 4, 'n_shared': 2, 'momentum': 0.0221867347438111, 'mask_type': 'sparsemax'}. Best is trial 12 with value: 6.077744000000001.
[I 2025-04-17 23:41:19,782] Trial 24 finished with value: 6.33741 and parameters: {'n_d': 20, 'n_steps': 6, 'gamma': 1.2535498779479017, 'cat_emb_dim': 1, 'n_independent': 5, 'n_shared': 3, 'momentum': 0.12881580930810171, 'mask_type': 'sparsemax'}. Best is trial 12 with value: 6.077744000000001.
[I 2025-04-18 00:26:33,320] Trial 25 finished with value: 6.2127680000000005 and parameters: {'n_d': 14, 'n_steps': 5, 'gamma': 1.8084554782027604, 'cat_emb_dim': 2, 'n_independent': 3, 'n_shared': 1, 'momentum': 0.04473537364975259, 'mask_type': 'sparsemax'}. Best is trial 12 with value: 6.077744000000001.
[I 2025-04-18 01:11:19,204] Trial 26 finished with value: 6.04678 and parameters: {'n_d': 25, 'n_steps': 3, 'gamma': 1.5846221433733516, 'cat_emb_dim': 3, 'n_independent': 4, 'n_shared': 2, 'momentum': 0.011617593330277103, 'mask_type': 'entmax'}. Best is trial 26 with value: 6.04678.
[I 2025-04-18 01:57:03,694] Trial 27 finished with value: 6.62585 and parameters: {'n_d': 41, 'n_steps': 3, 'gamma': 1.57830358382749, 'cat_emb_dim': 3, 'n_independent': 3, 'n_shared': 2, 'momentum': 0.0037229871129429823, 'mask_type': 'entmax'}. Best is trial 26 with value: 6.04678.
[I 2025-04-18 02:43:56,484] Trial 28 finished with value: 6.134386 and parameters: {'n_d': 31, 'n_steps': 3, 'gamma': 1.5758659451591819, 'cat_emb_dim': 3, 'n_independent': 5, 'n_shared': 1, 'momentum': 0.010660634123685826, 'mask_type': 'entmax'}. Best is trial 26 with value: 6.04678.
[I 2025-04-18 03:33:10,356] Trial 29 finished with value: 6.058556 and parameters: {'n_d': 26, 'n_steps': 4, 'gamma': 1.9704793821768831, 'cat_emb_dim': 2, 'n_independent': 3, 'n_shared': 5, 'momentum': 0.012857567683451266, 'mask_type': 'entmax'}. Best is trial 26 with value: 6.04678.
[I 2025-04-18 04:19:18,781] Trial 30 finished with value: 6.396874 and parameters: {'n_d': 23, 'n_steps': 3, 'gamma': 1.9314039784865973, 'cat_emb_dim': 3, 'n_independent': 2, 'n_shared': 5, 'momentum': 0.003374555981611062, 'mask_type': 'entmax'}. Best is trial 26 with value: 6.04678.
[I 2025-04-18 05:03:28,770] Trial 31 finished with value: 6.09555 and parameters: {'n_d': 26, 'n_steps': 4, 'gamma': 1.7793783956421054, 'cat_emb_dim': 2, 'n_independent': 3, 'n_shared': 5, 'momentum': 0.015498499313515166, 'mask_type': 'entmax'}. Best is trial 26 with value: 6.04678.
[I 2025-04-18 05:49:55,769] Trial 32 finished with value: 6.2366280000000005 and parameters: {'n_d': 14, 'n_steps': 4, 'gamma': 1.9887587583853168, 'cat_emb_dim': 2, 'n_independent': 3, 'n_shared': 5, 'momentum': 0.011534602638709621, 'mask_type': 'entmax'}. Best is trial 26 with value: 6.04678.
[I 2025-04-18 06:33:25,709] Trial 33 finished with value: 6.087149999999999 and parameters: {'n_d': 36, 'n_steps': 3, 'gamma': 1.8484281628028976, 'cat_emb_dim': 2, 'n_independent': 3, 'n_shared': 5, 'momentum': 0.02309987034454759, 'mask_type': 'entmax'}. Best is trial 26 with value: 6.04678.
[I 2025-04-18 07:16:04,453] Trial 34 finished with value: 6.0621339999999995 and parameters: {'n_d': 39, 'n_steps': 3, 'gamma': 1.8764859760702302, 'cat_emb_dim': 2, 'n_independent': 2, 'n_shared': 5, 'momentum': 0.026623913950138727, 'mask_type': 'entmax'}. Best is trial 26 with value: 6.04678.
[I 2025-04-18 07:57:23,451] Trial 35 finished with value: 6.231199999999999 and parameters: {'n_d': 45, 'n_steps': 3, 'gamma': 1.8788748290926371, 'cat_emb_dim': 2, 'n_independent': 2, 'n_shared': 5, 'momentum': 0.0064511989908358006, 'mask_type': 'entmax'}. Best is trial 26 with value: 6.04678.
[I 2025-04-18 08:40:05,343] Trial 36 finished with value: 6.140245999999999 and parameters: {'n_d': 43, 'n_steps': 7, 'gamma': 1.9836803205155757, 'cat_emb_dim': 2, 'n_independent': 1, 'n_shared': 5, 'momentum': 0.060524168674448556, 'mask_type': 'entmax'}. Best is trial 26 with value: 6.04678.
[I 2025-04-18 09:21:52,626] Trial 37 finished with value: 6.1765159999999995 and parameters: {'n_d': 39, 'n_steps': 3, 'gamma': 1.8367436646999482, 'cat_emb_dim': 3, 'n_independent': 2, 'n_shared': 4, 'momentum': 0.00685414189696784, 'mask_type': 'entmax'}. Best is trial 26 with value: 6.04678.
[I 2025-04-18 10:03:47,772] Trial 38 finished with value: 6.130512000000001 and parameters: {'n_d': 33, 'n_steps': 5, 'gamma': 1.0894681978361422, 'cat_emb_dim': 2, 'n_independent': 2, 'n_shared': 5, 'momentum': 0.026293186233706516, 'mask_type': 'entmax'}. Best is trial 26 with value: 6.04678.
[I 2025-04-18 10:47:05,215] Trial 39 finished with value: 6.23763 and parameters: {'n_d': 38, 'n_steps': 4, 'gamma': 1.7426629179394322, 'cat_emb_dim': 3, 'n_independent': 2, 'n_shared': 4, 'momentum': 0.011647147478859667, 'mask_type': 'entmax'}. Best is trial 26 with value: 6.04678.
[I 2025-04-18 11:33:13,774] Trial 40 finished with value: 6.404902 and parameters: {'n_d': 47, 'n_steps': 8, 'gamma': 1.6349762935256975, 'cat_emb_dim': 2, 'n_independent': 1, 'n_shared': 5, 'momentum': 0.1695852116567828, 'mask_type': 'entmax'}. Best is trial 26 with value: 6.04678.
[I 2025-04-18 12:17:50,677] Trial 41 finished with value: 6.000711999999999 and parameters: {'n_d': 35, 'n_steps': 3, 'gamma': 1.8830178798654342, 'cat_emb_dim': 2, 'n_independent': 3, 'n_shared': 5, 'momentum': 0.021221705429572718, 'mask_type': 'entmax'}. Best is trial 41 with value: 6.000711999999999.
[I 2025-04-18 13:02:47,880] Trial 42 finished with value: 6.112118 and parameters: {'n_d': 40, 'n_steps': 3, 'gamma': 1.915304775611133, 'cat_emb_dim': 2, 'n_independent': 3, 'n_shared': 5, 'momentum': 0.0731496986713902, 'mask_type': 'entmax'}. Best is trial 41 with value: 6.000711999999999.
[I 2025-04-18 13:47:24,034] Trial 43 finished with value: 6.0961799999999995 and parameters: {'n_d': 33, 'n_steps': 3, 'gamma': 1.8855162426137384, 'cat_emb_dim': 2, 'n_independent': 3, 'n_shared': 5, 'momentum': 0.032442584012144546, 'mask_type': 'entmax'}. Best is trial 41 with value: 6.000711999999999.
[I 2025-04-18 14:31:40,957] Trial 44 finished with value: 6.1742159999999995 and parameters: {'n_d': 55, 'n_steps': 3, 'gamma': 1.9543925326790081, 'cat_emb_dim': 2, 'n_independent': 3, 'n_shared': 4, 'momentum': 0.008680435086934706, 'mask_type': 'entmax'}. Best is trial 41 with value: 6.000711999999999.
[I 2025-04-18 15:16:44,233] Trial 45 finished with value: 6.194584 and parameters: {'n_d': 24, 'n_steps': 4, 'gamma': 1.688726732122702, 'cat_emb_dim': 2, 'n_independent': 2, 'n_shared': 5, 'momentum': 0.021146115487727386, 'mask_type': 'entmax'}. Best is trial 41 with value: 6.000711999999999.
[I 2025-04-18 16:02:37,390] Trial 46 finished with value: 6.033352 and parameters: {'n_d': 16, 'n_steps': 3, 'gamma': 1.7508662385632676, 'cat_emb_dim': 2, 'n_independent': 3, 'n_shared': 4, 'momentum': 0.012772556587360432, 'mask_type': 'entmax'}. Best is trial 41 with value: 6.000711999999999.
[I 2025-04-18 16:50:02,902] Trial 47 finished with value: 6.32207 and parameters: {'n_d': 16, 'n_steps': 3, 'gamma': 1.7617763187634643, 'cat_emb_dim': 2, 'n_independent': 3, 'n_shared': 4, 'momentum': 0.004362851562329275, 'mask_type': 'entmax'}. Best is trial 41 with value: 6.000711999999999.
[I 2025-04-18 17:36:24,637] Trial 48 finished with value: 6.082286000000001 and parameters: {'n_d': 27, 'n_steps': 4, 'gamma': 1.8164676963079969, 'cat_emb_dim': 2, 'n_independent': 3, 'n_shared': 5, 'momentum': 0.013248294849844166, 'mask_type': 'entmax'}. Best is trial 41 with value: 6.000711999999999.
[I 2025-04-18 18:25:56,648] Trial 49 finished with value: 6.0365400000000005 and parameters: {'n_d': 12, 'n_steps': 5, 'gamma': 1.7020750806270462, 'cat_emb_dim': 3, 'n_independent': 4, 'n_shared': 4, 'momentum': 0.00863200462783084, 'mask_type': 'entmax'}. Best is trial 41 with value: 6.000711999999999.
