[I 2025-04-01 04:16:32,902] Trial 75 finished with value: 4.465 and parameters: {'n_d': 19, 'n_steps': 10, 'gamma': 1.8381792819329084, 'cat_emb_dim': 1, 'n_independent': 3, 'n_shared': 2, 'momentum': 0.001150299826450287, 'mask_type': 'entmax'}. Best is trial 35 with value: 5.2892399999999995.
[I 2025-04-01 04:59:10,298] Trial 76 finished with value: 4.2026200000000005 and parameters: {'n_d': 50, 'n_steps': 10, 'gamma': 1.7953727595522784, 'cat_emb_dim': 1, 'n_independent': 4, 'n_shared': 2, 'momentum': 0.0015292089210305563, 'mask_type': 'entmax'}. Best is trial 35 with value: 5.2892399999999995.
[I 2025-04-01 05:51:40,074] Trial 77 finished with value: 4.25094 and parameters: {'n_d': 20, 'n_steps': 9, 'gamma': 1.906499488961439, 'cat_emb_dim': 1, 'n_independent': 3, 'n_shared': 3, 'momentum': 0.0011961136629142937, 'mask_type': 'entmax'}. Best is trial 35 with value: 5.2892399999999995.
[I 2025-04-01 06:31:23,010] Trial 78 finished with value: 4.38122 and parameters: {'n_d': 17, 'n_steps': 10, 'gamma': 1.9792502088487653, 'cat_emb_dim': 1, 'n_independent': 3, 'n_shared': 2, 'momentum': 0.0014423732910900792, 'mask_type': 'entmax'}. Best is trial 35 with value: 5.2892399999999995.
[I 2025-04-01 07:02:09,611] Trial 79 finished with value: 3.99574 and parameters: {'n_d': 25, 'n_steps': 9, 'gamma': 1.838465787887063, 'cat_emb_dim': 1, 'n_independent': 3, 'n_shared': 2, 'momentum': 0.0023575354273487007, 'mask_type': 'entmax'}. Best is trial 35 with value: 5.2892399999999995.
[I 2025-04-01 08:01:11,775] Trial 80 finished with value: 3.90554 and parameters: {'n_d': 11, 'n_steps': 10, 'gamma': 1.9287607583349946, 'cat_emb_dim': 1, 'n_independent': 3, 'n_shared': 5, 'momentum': 0.016031335991645558, 'mask_type': 'entmax'}. Best is trial 35 with value: 5.2892399999999995.
[I 2025-04-01 08:49:27,395] Trial 81 finished with value: 4.1892 and parameters: {'n_d': 35, 'n_steps': 9, 'gamma': 1.8743344966850435, 'cat_emb_dim': 2, 'n_independent': 4, 'n_shared': 3, 'momentum': 0.0018524004567639966, 'mask_type': 'entmax'}. Best is trial 35 with value: 5.2892399999999995.
[I 2025-04-01 09:49:13,867] Trial 82 finished with value: 4.36778 and parameters: {'n_d': 21, 'n_steps': 10, 'gamma': 1.960392334544114, 'cat_emb_dim': 1, 'n_independent': 3, 'n_shared': 2, 'momentum': 0.0011216543065569783, 'mask_type': 'entmax'}. Best is trial 35 with value: 5.2892399999999995.
[I 2025-04-01 10:40:47,307] Trial 83 finished with value: 4.642460000000001 and parameters: {'n_d': 17, 'n_steps': 9, 'gamma': 1.8146818701180636, 'cat_emb_dim': 1, 'n_independent': 3, 'n_shared': 4, 'momentum': 0.0015230682727828515, 'mask_type': 'entmax'}. Best is trial 35 with value: 5.2892399999999995.
[I 2025-04-01 11:50:06,934] Trial 84 finished with value: 4.11338 and parameters: {'n_d': 17, 'n_steps': 9, 'gamma': 1.8174302631344836, 'cat_emb_dim': 1, 'n_independent': 3, 'n_shared': 4, 'momentum': 0.00152638691519141, 'mask_type': 'entmax'}. Best is trial 35 with value: 5.2892399999999995.
[I 2025-04-01 12:29:50,986] Trial 85 finished with value: 5.2332399999999994 and parameters: {'n_d': 15, 'n_steps': 9, 'gamma': 1.710523788387032, 'cat_emb_dim': 1, 'n_independent': 3, 'n_shared': 4, 'momentum': 0.001177638115898599, 'mask_type': 'entmax'}. Best is trial 35 with value: 5.2892399999999995.
[I 2025-04-01 13:25:41,001] Trial 86 finished with value: 4.73122 and parameters: {'n_d': 15, 'n_steps': 9, 'gamma': 1.7088945720395863, 'cat_emb_dim': 1, 'n_independent': 3, 'n_shared': 4, 'momentum': 0.0011707074484105155, 'mask_type': 'entmax'}. Best is trial 35 with value: 5.2892399999999995.
[I 2025-04-01 14:15:28,032] Trial 87 finished with value: 3.91744 and parameters: {'n_d': 15, 'n_steps': 9, 'gamma': 1.716716456076757, 'cat_emb_dim': 1, 'n_independent': 3, 'n_shared': 4, 'momentum': 0.009912409741429306, 'mask_type': 'entmax'}. Best is trial 35 with value: 5.2892399999999995.
[I 2025-04-01 14:49:26,222] Trial 88 finished with value: 5.6018799999999995 and parameters: {'n_d': 14, 'n_steps': 9, 'gamma': 1.6263909066526099, 'cat_emb_dim': 1, 'n_independent': 3, 'n_shared': 4, 'momentum': 0.0010091286586840081, 'mask_type': 'entmax'}. Best is trial 88 with value: 5.6018799999999995.
[I 2025-04-01 15:56:23,544] Trial 89 finished with value: 4.10708 and parameters: {'n_d': 9, 'n_steps': 9, 'gamma': 1.6314681979570067, 'cat_emb_dim': 1, 'n_independent': 4, 'n_shared': 4, 'momentum': 0.002164795575566477, 'mask_type': 'entmax'}. Best is trial 88 with value: 5.6018799999999995.
[I 2025-04-01 16:50:21,154] Trial 90 finished with value: 4.39936 and parameters: {'n_d': 14, 'n_steps': 9, 'gamma': 1.6940088102201472, 'cat_emb_dim': 1, 'n_independent': 3, 'n_shared': 4, 'momentum': 0.001754043950793865, 'mask_type': 'entmax'}. Best is trial 88 with value: 5.6018799999999995.
[I 2025-04-01 17:25:29,164] Trial 91 finished with value: 5.9831 and parameters: {'n_d': 14, 'n_steps': 9, 'gamma': 1.7628506672787196, 'cat_emb_dim': 1, 'n_independent': 3, 'n_shared': 4, 'momentum': 0.0010624672219206063, 'mask_type': 'entmax'}. Best is trial 91 with value: 5.9831.
[I 2025-04-01 17:44:26,307] Trial 92 finished with value: 5.84408 and parameters: {'n_d': 11, 'n_steps': 8, 'gamma': 1.6588800597481703, 'cat_emb_dim': 1, 'n_independent': 2, 'n_shared': 5, 'momentum': 0.001015303657451892, 'mask_type': 'entmax'}. Best is trial 91 with value: 5.9831.
