[I 2025-03-30 22:33:10,442] Using an existing study with name 'TabNet_SAT11' instead of creating a new one.
[I 2025-03-30 22:35:22,548] Trial 3 finished with value: 0.3760800000000001 and parameters: {'n_d': 64, 'n_steps': 6, 'gamma': 1.0792832619432806, 'cat_emb_dim': 1, 'n_independent': 2, 'n_shared': 2, 'momentum': 0.07454631061889978, 'mask_type': 'entmax'}. Best is trial 3 with value: 0.3760800000000001.
[I 2025-03-30 22:39:00,664] Trial 4 finished with value: 0.38446 and parameters: {'n_d': 20, 'n_steps': 5, 'gamma': 1.062575215616779, 'cat_emb_dim': 2, 'n_independent': 5, 'n_shared': 3, 'momentum': 0.13195415509886038, 'mask_type': 'entmax'}. Best is trial 4 with value: 0.38446.
[I 2025-03-30 22:41:21,402] Trial 5 finished with value: 0.38092 and parameters: {'n_d': 31, 'n_steps': 4, 'gamma': 1.3353229699760054, 'cat_emb_dim': 1, 'n_independent': 3, 'n_shared': 3, 'momentum': 0.049173450125556316, 'mask_type': 'entmax'}. Best is trial 4 with value: 0.38446.
[I 2025-03-30 22:44:51,436] Trial 6 finished with value: 0.37836000000000003 and parameters: {'n_d': 61, 'n_steps': 7, 'gamma': 1.4048615648819123, 'cat_emb_dim': 2, 'n_independent': 3, 'n_shared': 2, 'momentum': 0.07908079218746916, 'mask_type': 'sparsemax'}. Best is trial 4 with value: 0.38446.
[I 2025-03-30 22:47:01,355] Trial 7 finished with value: 1.8950399999999998 and parameters: {'n_d': 14, 'n_steps': 3, 'gamma': 1.6695338236276092, 'cat_emb_dim': 3, 'n_independent': 5, 'n_shared': 4, 'momentum': 0.0011704656525214727, 'mask_type': 'entmax'}. Best is trial 7 with value: 1.8950399999999998.
[I 2025-03-30 22:50:17,400] Trial 8 finished with value: 0.7850199999999999 and parameters: {'n_d': 46, 'n_steps': 7, 'gamma': 1.6551738974360375, 'cat_emb_dim': 2, 'n_independent': 5, 'n_shared': 2, 'momentum': 0.002724226353157474, 'mask_type': 'sparsemax'}. Best is trial 7 with value: 1.8950399999999998.
[I 2025-03-30 22:55:22,322] Trial 9 finished with value: 0.41200000000000003 and parameters: {'n_d': 39, 'n_steps': 8, 'gamma': 1.7028360719369438, 'cat_emb_dim': 2, 'n_independent': 2, 'n_shared': 5, 'momentum': 0.22456579460592516, 'mask_type': 'sparsemax'}. Best is trial 7 with value: 1.8950399999999998.
[I 2025-03-30 22:58:50,514] Trial 10 finished with value: 0.40570000000000006 and parameters: {'n_d': 31, 'n_steps': 8, 'gamma': 1.2542694541681303, 'cat_emb_dim': 1, 'n_independent': 4, 'n_shared': 1, 'momentum': 0.03382427269542986, 'mask_type': 'entmax'}. Best is trial 7 with value: 1.8950399999999998.
[I 2025-03-30 23:02:28,833] Trial 11 finished with value: 1.5441200000000002 and parameters: {'n_d': 43, 'n_steps': 7, 'gamma': 1.6824736154686237, 'cat_emb_dim': 1, 'n_independent': 4, 'n_shared': 3, 'momentum': 0.001006339962448626, 'mask_type': 'sparsemax'}. Best is trial 7 with value: 1.8950399999999998.
[I 2025-03-30 23:05:40,709] Trial 12 finished with value: 0.37214 and parameters: {'n_d': 36, 'n_steps': 6, 'gamma': 1.2879697909916161, 'cat_emb_dim': 3, 'n_independent': 5, 'n_shared': 2, 'momentum': 0.09808991167616203, 'mask_type': 'entmax'}. Best is trial 7 with value: 1.8950399999999998.
[I 2025-03-30 23:07:43,447] Trial 13 finished with value: 0.44412 and parameters: {'n_d': 8, 'n_steps': 3, 'gamma': 1.959320534243366, 'cat_emb_dim': 3, 'n_independent': 1, 'n_shared': 5, 'momentum': 0.008969043918216091, 'mask_type': 'entmax'}. Best is trial 7 with value: 1.8950399999999998.
[I 2025-03-30 23:13:10,666] Trial 14 finished with value: 2.0139199999999997 and parameters: {'n_d': 50, 'n_steps': 10, 'gamma': 1.6819703718654022, 'cat_emb_dim': 3, 'n_independent': 4, 'n_shared': 4, 'momentum': 0.001014470443533903, 'mask_type': 'sparsemax'}. Best is trial 14 with value: 2.0139199999999997.
[I 2025-03-30 23:18:00,910] Trial 15 finished with value: 2.28466 and parameters: {'n_d': 53, 'n_steps': 10, 'gamma': 1.896164266454972, 'cat_emb_dim': 3, 'n_independent': 4, 'n_shared': 4, 'momentum': 0.001099282207777889, 'mask_type': 'sparsemax'}. Best is trial 15 with value: 2.28466.
[I 2025-03-30 23:24:27,396] Trial 16 finished with value: 0.55064 and parameters: {'n_d': 52, 'n_steps': 10, 'gamma': 1.987833456222655, 'cat_emb_dim': 3, 'n_independent': 4, 'n_shared': 4, 'momentum': 0.0049155442334164025, 'mask_type': 'sparsemax'}. Best is trial 15 with value: 2.28466.
[I 2025-03-30 23:30:01,696] Trial 17 finished with value: 0.50308 and parameters: {'n_d': 53, 'n_steps': 10, 'gamma': 1.8401853660913468, 'cat_emb_dim': 3, 'n_independent': 4, 'n_shared': 4, 'momentum': 0.01133585317330965, 'mask_type': 'sparsemax'}. Best is trial 15 with value: 2.28466.
[I 2025-03-30 23:35:09,752] Trial 18 finished with value: 0.9112199999999999 and parameters: {'n_d': 56, 'n_steps': 9, 'gamma': 1.826862921700155, 'cat_emb_dim': 3, 'n_independent': 3, 'n_shared': 4, 'momentum': 0.0022836334408777286, 'mask_type': 'sparsemax'}. Best is trial 15 with value: 2.28466.
[I 2025-03-30 23:41:10,750] Trial 19 finished with value: 1.00192 and parameters: {'n_d': 48, 'n_steps': 9, 'gamma': 1.5219038402278713, 'cat_emb_dim': 3, 'n_independent': 4, 'n_shared': 5, 'momentum': 0.002646381690417902, 'mask_type': 'sparsemax'}. Best is trial 15 with value: 2.28466.
[I 2025-03-30 23:45:54,754] Trial 20 finished with value: 0.5209600000000001 and parameters: {'n_d': 59, 'n_steps': 9, 'gamma': 1.8287819798633342, 'cat_emb_dim': 2, 'n_independent': 2, 'n_shared': 4, 'momentum': 0.005967017432568481, 'mask_type': 'sparsemax'}. Best is trial 15 with value: 2.28466.
[I 2025-03-30 23:51:54,425] Trial 21 finished with value: 0.5029 and parameters: {'n_d': 50, 'n_steps': 10, 'gamma': 1.5037103442138413, 'cat_emb_dim': 3, 'n_independent': 3, 'n_shared': 5, 'momentum': 0.021678995979149553, 'mask_type': 'sparsemax'}. Best is trial 15 with value: 2.28466.
[I 2025-03-30 23:57:06,384] Trial 22 finished with value: 0.99056 and parameters: {'n_d': 29, 'n_steps': 8, 'gamma': 1.8978829687769556, 'cat_emb_dim': 3, 'n_independent': 4, 'n_shared': 4, 'momentum': 0.0017062241284378822, 'mask_type': 'sparsemax'}. Best is trial 15 with value: 2.28466.
[I 2025-03-31 00:02:18,650] Trial 23 finished with value: 0.5581599999999999 and parameters: {'n_d': 40, 'n_steps': 9, 'gamma': 1.5932832729858928, 'cat_emb_dim': 2, 'n_independent': 3, 'n_shared': 3, 'momentum': 0.0038678905139439674, 'mask_type': 'sparsemax'}. Best is trial 15 with value: 2.28466.
[I 2025-03-31 00:03:05,991] Trial 24 finished with value: 1.58154 and parameters: {'n_d': 10, 'n_steps': 3, 'gamma': 1.75591442494138, 'cat_emb_dim': 3, 'n_independent': 5, 'n_shared': 4, 'momentum': 0.001070105379390903, 'mask_type': 'entmax'}. Best is trial 15 with value: 2.28466.
[I 2025-03-31 00:05:51,281] Trial 25 finished with value: 1.9026799999999997 and parameters: {'n_d': 17, 'n_steps': 5, 'gamma': 1.6097568342451434, 'cat_emb_dim': 3, 'n_independent': 5, 'n_shared': 4, 'momentum': 0.0015831955175763435, 'mask_type': 'entmax'}. Best is trial 15 with value: 2.28466.
[I 2025-03-31 00:08:47,166] Trial 26 finished with value: 1.35452 and parameters: {'n_d': 23, 'n_steps': 5, 'gamma': 1.5771579818956247, 'cat_emb_dim': 3, 'n_independent': 4, 'n_shared': 3, 'momentum': 0.0017197731300893776, 'mask_type': 'entmax'}. Best is trial 15 with value: 2.28466.
[I 2025-03-31 00:12:19,049] Trial 27 finished with value: 1.2325000000000004 and parameters: {'n_d': 17, 'n_steps': 5, 'gamma': 1.423533646348479, 'cat_emb_dim': 3, 'n_independent': 5, 'n_shared': 5, 'momentum': 0.001941101249741954, 'mask_type': 'sparsemax'}. Best is trial 15 with value: 2.28466.
[I 2025-03-31 00:15:23,135] Trial 28 finished with value: 0.50728 and parameters: {'n_d': 24, 'n_steps': 4, 'gamma': 1.7751281045495153, 'cat_emb_dim': 2, 'n_independent': 5, 'n_shared': 4, 'momentum': 0.00972980661241431, 'mask_type': 'sparsemax'}. Best is trial 15 with value: 2.28466.
[I 2025-03-31 00:19:24,536] Trial 29 finished with value: 0.75526 and parameters: {'n_d': 44, 'n_steps': 10, 'gamma': 1.9045378842268228, 'cat_emb_dim': 3, 'n_independent': 4, 'n_shared': 3, 'momentum': 0.0035916222476219703, 'mask_type': 'entmax'}. Best is trial 15 with value: 2.28466.
[I 2025-03-31 00:22:04,623] Trial 30 finished with value: 1.2777999999999998 and parameters: {'n_d': 55, 'n_steps': 4, 'gamma': 1.6097727441398082, 'cat_emb_dim': 3, 'n_independent': 4, 'n_shared': 4, 'momentum': 0.0015812830896621236, 'mask_type': 'sparsemax'}. Best is trial 15 with value: 2.28466.
[I 2025-03-31 00:26:18,791] Trial 31 finished with value: 0.62496 and parameters: {'n_d': 27, 'n_steps': 6, 'gamma': 1.7411762190744702, 'cat_emb_dim': 2, 'n_independent': 5, 'n_shared': 5, 'momentum': 0.0053857392601423856, 'mask_type': 'entmax'}. Best is trial 15 with value: 2.28466.
[I 2025-03-31 00:29:52,901] Trial 32 finished with value: 0.40984 and parameters: {'n_d': 63, 'n_steps': 8, 'gamma': 1.44371396360008, 'cat_emb_dim': 3, 'n_independent': 4, 'n_shared': 1, 'momentum': 0.016125280142687836, 'mask_type': 'entmax'}. Best is trial 15 with value: 2.28466.
[I 2025-03-31 00:33:52,493] Trial 33 finished with value: 1.0388199999999999 and parameters: {'n_d': 58, 'n_steps': 9, 'gamma': 1.8951967129788259, 'cat_emb_dim': 3, 'n_independent': 3, 'n_shared': 3, 'momentum': 0.0014634213152679206, 'mask_type': 'sparsemax'}. Best is trial 15 with value: 2.28466.
[I 2025-03-31 00:35:16,261] Trial 34 finished with value: 1.9339400000000002 and parameters: {'n_d': 11, 'n_steps': 3, 'gamma': 1.6258684540059365, 'cat_emb_dim': 3, 'n_independent': 5, 'n_shared': 4, 'momentum': 0.0011624597688195692, 'mask_type': 'entmax'}. Best is trial 15 with value: 2.28466.
[I 2025-03-31 00:37:38,927] Trial 35 finished with value: 2.35452 and parameters: {'n_d': 14, 'n_steps': 5, 'gamma': 1.149436011787179, 'cat_emb_dim': 3, 'n_independent': 5, 'n_shared': 4, 'momentum': 0.0010297812053822362, 'mask_type': 'entmax'}. Best is trial 35 with value: 2.35452.
[I 2025-03-31 00:38:34,103] Trial 36 finished with value: 2.09802 and parameters: {'n_d': 11, 'n_steps': 4, 'gamma': 1.1484899267778907, 'cat_emb_dim': 3, 'n_independent': 5, 'n_shared': 4, 'momentum': 0.001004352752547957, 'mask_type': 'entmax'}. Best is trial 35 with value: 2.35452.
[I 2025-03-31 00:40:58,195] Trial 37 finished with value: 0.8161999999999999 and parameters: {'n_d': 14, 'n_steps': 4, 'gamma': 1.1664226240575517, 'cat_emb_dim': 3, 'n_independent': 5, 'n_shared': 3, 'momentum': 0.003063147368002127, 'mask_type': 'entmax'}. Best is trial 35 with value: 2.35452.
[I 2025-03-31 00:42:02,283] Trial 38 finished with value: 0.96168 and parameters: {'n_d': 21, 'n_steps': 5, 'gamma': 1.0144413783086994, 'cat_emb_dim': 3, 'n_independent': 1, 'n_shared': 4, 'momentum': 0.0022358795589646225, 'mask_type': 'entmax'}. Best is trial 35 with value: 2.35452.
[I 2025-03-31 00:46:26,385] Trial 39 finished with value: 1.88898 and parameters: {'n_d': 34, 'n_steps': 6, 'gamma': 1.1203956888376525, 'cat_emb_dim': 2, 'n_independent': 5, 'n_shared': 5, 'momentum': 0.0013144128711803827, 'mask_type': 'entmax'}. Best is trial 35 with value: 2.35452.
[I 2025-03-31 00:47:28,085] Trial 40 finished with value: 1.8622999999999998 and parameters: {'n_d': 14, 'n_steps': 4, 'gamma': 1.2073568362910976, 'cat_emb_dim': 2, 'n_independent': 4, 'n_shared': 3, 'momentum': 0.0010819404168705266, 'mask_type': 'entmax'}. Best is trial 35 with value: 2.35452.
[I 2025-03-31 00:50:21,479] Trial 41 finished with value: 0.37229999999999996 and parameters: {'n_d': 64, 'n_steps': 4, 'gamma': 1.3574114215529465, 'cat_emb_dim': 3, 'n_independent': 3, 'n_shared': 4, 'momentum': 0.22747395654666205, 'mask_type': 'sparsemax'}. Best is trial 35 with value: 2.35452.
[I 2025-03-31 00:55:20,323] Trial 42 finished with value: 0.44993999999999995 and parameters: {'n_d': 17, 'n_steps': 7, 'gamma': 1.077967194176817, 'cat_emb_dim': 1, 'n_independent': 5, 'n_shared': 5, 'momentum': 0.04687172742750824, 'mask_type': 'entmax'}. Best is trial 35 with value: 2.35452.
[I 2025-03-31 01:01:22,434] Trial 43 finished with value: 0.79902 and parameters: {'n_d': 47, 'n_steps': 10, 'gamma': 1.1593451384607762, 'cat_emb_dim': 3, 'n_independent': 4, 'n_shared': 4, 'momentum': 0.004019725742603097, 'mask_type': 'sparsemax'}. Best is trial 35 with value: 2.35452.
[I 2025-03-31 01:02:45,959] Trial 44 finished with value: 1.8584599999999998 and parameters: {'n_d': 11, 'n_steps': 3, 'gamma': 1.309202690492535, 'cat_emb_dim': 3, 'n_independent': 5, 'n_shared': 4, 'momentum': 0.001264770618134766, 'mask_type': 'entmax'}. Best is trial 35 with value: 2.35452.
[I 2025-03-31 01:03:43,860] Trial 45 finished with value: 2.80386 and parameters: {'n_d': 14, 'n_steps': 3, 'gamma': 1.0136194191205694, 'cat_emb_dim': 3, 'n_independent': 5, 'n_shared': 4, 'momentum': 0.0010133373717923582, 'mask_type': 'entmax'}. Best is trial 45 with value: 2.80386.
[I 2025-03-31 01:05:38,416] Trial 46 finished with value: 0.98934 and parameters: {'n_d': 18, 'n_steps': 3, 'gamma': 1.0013153039866614, 'cat_emb_dim': 3, 'n_independent': 5, 'n_shared': 3, 'momentum': 0.0021825458689294073, 'mask_type': 'entmax'}. Best is trial 45 with value: 2.80386.
[I 2025-03-31 01:06:39,017] Trial 47 finished with value: 1.1400000000000001 and parameters: {'n_d': 8, 'n_steps': 4, 'gamma': 1.2184697815573031, 'cat_emb_dim': 3, 'n_independent': 5, 'n_shared': 4, 'momentum': 0.002692721154566793, 'mask_type': 'entmax'}. Best is trial 45 with value: 2.80386.
[I 2025-03-31 01:07:30,669] Trial 48 finished with value: 1.3677599999999999 and parameters: {'n_d': 13, 'n_steps': 5, 'gamma': 1.0476666342188001, 'cat_emb_dim': 3, 'n_independent': 2, 'n_shared': 4, 'momentum': 0.0010004054935576477, 'mask_type': 'entmax'}. Best is trial 45 with value: 2.80386.
[I 2025-03-31 01:11:49,691] Trial 49 finished with value: 1.61842 and parameters: {'n_d': 38, 'n_steps': 6, 'gamma': 1.1063980440635983, 'cat_emb_dim': 3, 'n_independent': 5, 'n_shared': 5, 'momentum': 0.0014211980729350278, 'mask_type': 'entmax'}. Best is trial 45 with value: 2.80386.
[I 2025-03-31 01:13:21,164] Trial 50 finished with value: 0.8444200000000001 and parameters: {'n_d': 20, 'n_steps': 3, 'gamma': 1.3583318934221527, 'cat_emb_dim': 2, 'n_independent': 4, 'n_shared': 2, 'momentum': 0.0019161936321641438, 'mask_type': 'sparsemax'}. Best is trial 45 with value: 2.80386.
[I 2025-03-31 01:16:15,885] Trial 51 finished with value: 0.48462000000000005 and parameters: {'n_d': 50, 'n_steps': 4, 'gamma': 1.2598616209612414, 'cat_emb_dim': 3, 'n_independent': 5, 'n_shared': 4, 'momentum': 0.007742068327150191, 'mask_type': 'entmax'}. Best is trial 45 with value: 2.80386.
[I 2025-03-31 01:21:01,795] Trial 52 finished with value: 0.5189 and parameters: {'n_d': 26, 'n_steps': 10, 'gamma': 1.1473192933159277, 'cat_emb_dim': 3, 'n_independent': 4, 'n_shared': 3, 'momentum': 0.3006544593279018, 'mask_type': 'sparsemax'}. Best is trial 45 with value: 2.80386.
