[I 2025-04-17 00:45:04,738] A new study created in RDB with name: TabNet_Diamonds
[I 2025-04-17 04:08:04,247] Trial 0 finished with value: 0.6724080000000001 and parameters: {'n_d': 43, 'n_steps': 10, 'gamma': 1.4691856720799983, 'cat_emb_dim': 2, 'n_independent': 4, 'n_shared': 5, 'momentum': 0.06749264708381293, 'mask_type': 'sparsemax'}. Best is trial 0 with value: 0.6724080000000001.
[I 2025-04-17 05:45:02,012] Trial 1 finished with value: 0.616882 and parameters: {'n_d': 46, 'n_steps': 4, 'gamma': 1.7662415573877221, 'cat_emb_dim': 2, 'n_independent': 4, 'n_shared': 5, 'momentum': 0.04451895212577754, 'mask_type': 'sparsemax'}. Best is trial 1 with value: 0.616882.
[I 2025-04-17 07:30:19,303] Trial 2 finished with value: 0.6640940000000001 and parameters: {'n_d': 36, 'n_steps': 6, 'gamma': 1.2613904403756875, 'cat_emb_dim': 1, 'n_independent': 3, 'n_shared': 3, 'momentum': 0.0021916416896049715, 'mask_type': 'sparsemax'}. Best is trial 1 with value: 0.616882.
[I 2025-04-17 09:18:45,747] Trial 3 finished with value: 0.670884 and parameters: {'n_d': 46, 'n_steps': 7, 'gamma': 1.538908110709881, 'cat_emb_dim': 1, 'n_independent': 4, 'n_shared': 1, 'momentum': 0.033136028354076745, 'mask_type': 'sparsemax'}. Best is trial 1 with value: 0.616882.
[I 2025-04-17 10:34:27,752] Trial 4 finished with value: 0.6440159999999999 and parameters: {'n_d': 35, 'n_steps': 5, 'gamma': 1.1516136600241116, 'cat_emb_dim': 2, 'n_independent': 2, 'n_shared': 5, 'momentum': 0.04285325203511371, 'mask_type': 'sparsemax'}. Best is trial 1 with value: 0.616882.
[I 2025-04-17 12:30:10,591] Trial 5 finished with value: 0.626352 and parameters: {'n_d': 44, 'n_steps': 9, 'gamma': 1.0185319090044873, 'cat_emb_dim': 1, 'n_independent': 1, 'n_shared': 4, 'momentum': 0.0033644400726901783, 'mask_type': 'entmax'}. Best is trial 1 with value: 0.616882.
[I 2025-04-17 14:42:09,281] Trial 6 finished with value: 0.668336 and parameters: {'n_d': 45, 'n_steps': 6, 'gamma': 1.2550072545190494, 'cat_emb_dim': 1, 'n_independent': 5, 'n_shared': 4, 'momentum': 0.3124544157847012, 'mask_type': 'sparsemax'}. Best is trial 1 with value: 0.616882.
[I 2025-04-17 16:49:41,036] Trial 7 finished with value: 0.625858 and parameters: {'n_d': 10, 'n_steps': 5, 'gamma': 1.5890136799186585, 'cat_emb_dim': 2, 'n_independent': 4, 'n_shared': 5, 'momentum': 0.31523264886606267, 'mask_type': 'sparsemax'}. Best is trial 1 with value: 0.616882.
[I 2025-04-17 18:34:01,541] Trial 8 finished with value: 0.6666320000000001 and parameters: {'n_d': 16, 'n_steps': 9, 'gamma': 1.992442824827774, 'cat_emb_dim': 1, 'n_independent': 1, 'n_shared': 5, 'momentum': 0.039130676056234076, 'mask_type': 'entmax'}. Best is trial 1 with value: 0.616882.
[I 2025-04-17 19:50:37,833] Trial 9 finished with value: 0.610676 and parameters: {'n_d': 50, 'n_steps': 3, 'gamma': 1.063660501619993, 'cat_emb_dim': 1, 'n_independent': 5, 'n_shared': 3, 'momentum': 0.07202419983989204, 'mask_type': 'entmax'}. Best is trial 9 with value: 0.610676.
[I 2025-04-17 20:48:00,894] Trial 10 finished with value: 0.637878 and parameters: {'n_d': 62, 'n_steps': 3, 'gamma': 1.0064851367052958, 'cat_emb_dim': 3, 'n_independent': 5, 'n_shared': 2, 'momentum': 0.007907811480640414, 'mask_type': 'entmax'}. Best is trial 9 with value: 0.610676.
[I 2025-04-17 22:10:13,316] Trial 11 finished with value: 0.572202 and parameters: {'n_d': 60, 'n_steps': 3, 'gamma': 1.8437216964235192, 'cat_emb_dim': 3, 'n_independent': 5, 'n_shared': 3, 'momentum': 0.12645427227434017, 'mask_type': 'entmax'}. Best is trial 11 with value: 0.572202.
[I 2025-04-17 23:33:13,076] Trial 12 finished with value: 0.5816459999999999 and parameters: {'n_d': 61, 'n_steps': 3, 'gamma': 1.8580101906830693, 'cat_emb_dim': 3, 'n_independent': 5, 'n_shared': 3, 'momentum': 0.12522174139946998, 'mask_type': 'entmax'}. Best is trial 11 with value: 0.572202.
[I 2025-04-18 00:42:11,446] Trial 13 finished with value: 0.582146 and parameters: {'n_d': 60, 'n_steps': 3, 'gamma': 1.9772331710057498, 'cat_emb_dim': 3, 'n_independent': 3, 'n_shared': 2, 'momentum': 0.14054234184756992, 'mask_type': 'entmax'}. Best is trial 11 with value: 0.572202.
[I 2025-04-18 01:49:47,439] Trial 14 finished with value: 0.6481840000000001 and parameters: {'n_d': 57, 'n_steps': 4, 'gamma': 1.8051919628948017, 'cat_emb_dim': 3, 'n_independent': 5, 'n_shared': 2, 'momentum': 0.011816861157336574, 'mask_type': 'entmax'}. Best is trial 11 with value: 0.572202.
[I 2025-04-18 03:28:22,813] Trial 15 finished with value: 0.5978859999999999 and parameters: {'n_d': 26, 'n_steps': 4, 'gamma': 1.7660448012858185, 'cat_emb_dim': 3, 'n_independent': 5, 'n_shared': 4, 'momentum': 0.12289325613296298, 'mask_type': 'entmax'}. Best is trial 11 with value: 0.572202.
[I 2025-04-18 04:45:49,600] Trial 16 finished with value: 0.609084 and parameters: {'n_d': 54, 'n_steps': 7, 'gamma': 1.6581365245334148, 'cat_emb_dim': 3, 'n_independent': 2, 'n_shared': 3, 'momentum': 0.1568161003764311, 'mask_type': 'entmax'}. Best is trial 11 with value: 0.572202.
[I 2025-04-18 06:11:25,771] Trial 17 finished with value: 0.5837919999999999 and parameters: {'n_d': 64, 'n_steps': 5, 'gamma': 1.8834911246634287, 'cat_emb_dim': 3, 'n_independent': 4, 'n_shared': 1, 'momentum': 0.012830079338919801, 'mask_type': 'entmax'}. Best is trial 11 with value: 0.572202.
[I 2025-04-18 07:14:06,831] Trial 18 finished with value: 0.5807260000000001 and parameters: {'n_d': 54, 'n_steps': 3, 'gamma': 1.4197698629573554, 'cat_emb_dim': 3, 'n_independent': 3, 'n_shared': 2, 'momentum': 0.2139455919432946, 'mask_type': 'entmax'}. Best is trial 11 with value: 0.572202.
[I 2025-04-18 09:05:19,040] Trial 19 finished with value: 0.58955 and parameters: {'n_d': 53, 'n_steps': 8, 'gamma': 1.4320790759316135, 'cat_emb_dim': 2, 'n_independent': 3, 'n_shared': 2, 'momentum': 0.3829139573354653, 'mask_type': 'entmax'}. Best is trial 11 with value: 0.572202.
[I 2025-04-18 09:58:55,385] Trial 20 finished with value: 0.5877519999999999 and parameters: {'n_d': 37, 'n_steps': 4, 'gamma': 1.3989450485411408, 'cat_emb_dim': 3, 'n_independent': 2, 'n_shared': 1, 'momentum': 0.2094719336705797, 'mask_type': 'entmax'}. Best is trial 11 with value: 0.572202.
[I 2025-04-18 11:01:19,188] Trial 21 finished with value: 0.5882720000000001 and parameters: {'n_d': 58, 'n_steps': 3, 'gamma': 1.6734017670610501, 'cat_emb_dim': 3, 'n_independent': 3, 'n_shared': 3, 'momentum': 0.10761078133974887, 'mask_type': 'entmax'}. Best is trial 11 with value: 0.572202.
[I 2025-04-18 12:00:59,696] Trial 22 finished with value: 0.601066 and parameters: {'n_d': 64, 'n_steps': 3, 'gamma': 1.8867834265839662, 'cat_emb_dim': 3, 'n_independent': 4, 'n_shared': 3, 'momentum': 0.07400553056120676, 'mask_type': 'entmax'}. Best is trial 11 with value: 0.572202.
[I 2025-04-18 13:10:00,810] Trial 23 finished with value: 0.5895379999999999 and parameters: {'n_d': 52, 'n_steps': 4, 'gamma': 1.3601066581040153, 'cat_emb_dim': 3, 'n_independent': 5, 'n_shared': 2, 'momentum': 0.2121664295470811, 'mask_type': 'entmax'}. Best is trial 11 with value: 0.572202.
[I 2025-04-18 14:24:31,501] Trial 24 finished with value: 0.587646 and parameters: {'n_d': 56, 'n_steps': 5, 'gamma': 1.6544240904254726, 'cat_emb_dim': 2, 'n_independent': 2, 'n_shared': 4, 'momentum': 0.024293290957613782, 'mask_type': 'entmax'}. Best is trial 11 with value: 0.572202.
[I 2025-04-18 15:40:07,185] Trial 25 finished with value: 0.581752 and parameters: {'n_d': 60, 'n_steps': 3, 'gamma': 1.8804849270792425, 'cat_emb_dim': 3, 'n_independent': 3, 'n_shared': 3, 'momentum': 0.23062805725062938, 'mask_type': 'entmax'}. Best is trial 11 with value: 0.572202.
[I 2025-04-18 16:42:27,707] Trial 26 finished with value: 0.601472 and parameters: {'n_d': 50, 'n_steps': 4, 'gamma': 1.549316952212016, 'cat_emb_dim': 3, 'n_independent': 4, 'n_shared': 2, 'momentum': 0.08562169785780321, 'mask_type': 'entmax'}. Best is trial 11 with value: 0.572202.
[I 2025-04-18 17:51:26,633] Trial 27 finished with value: 0.5839359999999999 and parameters: {'n_d': 39, 'n_steps': 3, 'gamma': 1.2899389557949668, 'cat_emb_dim': 2, 'n_independent': 5, 'n_shared': 3, 'momentum': 0.18815902423282088, 'mask_type': 'entmax'}. Best is trial 11 with value: 0.572202.
[I 2025-04-18 20:12:03,177] Trial 28 finished with value: 0.629982 and parameters: {'n_d': 27, 'n_steps': 6, 'gamma': 1.8170435919702628, 'cat_emb_dim': 3, 'n_independent': 4, 'n_shared': 4, 'momentum': 0.001096052262909225, 'mask_type': 'entmax'}. Best is trial 11 with value: 0.572202.
[I 2025-04-18 22:20:48,723] Trial 29 finished with value: 0.5997060000000001 and parameters: {'n_d': 49, 'n_steps': 10, 'gamma': 1.4732345185270068, 'cat_emb_dim': 2, 'n_independent': 4, 'n_shared': 2, 'momentum': 0.059337756624476365, 'mask_type': 'entmax'}. Best is trial 11 with value: 0.572202.
