[I 2025-03-30 19:30:12,282] Using an existing study with name 'TabNet_Boston' instead of creating a new one.
[I 2025-03-30 19:31:15,364] Trial 3 finished with value: 7.30112 and parameters: {'n_d': 25, 'n_steps': 8, 'gamma': 1.132565680321218, 'cat_emb_dim': 1, 'n_independent': 2, 'n_shared': 5, 'momentum': 0.0011815412356006637, 'mask_type': 'sparsemax'}. Best is trial 3 with value: 7.30112.
[I 2025-03-30 19:32:18,838] Trial 4 finished with value: 1.2226000000000001 and parameters: {'n_d': 49, 'n_steps': 10, 'gamma': 1.9067137884303886, 'cat_emb_dim': 1, 'n_independent': 1, 'n_shared': 3, 'momentum': 0.19225773291130296, 'mask_type': 'entmax'}. Best is trial 3 with value: 7.30112.
[I 2025-03-30 19:33:22,278] Trial 5 finished with value: 1.3712199999999999 and parameters: {'n_d': 15, 'n_steps': 4, 'gamma': 1.373370285669673, 'cat_emb_dim': 1, 'n_independent': 2, 'n_shared': 5, 'momentum': 0.014446694214836932, 'mask_type': 'sparsemax'}. Best is trial 3 with value: 7.30112.
[I 2025-03-30 19:34:13,424] Trial 6 finished with value: 1.2649000000000001 and parameters: {'n_d': 27, 'n_steps': 7, 'gamma': 1.5883702530454435, 'cat_emb_dim': 2, 'n_independent': 1, 'n_shared': 2, 'momentum': 0.025914896964757, 'mask_type': 'sparsemax'}. Best is trial 3 with value: 7.30112.
[I 2025-03-30 19:34:55,944] Trial 7 finished with value: 1.1894 and parameters: {'n_d': 14, 'n_steps': 8, 'gamma': 1.033004568024099, 'cat_emb_dim': 1, 'n_independent': 5, 'n_shared': 1, 'momentum': 0.08269391461090658, 'mask_type': 'entmax'}. Best is trial 3 with value: 7.30112.
[I 2025-03-30 19:36:17,753] Trial 8 finished with value: 1.6688800000000001 and parameters: {'n_d': 40, 'n_steps': 8, 'gamma': 1.4374060273073064, 'cat_emb_dim': 2, 'n_independent': 3, 'n_shared': 4, 'momentum': 0.013988566191180486, 'mask_type': 'entmax'}. Best is trial 3 with value: 7.30112.
[I 2025-03-30 19:37:17,413] Trial 9 finished with value: 1.2066400000000002 and parameters: {'n_d': 53, 'n_steps': 7, 'gamma': 1.2509595905692128, 'cat_emb_dim': 1, 'n_independent': 1, 'n_shared': 5, 'momentum': 0.09320987361752743, 'mask_type': 'sparsemax'}. Best is trial 3 with value: 7.30112.
[I 2025-03-30 19:38:29,068] Trial 10 finished with value: 1.37756 and parameters: {'n_d': 36, 'n_steps': 9, 'gamma': 1.9431503996644413, 'cat_emb_dim': 1, 'n_independent': 1, 'n_shared': 3, 'momentum': 0.02488602413761541, 'mask_type': 'entmax'}. Best is trial 3 with value: 7.30112.
[I 2025-03-30 19:39:21,734] Trial 11 finished with value: 1.3150400000000002 and parameters: {'n_d': 59, 'n_steps': 4, 'gamma': 1.9061595585346067, 'cat_emb_dim': 1, 'n_independent': 4, 'n_shared': 5, 'momentum': 0.03444817628801874, 'mask_type': 'entmax'}. Best is trial 3 with value: 7.30112.
[I 2025-03-30 19:39:59,759] Trial 12 finished with value: 1.4862199999999999 and parameters: {'n_d': 32, 'n_steps': 5, 'gamma': 1.3715554818981457, 'cat_emb_dim': 1, 'n_independent': 3, 'n_shared': 1, 'momentum': 0.018962003497344677, 'mask_type': 'entmax'}. Best is trial 3 with value: 7.30112.
[I 2025-03-30 19:41:03,433] Trial 13 finished with value: 6.440040000000001 and parameters: {'n_d': 25, 'n_steps': 10, 'gamma': 1.063274574384052, 'cat_emb_dim': 3, 'n_independent': 2, 'n_shared': 4, 'momentum': 0.0017583815722842005, 'mask_type': 'sparsemax'}. Best is trial 3 with value: 7.30112.
[I 2025-03-30 19:42:11,523] Trial 14 finished with value: 7.25474 and parameters: {'n_d': 22, 'n_steps': 10, 'gamma': 1.0074808210415376, 'cat_emb_dim': 3, 'n_independent': 2, 'n_shared': 4, 'momentum': 0.0011153206957731727, 'mask_type': 'sparsemax'}. Best is trial 3 with value: 7.30112.
[I 2025-03-30 19:42:55,832] Trial 15 finished with value: 6.91548 and parameters: {'n_d': 21, 'n_steps': 9, 'gamma': 1.1675400083797953, 'cat_emb_dim': 3, 'n_independent': 2, 'n_shared': 4, 'momentum': 0.0010747051682323096, 'mask_type': 'sparsemax'}. Best is trial 3 with value: 7.30112.
[I 2025-03-30 19:43:27,468] Trial 16 finished with value: 2.6229 and parameters: {'n_d': 8, 'n_steps': 6, 'gamma': 1.6511673838338274, 'cat_emb_dim': 3, 'n_independent': 2, 'n_shared': 4, 'momentum': 0.00341706935206272, 'mask_type': 'sparsemax'}. Best is trial 3 with value: 7.30112.
[I 2025-03-30 19:45:22,524] Trial 17 finished with value: 5.4774 and parameters: {'n_d': 42, 'n_steps': 9, 'gamma': 1.2074639553737605, 'cat_emb_dim': 2, 'n_independent': 4, 'n_shared': 5, 'momentum': 0.004440814958938439, 'mask_type': 'sparsemax'}. Best is trial 3 with value: 7.30112.
[I 2025-03-30 19:47:09,510] Trial 18 finished with value: 2.9785600000000003 and parameters: {'n_d': 20, 'n_steps': 10, 'gamma': 1.0054241232459047, 'cat_emb_dim': 3, 'n_independent': 3, 'n_shared': 4, 'momentum': 0.005363692731476311, 'mask_type': 'sparsemax'}. Best is trial 3 with value: 7.30112.
[I 2025-03-30 19:47:54,679] Trial 19 finished with value: 6.641360000000001 and parameters: {'n_d': 31, 'n_steps': 8, 'gamma': 1.1521116488756242, 'cat_emb_dim': 2, 'n_independent': 2, 'n_shared': 3, 'momentum': 0.001012240309099967, 'mask_type': 'sparsemax'}. Best is trial 3 with value: 7.30112.
[I 2025-03-30 19:48:24,464] Trial 20 finished with value: 3.72622 and parameters: {'n_d': 10, 'n_steps': 6, 'gamma': 1.2719072420509272, 'cat_emb_dim': 2, 'n_independent': 4, 'n_shared': 2, 'momentum': 0.002523759443854817, 'mask_type': 'sparsemax'}. Best is trial 3 with value: 7.30112.
[I 2025-03-30 19:50:07,114] Trial 21 finished with value: 2.7424600000000003 and parameters: {'n_d': 19, 'n_steps': 9, 'gamma': 1.7291109831175995, 'cat_emb_dim': 3, 'n_independent': 2, 'n_shared': 5, 'momentum': 0.005143763690194881, 'mask_type': 'sparsemax'}. Best is trial 3 with value: 7.30112.
[I 2025-03-30 19:51:10,243] Trial 22 finished with value: 2.3276999999999997 and parameters: {'n_d': 26, 'n_steps': 3, 'gamma': 1.0916327128040129, 'cat_emb_dim': 2, 'n_independent': 3, 'n_shared': 4, 'momentum': 0.007497160346535988, 'mask_type': 'sparsemax'}. Best is trial 3 with value: 7.30112.
[I 2025-03-30 19:52:21,882] Trial 23 finished with value: 7.533099999999999 and parameters: {'n_d': 42, 'n_steps': 8, 'gamma': 1.3165428016980703, 'cat_emb_dim': 2, 'n_independent': 5, 'n_shared': 3, 'momentum': 0.0016663853898353047, 'mask_type': 'sparsemax'}. Best is trial 23 with value: 7.533099999999999.
[I 2025-03-30 19:53:44,934] Trial 24 finished with value: 7.0856200000000005 and parameters: {'n_d': 40, 'n_steps': 8, 'gamma': 1.3358238170163572, 'cat_emb_dim': 2, 'n_independent': 5, 'n_shared': 3, 'momentum': 0.0017988782122928288, 'mask_type': 'sparsemax'}. Best is trial 23 with value: 7.533099999999999.
[I 2025-03-30 19:54:24,736] Trial 25 finished with value: 7.789240000000001 and parameters: {'n_d': 47, 'n_steps': 7, 'gamma': 1.123911559954574, 'cat_emb_dim': 3, 'n_independent': 5, 'n_shared': 2, 'momentum': 0.0017492683262505184, 'mask_type': 'sparsemax'}. Best is trial 25 with value: 7.789240000000001.
[I 2025-03-30 19:55:30,739] Trial 26 finished with value: 5.87402 and parameters: {'n_d': 47, 'n_steps': 6, 'gamma': 1.4909310752848557, 'cat_emb_dim': 2, 'n_independent': 5, 'n_shared': 2, 'momentum': 0.002181598276796706, 'mask_type': 'sparsemax'}. Best is trial 25 with value: 7.789240000000001.
[I 2025-03-30 19:56:54,441] Trial 27 finished with value: 2.01338 and parameters: {'n_d': 62, 'n_steps': 7, 'gamma': 1.2980744638231032, 'cat_emb_dim': 3, 'n_independent': 4, 'n_shared': 2, 'momentum': 0.007230584443411633, 'mask_type': 'sparsemax'}. Best is trial 25 with value: 7.789240000000001.
[I 2025-03-30 19:57:59,595] Trial 28 finished with value: 6.610200000000001 and parameters: {'n_d': 55, 'n_steps': 7, 'gamma': 1.1400015581962732, 'cat_emb_dim': 2, 'n_independent': 5, 'n_shared': 3, 'momentum': 0.003264037861334293, 'mask_type': 'sparsemax'}. Best is trial 25 with value: 7.789240000000001.
[I 2025-03-30 19:58:55,949] Trial 29 finished with value: 7.553019999999999 and parameters: {'n_d': 35, 'n_steps': 8, 'gamma': 1.220956593796977, 'cat_emb_dim': 2, 'n_independent': 5, 'n_shared': 2, 'momentum': 0.0016060343697569216, 'mask_type': 'sparsemax'}. Best is trial 25 with value: 7.789240000000001.
[I 2025-03-30 20:00:19,845] Trial 30 finished with value: 2.10444 and parameters: {'n_d': 45, 'n_steps': 5, 'gamma': 1.437798424802772, 'cat_emb_dim': 2, 'n_independent': 5, 'n_shared': 2, 'momentum': 0.008495052567778029, 'mask_type': 'sparsemax'}. Best is trial 25 with value: 7.789240000000001.
[I 2025-03-30 20:01:13,811] Trial 31 finished with value: 5.706620000000001 and parameters: {'n_d': 36, 'n_steps': 7, 'gamma': 1.2170927567603227, 'cat_emb_dim': 2, 'n_independent': 4, 'n_shared': 1, 'momentum': 0.0018714105821808825, 'mask_type': 'sparsemax'}. Best is trial 25 with value: 7.789240000000001.
[I 2025-03-30 20:02:23,966] Trial 32 finished with value: 7.21514 and parameters: {'n_d': 52, 'n_steps': 8, 'gamma': 1.0998790972250005, 'cat_emb_dim': 2, 'n_independent': 5, 'n_shared': 2, 'momentum': 0.0016659966798852537, 'mask_type': 'sparsemax'}. Best is trial 25 with value: 7.789240000000001.
[I 2025-03-30 20:03:31,282] Trial 33 finished with value: 5.234720000000001 and parameters: {'n_d': 44, 'n_steps': 8, 'gamma': 1.2931256727660358, 'cat_emb_dim': 3, 'n_independent': 5, 'n_shared': 1, 'momentum': 0.0031930794588393074, 'mask_type': 'sparsemax'}. Best is trial 25 with value: 7.789240000000001.
[I 2025-03-30 20:04:31,189] Trial 34 finished with value: 7.51638 and parameters: {'n_d': 32, 'n_steps': 9, 'gamma': 1.2006941580849009, 'cat_emb_dim': 1, 'n_independent': 4, 'n_shared': 3, 'momentum': 0.0014095811871692261, 'mask_type': 'sparsemax'}. Best is trial 25 with value: 7.789240000000001.
[I 2025-03-30 20:05:39,911] Trial 35 finished with value: 6.88138 and parameters: {'n_d': 34, 'n_steps': 9, 'gamma': 1.1865009728034703, 'cat_emb_dim': 1, 'n_independent': 4, 'n_shared': 3, 'momentum': 0.001442273205263292, 'mask_type': 'sparsemax'}. Best is trial 25 with value: 7.789240000000001.
[I 2025-03-30 20:07:08,361] Trial 36 finished with value: 1.2005400000000002 and parameters: {'n_d': 38, 'n_steps': 9, 'gamma': 1.3891716282954787, 'cat_emb_dim': 1, 'n_independent': 5, 'n_shared': 2, 'momentum': 0.3466244172420148, 'mask_type': 'sparsemax'}. Best is trial 25 with value: 7.789240000000001.
[I 2025-03-30 20:08:27,731] Trial 37 finished with value: 6.3011800000000004 and parameters: {'n_d': 49, 'n_steps': 8, 'gamma': 1.2534045230813344, 'cat_emb_dim': 2, 'n_independent': 4, 'n_shared': 3, 'momentum': 0.0026693608645600706, 'mask_type': 'sparsemax'}. Best is trial 25 with value: 7.789240000000001.
[I 2025-03-30 20:09:32,047] Trial 38 finished with value: 7.66644 and parameters: {'n_d': 30, 'n_steps': 7, 'gamma': 1.5549965683101221, 'cat_emb_dim': 2, 'n_independent': 5, 'n_shared': 3, 'momentum': 0.0012849639510691068, 'mask_type': 'entmax'}. Best is trial 25 with value: 7.789240000000001.
[I 2025-03-30 20:11:02,414] Trial 39 finished with value: 4.00218 and parameters: {'n_d': 43, 'n_steps': 7, 'gamma': 1.5881399394584421, 'cat_emb_dim': 2, 'n_independent': 5, 'n_shared': 2, 'momentum': 0.004154335207651047, 'mask_type': 'entmax'}. Best is trial 25 with value: 7.789240000000001.
[I 2025-03-30 20:12:17,456] Trial 40 finished with value: 1.8607200000000002 and parameters: {'n_d': 28, 'n_steps': 6, 'gamma': 1.5500519255218461, 'cat_emb_dim': 2, 'n_independent': 5, 'n_shared': 2, 'momentum': 0.011994587159804252, 'mask_type': 'entmax'}. Best is trial 25 with value: 7.789240000000001.
[I 2025-03-30 20:12:57,735] Trial 41 finished with value: 5.83366 and parameters: {'n_d': 38, 'n_steps': 5, 'gamma': 1.77602361219141, 'cat_emb_dim': 2, 'n_independent': 5, 'n_shared': 1, 'momentum': 0.0023750112338824453, 'mask_type': 'entmax'}. Best is trial 25 with value: 7.789240000000001.
[I 2025-03-30 20:14:11,325] Trial 42 finished with value: 1.2359200000000001 and parameters: {'n_d': 48, 'n_steps': 7, 'gamma': 1.4452697999518431, 'cat_emb_dim': 2, 'n_independent': 5, 'n_shared': 3, 'momentum': 0.07791517081161349, 'mask_type': 'entmax'}. Best is trial 25 with value: 7.789240000000001.
[I 2025-03-30 20:15:53,053] Trial 43 finished with value: 1.27038 and parameters: {'n_d': 51, 'n_steps': 8, 'gamma': 1.5227665349369255, 'cat_emb_dim': 2, 'n_independent': 5, 'n_shared': 3, 'momentum': 0.04790507138588355, 'mask_type': 'entmax'}. Best is trial 25 with value: 7.789240000000001.
[I 2025-03-30 20:16:42,546] Trial 44 finished with value: 7.597319999999999 and parameters: {'n_d': 30, 'n_steps': 8, 'gamma': 1.1230602530372837, 'cat_emb_dim': 1, 'n_independent': 4, 'n_shared': 3, 'momentum': 0.0013962633698898013, 'mask_type': 'entmax'}. Best is trial 25 with value: 7.789240000000001.
[I 2025-03-30 20:17:14,227] Trial 45 finished with value: 7.55012 and parameters: {'n_d': 29, 'n_steps': 7, 'gamma': 1.0951325414216462, 'cat_emb_dim': 1, 'n_independent': 4, 'n_shared': 2, 'momentum': 0.0012649426037839157, 'mask_type': 'entmax'}. Best is trial 25 with value: 7.789240000000001.
[I 2025-03-30 20:17:55,435] Trial 46 finished with value: 6.1266 and parameters: {'n_d': 29, 'n_steps': 7, 'gamma': 1.068288642818898, 'cat_emb_dim': 1, 'n_independent': 3, 'n_shared': 2, 'momentum': 0.0013605436078134988, 'mask_type': 'entmax'}. Best is trial 25 with value: 7.789240000000001.
[I 2025-03-30 20:18:31,022] Trial 47 finished with value: 6.5196 and parameters: {'n_d': 23, 'n_steps': 6, 'gamma': 1.1080418801097307, 'cat_emb_dim': 1, 'n_independent': 4, 'n_shared': 2, 'momentum': 0.0011581928069546825, 'mask_type': 'entmax'}. Best is trial 25 with value: 7.789240000000001.
[I 2025-03-30 20:19:31,622] Trial 48 finished with value: 4.54316 and parameters: {'n_d': 30, 'n_steps': 7, 'gamma': 1.043488344644167, 'cat_emb_dim': 1, 'n_independent': 4, 'n_shared': 1, 'momentum': 0.0021698540472485563, 'mask_type': 'entmax'}. Best is trial 25 with value: 7.789240000000001.
[I 2025-03-30 20:20:07,298] Trial 49 finished with value: 7.00506 and parameters: {'n_d': 34, 'n_steps': 7, 'gamma': 1.6431815911140542, 'cat_emb_dim': 1, 'n_independent': 4, 'n_shared': 2, 'momentum': 0.0013441601805312766, 'mask_type': 'entmax'}. Best is trial 25 with value: 7.789240000000001.
[I 2025-03-30 20:20:36,675] Trial 50 finished with value: 6.879740000000001 and parameters: {'n_d': 18, 'n_steps': 8, 'gamma': 1.1222452941207781, 'cat_emb_dim': 1, 'n_independent': 3, 'n_shared': 3, 'momentum': 0.0010154898983324129, 'mask_type': 'entmax'}. Best is trial 25 with value: 7.789240000000001.
[I 2025-03-30 20:21:40,314] Trial 51 finished with value: 5.19212 and parameters: {'n_d': 24, 'n_steps': 6, 'gamma': 1.0408475775647945, 'cat_emb_dim': 1, 'n_independent': 5, 'n_shared': 2, 'momentum': 0.002837717996397124, 'mask_type': 'entmax'}. Best is trial 25 with value: 7.789240000000001.
[I 2025-03-30 20:22:28,385] Trial 52 finished with value: 2.9663200000000005 and parameters: {'n_d': 34, 'n_steps': 7, 'gamma': 1.3894667700062933, 'cat_emb_dim': 3, 'n_independent': 3, 'n_shared': 1, 'momentum': 0.003969781137613192, 'mask_type': 'entmax'}. Best is trial 25 with value: 7.789240000000001.
[I 2025-03-30 20:23:11,797] Using an existing study with name 'TabNet_Moneyball' instead of creating a new one.
[I 2025-03-30 20:24:59,041] Trial 3 finished with value: 1.1606800000000002 and parameters: {'n_d': 32, 'n_steps': 6, 'gamma': 1.372208670602276, 'cat_emb_dim': 3, 'n_independent': 3, 'n_shared': 1, 'momentum': 0.008656472486397072, 'mask_type': 'sparsemax'}. Best is trial 3 with value: 1.1606800000000002.
[I 2025-03-30 20:26:11,609] Trial 4 finished with value: 1.1709600000000002 and parameters: {'n_d': 46, 'n_steps': 3, 'gamma': 1.7291213760978554, 'cat_emb_dim': 3, 'n_independent': 4, 'n_shared': 2, 'momentum': 0.011322745515711219, 'mask_type': 'entmax'}. Best is trial 4 with value: 1.1709600000000002.
[I 2025-03-30 20:26:53,554] Trial 5 finished with value: 2.42748 and parameters: {'n_d': 10, 'n_steps': 6, 'gamma': 1.7316247376232017, 'cat_emb_dim': 1, 'n_independent': 2, 'n_shared': 5, 'momentum': 0.0010716286094721362, 'mask_type': 'entmax'}. Best is trial 5 with value: 2.42748.
[I 2025-03-30 20:27:32,540] Trial 6 finished with value: 2.11836 and parameters: {'n_d': 20, 'n_steps': 6, 'gamma': 1.541402237801751, 'cat_emb_dim': 2, 'n_independent': 1, 'n_shared': 3, 'momentum': 0.0012479198206749665, 'mask_type': 'entmax'}. Best is trial 5 with value: 2.42748.
[I 2025-03-30 20:31:53,190] Trial 7 finished with value: 1.0622800000000001 and parameters: {'n_d': 15, 'n_steps': 10, 'gamma': 1.137266769506828, 'cat_emb_dim': 3, 'n_independent': 4, 'n_shared': 5, 'momentum': 0.0955867180552995, 'mask_type': 'sparsemax'}. Best is trial 5 with value: 2.42748.
[I 2025-03-30 20:33:48,274] Trial 8 finished with value: 1.04836 and parameters: {'n_d': 23, 'n_steps': 6, 'gamma': 1.9393263335350972, 'cat_emb_dim': 1, 'n_independent': 4, 'n_shared': 2, 'momentum': 0.02955191198114471, 'mask_type': 'entmax'}. Best is trial 5 with value: 2.42748.
[I 2025-03-30 20:34:30,579] Trial 9 finished with value: 3.0829600000000004 and parameters: {'n_d': 9, 'n_steps': 5, 'gamma': 1.3817085156081836, 'cat_emb_dim': 3, 'n_independent': 4, 'n_shared': 5, 'momentum': 0.0014711016453753467, 'mask_type': 'entmax'}. Best is trial 9 with value: 3.0829600000000004.
[I 2025-03-30 20:35:24,418] Trial 10 finished with value: 0.9394399999999999 and parameters: {'n_d': 54, 'n_steps': 3, 'gamma': 1.146064969013056, 'cat_emb_dim': 1, 'n_independent': 3, 'n_shared': 4, 'momentum': 0.17635802666090059, 'mask_type': 'entmax'}. Best is trial 9 with value: 3.0829600000000004.
[I 2025-03-30 20:38:44,723] Trial 11 finished with value: 1.16922 and parameters: {'n_d': 50, 'n_steps': 10, 'gamma': 1.6977310617227315, 'cat_emb_dim': 1, 'n_independent': 2, 'n_shared': 4, 'momentum': 0.014866541565761898, 'mask_type': 'entmax'}. Best is trial 9 with value: 3.0829600000000004.
[I 2025-03-30 20:39:11,932] Trial 12 finished with value: 2.92934 and parameters: {'n_d': 20, 'n_steps': 3, 'gamma': 1.3451824495417504, 'cat_emb_dim': 2, 'n_independent': 1, 'n_shared': 5, 'momentum': 0.0013843181484568027, 'mask_type': 'sparsemax'}. Best is trial 9 with value: 3.0829600000000004.
[I 2025-03-30 20:41:21,031] Trial 13 finished with value: 3.6815400000000005 and parameters: {'n_d': 63, 'n_steps': 4, 'gamma': 1.0468661279328724, 'cat_emb_dim': 3, 'n_independent': 5, 'n_shared': 4, 'momentum': 0.0035276205238930986, 'mask_type': 'sparsemax'}. Best is trial 13 with value: 3.6815400000000005.
[I 2025-03-30 20:43:53,117] Trial 14 finished with value: 2.2639199999999997 and parameters: {'n_d': 60, 'n_steps': 4, 'gamma': 1.0160051607591332, 'cat_emb_dim': 3, 'n_independent': 5, 'n_shared': 4, 'momentum': 0.0038451657245471456, 'mask_type': 'sparsemax'}. Best is trial 13 with value: 3.6815400000000005.
[I 2025-03-30 20:47:54,374] Trial 15 finished with value: 2.4371400000000003 and parameters: {'n_d': 38, 'n_steps': 8, 'gamma': 1.2861201095609687, 'cat_emb_dim': 2, 'n_independent': 5, 'n_shared': 4, 'momentum': 0.004057934790019668, 'mask_type': 'sparsemax'}. Best is trial 13 with value: 3.6815400000000005.
[I 2025-03-30 20:49:29,802] Trial 16 finished with value: 3.7073 and parameters: {'n_d': 32, 'n_steps': 5, 'gamma': 1.4907822506634163, 'cat_emb_dim': 3, 'n_independent': 5, 'n_shared': 3, 'momentum': 0.0031700523382658065, 'mask_type': 'sparsemax'}. Best is trial 16 with value: 3.7073.
[I 2025-03-30 20:52:30,059] Trial 17 finished with value: 2.7659599999999998 and parameters: {'n_d': 64, 'n_steps': 8, 'gamma': 1.5513916380262434, 'cat_emb_dim': 3, 'n_independent': 5, 'n_shared': 3, 'momentum': 0.003906944002208784, 'mask_type': 'sparsemax'}. Best is trial 16 with value: 3.7073.
[I 2025-03-30 20:54:12,237] Trial 18 finished with value: 1.0863 and parameters: {'n_d': 35, 'n_steps': 4, 'gamma': 1.9741467147910714, 'cat_emb_dim': 2, 'n_independent': 5, 'n_shared': 2, 'momentum': 0.037826003136246726, 'mask_type': 'sparsemax'}. Best is trial 16 with value: 3.7073.
[I 2025-03-30 20:56:57,573] Trial 19 finished with value: 1.3008199999999999 and parameters: {'n_d': 42, 'n_steps': 5, 'gamma': 1.007262581896424, 'cat_emb_dim': 3, 'n_independent': 5, 'n_shared': 3, 'momentum': 0.0058318976996884755, 'mask_type': 'sparsemax'}. Best is trial 16 with value: 3.7073.
[I 2025-03-30 20:59:01,178] Trial 20 finished with value: 0.9982200000000001 and parameters: {'n_d': 30, 'n_steps': 8, 'gamma': 1.2085570824608127, 'cat_emb_dim': 2, 'n_independent': 4, 'n_shared': 1, 'momentum': 0.05208027685758049, 'mask_type': 'sparsemax'}. Best is trial 16 with value: 3.7073.
[I 2025-03-30 20:59:55,148] Trial 21 finished with value: 2.7803 and parameters: {'n_d': 27, 'n_steps': 4, 'gamma': 1.85043153989871, 'cat_emb_dim': 3, 'n_independent': 3, 'n_shared': 3, 'momentum': 0.0026364328251784115, 'mask_type': 'sparsemax'}. Best is trial 16 with value: 3.7073.
[I 2025-03-30 21:01:46,916] Trial 22 finished with value: 4.57212 and parameters: {'n_d': 56, 'n_steps': 5, 'gamma': 1.4640581860381372, 'cat_emb_dim': 2, 'n_independent': 5, 'n_shared': 4, 'momentum': 0.0021758428852353107, 'mask_type': 'sparsemax'}. Best is trial 22 with value: 4.57212.
[I 2025-03-30 21:03:51,403] Trial 23 finished with value: 1.05576 and parameters: {'n_d': 53, 'n_steps': 7, 'gamma': 1.468301302170269, 'cat_emb_dim': 2, 'n_independent': 2, 'n_shared': 3, 'momentum': 0.3341818317321341, 'mask_type': 'sparsemax'}. Best is trial 22 with value: 4.57212.
[I 2025-03-30 21:05:29,371] Trial 24 finished with value: 5.95272 and parameters: {'n_d': 60, 'n_steps': 5, 'gamma': 1.6189379973517593, 'cat_emb_dim': 2, 'n_independent': 5, 'n_shared': 4, 'momentum': 0.002165607593525672, 'mask_type': 'sparsemax'}. Best is trial 24 with value: 5.95272.
[I 2025-03-30 21:07:51,572] Trial 25 finished with value: 1.93856 and parameters: {'n_d': 58, 'n_steps': 5, 'gamma': 1.6337289314631844, 'cat_emb_dim': 2, 'n_independent': 5, 'n_shared': 4, 'momentum': 0.007290755662954707, 'mask_type': 'sparsemax'}. Best is trial 24 with value: 5.95272.
