[I 2025-03-30 14:11:38,327] Using an existing study with name 'TabNet_MIP' instead of creating a new one.
[I 2025-03-30 14:13:17,730] Trial 3 finished with value: 2.46244 and parameters: {'n_d': 18, 'n_steps': 9, 'gamma': 1.2358309967078038, 'cat_emb_dim': 2, 'n_independent': 1, 'n_shared': 3, 'momentum': 0.18689183085633782, 'mask_type': 'sparsemax'}. Best is trial 3 with value: 2.46244.
[I 2025-03-30 14:14:23,712] Trial 4 finished with value: 2.5098399999999996 and parameters: {'n_d': 43, 'n_steps': 5, 'gamma': 1.6097587156091682, 'cat_emb_dim': 1, 'n_independent': 2, 'n_shared': 2, 'momentum': 0.01054638409092627, 'mask_type': 'entmax'}. Best is trial 4 with value: 2.5098399999999996.
[I 2025-03-30 14:17:27,714] Trial 5 finished with value: 2.49924 and parameters: {'n_d': 44, 'n_steps': 9, 'gamma': 1.6261186995922, 'cat_emb_dim': 3, 'n_independent': 3, 'n_shared': 5, 'momentum': 0.06452431759877324, 'mask_type': 'sparsemax'}. Best is trial 4 with value: 2.5098399999999996.
[I 2025-03-30 14:19:46,455] Trial 6 finished with value: 2.6129000000000007 and parameters: {'n_d': 32, 'n_steps': 9, 'gamma': 1.5666747120365088, 'cat_emb_dim': 2, 'n_independent': 5, 'n_shared': 1, 'momentum': 0.03724889198553956, 'mask_type': 'sparsemax'}. Best is trial 6 with value: 2.6129000000000007.
[I 2025-03-30 14:23:52,797] Trial 7 finished with value: 2.48214 and parameters: {'n_d': 60, 'n_steps': 10, 'gamma': 1.4695226442926823, 'cat_emb_dim': 3, 'n_independent': 4, 'n_shared': 5, 'momentum': 0.12225164721881426, 'mask_type': 'entmax'}. Best is trial 6 with value: 2.6129000000000007.
[I 2025-03-30 14:25:01,112] Trial 8 finished with value: 3.15122 and parameters: {'n_d': 40, 'n_steps': 8, 'gamma': 1.753371650430401, 'cat_emb_dim': 1, 'n_independent': 2, 'n_shared': 1, 'momentum': 0.0013654634822217139, 'mask_type': 'entmax'}. Best is trial 8 with value: 3.15122.
[I 2025-03-30 14:26:03,055] Trial 9 finished with value: 2.49528 and parameters: {'n_d': 42, 'n_steps': 4, 'gamma': 1.3389864235968734, 'cat_emb_dim': 1, 'n_independent': 2, 'n_shared': 4, 'momentum': 0.028184570274547564, 'mask_type': 'entmax'}. Best is trial 8 with value: 3.15122.
[I 2025-03-30 14:27:31,223] Trial 10 finished with value: 2.4664 and parameters: {'n_d': 53, 'n_steps': 6, 'gamma': 1.169557012979651, 'cat_emb_dim': 3, 'n_independent': 5, 'n_shared': 1, 'momentum': 0.017644698217953777, 'mask_type': 'sparsemax'}. Best is trial 8 with value: 3.15122.
[I 2025-03-30 14:29:08,978] Trial 11 finished with value: 2.6985799999999998 and parameters: {'n_d': 55, 'n_steps': 5, 'gamma': 1.833323182780207, 'cat_emb_dim': 3, 'n_independent': 4, 'n_shared': 3, 'momentum': 0.0058706952076756315, 'mask_type': 'sparsemax'}. Best is trial 8 with value: 3.15122.
[I 2025-03-30 14:30:29,108] Trial 12 finished with value: 2.41344 and parameters: {'n_d': 41, 'n_steps': 5, 'gamma': 1.3721100029473874, 'cat_emb_dim': 3, 'n_independent': 2, 'n_shared': 5, 'momentum': 0.04082891418919128, 'mask_type': 'entmax'}. Best is trial 8 with value: 3.15122.
[I 2025-03-30 14:31:23,749] Trial 13 finished with value: 3.08824 and parameters: {'n_d': 25, 'n_steps': 7, 'gamma': 1.9925606930587532, 'cat_emb_dim': 1, 'n_independent': 1, 'n_shared': 2, 'momentum': 0.0011294407338455102, 'mask_type': 'entmax'}. Best is trial 8 with value: 3.15122.
[I 2025-03-30 14:32:17,372] Trial 14 finished with value: 3.11212 and parameters: {'n_d': 24, 'n_steps': 7, 'gamma': 1.9939066306803654, 'cat_emb_dim': 1, 'n_independent': 1, 'n_shared': 2, 'momentum': 0.0012248768632868042, 'mask_type': 'entmax'}. Best is trial 8 with value: 3.15122.
[I 2025-03-30 14:33:23,836] Trial 15 finished with value: 2.70856 and parameters: {'n_d': 8, 'n_steps': 7, 'gamma': 1.8235732772082787, 'cat_emb_dim': 1, 'n_independent': 1, 'n_shared': 2, 'momentum': 0.0010607307570380752, 'mask_type': 'entmax'}. Best is trial 8 with value: 3.15122.
[I 2025-03-30 14:34:32,575] Trial 16 finished with value: 2.91644 and parameters: {'n_d': 30, 'n_steps': 8, 'gamma': 1.9522053515748155, 'cat_emb_dim': 2, 'n_independent': 2, 'n_shared': 1, 'momentum': 0.0031502288730777066, 'mask_type': 'entmax'}. Best is trial 8 with value: 3.15122.
[I 2025-03-30 14:35:31,157] Trial 17 finished with value: 3.37928 and parameters: {'n_d': 20, 'n_steps': 8, 'gamma': 1.7703661680958889, 'cat_emb_dim': 1, 'n_independent': 3, 'n_shared': 2, 'momentum': 0.002298109751073072, 'mask_type': 'entmax'}. Best is trial 17 with value: 3.37928.
[I 2025-03-30 14:37:01,312] Trial 18 finished with value: 2.91308 and parameters: {'n_d': 13, 'n_steps': 8, 'gamma': 1.7325025990306817, 'cat_emb_dim': 1, 'n_independent': 3, 'n_shared': 1, 'momentum': 0.00252374481320464, 'mask_type': 'entmax'}. Best is trial 17 with value: 3.37928.
[I 2025-03-30 14:37:57,900] Trial 19 finished with value: 3.02452 and parameters: {'n_d': 20, 'n_steps': 3, 'gamma': 1.7924069566557321, 'cat_emb_dim': 2, 'n_independent': 4, 'n_shared': 2, 'momentum': 0.0026577168638684005, 'mask_type': 'entmax'}. Best is trial 17 with value: 3.37928.
[I 2025-03-30 14:41:10,459] Trial 20 finished with value: 2.7309600000000005 and parameters: {'n_d': 35, 'n_steps': 10, 'gamma': 1.7011823013446619, 'cat_emb_dim': 1, 'n_independent': 3, 'n_shared': 3, 'momentum': 0.00671207319527497, 'mask_type': 'entmax'}. Best is trial 17 with value: 3.37928.
[I 2025-03-30 14:42:33,886] Trial 21 finished with value: 2.86522 and parameters: {'n_d': 27, 'n_steps': 8, 'gamma': 1.4749270396097025, 'cat_emb_dim': 2, 'n_independent': 3, 'n_shared': 1, 'momentum': 0.005341975533055219, 'mask_type': 'entmax'}. Best is trial 17 with value: 3.37928.
[I 2025-03-30 14:43:52,719] Trial 22 finished with value: 2.45182 and parameters: {'n_d': 51, 'n_steps': 6, 'gamma': 1.0750239160946986, 'cat_emb_dim': 1, 'n_independent': 2, 'n_shared': 3, 'momentum': 0.3649833058567546, 'mask_type': 'entmax'}. Best is trial 17 with value: 3.37928.
[I 2025-03-30 14:46:47,994] Trial 23 finished with value: 5.0498400000000006 and parameters: {'n_d': 36, 'n_steps': 8, 'gamma': 1.8802019996429262, 'cat_emb_dim': 1, 'n_independent': 4, 'n_shared': 4, 'momentum': 0.0019666058447405745, 'mask_type': 'entmax'}. Best is trial 23 with value: 5.0498400000000006.
[I 2025-03-30 14:49:09,977] Trial 24 finished with value: 5.9658 and parameters: {'n_d': 36, 'n_steps': 8, 'gamma': 1.8827176558910892, 'cat_emb_dim': 1, 'n_independent': 4, 'n_shared': 4, 'momentum': 0.0018897170593771902, 'mask_type': 'entmax'}. Best is trial 24 with value: 5.9658.
[I 2025-03-30 14:52:22,351] Trial 25 finished with value: 4.6972000000000005 and parameters: {'n_d': 36, 'n_steps': 9, 'gamma': 1.904412297479279, 'cat_emb_dim': 1, 'n_independent': 4, 'n_shared': 4, 'momentum': 0.0024880871970858207, 'mask_type': 'entmax'}. Best is trial 24 with value: 5.9658.
[I 2025-03-30 14:55:38,663] Trial 26 finished with value: 2.56288 and parameters: {'n_d': 36, 'n_steps': 9, 'gamma': 1.8932707488000018, 'cat_emb_dim': 1, 'n_independent': 4, 'n_shared': 4, 'momentum': 0.010476932269826699, 'mask_type': 'entmax'}. Best is trial 24 with value: 5.9658.
[I 2025-03-30 15:00:28,193] Trial 27 finished with value: 3.1252 and parameters: {'n_d': 34, 'n_steps': 10, 'gamma': 1.8947204595746048, 'cat_emb_dim': 2, 'n_independent': 5, 'n_shared': 4, 'momentum': 0.004130762136082732, 'mask_type': 'entmax'}. Best is trial 24 with value: 5.9658.
[I 2025-03-30 15:04:03,321] Trial 28 finished with value: 4.5492799999999995 and parameters: {'n_d': 48, 'n_steps': 9, 'gamma': 1.9039822563736626, 'cat_emb_dim': 1, 'n_independent': 4, 'n_shared': 4, 'momentum': 0.001658045362365763, 'mask_type': 'entmax'}. Best is trial 24 with value: 5.9658.
[I 2025-03-30 15:06:39,293] Trial 29 finished with value: 2.6227 and parameters: {'n_d': 47, 'n_steps': 7, 'gamma': 1.6929839266097355, 'cat_emb_dim': 1, 'n_independent': 4, 'n_shared': 4, 'momentum': 0.010087774399985086, 'mask_type': 'sparsemax'}. Best is trial 24 with value: 5.9658.
[I 2025-03-30 15:09:59,725] Trial 30 finished with value: 2.9573400000000003 and parameters: {'n_d': 38, 'n_steps': 8, 'gamma': 1.8623065744701395, 'cat_emb_dim': 2, 'n_independent': 5, 'n_shared': 4, 'momentum': 0.004057163427091416, 'mask_type': 'entmax'}. Best is trial 24 with value: 5.9658.
[I 2025-03-30 15:13:32,942] Trial 31 finished with value: 5.3255 and parameters: {'n_d': 29, 'n_steps': 10, 'gamma': 1.9361401724694844, 'cat_emb_dim': 1, 'n_independent': 4, 'n_shared': 5, 'momentum': 0.0019820793080942522, 'mask_type': 'entmax'}. Best is trial 24 with value: 5.9658.
[I 2025-03-30 15:19:10,583] Trial 32 finished with value: 4.0644800000000005 and parameters: {'n_d': 29, 'n_steps': 10, 'gamma': 1.6627078973893217, 'cat_emb_dim': 2, 'n_independent': 5, 'n_shared': 5, 'momentum': 0.001878972896897352, 'mask_type': 'sparsemax'}. Best is trial 24 with value: 5.9658.
[I 2025-03-30 15:20:32,567] Trial 33 finished with value: 2.9813 and parameters: {'n_d': 16, 'n_steps': 6, 'gamma': 1.5570946415283524, 'cat_emb_dim': 1, 'n_independent': 4, 'n_shared': 5, 'momentum': 0.008079406942322127, 'mask_type': 'entmax'}. Best is trial 24 with value: 5.9658.
[I 2025-03-30 15:23:43,568] Trial 34 finished with value: 4.78894 and parameters: {'n_d': 32, 'n_steps': 9, 'gamma': 1.9002750150382668, 'cat_emb_dim': 1, 'n_independent': 4, 'n_shared': 4, 'momentum': 0.0017781836074119983, 'mask_type': 'entmax'}. Best is trial 24 with value: 5.9658.
[I 2025-03-30 15:28:04,213] Trial 35 finished with value: 3.2648199999999994 and parameters: {'n_d': 31, 'n_steps': 10, 'gamma': 1.965525279282323, 'cat_emb_dim': 1, 'n_independent': 4, 'n_shared': 5, 'momentum': 0.0038618477453844203, 'mask_type': 'entmax'}. Best is trial 24 with value: 5.9658.
[I 2025-03-30 15:30:25,227] Trial 36 finished with value: 4.4662 and parameters: {'n_d': 24, 'n_steps': 9, 'gamma': 1.8282810008231358, 'cat_emb_dim': 1, 'n_independent': 4, 'n_shared': 3, 'momentum': 0.0018242437584677746, 'mask_type': 'entmax'}. Best is trial 24 with value: 5.9658.
[I 2025-03-30 15:33:08,267] Trial 37 finished with value: 2.5477 and parameters: {'n_d': 33, 'n_steps': 9, 'gamma': 1.9504804352250815, 'cat_emb_dim': 1, 'n_independent': 3, 'n_shared': 4, 'momentum': 0.014215414719379213, 'mask_type': 'entmax'}. Best is trial 24 with value: 5.9658.
[I 2025-03-30 15:38:02,947] Trial 38 finished with value: 4.66434 and parameters: {'n_d': 45, 'n_steps': 10, 'gamma': 1.6220415957262775, 'cat_emb_dim': 1, 'n_independent': 5, 'n_shared': 5, 'momentum': 0.0017104179260583846, 'mask_type': 'sparsemax'}. Best is trial 24 with value: 5.9658.
[I 2025-03-30 15:40:21,287] Trial 39 finished with value: 2.42606 and parameters: {'n_d': 39, 'n_steps': 9, 'gamma': 1.7683668306478189, 'cat_emb_dim': 1, 'n_independent': 3, 'n_shared': 3, 'momentum': 0.07535091276735452, 'mask_type': 'entmax'}. Best is trial 24 with value: 5.9658.
[I 2025-03-30 15:42:01,415] Trial 40 finished with value: 7.9283 and parameters: {'n_d': 28, 'n_steps': 9, 'gamma': 1.8538101701376584, 'cat_emb_dim': 2, 'n_independent': 4, 'n_shared': 4, 'momentum': 0.001014256653404798, 'mask_type': 'entmax'}. Best is trial 40 with value: 7.9283.
[I 2025-03-30 15:44:50,987] Trial 41 finished with value: 6.928540000000001 and parameters: {'n_d': 24, 'n_steps': 8, 'gamma': 1.5525411093976333, 'cat_emb_dim': 2, 'n_independent': 5, 'n_shared': 5, 'momentum': 0.0013887969828640077, 'mask_type': 'entmax'}. Best is trial 40 with value: 7.9283.
[I 2025-03-30 15:47:30,884] Trial 42 finished with value: 8.279259999999999 and parameters: {'n_d': 22, 'n_steps': 10, 'gamma': 1.3677080656114589, 'cat_emb_dim': 2, 'n_independent': 5, 'n_shared': 5, 'momentum': 0.0010410154899340204, 'mask_type': 'sparsemax'}. Best is trial 42 with value: 8.279259999999999.
[I 2025-03-30 15:48:45,234] Trial 43 finished with value: 8.62898 and parameters: {'n_d': 20, 'n_steps': 8, 'gamma': 1.3744667596709879, 'cat_emb_dim': 2, 'n_independent': 5, 'n_shared': 5, 'momentum': 0.0010020487774744906, 'mask_type': 'sparsemax'}. Best is trial 43 with value: 8.62898.
[I 2025-03-30 15:50:31,381] Trial 44 finished with value: 8.06498 and parameters: {'n_d': 21, 'n_steps': 8, 'gamma': 1.3697966138907152, 'cat_emb_dim': 2, 'n_independent': 5, 'n_shared': 5, 'momentum': 0.0010004641607987243, 'mask_type': 'sparsemax'}. Best is trial 43 with value: 8.62898.
[I 2025-03-30 15:52:08,631] Trial 45 finished with value: 7.70388 and parameters: {'n_d': 17, 'n_steps': 7, 'gamma': 1.3948541368463607, 'cat_emb_dim': 2, 'n_independent': 5, 'n_shared': 5, 'momentum': 0.001001911743172389, 'mask_type': 'sparsemax'}. Best is trial 43 with value: 8.62898.
[I 2025-03-30 15:53:14,433] Trial 46 finished with value: 7.41922 and parameters: {'n_d': 15, 'n_steps': 7, 'gamma': 1.3762047499602572, 'cat_emb_dim': 2, 'n_independent': 5, 'n_shared': 5, 'momentum': 0.0010412907756553753, 'mask_type': 'sparsemax'}. Best is trial 43 with value: 8.62898.
[I 2025-03-30 15:55:16,848] Trial 47 finished with value: 6.8738600000000005 and parameters: {'n_d': 21, 'n_steps': 7, 'gamma': 1.3036416610718928, 'cat_emb_dim': 2, 'n_independent': 5, 'n_shared': 5, 'momentum': 0.0013512218898556892, 'mask_type': 'sparsemax'}. Best is trial 43 with value: 8.62898.
[I 2025-03-30 15:56:29,701] Trial 48 finished with value: 4.3304800000000006 and parameters: {'n_d': 8, 'n_steps': 7, 'gamma': 1.4125141578232878, 'cat_emb_dim': 2, 'n_independent': 5, 'n_shared': 5, 'momentum': 0.0010756723551391882, 'mask_type': 'sparsemax'}. Best is trial 43 with value: 8.62898.
[I 2025-03-30 15:57:16,795] Trial 49 finished with value: 5.82848 and parameters: {'n_d': 13, 'n_steps': 6, 'gamma': 1.2599260760302144, 'cat_emb_dim': 2, 'n_independent': 5, 'n_shared': 5, 'momentum': 0.0010083020133233517, 'mask_type': 'sparsemax'}. Best is trial 43 with value: 8.62898.
[I 2025-03-30 16:00:59,846] Trial 50 finished with value: 5.86096 and parameters: {'n_d': 19, 'n_steps': 9, 'gamma': 1.206261452362676, 'cat_emb_dim': 3, 'n_independent': 5, 'n_shared': 5, 'momentum': 0.0013644521671195042, 'mask_type': 'sparsemax'}. Best is trial 43 with value: 8.62898.
[I 2025-03-30 16:02:44,247] Trial 51 finished with value: 2.4626799999999998 and parameters: {'n_d': 17, 'n_steps': 5, 'gamma': 1.4309003913796792, 'cat_emb_dim': 2, 'n_independent': 5, 'n_shared': 5, 'momentum': 0.027646241999691953, 'mask_type': 'sparsemax'}. Best is trial 43 with value: 8.62898.
[I 2025-03-30 16:04:20,640] Trial 52 finished with value: 6.181219999999999 and parameters: {'n_d': 12, 'n_steps': 8, 'gamma': 1.2890156388123803, 'cat_emb_dim': 2, 'n_independent': 5, 'n_shared': 5, 'momentum': 0.0014449079685064994, 'mask_type': 'sparsemax'}. Best is trial 43 with value: 8.62898.
[I 2025-03-30 16:06:29,876] Trial 53 finished with value: 5.11648 and parameters: {'n_d': 26, 'n_steps': 4, 'gamma': 1.499259752216601, 'cat_emb_dim': 2, 'n_independent': 5, 'n_shared': 5, 'momentum': 0.0012954426222952108, 'mask_type': 'sparsemax'}. Best is trial 43 with value: 8.62898.
[I 2025-03-30 16:09:18,030] Trial 54 finished with value: 6.938019999999999 and parameters: {'n_d': 22, 'n_steps': 7, 'gamma': 1.3458086466629258, 'cat_emb_dim': 2, 'n_independent': 5, 'n_shared': 5, 'momentum': 0.0010224477661168034, 'mask_type': 'sparsemax'}. Best is trial 43 with value: 8.62898.
[I 2025-03-30 16:10:57,438] Trial 55 finished with value: 3.83172 and parameters: {'n_d': 15, 'n_steps': 6, 'gamma': 1.4044902254454599, 'cat_emb_dim': 2, 'n_independent': 5, 'n_shared': 5, 'momentum': 0.003094844664984814, 'mask_type': 'sparsemax'}. Best is trial 43 with value: 8.62898.
[I 2025-03-30 16:13:25,691] Trial 56 finished with value: 6.63938 and parameters: {'n_d': 22, 'n_steps': 7, 'gamma': 1.340546981478491, 'cat_emb_dim': 2, 'n_independent': 5, 'n_shared': 5, 'momentum': 0.001199806652690893, 'mask_type': 'sparsemax'}. Best is trial 43 with value: 8.62898.
[I 2025-03-30 16:17:05,753] Trial 57 finished with value: 3.83802 and parameters: {'n_d': 18, 'n_steps': 8, 'gamma': 1.14995368330985, 'cat_emb_dim': 3, 'n_independent': 5, 'n_shared': 5, 'momentum': 0.0030964839201582297, 'mask_type': 'sparsemax'}. Best is trial 43 with value: 8.62898.
[I 2025-03-30 16:18:36,902] Trial 58 finished with value: 4.301139999999999 and parameters: {'n_d': 10, 'n_steps': 7, 'gamma': 1.4426286518362856, 'cat_emb_dim': 2, 'n_independent': 5, 'n_shared': 5, 'momentum': 0.002380280334903733, 'mask_type': 'sparsemax'}. Best is trial 43 with value: 8.62898.
[I 2025-03-30 16:20:35,940] Trial 59 finished with value: 6.989960000000001 and parameters: {'n_d': 15, 'n_steps': 8, 'gamma': 1.382837345180887, 'cat_emb_dim': 2, 'n_independent': 5, 'n_shared': 5, 'momentum': 0.0010088609225084246, 'mask_type': 'sparsemax'}. Best is trial 43 with value: 8.62898.
[I 2025-03-30 16:22:07,891] Trial 60 finished with value: 5.94336 and parameters: {'n_d': 11, 'n_steps': 9, 'gamma': 1.5240369007569676, 'cat_emb_dim': 2, 'n_independent': 5, 'n_shared': 4, 'momentum': 0.001549040625857892, 'mask_type': 'sparsemax'}. Best is trial 43 with value: 8.62898.
[I 2025-03-30 16:24:40,842] Trial 61 finished with value: 2.49908 and parameters: {'n_d': 28, 'n_steps': 7, 'gamma': 1.2214035571178132, 'cat_emb_dim': 2, 'n_independent': 5, 'n_shared': 5, 'momentum': 0.23115738617362996, 'mask_type': 'sparsemax'}. Best is trial 43 with value: 8.62898.
[I 2025-03-30 16:25:53,911] Trial 62 finished with value: 6.0281 and parameters: {'n_d': 23, 'n_steps': 6, 'gamma': 1.4647929938566002, 'cat_emb_dim': 2, 'n_independent': 5, 'n_shared': 4, 'momentum': 0.0022010546608157685, 'mask_type': 'sparsemax'}. Best is trial 43 with value: 8.62898.
[I 2025-03-30 16:28:56,158] Trial 63 finished with value: 6.0024 and parameters: {'n_d': 19, 'n_steps': 8, 'gamma': 1.3013171711479377, 'cat_emb_dim': 3, 'n_independent': 5, 'n_shared': 5, 'momentum': 0.0012202591732629901, 'mask_type': 'sparsemax'}. Best is trial 43 with value: 8.62898.
[I 2025-03-30 16:30:23,537] Trial 64 finished with value: 8.20026 and parameters: {'n_d': 15, 'n_steps': 8, 'gamma': 1.3664163945920502, 'cat_emb_dim': 2, 'n_independent': 5, 'n_shared': 5, 'momentum': 0.001005900048977032, 'mask_type': 'sparsemax'}. Best is trial 43 with value: 8.62898.
[I 2025-03-30 16:33:43,015] Trial 65 finished with value: 5.76896 and parameters: {'n_d': 63, 'n_steps': 8, 'gamma': 1.3720903815160896, 'cat_emb_dim': 2, 'n_independent': 5, 'n_shared': 5, 'momentum': 0.001557579786455449, 'mask_type': 'sparsemax'}. Best is trial 43 with value: 8.62898.
[I 2025-03-30 16:35:56,102] Trial 66 finished with value: 7.77854 and parameters: {'n_d': 14, 'n_steps': 9, 'gamma': 1.3764375016614931, 'cat_emb_dim': 2, 'n_independent': 5, 'n_shared': 5, 'momentum': 0.0010128875757918832, 'mask_type': 'sparsemax'}. Best is trial 43 with value: 8.62898.
[I 2025-03-30 16:39:01,687] Trial 67 finished with value: 6.869719999999999 and parameters: {'n_d': 26, 'n_steps': 9, 'gamma': 1.2505035079699578, 'cat_emb_dim': 2, 'n_independent': 4, 'n_shared': 5, 'momentum': 0.0012237388654102296, 'mask_type': 'sparsemax'}. Best is trial 43 with value: 8.62898.
[I 2025-03-30 16:41:12,367] Trial 68 finished with value: 7.837000000000001 and parameters: {'n_d': 20, 'n_steps': 10, 'gamma': 1.3154490838132704, 'cat_emb_dim': 2, 'n_independent': 5, 'n_shared': 4, 'momentum': 0.0015023189791491805, 'mask_type': 'sparsemax'}. Best is trial 43 with value: 8.62898.
[I 2025-03-30 16:45:09,869] Trial 69 finished with value: 5.24602 and parameters: {'n_d': 20, 'n_steps': 10, 'gamma': 1.3240846922289977, 'cat_emb_dim': 2, 'n_independent': 5, 'n_shared': 4, 'momentum': 0.0015504832125059224, 'mask_type': 'sparsemax'}. Best is trial 43 with value: 8.62898.
[I 2025-03-30 16:46:51,807] Trial 70 finished with value: 3.90888 and parameters: {'n_d': 14, 'n_steps': 10, 'gamma': 1.1783644875826975, 'cat_emb_dim': 2, 'n_independent': 4, 'n_shared': 3, 'momentum': 0.0025248338204931116, 'mask_type': 'sparsemax'}. Best is trial 43 with value: 8.62898.
[I 2025-03-30 16:48:47,305] Trial 71 finished with value: 5.0921199999999995 and parameters: {'n_d': 10, 'n_steps': 10, 'gamma': 1.282196832107732, 'cat_emb_dim': 2, 'n_independent': 5, 'n_shared': 4, 'momentum': 0.0020133647348449407, 'mask_type': 'sparsemax'}. Best is trial 43 with value: 8.62898.
[I 2025-03-30 16:50:42,193] Trial 72 finished with value: 7.52276 and parameters: {'n_d': 21, 'n_steps': 9, 'gamma': 1.121244658396861, 'cat_emb_dim': 2, 'n_independent': 5, 'n_shared': 4, 'momentum': 0.0012573474950038509, 'mask_type': 'sparsemax'}. Best is trial 43 with value: 8.62898.
[I 2025-03-30 16:53:59,076] Trial 73 finished with value: 3.49472 and parameters: {'n_d': 18, 'n_steps': 10, 'gamma': 1.45772516840321, 'cat_emb_dim': 2, 'n_independent': 4, 'n_shared': 4, 'momentum': 0.0028476348061662452, 'mask_type': 'sparsemax'}. Best is trial 43 with value: 8.62898.
[I 2025-03-30 16:57:04,742] Trial 74 finished with value: 5.90126 and parameters: {'n_d': 17, 'n_steps': 9, 'gamma': 1.406272285395797, 'cat_emb_dim': 2, 'n_independent': 5, 'n_shared': 5, 'momentum': 0.0015450272707429485, 'mask_type': 'sparsemax'}. Best is trial 43 with value: 8.62898.
[I 2025-03-30 16:59:54,209] Trial 75 finished with value: 7.6034999999999995 and parameters: {'n_d': 25, 'n_steps': 9, 'gamma': 1.4998526247483017, 'cat_emb_dim': 2, 'n_independent': 5, 'n_shared': 5, 'momentum': 0.0010087729554097472, 'mask_type': 'sparsemax'}. Best is trial 43 with value: 8.62898.
[I 2025-03-30 17:03:46,902] Trial 76 finished with value: 6.62092 and parameters: {'n_d': 17, 'n_steps': 10, 'gamma': 1.348493776121897, 'cat_emb_dim': 2, 'n_independent': 5, 'n_shared': 5, 'momentum': 0.001230863744640891, 'mask_type': 'sparsemax'}. Best is trial 43 with value: 8.62898.
[I 2025-03-30 17:04:56,775] Trial 77 finished with value: 7.102199999999999 and parameters: {'n_d': 13, 'n_steps': 8, 'gamma': 1.3708334166950868, 'cat_emb_dim': 2, 'n_independent': 5, 'n_shared': 5, 'momentum': 0.001724668093147605, 'mask_type': 'sparsemax'}. Best is trial 43 with value: 8.62898.
