[I 2025-03-30 12:23:36,180] Using an existing study with name 'TabNet_Diamonds' instead of creating a new one.
[I 2025-03-30 14:10:00,517] Trial 3 finished with value: 0.6266200000000001 and parameters: {'n_d': 38, 'n_steps': 10, 'gamma': 1.330249081459642, 'cat_emb_dim': 2, 'n_independent': 2, 'n_shared': 2, 'momentum': 0.002234609250146497, 'mask_type': 'entmax'}. Best is trial 3 with value: 0.6266200000000001.
[I 2025-03-30 15:11:11,814] Trial 4 finished with value: 0.62134 and parameters: {'n_d': 20, 'n_steps': 3, 'gamma': 1.6069349907047779, 'cat_emb_dim': 1, 'n_independent': 2, 'n_shared': 2, 'momentum': 0.0023270964946622195, 'mask_type': 'entmax'}. Best is trial 3 with value: 0.6266200000000001.
[I 2025-03-30 16:52:14,985] Trial 5 finished with value: 0.6324400000000001 and parameters: {'n_d': 59, 'n_steps': 7, 'gamma': 1.039894832455389, 'cat_emb_dim': 1, 'n_independent': 2, 'n_shared': 4, 'momentum': 0.07975638320679328, 'mask_type': 'sparsemax'}. Best is trial 5 with value: 0.6324400000000001.
[I 2025-03-30 18:12:14,761] Trial 6 finished with value: 0.6532600000000001 and parameters: {'n_d': 52, 'n_steps': 5, 'gamma': 1.8583073545470548, 'cat_emb_dim': 3, 'n_independent': 5, 'n_shared': 5, 'momentum': 0.03353409790255242, 'mask_type': 'sparsemax'}. Best is trial 6 with value: 0.6532600000000001.
[I 2025-03-30 19:09:58,654] Trial 7 finished with value: 0.6511000000000001 and parameters: {'n_d': 17, 'n_steps': 3, 'gamma': 1.012586963647991, 'cat_emb_dim': 3, 'n_independent': 5, 'n_shared': 5, 'momentum': 0.006196321153188687, 'mask_type': 'entmax'}. Best is trial 6 with value: 0.6532600000000001.
[I 2025-03-30 20:26:45,968] Trial 8 finished with value: 0.6826800000000001 and parameters: {'n_d': 12, 'n_steps': 5, 'gamma': 1.263859320313395, 'cat_emb_dim': 3, 'n_independent': 3, 'n_shared': 4, 'momentum': 0.005078815902864435, 'mask_type': 'sparsemax'}. Best is trial 8 with value: 0.6826800000000001.
[I 2025-03-30 21:22:29,900] Trial 9 finished with value: 0.62476 and parameters: {'n_d': 29, 'n_steps': 5, 'gamma': 1.7885460367192891, 'cat_emb_dim': 3, 'n_independent': 1, 'n_shared': 2, 'momentum': 0.00963576540025324, 'mask_type': 'entmax'}. Best is trial 8 with value: 0.6826800000000001.
[I 2025-03-31 00:13:12,111] Trial 10 finished with value: 0.62158 and parameters: {'n_d': 60, 'n_steps': 10, 'gamma': 1.8476525501746845, 'cat_emb_dim': 2, 'n_independent': 5, 'n_shared': 5, 'momentum': 0.1865835523276842, 'mask_type': 'sparsemax'}. Best is trial 8 with value: 0.6826800000000001.
[I 2025-03-31 02:00:09,155] Trial 11 finished with value: 0.6651999999999999 and parameters: {'n_d': 47, 'n_steps': 6, 'gamma': 1.8016980795485913, 'cat_emb_dim': 1, 'n_independent': 5, 'n_shared': 3, 'momentum': 0.017113069815339367, 'mask_type': 'sparsemax'}. Best is trial 8 with value: 0.6826800000000001.
[I 2025-03-31 04:03:32,574] Trial 12 finished with value: 0.621 and parameters: {'n_d': 11, 'n_steps': 8, 'gamma': 1.2399473546027948, 'cat_emb_dim': 3, 'n_independent': 2, 'n_shared': 4, 'momentum': 0.04072693325411094, 'mask_type': 'sparsemax'}. Best is trial 8 with value: 0.6826800000000001.
[I 2025-03-31 05:22:45,299] Trial 13 finished with value: 0.66318 and parameters: {'n_d': 29, 'n_steps': 4, 'gamma': 1.5130281819769742, 'cat_emb_dim': 2, 'n_independent': 4, 'n_shared': 1, 'momentum': 0.0013343268047619314, 'mask_type': 'sparsemax'}. Best is trial 8 with value: 0.6826800000000001.
[I 2025-03-31 07:00:34,570] Trial 14 finished with value: 0.6782600000000001 and parameters: {'n_d': 44, 'n_steps': 6, 'gamma': 1.2955211870155094, 'cat_emb_dim': 1, 'n_independent': 4, 'n_shared': 3, 'momentum': 0.009222147367324957, 'mask_type': 'sparsemax'}. Best is trial 8 with value: 0.6826800000000001.
[I 2025-03-31 08:26:55,114] Trial 15 finished with value: 0.6860799999999999 and parameters: {'n_d': 41, 'n_steps': 7, 'gamma': 1.27105823046316, 'cat_emb_dim': 1, 'n_independent': 3, 'n_shared': 3, 'momentum': 0.005505971559725207, 'mask_type': 'sparsemax'}. Best is trial 15 with value: 0.6860799999999999.
[I 2025-03-31 10:44:50,473] Trial 16 finished with value: 0.66714 and parameters: {'n_d': 32, 'n_steps': 8, 'gamma': 1.1803146088295313, 'cat_emb_dim': 2, 'n_independent': 3, 'n_shared': 4, 'momentum': 0.0046250739367755395, 'mask_type': 'sparsemax'}. Best is trial 15 with value: 0.6860799999999999.
[I 2025-03-31 12:31:20,892] Trial 17 finished with value: 0.67054 and parameters: {'n_d': 22, 'n_steps': 8, 'gamma': 1.4135922343414449, 'cat_emb_dim': 2, 'n_independent': 3, 'n_shared': 3, 'momentum': 0.0035795845073108186, 'mask_type': 'sparsemax'}. Best is trial 15 with value: 0.6860799999999999.
[I 2025-03-31 14:34:22,748] Trial 18 finished with value: 0.8880799999999999 and parameters: {'n_d': 8, 'n_steps': 7, 'gamma': 1.1367554225728589, 'cat_emb_dim': 1, 'n_independent': 4, 'n_shared': 4, 'momentum': 0.0010038774033580649, 'mask_type': 'sparsemax'}. Best is trial 18 with value: 0.8880799999999999.
[I 2025-03-31 16:25:32,910] Trial 19 finished with value: 0.67898 and parameters: {'n_d': 41, 'n_steps': 7, 'gamma': 1.1265842440565628, 'cat_emb_dim': 1, 'n_independent': 4, 'n_shared': 1, 'momentum': 0.0010556995878123812, 'mask_type': 'sparsemax'}. Best is trial 18 with value: 0.8880799999999999.
[I 2025-03-31 19:06:25,831] Trial 20 finished with value: 0.70586 and parameters: {'n_d': 51, 'n_steps': 9, 'gamma': 1.625630799277245, 'cat_emb_dim': 1, 'n_independent': 4, 'n_shared': 4, 'momentum': 0.0018668086779116187, 'mask_type': 'sparsemax'}. Best is trial 18 with value: 0.8880799999999999.
[I 2025-03-31 21:27:17,602] Trial 21 finished with value: 0.70438 and parameters: {'n_d': 51, 'n_steps': 9, 'gamma': 1.6603685020671035, 'cat_emb_dim': 1, 'n_independent': 4, 'n_shared': 4, 'momentum': 0.0017932371578793097, 'mask_type': 'entmax'}. Best is trial 18 with value: 0.8880799999999999.
[I 2025-04-01 00:18:54,551] Trial 22 finished with value: 0.7771000000000001 and parameters: {'n_d': 8, 'n_steps': 9, 'gamma': 1.4779082785768605, 'cat_emb_dim': 1, 'n_independent': 4, 'n_shared': 5, 'momentum': 0.37339297702791013, 'mask_type': 'sparsemax'}. Best is trial 18 with value: 0.8880799999999999.
[I 2025-04-01 03:07:31,174] Trial 23 finished with value: 0.6346 and parameters: {'n_d': 8, 'n_steps': 9, 'gamma': 1.990873796851433, 'cat_emb_dim': 2, 'n_independent': 4, 'n_shared': 5, 'momentum': 0.3859999130900889, 'mask_type': 'sparsemax'}. Best is trial 18 with value: 0.8880799999999999.
[I 2025-04-01 05:30:22,112] Trial 24 finished with value: 0.6819399999999999 and parameters: {'n_d': 15, 'n_steps': 9, 'gamma': 1.4915681364774445, 'cat_emb_dim': 1, 'n_independent': 4, 'n_shared': 5, 'momentum': 0.06863525065603433, 'mask_type': 'sparsemax'}. Best is trial 18 with value: 0.8880799999999999.
[I 2025-04-01 08:14:49,991] Trial 25 finished with value: 0.83844 and parameters: {'n_d': 26, 'n_steps': 10, 'gamma': 1.682235388746962, 'cat_emb_dim': 1, 'n_independent': 4, 'n_shared': 4, 'momentum': 0.0010390937576289076, 'mask_type': 'sparsemax'}. Best is trial 18 with value: 0.8880799999999999.
[I 2025-04-01 11:47:21,506] Trial 26 finished with value: 0.67638 and parameters: {'n_d': 24, 'n_steps': 10, 'gamma': 1.70476578639084, 'cat_emb_dim': 1, 'n_independent': 3, 'n_shared': 5, 'momentum': 0.3613034920083372, 'mask_type': 'sparsemax'}. Best is trial 18 with value: 0.8880799999999999.
[I 2025-04-01 15:04:24,296] Trial 27 finished with value: 0.74566 and parameters: {'n_d': 8, 'n_steps': 10, 'gamma': 1.4069334146035226, 'cat_emb_dim': 1, 'n_independent': 5, 'n_shared': 4, 'momentum': 0.14339273105437386, 'mask_type': 'sparsemax'}. Best is trial 18 with value: 0.8880799999999999.
[I 2025-04-01 17:22:22,136] Trial 28 finished with value: 0.7410599999999999 and parameters: {'n_d': 16, 'n_steps': 8, 'gamma': 1.5288896670620353, 'cat_emb_dim': 1, 'n_independent': 4, 'n_shared': 4, 'momentum': 0.018137229261795007, 'mask_type': 'sparsemax'}. Best is trial 18 with value: 0.8880799999999999.
[I 2025-04-01 20:01:42,094] Trial 29 finished with value: 0.6846800000000001 and parameters: {'n_d': 26, 'n_steps': 9, 'gamma': 1.1163142829780783, 'cat_emb_dim': 1, 'n_independent': 3, 'n_shared': 5, 'momentum': 0.0029029074267611643, 'mask_type': 'entmax'}. Best is trial 18 with value: 0.8880799999999999.
[I 2025-04-01 23:41:15,604] Trial 30 finished with value: 0.7581800000000001 and parameters: {'n_d': 19, 'n_steps': 10, 'gamma': 1.3964610725585291, 'cat_emb_dim': 2, 'n_independent': 4, 'n_shared': 4, 'momentum': 0.0014337999108576462, 'mask_type': 'sparsemax'}. Best is trial 18 with value: 0.8880799999999999.
[I 2025-04-02 02:44:21,127] Trial 31 finished with value: 0.8404200000000002 and parameters: {'n_d': 13, 'n_steps': 8, 'gamma': 1.968150761157319, 'cat_emb_dim': 1, 'n_independent': 5, 'n_shared': 5, 'momentum': 0.0010617019128179748, 'mask_type': 'sparsemax'}. Best is trial 18 with value: 0.8880799999999999.
[I 2025-04-02 04:35:51,237] Trial 32 finished with value: 0.7395799999999999 and parameters: {'n_d': 35, 'n_steps': 6, 'gamma': 1.9537803548511197, 'cat_emb_dim': 1, 'n_independent': 5, 'n_shared': 3, 'momentum': 0.0011736335526755324, 'mask_type': 'entmax'}. Best is trial 18 with value: 0.8880799999999999.
[I 2025-04-02 06:38:04,987] Trial 33 finished with value: 0.65202 and parameters: {'n_d': 13, 'n_steps': 7, 'gamma': 1.926090515974195, 'cat_emb_dim': 2, 'n_independent': 5, 'n_shared': 3, 'momentum': 0.002781023040405986, 'mask_type': 'sparsemax'}. Best is trial 18 with value: 0.8880799999999999.
[I 2025-04-02 08:53:18,349] Trial 34 finished with value: 0.8518399999999999 and parameters: {'n_d': 9, 'n_steps': 8, 'gamma': 1.7434722882409945, 'cat_emb_dim': 1, 'n_independent': 4, 'n_shared': 5, 'momentum': 0.0017787527377500561, 'mask_type': 'sparsemax'}. Best is trial 18 with value: 0.8880799999999999.
[I 2025-04-02 11:38:52,990] Trial 35 finished with value: 1.47268 and parameters: {'n_d': 20, 'n_steps': 8, 'gamma': 1.7326743898919266, 'cat_emb_dim': 1, 'n_independent': 5, 'n_shared': 5, 'momentum': 0.001058109003799555, 'mask_type': 'sparsemax'}. Best is trial 35 with value: 1.47268.
srun: Job step aborted: Waiting up to 32 seconds for job step to finish.
slurmstepd: error: *** JOB 115478 ON stud-000 CANCELLED AT 2025-04-02T12:23:42 DUE TO TIME LIMIT ***
slurmstepd: error: *** STEP 115478.0 ON stud-000 CANCELLED AT 2025-04-02T12:23:42 DUE TO TIME LIMIT ***
