[I 2025-03-30 12:23:10,534] Using an existing study with name 'TabNet_Allstate_Claims' instead of creating a new one.
[I 2025-03-30 19:54:25,756] Trial 3 finished with value: 6.537819999999999 and parameters: {'n_d': 54, 'n_steps': 4, 'gamma': 1.1634126918928285, 'cat_emb_dim': 1, 'n_independent': 4, 'n_shared': 5, 'momentum': 0.19259779341831457, 'mask_type': 'sparsemax'}. Best is trial 3 with value: 6.537819999999999.
[I 2025-03-31 03:18:33,519] Trial 4 finished with value: 6.5346400000000004 and parameters: {'n_d': 50, 'n_steps': 4, 'gamma': 1.287394168514881, 'cat_emb_dim': 2, 'n_independent': 1, 'n_shared': 5, 'momentum': 0.36193794197632867, 'mask_type': 'entmax'}. Best is trial 3 with value: 6.537819999999999.
[I 2025-03-31 12:39:40,634] Trial 5 finished with value: 6.5318999999999985 and parameters: {'n_d': 60, 'n_steps': 6, 'gamma': 1.9093170757985158, 'cat_emb_dim': 1, 'n_independent': 2, 'n_shared': 2, 'momentum': 0.004190128213584084, 'mask_type': 'sparsemax'}. Best is trial 3 with value: 6.537819999999999.
[I 2025-03-31 23:40:31,814] Trial 6 finished with value: 6.538259999999999 and parameters: {'n_d': 12, 'n_steps': 6, 'gamma': 1.4921895070384743, 'cat_emb_dim': 1, 'n_independent': 2, 'n_shared': 5, 'momentum': 0.0017812705579288248, 'mask_type': 'sparsemax'}. Best is trial 6 with value: 6.538259999999999.
[I 2025-04-01 09:10:36,442] Trial 7 finished with value: 6.505599999999999 and parameters: {'n_d': 10, 'n_steps': 7, 'gamma': 1.9472126033649575, 'cat_emb_dim': 1, 'n_independent': 1, 'n_shared': 3, 'momentum': 0.016286304749596685, 'mask_type': 'entmax'}. Best is trial 6 with value: 6.538259999999999.
