[I 2025-03-30 17:08:08,712] Trial 78 finished with value: 5.24824 and parameters: {'n_d': 23, 'n_steps': 8, 'gamma': 1.3273854289202722, 'cat_emb_dim': 2, 'n_independent': 5, 'n_shared': 5, 'momentum': 0.0022169430364037163, 'mask_type': 'sparsemax'}. Best is trial 43 with value: 8.62898.
[I 2025-03-30 17:09:10,256] Trial 79 finished with value: 4.57742 and parameters: {'n_d': 19, 'n_steps': 9, 'gamma': 1.4290440728446985, 'cat_emb_dim': 2, 'n_independent': 4, 'n_shared': 2, 'momentum': 0.0011485744427732231, 'mask_type': 'sparsemax'}. Best is trial 43 with value: 8.62898.
[I 2025-03-30 17:10:12,045] Trial 80 finished with value: 3.4200000000000004 and parameters: {'n_d': 16, 'n_steps': 10, 'gamma': 1.2708207165169902, 'cat_emb_dim': 2, 'n_independent': 1, 'n_shared': 4, 'momentum': 0.0013718421394855, 'mask_type': 'sparsemax'}. Best is trial 43 with value: 8.62898.
[I 2025-03-30 17:13:10,888] Trial 81 finished with value: 6.45458 and parameters: {'n_d': 21, 'n_steps': 9, 'gamma': 1.3079354292734182, 'cat_emb_dim': 2, 'n_independent': 5, 'n_shared': 5, 'momentum': 0.0016646137711695754, 'mask_type': 'sparsemax'}. Best is trial 43 with value: 8.62898.
[I 2025-03-30 17:15:53,355] Trial 82 finished with value: 3.0701 and parameters: {'n_d': 28, 'n_steps': 8, 'gamma': 1.0000431335357953, 'cat_emb_dim': 2, 'n_independent': 5, 'n_shared': 3, 'momentum': 0.003591750774142421, 'mask_type': 'sparsemax'}. Best is trial 43 with value: 8.62898.
[I 2025-03-30 17:19:40,460] Trial 83 finished with value: 2.4717600000000006 and parameters: {'n_d': 8, 'n_steps': 10, 'gamma': 1.3931835130939518, 'cat_emb_dim': 2, 'n_independent': 4, 'n_shared': 5, 'momentum': 0.0971208171544773, 'mask_type': 'sparsemax'}. Best is trial 43 with value: 8.62898.
[I 2025-03-30 17:22:16,973] Trial 84 finished with value: 8.04058 and parameters: {'n_d': 26, 'n_steps': 9, 'gamma': 1.5063699259981636, 'cat_emb_dim': 2, 'n_independent': 5, 'n_shared': 5, 'momentum': 0.0010287740874325903, 'mask_type': 'sparsemax'}. Best is trial 43 with value: 8.62898.
[I 2025-03-30 17:25:08,714] Trial 85 finished with value: 7.693600000000001 and parameters: {'n_d': 25, 'n_steps': 9, 'gamma': 1.5286731728817744, 'cat_emb_dim': 2, 'n_independent': 5, 'n_shared': 5, 'momentum': 0.0011491197181686715, 'mask_type': 'sparsemax'}. Best is trial 43 with value: 8.62898.
[I 2025-03-30 17:29:08,068] Trial 86 finished with value: 2.9718199999999997 and parameters: {'n_d': 30, 'n_steps': 9, 'gamma': 1.3590559995570537, 'cat_emb_dim': 2, 'n_independent': 5, 'n_shared': 5, 'momentum': 0.005011323742233069, 'mask_type': 'sparsemax'}. Best is trial 43 with value: 8.62898.
[I 2025-03-30 17:31:36,322] Trial 87 finished with value: 6.99906 and parameters: {'n_d': 23, 'n_steps': 8, 'gamma': 1.4843344656121913, 'cat_emb_dim': 2, 'n_independent': 5, 'n_shared': 5, 'momentum': 0.0014147934826495756, 'mask_type': 'sparsemax'}. Best is trial 43 with value: 8.62898.
[I 2025-03-30 17:34:43,465] Trial 88 finished with value: 4.9782399999999996 and parameters: {'n_d': 20, 'n_steps': 8, 'gamma': 1.4328446195574354, 'cat_emb_dim': 2, 'n_independent': 5, 'n_shared': 5, 'momentum': 0.002038348059248741, 'mask_type': 'sparsemax'}. Best is trial 43 with value: 8.62898.
[I 2025-03-30 17:36:35,110] Trial 89 finished with value: 8.75942 and parameters: {'n_d': 14, 'n_steps': 10, 'gamma': 1.5848384082400053, 'cat_emb_dim': 2, 'n_independent': 5, 'n_shared': 5, 'momentum': 0.0010078945202086514, 'mask_type': 'sparsemax'}. Best is trial 89 with value: 8.75942.
[I 2025-03-30 17:39:11,245] Trial 90 finished with value: 4.571 and parameters: {'n_d': 11, 'n_steps': 10, 'gamma': 1.5309506589859927, 'cat_emb_dim': 2, 'n_independent': 3, 'n_shared': 5, 'momentum': 0.0011772383708630674, 'mask_type': 'sparsemax'}. Best is trial 89 with value: 8.75942.
[I 2025-03-30 17:43:49,552] Trial 91 finished with value: 2.5891399999999996 and parameters: {'n_d': 15, 'n_steps': 10, 'gamma': 1.5715384093371767, 'cat_emb_dim': 2, 'n_independent': 5, 'n_shared': 5, 'momentum': 0.03780585962643696, 'mask_type': 'sparsemax'}. Best is trial 89 with value: 8.75942.
[I 2025-03-30 17:46:48,254] Trial 92 finished with value: 6.8934 and parameters: {'n_d': 22, 'n_steps': 10, 'gamma': 1.595955599769306, 'cat_emb_dim': 2, 'n_independent': 5, 'n_shared': 4, 'momentum': 0.0014151626127112717, 'mask_type': 'sparsemax'}. Best is trial 89 with value: 8.75942.
[I 2025-03-30 17:50:05,556] Trial 93 finished with value: 6.24174 and parameters: {'n_d': 27, 'n_steps': 9, 'gamma': 1.3240138837013253, 'cat_emb_dim': 2, 'n_independent': 5, 'n_shared': 5, 'momentum': 0.001807301293390842, 'mask_type': 'sparsemax'}. Best is trial 89 with value: 8.75942.
[I 2025-03-30 17:52:27,888] Trial 94 finished with value: 7.832759999999999 and parameters: {'n_d': 16, 'n_steps': 9, 'gamma': 1.7311520142825176, 'cat_emb_dim': 2, 'n_independent': 5, 'n_shared': 5, 'momentum': 0.001033242193788599, 'mask_type': 'sparsemax'}. Best is trial 89 with value: 8.75942.
[I 2025-03-30 17:55:26,890] Trial 95 finished with value: 7.07166 and parameters: {'n_d': 14, 'n_steps': 9, 'gamma': 1.6534576133013195, 'cat_emb_dim': 2, 'n_independent': 5, 'n_shared': 5, 'momentum': 0.0011592193874111255, 'mask_type': 'sparsemax'}. Best is trial 89 with value: 8.75942.
[I 2025-03-30 17:58:46,013] Trial 96 finished with value: 7.24336 and parameters: {'n_d': 18, 'n_steps': 10, 'gamma': 1.7933325292004083, 'cat_emb_dim': 2, 'n_independent': 5, 'n_shared': 5, 'momentum': 0.0010969443699542442, 'mask_type': 'sparsemax'}. Best is trial 89 with value: 8.75942.
[I 2025-03-30 18:00:29,231] Trial 97 finished with value: 8.42722 and parameters: {'n_d': 16, 'n_steps': 9, 'gamma': 1.6602951941628596, 'cat_emb_dim': 2, 'n_independent': 5, 'n_shared': 5, 'momentum': 0.001003650664231549, 'mask_type': 'sparsemax'}. Best is trial 89 with value: 8.75942.
[I 2025-03-30 18:05:08,854] Trial 98 finished with value: 2.52842 and parameters: {'n_d': 20, 'n_steps': 10, 'gamma': 1.7361015774859145, 'cat_emb_dim': 2, 'n_independent': 5, 'n_shared': 5, 'momentum': 0.050106356941246676, 'mask_type': 'sparsemax'}. Best is trial 89 with value: 8.75942.
[I 2025-03-30 18:09:48,525] Trial 99 finished with value: 4.85968 and parameters: {'n_d': 24, 'n_steps': 9, 'gamma': 1.6466661448192452, 'cat_emb_dim': 2, 'n_independent': 5, 'n_shared': 5, 'momentum': 0.0013728162817595506, 'mask_type': 'sparsemax'}. Best is trial 89 with value: 8.75942.
[I 2025-03-30 18:10:25,801] Trial 100 finished with value: 5.49252 and parameters: {'n_d': 16, 'n_steps': 3, 'gamma': 1.8461450332623532, 'cat_emb_dim': 2, 'n_independent': 5, 'n_shared': 5, 'momentum': 0.001676219105149382, 'mask_type': 'entmax'}. Best is trial 89 with value: 8.75942.
[I 2025-03-30 18:13:26,743] Trial 101 finished with value: 7.79884 and parameters: {'n_d': 56, 'n_steps': 10, 'gamma': 1.6156228041034697, 'cat_emb_dim': 2, 'n_independent': 4, 'n_shared': 5, 'momentum': 0.0012597302051109494, 'mask_type': 'sparsemax'}. Best is trial 89 with value: 8.75942.
