[I 2025-03-30 13:41:36,722] Using an existing study with name 'TabNet_House_Sales' instead of creating a new one.
[I 2025-03-30 14:00:17,211] Trial 3 finished with value: 4.1115 and parameters: {'n_d': 31, 'n_steps': 5, 'gamma': 1.1721979444194162, 'cat_emb_dim': 3, 'n_independent': 1, 'n_shared': 1, 'momentum': 0.0014154124812624214, 'mask_type': 'sparsemax'}. Best is trial 3 with value: 4.1115.
[I 2025-03-30 14:28:56,870] Trial 4 finished with value: 3.9595 and parameters: {'n_d': 41, 'n_steps': 6, 'gamma': 1.5540358243258137, 'cat_emb_dim': 2, 'n_independent': 3, 'n_shared': 4, 'momentum': 0.013088558173333011, 'mask_type': 'sparsemax'}. Best is trial 3 with value: 4.1115.
[I 2025-03-30 14:53:37,385] Trial 5 finished with value: 4.0529 and parameters: {'n_d': 57, 'n_steps': 10, 'gamma': 1.0464966408038356, 'cat_emb_dim': 3, 'n_independent': 3, 'n_shared': 2, 'momentum': 0.11718037628581254, 'mask_type': 'entmax'}. Best is trial 3 with value: 4.1115.
[I 2025-03-30 15:10:08,801] Trial 6 finished with value: 3.9653600000000004 and parameters: {'n_d': 62, 'n_steps': 7, 'gamma': 1.9144987899105255, 'cat_emb_dim': 2, 'n_independent': 2, 'n_shared': 1, 'momentum': 0.00603895630374051, 'mask_type': 'entmax'}. Best is trial 3 with value: 4.1115.
[I 2025-03-30 15:47:52,716] Trial 7 finished with value: 3.9675999999999996 and parameters: {'n_d': 16, 'n_steps': 8, 'gamma': 1.3171807816899594, 'cat_emb_dim': 2, 'n_independent': 3, 'n_shared': 2, 'momentum': 0.004707924470532949, 'mask_type': 'sparsemax'}. Best is trial 3 with value: 4.1115.
[I 2025-03-30 16:17:01,361] Trial 8 finished with value: 3.9678200000000006 and parameters: {'n_d': 39, 'n_steps': 5, 'gamma': 1.649728705347382, 'cat_emb_dim': 3, 'n_independent': 4, 'n_shared': 3, 'momentum': 0.0050003981672912985, 'mask_type': 'sparsemax'}. Best is trial 3 with value: 4.1115.
[I 2025-03-30 16:47:37,863] Trial 9 finished with value: 4.446940000000001 and parameters: {'n_d': 12, 'n_steps': 8, 'gamma': 1.9742480674912164, 'cat_emb_dim': 3, 'n_independent': 2, 'n_shared': 2, 'momentum': 0.0011319226945777224, 'mask_type': 'entmax'}. Best is trial 9 with value: 4.446940000000001.
[I 2025-03-30 17:07:22,688] Trial 10 finished with value: 3.9855599999999995 and parameters: {'n_d': 52, 'n_steps': 4, 'gamma': 1.1999999356124962, 'cat_emb_dim': 1, 'n_independent': 4, 'n_shared': 3, 'momentum': 0.008914281543266296, 'mask_type': 'sparsemax'}. Best is trial 9 with value: 4.446940000000001.
[I 2025-03-30 18:21:17,923] Trial 11 finished with value: 3.9356999999999998 and parameters: {'n_d': 10, 'n_steps': 10, 'gamma': 1.7483282682824348, 'cat_emb_dim': 2, 'n_independent': 2, 'n_shared': 5, 'momentum': 0.003676738785868053, 'mask_type': 'entmax'}. Best is trial 9 with value: 4.446940000000001.
[I 2025-03-30 19:04:37,236] Trial 12 finished with value: 3.9235599999999997 and parameters: {'n_d': 27, 'n_steps': 8, 'gamma': 1.549930205844909, 'cat_emb_dim': 3, 'n_independent': 3, 'n_shared': 5, 'momentum': 0.07492716432121453, 'mask_type': 'sparsemax'}. Best is trial 9 with value: 4.446940000000001.
[I 2025-03-30 19:21:58,827] Trial 13 finished with value: 3.9125799999999997 and parameters: {'n_d': 18, 'n_steps': 3, 'gamma': 1.9997943681826214, 'cat_emb_dim': 1, 'n_independent': 5, 'n_shared': 2, 'momentum': 0.372913813815632, 'mask_type': 'entmax'}. Best is trial 9 with value: 4.446940000000001.
[I 2025-03-30 19:38:16,922] Trial 14 finished with value: 4.3022 and parameters: {'n_d': 27, 'n_steps': 6, 'gamma': 1.3577361387908642, 'cat_emb_dim': 3, 'n_independent': 1, 'n_shared': 1, 'momentum': 0.001083858200656355, 'mask_type': 'entmax'}. Best is trial 9 with value: 4.446940000000001.
[I 2025-03-30 19:58:59,286] Trial 15 finished with value: 4.3505400000000005 and parameters: {'n_d': 22, 'n_steps': 8, 'gamma': 1.4216196101858332, 'cat_emb_dim': 3, 'n_independent': 1, 'n_shared': 1, 'momentum': 0.0010354589555980327, 'mask_type': 'entmax'}. Best is trial 9 with value: 4.446940000000001.
[I 2025-03-30 20:45:55,035] Trial 16 finished with value: 3.9603399999999995 and parameters: {'n_d': 8, 'n_steps': 8, 'gamma': 1.738470360282106, 'cat_emb_dim': 3, 'n_independent': 2, 'n_shared': 2, 'momentum': 0.00197673380478443, 'mask_type': 'entmax'}. Best is trial 9 with value: 4.446940000000001.
[I 2025-03-30 21:08:26,817] Trial 17 finished with value: 3.9333 and parameters: {'n_d': 19, 'n_steps': 9, 'gamma': 1.4110791144875916, 'cat_emb_dim': 3, 'n_independent': 1, 'n_shared': 1, 'momentum': 0.026933924965523628, 'mask_type': 'entmax'}. Best is trial 9 with value: 4.446940000000001.
[I 2025-03-30 21:33:18,275] Trial 18 finished with value: 4.039960000000001 and parameters: {'n_d': 21, 'n_steps': 7, 'gamma': 1.848278589980811, 'cat_emb_dim': 2, 'n_independent': 2, 'n_shared': 2, 'momentum': 0.002423625511895616, 'mask_type': 'entmax'}. Best is trial 9 with value: 4.446940000000001.
[I 2025-03-30 22:08:12,064] Trial 19 finished with value: 3.9156400000000007 and parameters: {'n_d': 14, 'n_steps': 9, 'gamma': 1.4877605365519189, 'cat_emb_dim': 3, 'n_independent': 1, 'n_shared': 3, 'momentum': 0.02250570654292334, 'mask_type': 'entmax'}. Best is trial 9 with value: 4.446940000000001.
[I 2025-03-30 23:07:43,088] Trial 20 finished with value: 4.369999999999999 and parameters: {'n_d': 25, 'n_steps': 9, 'gamma': 1.6423962558881626, 'cat_emb_dim': 1, 'n_independent': 2, 'n_shared': 4, 'momentum': 0.0011363418486922267, 'mask_type': 'entmax'}. Best is trial 9 with value: 4.446940000000001.
[I 2025-03-30 23:52:53,431] Trial 21 finished with value: 4.040979999999999 and parameters: {'n_d': 32, 'n_steps': 9, 'gamma': 1.8344847593461986, 'cat_emb_dim': 1, 'n_independent': 2, 'n_shared': 4, 'momentum': 0.0024219516400109126, 'mask_type': 'entmax'}. Best is trial 9 with value: 4.446940000000001.
[I 2025-03-31 00:44:39,325] Trial 22 finished with value: 3.9378800000000007 and parameters: {'n_d': 47, 'n_steps': 10, 'gamma': 1.6640509645741857, 'cat_emb_dim': 1, 'n_independent': 4, 'n_shared': 4, 'momentum': 0.04753125168964243, 'mask_type': 'entmax'}. Best is trial 9 with value: 4.446940000000001.
[I 2025-03-31 01:10:08,848] Trial 23 finished with value: 3.9312200000000006 and parameters: {'n_d': 25, 'n_steps': 7, 'gamma': 1.9970259826805048, 'cat_emb_dim': 1, 'n_independent': 2, 'n_shared': 4, 'momentum': 0.01053896020998366, 'mask_type': 'entmax'}. Best is trial 9 with value: 4.446940000000001.
[I 2025-03-31 01:33:26,301] Trial 24 finished with value: 4.4381 and parameters: {'n_d': 22, 'n_steps': 8, 'gamma': 1.4336284871755476, 'cat_emb_dim': 2, 'n_independent': 1, 'n_shared': 2, 'momentum': 0.0010190348787136694, 'mask_type': 'entmax'}. Best is trial 9 with value: 4.446940000000001.
[I 2025-03-31 02:21:32,243] Trial 25 finished with value: 4.03148 and parameters: {'n_d': 12, 'n_steps': 9, 'gamma': 1.2729905029184096, 'cat_emb_dim': 2, 'n_independent': 2, 'n_shared': 3, 'momentum': 0.0017623439825334027, 'mask_type': 'entmax'}. Best is trial 9 with value: 4.446940000000001.
[I 2025-03-31 02:43:39,597] Trial 26 finished with value: 3.97342 and parameters: {'n_d': 34, 'n_steps': 8, 'gamma': 1.64072406430781, 'cat_emb_dim': 1, 'n_independent': 1, 'n_shared': 2, 'momentum': 0.003175475711864543, 'mask_type': 'entmax'}. Best is trial 9 with value: 4.446940000000001.
[I 2025-03-31 03:10:52,454] Trial 27 finished with value: 4.7773 and parameters: {'n_d': 23, 'n_steps': 9, 'gamma': 1.5020686246874828, 'cat_emb_dim': 2, 'n_independent': 2, 'n_shared': 3, 'momentum': 0.001039648109993645, 'mask_type': 'entmax'}. Best is trial 27 with value: 4.7773.
[I 2025-03-31 03:40:48,867] Trial 28 finished with value: 4.064 and parameters: {'n_d': 14, 'n_steps': 7, 'gamma': 1.0158544800565434, 'cat_emb_dim': 2, 'n_independent': 1, 'n_shared': 3, 'momentum': 0.0016263588676168285, 'mask_type': 'entmax'}. Best is trial 27 with value: 4.7773.
[I 2025-03-31 04:06:07,567] Trial 29 finished with value: 4.042 and parameters: {'n_d': 21, 'n_steps': 8, 'gamma': 1.5015146399021821, 'cat_emb_dim': 2, 'n_independent': 2, 'n_shared': 3, 'momentum': 0.0026508794125401553, 'mask_type': 'entmax'}. Best is trial 27 with value: 4.7773.
[I 2025-03-31 04:37:26,539] Trial 30 finished with value: 4.00146 and parameters: {'n_d': 38, 'n_steps': 10, 'gamma': 1.1624100217494382, 'cat_emb_dim': 2, 'n_independent': 1, 'n_shared': 2, 'momentum': 0.007109063345643766, 'mask_type': 'entmax'}. Best is trial 27 with value: 4.7773.
[I 2025-03-31 05:13:05,261] Trial 31 finished with value: 4.1413199999999994 and parameters: {'n_d': 8, 'n_steps': 6, 'gamma': 1.2645729947829039, 'cat_emb_dim': 2, 'n_independent': 3, 'n_shared': 2, 'momentum': 0.0016230813292724216, 'mask_type': 'entmax'}. Best is trial 27 with value: 4.7773.
[I 2025-03-31 05:39:51,472] Trial 32 finished with value: 4.20912 and parameters: {'n_d': 31, 'n_steps': 9, 'gamma': 1.1232089840428983, 'cat_emb_dim': 2, 'n_independent': 1, 'n_shared': 1, 'momentum': 0.0010380295085204406, 'mask_type': 'sparsemax'}. Best is trial 27 with value: 4.7773.
[I 2025-03-31 05:57:20,101] Trial 33 finished with value: 4.00288 and parameters: {'n_d': 29, 'n_steps': 5, 'gamma': 1.4200221475588646, 'cat_emb_dim': 2, 'n_independent': 2, 'n_shared': 3, 'momentum': 0.003788518161750192, 'mask_type': 'entmax'}. Best is trial 27 with value: 4.7773.
[I 2025-03-31 06:45:33,826] Trial 34 finished with value: 4.204359999999999 and parameters: {'n_d': 24, 'n_steps': 9, 'gamma': 1.5911142631735407, 'cat_emb_dim': 1, 'n_independent': 2, 'n_shared': 4, 'momentum': 0.0013941542270806235, 'mask_type': 'entmax'}. Best is trial 27 with value: 4.7773.
[I 2025-03-31 07:19:24,515] Trial 35 finished with value: 5.2892399999999995 and parameters: {'n_d': 16, 'n_steps': 9, 'gamma': 1.7201987015170987, 'cat_emb_dim': 1, 'n_independent': 3, 'n_shared': 5, 'momentum': 0.0013490201278565754, 'mask_type': 'entmax'}. Best is trial 35 with value: 5.2892399999999995.
[I 2025-03-31 08:21:40,961] Trial 36 finished with value: 4.32738 and parameters: {'n_d': 17, 'n_steps': 10, 'gamma': 1.7246692877792993, 'cat_emb_dim': 2, 'n_independent': 3, 'n_shared': 5, 'momentum': 0.0019430275716559298, 'mask_type': 'entmax'}. Best is trial 35 with value: 5.2892399999999995.
[I 2025-03-31 08:42:03,911] Trial 37 finished with value: 3.91378 and parameters: {'n_d': 44, 'n_steps': 7, 'gamma': 1.899817045434856, 'cat_emb_dim': 2, 'n_independent': 3, 'n_shared': 2, 'momentum': 0.014610034430484862, 'mask_type': 'entmax'}. Best is trial 35 with value: 5.2892399999999995.
[I 2025-03-31 09:09:00,439] Trial 38 finished with value: 4.54408 and parameters: {'n_d': 12, 'n_steps': 8, 'gamma': 1.8160745143895234, 'cat_emb_dim': 3, 'n_independent': 3, 'n_shared': 2, 'momentum': 0.0014265781322893934, 'mask_type': 'sparsemax'}. Best is trial 35 with value: 5.2892399999999995.
[I 2025-03-31 09:49:41,771] Trial 39 finished with value: 4.25288 and parameters: {'n_d': 12, 'n_steps': 8, 'gamma': 1.802322289601082, 'cat_emb_dim': 3, 'n_independent': 4, 'n_shared': 3, 'momentum': 0.0015157622566094272, 'mask_type': 'sparsemax'}. Best is trial 35 with value: 5.2892399999999995.
[I 2025-03-31 10:45:59,508] Trial 40 finished with value: 4.0103800000000005 and parameters: {'n_d': 15, 'n_steps': 9, 'gamma': 1.9426747512029527, 'cat_emb_dim': 3, 'n_independent': 3, 'n_shared': 5, 'momentum': 0.004611216495769327, 'mask_type': 'sparsemax'}. Best is trial 35 with value: 5.2892399999999995.
[I 2025-03-31 11:46:45,738] Trial 41 finished with value: 3.9008200000000004 and parameters: {'n_d': 12, 'n_steps': 10, 'gamma': 1.8872748870570282, 'cat_emb_dim': 3, 'n_independent': 5, 'n_shared': 2, 'momentum': 0.21533303564600936, 'mask_type': 'sparsemax'}. Best is trial 35 with value: 5.2892399999999995.
[I 2025-03-31 12:19:59,463] Trial 42 finished with value: 4.01622 and parameters: {'n_d': 17, 'n_steps': 7, 'gamma': 1.9513076249048127, 'cat_emb_dim': 3, 'n_independent': 3, 'n_shared': 3, 'momentum': 0.003008590326224302, 'mask_type': 'sparsemax'}. Best is trial 35 with value: 5.2892399999999995.
[I 2025-03-31 13:18:07,490] Trial 43 finished with value: 3.9380800000000002 and parameters: {'n_d': 11, 'n_steps': 8, 'gamma': 1.805492962611026, 'cat_emb_dim': 3, 'n_independent': 4, 'n_shared': 4, 'momentum': 0.006186107060030847, 'mask_type': 'sparsemax'}. Best is trial 35 with value: 5.2892399999999995.
[I 2025-03-31 13:53:53,342] Trial 44 finished with value: 4.425680000000001 and parameters: {'n_d': 21, 'n_steps': 8, 'gamma': 1.502855053807758, 'cat_emb_dim': 2, 'n_independent': 3, 'n_shared': 2, 'momentum': 0.0013444924151258012, 'mask_type': 'sparsemax'}. Best is trial 35 with value: 5.2892399999999995.
[I 2025-03-31 14:23:31,053] Trial 45 finished with value: 4.0743 and parameters: {'n_d': 61, 'n_steps': 9, 'gamma': 1.6978277596108833, 'cat_emb_dim': 3, 'n_independent': 3, 'n_shared': 2, 'momentum': 0.0022004823648493427, 'mask_type': 'entmax'}. Best is trial 35 with value: 5.2892399999999995.
[I 2025-03-31 14:59:53,955] Trial 46 finished with value: 4.362640000000001 and parameters: {'n_d': 19, 'n_steps': 8, 'gamma': 1.592619176681612, 'cat_emb_dim': 2, 'n_independent': 4, 'n_shared': 1, 'momentum': 0.0013492407137546958, 'mask_type': 'sparsemax'}. Best is trial 35 with value: 5.2892399999999995.
[I 2025-03-31 15:19:17,500] Trial 47 finished with value: 4.695720000000001 and parameters: {'n_d': 8, 'n_steps': 4, 'gamma': 1.793417085206515, 'cat_emb_dim': 1, 'n_independent': 3, 'n_shared': 2, 'momentum': 0.001055457354104783, 'mask_type': 'entmax'}. Best is trial 35 with value: 5.2892399999999995.
[I 2025-03-31 15:46:35,119] Trial 48 finished with value: 3.9421400000000006 and parameters: {'n_d': 9, 'n_steps': 4, 'gamma': 1.7757357521278285, 'cat_emb_dim': 1, 'n_independent': 3, 'n_shared': 1, 'momentum': 0.003823263914445724, 'mask_type': 'entmax'}. Best is trial 35 with value: 5.2892399999999995.
[I 2025-03-31 16:15:06,148] Trial 49 finished with value: 3.99844 and parameters: {'n_d': 15, 'n_steps': 3, 'gamma': 1.8611456655176306, 'cat_emb_dim': 1, 'n_independent': 4, 'n_shared': 3, 'momentum': 0.002087240939724319, 'mask_type': 'sparsemax'}. Best is trial 35 with value: 5.2892399999999995.
[I 2025-03-31 16:41:43,394] Trial 50 finished with value: 4.2925 and parameters: {'n_d': 10, 'n_steps': 4, 'gamma': 1.9406880640255928, 'cat_emb_dim': 1, 'n_independent': 3, 'n_shared': 2, 'momentum': 0.0013215781141269292, 'mask_type': 'entmax'}. Best is trial 35 with value: 5.2892399999999995.
[I 2025-03-31 17:14:16,552] Trial 51 finished with value: 3.95578 and parameters: {'n_d': 13, 'n_steps': 6, 'gamma': 1.7720351490912996, 'cat_emb_dim': 1, 'n_independent': 3, 'n_shared': 2, 'momentum': 0.0028234656089064845, 'mask_type': 'entmax'}. Best is trial 35 with value: 5.2892399999999995.
[I 2025-03-31 17:47:41,462] Trial 52 finished with value: 4.14014 and parameters: {'n_d': 19, 'n_steps': 5, 'gamma': 1.7096689737008302, 'cat_emb_dim': 1, 'n_independent': 2, 'n_shared': 5, 'momentum': 0.0017584710817016933, 'mask_type': 'entmax'}. Best is trial 35 with value: 5.2892399999999995.
[I 2025-03-31 18:03:30,095] Trial 53 finished with value: 4.656599999999999 and parameters: {'n_d': 9, 'n_steps': 4, 'gamma': 1.866478431127883, 'cat_emb_dim': 3, 'n_independent': 2, 'n_shared': 1, 'momentum': 0.0010095190868716325, 'mask_type': 'sparsemax'}. Best is trial 35 with value: 5.2892399999999995.
[I 2025-03-31 18:19:51,658] Trial 54 finished with value: 4.47548 and parameters: {'n_d': 8, 'n_steps': 4, 'gamma': 1.8254308786012312, 'cat_emb_dim': 3, 'n_independent': 2, 'n_shared': 1, 'momentum': 0.0010123783218723393, 'mask_type': 'sparsemax'}. Best is trial 35 with value: 5.2892399999999995.
[I 2025-03-31 18:41:44,333] Trial 55 finished with value: 4.41152 and parameters: {'n_d': 8, 'n_steps': 4, 'gamma': 1.8899651085204237, 'cat_emb_dim': 3, 'n_independent': 2, 'n_shared': 1, 'momentum': 0.0010032936741434155, 'mask_type': 'sparsemax'}. Best is trial 35 with value: 5.2892399999999995.
[I 2025-03-31 19:10:15,558] Trial 56 finished with value: 4.03628 and parameters: {'n_d': 11, 'n_steps': 4, 'gamma': 1.8139758859253783, 'cat_emb_dim': 3, 'n_independent': 2, 'n_shared': 1, 'momentum': 0.0013060854158563845, 'mask_type': 'sparsemax'}. Best is trial 35 with value: 5.2892399999999995.
[I 2025-03-31 19:33:10,602] Trial 57 finished with value: 3.9900399999999996 and parameters: {'n_d': 15, 'n_steps': 3, 'gamma': 1.8573535626627677, 'cat_emb_dim': 3, 'n_independent': 3, 'n_shared': 1, 'momentum': 0.0020008361334195924, 'mask_type': 'sparsemax'}. Best is trial 35 with value: 5.2892399999999995.
[I 2025-03-31 19:54:22,438] Trial 58 finished with value: 4.2123800000000005 and parameters: {'n_d': 10, 'n_steps': 5, 'gamma': 1.6788037432044922, 'cat_emb_dim': 3, 'n_independent': 2, 'n_shared': 1, 'momentum': 0.0012356857547314076, 'mask_type': 'sparsemax'}. Best is trial 35 with value: 5.2892399999999995.
[I 2025-03-31 20:23:51,463] Trial 59 finished with value: 4.1056 and parameters: {'n_d': 8, 'n_steps': 4, 'gamma': 1.7624316571032719, 'cat_emb_dim': 3, 'n_independent': 3, 'n_shared': 1, 'momentum': 0.0016309686430098919, 'mask_type': 'sparsemax'}. Best is trial 35 with value: 5.2892399999999995.
[I 2025-03-31 20:39:17,988] Trial 60 finished with value: 3.9236000000000004 and parameters: {'n_d': 16, 'n_steps': 3, 'gamma': 1.6113619223816626, 'cat_emb_dim': 3, 'n_independent': 2, 'n_shared': 1, 'momentum': 0.03686454939568207, 'mask_type': 'sparsemax'}. Best is trial 35 with value: 5.2892399999999995.
[I 2025-03-31 21:02:06,338] Trial 61 finished with value: 4.508940000000001 and parameters: {'n_d': 13, 'n_steps': 5, 'gamma': 1.744780515308381, 'cat_emb_dim': 1, 'n_independent': 2, 'n_shared': 1, 'momentum': 0.0010066280366119872, 'mask_type': 'sparsemax'}. Best is trial 35 with value: 5.2892399999999995.
[I 2025-03-31 21:32:26,142] Trial 62 finished with value: 3.89724 and parameters: {'n_d': 13, 'n_steps': 5, 'gamma': 1.738104217530305, 'cat_emb_dim': 1, 'n_independent': 3, 'n_shared': 3, 'momentum': 0.10194774871584415, 'mask_type': 'sparsemax'}. Best is trial 35 with value: 5.2892399999999995.
[I 2025-03-31 22:15:46,233] Trial 63 finished with value: 4.00428 and parameters: {'n_d': 18, 'n_steps': 6, 'gamma': 1.6768328418082294, 'cat_emb_dim': 1, 'n_independent': 5, 'n_shared': 1, 'momentum': 0.0024022738052668306, 'mask_type': 'sparsemax'}. Best is trial 35 with value: 5.2892399999999995.
[I 2025-03-31 22:29:18,143] Trial 64 finished with value: 4.74966 and parameters: {'n_d': 10, 'n_steps': 4, 'gamma': 1.8335088587502, 'cat_emb_dim': 1, 'n_independent': 2, 'n_shared': 1, 'momentum': 0.001173815269771185, 'mask_type': 'sparsemax'}. Best is trial 35 with value: 5.2892399999999995.
[I 2025-03-31 23:01:25,643] Trial 65 finished with value: 4.019080000000001 and parameters: {'n_d': 10, 'n_steps': 5, 'gamma': 1.784541225066594, 'cat_emb_dim': 1, 'n_independent': 2, 'n_shared': 1, 'momentum': 0.001229286385414259, 'mask_type': 'sparsemax'}. Best is trial 35 with value: 5.2892399999999995.
[I 2025-03-31 23:30:26,473] Trial 66 finished with value: 3.9951800000000004 and parameters: {'n_d': 14, 'n_steps': 4, 'gamma': 1.9162232244176853, 'cat_emb_dim': 1, 'n_independent': 2, 'n_shared': 1, 'momentum': 0.0016393409384411525, 'mask_type': 'sparsemax'}. Best is trial 35 with value: 5.2892399999999995.
[I 2025-03-31 23:46:18,929] Trial 67 finished with value: 4.5282800000000005 and parameters: {'n_d': 13, 'n_steps': 3, 'gamma': 1.5385036764762186, 'cat_emb_dim': 1, 'n_independent': 2, 'n_shared': 2, 'momentum': 0.0012379431678577518, 'mask_type': 'sparsemax'}. Best is trial 35 with value: 5.2892399999999995.
[I 2025-04-01 00:08:56,595] Trial 68 finished with value: 4.01244 and parameters: {'n_d': 16, 'n_steps': 3, 'gamma': 1.5334673470945892, 'cat_emb_dim': 1, 'n_independent': 2, 'n_shared': 2, 'momentum': 0.002012204366079204, 'mask_type': 'sparsemax'}. Best is trial 35 with value: 5.2892399999999995.
[I 2025-04-01 00:35:41,890] Trial 69 finished with value: 3.94732 and parameters: {'n_d': 10, 'n_steps': 3, 'gamma': 1.4576130164756038, 'cat_emb_dim': 1, 'n_independent': 3, 'n_shared': 2, 'momentum': 0.003345685931063028, 'mask_type': 'sparsemax'}. Best is trial 35 with value: 5.2892399999999995.
[I 2025-04-01 00:55:02,231] Trial 70 finished with value: 4.384259999999999 and parameters: {'n_d': 28, 'n_steps': 3, 'gamma': 1.5619023307155564, 'cat_emb_dim': 1, 'n_independent': 2, 'n_shared': 2, 'momentum': 0.0014224805825809135, 'mask_type': 'sparsemax'}. Best is trial 35 with value: 5.2892399999999995.
[I 2025-04-01 01:13:40,798] Trial 71 finished with value: 4.03712 and parameters: {'n_d': 24, 'n_steps': 4, 'gamma': 1.3703755311454446, 'cat_emb_dim': 1, 'n_independent': 1, 'n_shared': 3, 'momentum': 0.002603624005921412, 'mask_type': 'entmax'}. Best is trial 35 with value: 5.2892399999999995.
[I 2025-04-01 01:55:03,008] Trial 72 finished with value: 4.58904 and parameters: {'n_d': 19, 'n_steps': 10, 'gamma': 1.8653668258252234, 'cat_emb_dim': 1, 'n_independent': 3, 'n_shared': 2, 'momentum': 0.001171514959114947, 'mask_type': 'entmax'}. Best is trial 35 with value: 5.2892399999999995.
[I 2025-04-01 03:03:33,534] Trial 73 finished with value: 4.12618 and parameters: {'n_d': 23, 'n_steps': 10, 'gamma': 1.870157403356906, 'cat_emb_dim': 1, 'n_independent': 3, 'n_shared': 4, 'momentum': 0.0017844219949268052, 'mask_type': 'entmax'}. Best is trial 35 with value: 5.2892399999999995.
[I 2025-04-01 03:34:55,121] Trial 74 finished with value: 4.62288 and parameters: {'n_d': 20, 'n_steps': 10, 'gamma': 1.82697233809064, 'cat_emb_dim': 1, 'n_independent': 3, 'n_shared': 2, 'momentum': 0.0011850853356278083, 'mask_type': 'entmax'}. Best is trial 35 with value: 5.2892399999999995.
