[I 2025-03-30 01:49:34,194] Using an existing study with name 'TabNet_Boston' instead of creating a new one.
[W 2025-03-30 01:49:42,969] Trial 2 failed with parameters: {'n_d': 8, 'n_steps': 4, 'gamma': 1.9516227632950471, 'cat_emb_dim': 3, 'n_independent': 5, 'n_shared': 1, 'momentum': 0.08525718091430651, 'mask_type': 'entmax'} because of the following error: TypeError("object of type 'NoneType' has no len()").
Traceback (most recent call last):
  File "/home/mburu/.local/lib/python3.8/site-packages/optuna/study/_optimize.py", line 197, in _run_trial
    value_or_values = func(trial)
  File "train.py", line 415, in __call__
    sc, time = cross_validation(model, self.X, self.y, args_cp, visual=False, save_model=False)#Dont save model during HPT
  File "train.py", line 334, in cross_validation
    print(f"Class label len :{len(args.bin_alt)}")
TypeError: object of type 'NoneType' has no len()
[W 2025-03-30 01:49:42,969] Trial 2 failed with value None.
Traceback (most recent call last):
  File "train.py", line 474, in <module>
    main(arguments)
  File "train.py", line 437, in main
    study.optimize(Objective(args, model_name, X, y), n_trials=args.n_trials)
  File "/home/mburu/.local/lib/python3.8/site-packages/optuna/study/study.py", line 475, in optimize
    _optimize(
  File "/home/mburu/.local/lib/python3.8/site-packages/optuna/study/_optimize.py", line 63, in _optimize
    _optimize_sequential(
  File "/home/mburu/.local/lib/python3.8/site-packages/optuna/study/_optimize.py", line 160, in _optimize_sequential
    frozen_trial = _run_trial(study, func, catch)
  File "/home/mburu/.local/lib/python3.8/site-packages/optuna/study/_optimize.py", line 248, in _run_trial
    raise func_err
  File "/home/mburu/.local/lib/python3.8/site-packages/optuna/study/_optimize.py", line 197, in _run_trial
    value_or_values = func(trial)
  File "train.py", line 415, in __call__
    sc, time = cross_validation(model, self.X, self.y, args_cp, visual=False, save_model=False)#Dont save model during HPT
  File "train.py", line 334, in cross_validation
    print(f"Class label len :{len(args.bin_alt)}")
TypeError: object of type 'NoneType' has no len()
srun: error: stud-000: task 0: Exited with exit code 1
[I 2025-03-30 01:49:49,996] Using an existing study with name 'TabNet_Socmob' instead of creating a new one.
[I 2025-03-30 01:50:51,542] Trial 51 finished with value: 3.56656 and parameters: {'n_d': 51, 'n_steps': 4, 'gamma': 1.5259749797380535, 'cat_emb_dim': 2, 'n_independent': 1, 'n_shared': 5, 'momentum': 0.01089710083415041, 'mask_type': 'entmax'}. Best is trial 17 with value: 9.33594.
[I 2025-03-30 01:51:28,170] Trial 52 finished with value: 8.7607 and parameters: {'n_d': 38, 'n_steps': 4, 'gamma': 1.8019270203638786, 'cat_emb_dim': 2, 'n_independent': 2, 'n_shared': 5, 'momentum': 0.0010254165629366332, 'mask_type': 'entmax'}. Best is trial 17 with value: 9.33594.
[I 2025-03-30 01:52:14,428] Trial 53 finished with value: 7.780799999999999 and parameters: {'n_d': 39, 'n_steps': 4, 'gamma': 1.71821392325208, 'cat_emb_dim': 2, 'n_independent': 2, 'n_shared': 5, 'momentum': 0.0012503307786214978, 'mask_type': 'entmax'}. Best is trial 17 with value: 9.33594.
[I 2025-03-30 01:53:33,816] Trial 54 finished with value: 7.55938 and parameters: {'n_d': 43, 'n_steps': 5, 'gamma': 1.8890935425460338, 'cat_emb_dim': 2, 'n_independent': 2, 'n_shared': 5, 'momentum': 0.001674881847166084, 'mask_type': 'entmax'}. Best is trial 17 with value: 9.33594.
[I 2025-03-30 01:54:05,092] Trial 55 finished with value: 8.75038 and parameters: {'n_d': 36, 'n_steps': 3, 'gamma': 1.6628723062880404, 'cat_emb_dim': 2, 'n_independent': 3, 'n_shared': 5, 'momentum': 0.0012242912993639258, 'mask_type': 'entmax'}. Best is trial 17 with value: 9.33594.
[I 2025-03-30 01:56:55,964] Trial 56 finished with value: 5.97158 and parameters: {'n_d': 31, 'n_steps': 9, 'gamma': 1.4767679951316743, 'cat_emb_dim': 2, 'n_independent': 3, 'n_shared': 5, 'momentum': 0.002848926736768479, 'mask_type': 'entmax'}. Best is trial 17 with value: 9.33594.
[I 2025-03-30 01:58:05,036] Trial 57 finished with value: 7.8581 and parameters: {'n_d': 27, 'n_steps': 4, 'gamma': 1.7675531886467923, 'cat_emb_dim': 3, 'n_independent': 4, 'n_shared': 5, 'momentum': 0.0020999061401810793, 'mask_type': 'entmax'}. Best is trial 17 with value: 9.33594.
[I 2025-03-30 01:58:45,609] Trial 58 finished with value: 6.94812 and parameters: {'n_d': 35, 'n_steps': 3, 'gamma': 1.6658627762281557, 'cat_emb_dim': 2, 'n_independent': 3, 'n_shared': 4, 'momentum': 0.001248389849813034, 'mask_type': 'entmax'}. Best is trial 17 with value: 9.33594.
[I 2025-03-30 03:00:23,477] Trial 59 finished with value: 7.437100000000001 and parameters: {'n_d': 37, 'n_steps': 5, 'gamma': 1.819318514291942, 'cat_emb_dim': 2, 'n_independent': 3, 'n_shared': 5, 'momentum': 0.0016359797085784805, 'mask_type': 'entmax'}. Best is trial 17 with value: 9.33594.
[I 2025-03-30 03:02:13,400] Trial 60 finished with value: 8.69474 and parameters: {'n_d': 47, 'n_steps': 4, 'gamma': 1.7321266089561431, 'cat_emb_dim': 2, 'n_independent': 4, 'n_shared': 5, 'momentum': 0.001237413651896844, 'mask_type': 'entmax'}. Best is trial 17 with value: 9.33594.
[I 2025-03-30 03:03:46,333] Trial 61 finished with value: 5.43446 and parameters: {'n_d': 48, 'n_steps': 5, 'gamma': 1.8825645627966812, 'cat_emb_dim': 2, 'n_independent': 4, 'n_shared': 5, 'momentum': 0.005242576022595015, 'mask_type': 'entmax'}. Best is trial 17 with value: 9.33594.
[I 2025-03-30 03:05:09,929] Trial 62 finished with value: 8.945179999999999 and parameters: {'n_d': 42, 'n_steps': 4, 'gamma': 1.7307752422104006, 'cat_emb_dim': 2, 'n_independent': 3, 'n_shared': 5, 'momentum': 0.0012289443878672247, 'mask_type': 'entmax'}. Best is trial 17 with value: 9.33594.
[I 2025-03-30 03:06:48,405] Trial 63 finished with value: 8.670660000000002 and parameters: {'n_d': 39, 'n_steps': 4, 'gamma': 1.7318002772686465, 'cat_emb_dim': 2, 'n_independent': 3, 'n_shared': 5, 'momentum': 0.0012041742579704437, 'mask_type': 'entmax'}. Best is trial 17 with value: 9.33594.
[I 2025-03-30 03:08:37,711] Trial 64 finished with value: 8.34076 and parameters: {'n_d': 41, 'n_steps': 4, 'gamma': 1.7619790357460525, 'cat_emb_dim': 2, 'n_independent': 4, 'n_shared': 5, 'momentum': 0.0017097021774115048, 'mask_type': 'entmax'}. Best is trial 17 with value: 9.33594.
[I 2025-03-30 03:11:27,412] Trial 65 finished with value: 9.204080000000001 and parameters: {'n_d': 46, 'n_steps': 8, 'gamma': 1.7944553145184514, 'cat_emb_dim': 2, 'n_independent': 5, 'n_shared': 5, 'momentum': 0.0012332267558496806, 'mask_type': 'entmax'}. Best is trial 17 with value: 9.33594.
[I 2025-03-30 03:14:58,936] Trial 66 finished with value: 7.93962 and parameters: {'n_d': 42, 'n_steps': 8, 'gamma': 1.7947509200784408, 'cat_emb_dim': 2, 'n_independent': 5, 'n_shared': 5, 'momentum': 0.0022821183689343584, 'mask_type': 'entmax'}. Best is trial 17 with value: 9.33594.
[I 2025-03-30 03:18:01,784] Trial 67 finished with value: 8.22654 and parameters: {'n_d': 29, 'n_steps': 7, 'gamma': 1.5628229396374984, 'cat_emb_dim': 2, 'n_independent': 5, 'n_shared': 5, 'momentum': 0.0015348502945359008, 'mask_type': 'entmax'}. Best is trial 17 with value: 9.33594.
[I 2025-03-30 03:20:44,445] Trial 68 finished with value: 8.63944 and parameters: {'n_d': 33, 'n_steps': 8, 'gamma': 1.93267244516751, 'cat_emb_dim': 2, 'n_independent': 4, 'n_shared': 4, 'momentum': 0.0012241065633287215, 'mask_type': 'entmax'}. Best is trial 17 with value: 9.33594.
[I 2025-03-30 03:23:55,391] Trial 69 finished with value: 7.3519000000000005 and parameters: {'n_d': 36, 'n_steps': 7, 'gamma': 1.6936003378229603, 'cat_emb_dim': 2, 'n_independent': 5, 'n_shared': 5, 'momentum': 0.0028236166747201835, 'mask_type': 'entmax'}. Best is trial 17 with value: 9.33594.
[I 2025-03-30 03:24:53,882] Trial 70 finished with value: 5.612260000000001 and parameters: {'n_d': 46, 'n_steps': 6, 'gamma': 1.8435647378479423, 'cat_emb_dim': 2, 'n_independent': 3, 'n_shared': 2, 'momentum': 0.0018815456192368052, 'mask_type': 'sparsemax'}. Best is trial 17 with value: 9.33594.
[I 2025-03-30 03:26:31,030] Trial 71 finished with value: 7.6152 and parameters: {'n_d': 51, 'n_steps': 5, 'gamma': 1.1219954169904387, 'cat_emb_dim': 2, 'n_independent': 4, 'n_shared': 4, 'momentum': 0.0023333505574342217, 'mask_type': 'entmax'}. Best is trial 17 with value: 9.33594.
[I 2025-03-30 03:29:57,764] Trial 72 finished with value: 8.84902 and parameters: {'n_d': 47, 'n_steps': 9, 'gamma': 1.7437324114831878, 'cat_emb_dim': 2, 'n_independent': 3, 'n_shared': 5, 'momentum': 0.0011990364730403954, 'mask_type': 'entmax'}. Best is trial 17 with value: 9.33594.
[I 2025-03-30 03:33:25,025] Trial 73 finished with value: 8.583540000000001 and parameters: {'n_d': 38, 'n_steps': 9, 'gamma': 1.715757591921469, 'cat_emb_dim': 2, 'n_independent': 3, 'n_shared': 5, 'momentum': 0.001187319338425085, 'mask_type': 'entmax'}. Best is trial 17 with value: 9.33594.
[I 2025-03-30 03:36:37,202] Trial 74 finished with value: 8.423779999999999 and parameters: {'n_d': 48, 'n_steps': 9, 'gamma': 1.781609240700729, 'cat_emb_dim': 2, 'n_independent': 3, 'n_shared': 5, 'momentum': 0.0015219581266967042, 'mask_type': 'entmax'}. Best is trial 17 with value: 9.33594.
[I 2025-03-30 03:38:58,930] Trial 75 finished with value: 7.62214 and parameters: {'n_d': 46, 'n_steps': 10, 'gamma': 1.6639263649954217, 'cat_emb_dim': 2, 'n_independent': 3, 'n_shared': 3, 'momentum': 0.001389586604785743, 'mask_type': 'entmax'}. Best is trial 17 with value: 9.33594.
[I 2025-03-30 03:42:23,639] Trial 76 finished with value: 8.950120000000002 and parameters: {'n_d': 43, 'n_steps': 8, 'gamma': 1.8206328373721798, 'cat_emb_dim': 2, 'n_independent': 4, 'n_shared': 5, 'momentum': 0.0011426480877388709, 'mask_type': 'entmax'}. Best is trial 17 with value: 9.33594.
[I 2025-03-30 03:46:17,765] Trial 77 finished with value: 8.418360000000002 and parameters: {'n_d': 43, 'n_steps': 8, 'gamma': 1.8284156363402253, 'cat_emb_dim': 2, 'n_independent': 5, 'n_shared': 5, 'momentum': 0.0018393128620987173, 'mask_type': 'entmax'}. Best is trial 17 with value: 9.33594.
[I 2025-03-30 03:48:30,213] Trial 78 finished with value: 3.3792999999999997 and parameters: {'n_d': 39, 'n_steps': 7, 'gamma': 1.5943168140898922, 'cat_emb_dim': 2, 'n_independent': 3, 'n_shared': 5, 'momentum': 0.023252697744704322, 'mask_type': 'entmax'}. Best is trial 17 with value: 9.33594.
[I 2025-03-30 03:51:16,839] Trial 79 finished with value: 8.79856 and parameters: {'n_d': 42, 'n_steps': 8, 'gamma': 1.8707358580338795, 'cat_emb_dim': 2, 'n_independent': 3, 'n_shared': 5, 'momentum': 0.0011225990338338254, 'mask_type': 'entmax'}. Best is trial 17 with value: 9.33594.
[I 2025-03-30 03:54:15,434] Trial 80 finished with value: 8.8858 and parameters: {'n_d': 42, 'n_steps': 8, 'gamma': 1.8655424776076486, 'cat_emb_dim': 2, 'n_independent': 3, 'n_shared': 5, 'momentum': 0.001027899171859505, 'mask_type': 'entmax'}. Best is trial 17 with value: 9.33594.
[I 2025-03-30 03:57:50,606] Trial 81 finished with value: 7.333499999999999 and parameters: {'n_d': 45, 'n_steps': 8, 'gamma': 1.8645668347466722, 'cat_emb_dim': 2, 'n_independent': 3, 'n_shared': 5, 'momentum': 0.0015269193846018545, 'mask_type': 'sparsemax'}. Best is trial 17 with value: 9.33594.
[I 2025-03-30 04:01:14,174] Trial 82 finished with value: 9.10806 and parameters: {'n_d': 42, 'n_steps': 9, 'gamma': 1.9202680850243403, 'cat_emb_dim': 2, 'n_independent': 3, 'n_shared': 5, 'momentum': 0.0010133082294436547, 'mask_type': 'entmax'}. Best is trial 17 with value: 9.33594.
[I 2025-03-30 04:04:48,209] Trial 83 finished with value: 8.741219999999998 and parameters: {'n_d': 41, 'n_steps': 9, 'gamma': 1.9670834098797876, 'cat_emb_dim': 2, 'n_independent': 3, 'n_shared': 5, 'momentum': 0.0011535110328269786, 'mask_type': 'entmax'}. Best is trial 17 with value: 9.33594.
[I 2025-03-30 04:07:39,500] Trial 84 finished with value: 8.48054 and parameters: {'n_d': 42, 'n_steps': 8, 'gamma': 1.9203543766627447, 'cat_emb_dim': 2, 'n_independent': 3, 'n_shared': 5, 'momentum': 0.001420383597230415, 'mask_type': 'entmax'}. Best is trial 17 with value: 9.33594.
[I 2025-03-30 04:10:36,283] Trial 85 finished with value: 9.2712 and parameters: {'n_d': 43, 'n_steps': 8, 'gamma': 1.9988439928655983, 'cat_emb_dim': 2, 'n_independent': 3, 'n_shared': 5, 'momentum': 0.0010102333243809211, 'mask_type': 'entmax'}. Best is trial 17 with value: 9.33594.
[I 2025-03-30 04:14:12,167] Trial 86 finished with value: 8.64348 and parameters: {'n_d': 44, 'n_steps': 9, 'gamma': 1.9979527496841483, 'cat_emb_dim': 2, 'n_independent': 3, 'n_shared': 5, 'momentum': 0.001011264661141024, 'mask_type': 'entmax'}. Best is trial 17 with value: 9.33594.
[I 2025-03-30 04:17:00,999] Trial 87 finished with value: 7.692280000000001 and parameters: {'n_d': 40, 'n_steps': 10, 'gamma': 1.9597582349906768, 'cat_emb_dim': 2, 'n_independent': 3, 'n_shared': 5, 'momentum': 0.0021028346486525636, 'mask_type': 'entmax'}. Best is trial 17 with value: 9.33594.
[I 2025-03-30 04:18:35,130] Trial 88 finished with value: 3.3566000000000003 and parameters: {'n_d': 50, 'n_steps': 9, 'gamma': 1.9478413160112358, 'cat_emb_dim': 2, 'n_independent': 3, 'n_shared': 1, 'momentum': 0.39247347259943977, 'mask_type': 'entmax'}. Best is trial 17 with value: 9.33594.
[I 2025-03-30 04:21:04,901] Trial 89 finished with value: 7.5114 and parameters: {'n_d': 45, 'n_steps': 8, 'gamma': 1.9097431487612158, 'cat_emb_dim': 2, 'n_independent': 4, 'n_shared': 3, 'momentum': 0.0017213798604267664, 'mask_type': 'entmax'}. Best is trial 17 with value: 9.33594.
[I 2025-03-30 04:23:29,673] Trial 90 finished with value: 8.611920000000001 and parameters: {'n_d': 48, 'n_steps': 7, 'gamma': 1.8402701208868277, 'cat_emb_dim': 2, 'n_independent': 3, 'n_shared': 5, 'momentum': 0.0013633357361726374, 'mask_type': 'entmax'}. Best is trial 17 with value: 9.33594.
[I 2025-03-30 04:26:13,443] Trial 91 finished with value: 5.2483 and parameters: {'n_d': 40, 'n_steps': 8, 'gamma': 1.9319060377903678, 'cat_emb_dim': 2, 'n_independent': 4, 'n_shared': 4, 'momentum': 0.0037123943449177566, 'mask_type': 'entmax'}. Best is trial 17 with value: 9.33594.
[I 2025-03-30 04:29:13,304] Trial 92 finished with value: 8.75986 and parameters: {'n_d': 43, 'n_steps': 8, 'gamma': 1.8638542680011903, 'cat_emb_dim': 2, 'n_independent': 3, 'n_shared': 5, 'momentum': 0.0011044357003095933, 'mask_type': 'entmax'}. Best is trial 17 with value: 9.33594.
[I 2025-03-30 04:33:00,726] Trial 93 finished with value: 8.496179999999999 and parameters: {'n_d': 42, 'n_steps': 8, 'gamma': 1.880165145494976, 'cat_emb_dim': 2, 'n_independent': 3, 'n_shared': 5, 'momentum': 0.0011500573565724158, 'mask_type': 'entmax'}. Best is trial 17 with value: 9.33594.
[I 2025-03-30 04:36:40,249] Trial 94 finished with value: 8.2446 and parameters: {'n_d': 45, 'n_steps': 9, 'gamma': 1.8917674458244635, 'cat_emb_dim': 2, 'n_independent': 3, 'n_shared': 5, 'momentum': 0.0013761883104248666, 'mask_type': 'entmax'}. Best is trial 17 with value: 9.33594.
[I 2025-03-30 04:38:30,534] Trial 95 finished with value: 9.1534 and parameters: {'n_d': 43, 'n_steps': 7, 'gamma': 1.9933801191550349, 'cat_emb_dim': 2, 'n_independent': 3, 'n_shared': 5, 'momentum': 0.0010157301236992135, 'mask_type': 'entmax'}. Best is trial 17 with value: 9.33594.
[I 2025-03-30 04:40:44,882] Trial 96 finished with value: 9.26144 and parameters: {'n_d': 47, 'n_steps': 7, 'gamma': 1.9869083197922794, 'cat_emb_dim': 2, 'n_independent': 3, 'n_shared': 5, 'momentum': 0.0010106985178029758, 'mask_type': 'entmax'}. Best is trial 17 with value: 9.33594.
[I 2025-03-30 04:42:49,650] Trial 97 finished with value: 3.3132999999999995 and parameters: {'n_d': 43, 'n_steps': 7, 'gamma': 1.981041493912566, 'cat_emb_dim': 2, 'n_independent': 3, 'n_shared': 5, 'momentum': 0.044332295217345545, 'mask_type': 'entmax'}. Best is trial 17 with value: 9.33594.
[I 2025-03-30 04:45:05,785] Trial 98 finished with value: 9.34298 and parameters: {'n_d': 49, 'n_steps': 6, 'gamma': 1.9936897444554504, 'cat_emb_dim': 2, 'n_independent': 5, 'n_shared': 5, 'momentum': 0.0010174761003975195, 'mask_type': 'sparsemax'}. Best is trial 98 with value: 9.34298.
[I 2025-03-30 04:47:29,525] Trial 99 finished with value: 8.367360000000001 and parameters: {'n_d': 52, 'n_steps': 6, 'gamma': 1.9510272801514976, 'cat_emb_dim': 2, 'n_independent': 5, 'n_shared': 5, 'momentum': 0.0016130318037770426, 'mask_type': 'sparsemax'}. Best is trial 98 with value: 9.34298.
[I 2025-03-30 04:50:41,397] Trial 100 finished with value: 8.2518 and parameters: {'n_d': 47, 'n_steps': 7, 'gamma': 1.9991291966315134, 'cat_emb_dim': 2, 'n_independent': 5, 'n_shared': 5, 'momentum': 0.0019304405399979915, 'mask_type': 'sparsemax'}. Best is trial 98 with value: 9.34298.
[I 2025-03-30 04:53:18,940] Using an existing study with name 'TabNet_Sensory' instead of creating a new one.
[I 2025-03-30 04:54:43,554] Trial 51 finished with value: 1.7407 and parameters: {'n_d': 23, 'n_steps': 10, 'gamma': 1.1516690724866536, 'cat_emb_dim': 3, 'n_independent': 3, 'n_shared': 4, 'momentum': 0.013963901909369731, 'mask_type': 'sparsemax'}. Best is trial 42 with value: 8.20962.
[I 2025-03-30 04:55:57,586] Trial 52 finished with value: 7.621779999999999 and parameters: {'n_d': 28, 'n_steps': 9, 'gamma': 1.4197813228777414, 'cat_emb_dim': 3, 'n_independent': 4, 'n_shared': 4, 'momentum': 0.0012202855201846373, 'mask_type': 'sparsemax'}. Best is trial 42 with value: 8.20962.
[I 2025-03-30 04:57:41,407] Trial 53 finished with value: 7.08926 and parameters: {'n_d': 37, 'n_steps': 9, 'gamma': 1.4758001450298819, 'cat_emb_dim': 3, 'n_independent': 4, 'n_shared': 4, 'momentum': 0.0012659713170523892, 'mask_type': 'sparsemax'}. Best is trial 42 with value: 8.20962.
[I 2025-03-30 04:59:37,825] Trial 54 finished with value: 6.051900000000001 and parameters: {'n_d': 28, 'n_steps': 9, 'gamma': 1.3730230260015988, 'cat_emb_dim': 3, 'n_independent': 4, 'n_shared': 5, 'momentum': 0.0019429874563745028, 'mask_type': 'sparsemax'}. Best is trial 42 with value: 8.20962.
[I 2025-03-30 05:01:18,809] Trial 55 finished with value: 7.290000000000001 and parameters: {'n_d': 34, 'n_steps': 9, 'gamma': 1.4291653169718959, 'cat_emb_dim': 3, 'n_independent': 3, 'n_shared': 5, 'momentum': 0.0011882352144854172, 'mask_type': 'sparsemax'}. Best is trial 42 with value: 8.20962.
[I 2025-03-30 05:03:20,396] Trial 56 finished with value: 2.83142 and parameters: {'n_d': 25, 'n_steps': 8, 'gamma': 1.4878589667095643, 'cat_emb_dim': 3, 'n_independent': 4, 'n_shared': 4, 'momentum': 0.0037875325652418105, 'mask_type': 'sparsemax'}. Best is trial 42 with value: 8.20962.
[I 2025-03-30 05:05:07,281] Trial 57 finished with value: 6.136620000000001 and parameters: {'n_d': 32, 'n_steps': 10, 'gamma': 1.0021323842811103, 'cat_emb_dim': 3, 'n_independent': 3, 'n_shared': 4, 'momentum': 0.0017058683841186977, 'mask_type': 'sparsemax'}. Best is trial 42 with value: 8.20962.
[I 2025-03-30 05:06:29,683] Trial 58 finished with value: 5.1578800000000005 and parameters: {'n_d': 44, 'n_steps': 9, 'gamma': 1.0779133133732048, 'cat_emb_dim': 3, 'n_independent': 4, 'n_shared': 3, 'momentum': 0.002416820384320146, 'mask_type': 'sparsemax'}. Best is trial 42 with value: 8.20962.
[I 2025-03-30 05:07:18,004] Trial 59 finished with value: 1.6959 and parameters: {'n_d': 16, 'n_steps': 8, 'gamma': 1.4145512448891964, 'cat_emb_dim': 3, 'n_independent': 2, 'n_shared': 5, 'momentum': 0.07855004328997049, 'mask_type': 'sparsemax'}. Best is trial 42 with value: 8.20962.
[I 2025-03-30 05:08:28,276] Trial 60 finished with value: 7.9976 and parameters: {'n_d': 60, 'n_steps': 10, 'gamma': 1.3267476746821403, 'cat_emb_dim': 2, 'n_independent': 4, 'n_shared': 3, 'momentum': 0.00118644462530515, 'mask_type': 'sparsemax'}. Best is trial 42 with value: 8.20962.
[I 2025-03-30 05:09:47,638] Trial 61 finished with value: 7.775799999999999 and parameters: {'n_d': 58, 'n_steps': 10, 'gamma': 1.3199176075351846, 'cat_emb_dim': 2, 'n_independent': 4, 'n_shared': 3, 'momentum': 0.0010172137112437543, 'mask_type': 'sparsemax'}. Best is trial 42 with value: 8.20962.
[I 2025-03-30 05:10:51,711] Trial 62 finished with value: 8.04196 and parameters: {'n_d': 60, 'n_steps': 10, 'gamma': 1.3138469766705927, 'cat_emb_dim': 2, 'n_independent': 4, 'n_shared': 3, 'momentum': 0.0010089155766417816, 'mask_type': 'sparsemax'}. Best is trial 42 with value: 8.20962.
[I 2025-03-30 05:12:00,946] Trial 63 finished with value: 7.82952 and parameters: {'n_d': 60, 'n_steps': 10, 'gamma': 1.318275459678067, 'cat_emb_dim': 2, 'n_independent': 4, 'n_shared': 3, 'momentum': 0.0010247999130294958, 'mask_type': 'sparsemax'}. Best is trial 42 with value: 8.20962.
[I 2025-03-30 05:13:34,059] Trial 64 finished with value: 6.891640000000001 and parameters: {'n_d': 60, 'n_steps': 10, 'gamma': 1.2439391631178096, 'cat_emb_dim': 2, 'n_independent': 4, 'n_shared': 3, 'momentum': 0.0017637229633304609, 'mask_type': 'sparsemax'}. Best is trial 42 with value: 8.20962.
[I 2025-03-30 05:14:39,814] Trial 65 finished with value: 8.3146 and parameters: {'n_d': 64, 'n_steps': 10, 'gamma': 1.3083071169472629, 'cat_emb_dim': 2, 'n_independent': 5, 'n_shared': 3, 'momentum': 0.0012064061189338748, 'mask_type': 'sparsemax'}. Best is trial 65 with value: 8.3146.
[I 2025-03-30 05:15:28,790] Trial 66 finished with value: 8.4962 and parameters: {'n_d': 64, 'n_steps': 10, 'gamma': 1.2848422903260368, 'cat_emb_dim': 2, 'n_independent': 5, 'n_shared': 3, 'momentum': 0.0012898569410406914, 'mask_type': 'sparsemax'}. Best is trial 66 with value: 8.4962.
[I 2025-03-30 05:17:44,443] Trial 67 finished with value: 5.2046399999999995 and parameters: {'n_d': 62, 'n_steps': 10, 'gamma': 1.2880684979599084, 'cat_emb_dim': 2, 'n_independent': 5, 'n_shared': 3, 'momentum': 0.002564510051329342, 'mask_type': 'sparsemax'}. Best is trial 66 with value: 8.4962.
